SET TIME_ZONE='+03:00';
SET character_set_collations= REGEXP_REPLACE(@@character_set_collations, '(utf8mb3=[a-z0-9_]*)', '');
SELECT @@character_set_collations;
@@character_set_collations
ucs2=ucs2_uca1400_ai_ci,utf8mb4=utf8mb4_uca1400_ai_ci,utf16=utf16_uca1400_ai_ci,utf32=utf32_uca1400_ai_ci
drop table if exists t1,t2,t3,t4;
drop database if exists mysqltest;
drop table if exists t1,t2;
set names utf8;
select left(_utf8 0xD0B0D0B1D0B2,1);
left(_utf8 0xD0B0D0B1D0B2,1)
а
select right(_utf8 0xD0B0D0B2D0B2,1);
right(_utf8 0xD0B0D0B2D0B2,1)
в
select locate('he','hello');
locate('he','hello')
1
select locate('he','hello',2);
locate('he','hello',2)
0
select locate('lo','hello',2);
locate('lo','hello',2)
4
select locate('HE','hello');
locate('HE','hello')
1
select locate('HE','hello',2);
locate('HE','hello',2)
0
select locate('LO','hello',2);
locate('LO','hello',2)
4
select locate('HE','hello' collate utf8_bin);
locate('HE','hello' collate utf8_bin)
0
select locate('HE','hello' collate utf8_bin,2);
locate('HE','hello' collate utf8_bin,2)
0
select locate('LO','hello' collate utf8_bin,2);
locate('LO','hello' collate utf8_bin,2)
0
select locate(_utf8 0xD0B1, _utf8 0xD0B0D0B1D0B2);
locate(_utf8 0xD0B1, _utf8 0xD0B0D0B1D0B2)
2
select locate(_utf8 0xD091, _utf8 0xD0B0D0B1D0B2);
locate(_utf8 0xD091, _utf8 0xD0B0D0B1D0B2)
2
select locate(_utf8 0xD0B1, _utf8 0xD0B0D091D0B2);
locate(_utf8 0xD0B1, _utf8 0xD0B0D091D0B2)
2
select locate(_utf8 0xD091, _utf8 0xD0B0D0B1D0B2 collate utf8_bin);
locate(_utf8 0xD091, _utf8 0xD0B0D0B1D0B2 collate utf8_bin)
0
select locate(_utf8 0xD0B1, _utf8 0xD0B0D091D0B2 collate utf8_bin);
locate(_utf8 0xD0B1, _utf8 0xD0B0D091D0B2 collate utf8_bin)
0
select length(_utf8 0xD0B1), bit_length(_utf8 0xD0B1), char_length(_utf8 0xD0B1);
length(_utf8 0xD0B1)	bit_length(_utf8 0xD0B1)	char_length(_utf8 0xD0B1)
2	16	1
select 'a' like 'a';
'a' like 'a'
1
select 'A' like 'a';
'A' like 'a'
1
select 'A' like 'a' collate utf8_bin;
'A' like 'a' collate utf8_bin
0
select _utf8 0xD0B0D0B1D0B2 like concat(_utf8'%',_utf8 0xD0B1,_utf8 '%') as exp;
exp
1
select convert(_latin1'G�nter Andr�' using utf8) like CONVERT(_latin1'G�NTER%' USING utf8) as exp;
exp
1
select CONVERT(_koi8r'����' USING utf8) LIKE CONVERT(_koi8r'����' USING utf8) as exp;
exp
1
select CONVERT(_koi8r'����' USING utf8) LIKE CONVERT(_koi8r'����' USING utf8) as exp;
exp
1
select insert('txs',2,1,'hi'),insert('is ',4,0,'a'),insert('txxxxt',2,4,'es');
insert('txs',2,1,'hi')	insert('is ',4,0,'a')	insert('txxxxt',2,4,'es')
this	is 	test
select insert("aa",100,1,"b"),insert("aa",1,3,"b");
insert("aa",100,1,"b")	insert("aa",1,3,"b")
aa	b
select char_length(left(@a:='тест',5)), length(@a), @a;
char_length(left(@a:='тест',5))	length(@a)	@a
4	8	тест
create table t1 select date_format("2004-01-19 10:10:10", "%Y-%m-%d");
show create table t1;
Table	Create Table
t1	CREATE TABLE `t1` (
  `date_format("2004-01-19 10:10:10", "%Y-%m-%d")` varchar(10) CHARACTER SET utf8mb3 COLLATE utf8mb3_general_ci DEFAULT NULL
) ENGINE=MyISAM DEFAULT CHARSET=utf8mb4 COLLATE=utf8mb4_uca1400_ai_ci
select * from t1;
date_format("2004-01-19 10:10:10", "%Y-%m-%d")
2004-01-19
drop table t1;
set names utf8;
set LC_TIME_NAMES='fr_FR';
create table t1 (s1 char(20) character set latin1);
insert into t1 values (date_format('2004-02-02','%M'));
select hex(s1) from t1;
hex(s1)
66E97672696572
drop table t1;
create table t1 (s1 char(20) character set koi8r);
set LC_TIME_NAMES='ru_RU';
insert into t1 values (date_format('2004-02-02','%M'));
insert into t1 values (date_format('2004-02-02','%b'));
insert into t1 values (date_format('2004-02-02','%W'));
insert into t1 values (date_format('2004-02-02','%a'));
select hex(s1), s1 from t1;
hex(s1)	s1
E6C5D7D2C1CCD1	Февраля
E6C5D7	Фев
F0CFCEC5C4C5CCD8CEC9CB	Понедельник
F0CEC4	Пнд
drop table t1;
set LC_TIME_NAMES='en_US';
set names koi8r;
create table t1 (s1 char(1) character set utf8);
insert ignore into t1 values (_koi8r'��');
Warnings:
Warning	1265	Data truncated for column 's1' at row 1
select s1,hex(s1),char_length(s1),octet_length(s1) from t1;
s1	hex(s1)	char_length(s1)	octet_length(s1)
�	D0B0	1	2
drop table t1;
create table t1 (s1 tinytext character set utf8);
insert ignore into t1 select repeat('a',300);
Warnings:
Warning	1265	Data truncated for column 's1' at row 1
insert ignore into t1 select repeat('�',300);
Warnings:
Warning	1265	Data truncated for column 's1' at row 1
insert ignore into t1 select repeat('a�',300);
Warnings:
Warning	1265	Data truncated for column 's1' at row 1
insert ignore into t1 select repeat('�a',300);
Warnings:
Warning	1265	Data truncated for column 's1' at row 1
insert ignore into t1 select repeat('��',300);
Warnings:
Warning	1265	Data truncated for column 's1' at row 1
select hex(s1) from t1;
hex(s1)
616161616161616161616161616161616161616161616161616161616161616161616161616161616161616161616161616161616161616161616161616161616161616161616161616161616161616161616161616161616161616161616161616161616161616161616161616161616161616161616161616161616161616161616161616161616161616161616161616161616161616161616161616161616161616161616161616161616161616161616161616161616161616161616161616161616161616161616161616161616161616161616161616161616161616161616161616161616161616161616161616161616161616161616161616161
D18FD18FD18FD18FD18FD18FD18FD18FD18FD18FD18FD18FD18FD18FD18FD18FD18FD18FD18FD18FD18FD18FD18FD18FD18FD18FD18FD18FD18FD18FD18FD18FD18FD18FD18FD18FD18FD18FD18FD18FD18FD18FD18FD18FD18FD18FD18FD18FD18FD18FD18FD18FD18FD18FD18FD18FD18FD18FD18FD18FD18FD18FD18FD18FD18FD18FD18FD18FD18FD18FD18FD18FD18FD18FD18FD18FD18FD18FD18FD18FD18FD18FD18FD18FD18FD18FD18FD18FD18FD18FD18FD18FD18FD18FD18FD18FD18FD18FD18FD18FD18FD18FD18FD18FD18FD18FD18FD18FD18FD18FD18FD18FD18FD18FD18FD18FD18FD18FD18FD18FD18FD18FD18FD18FD18FD18FD18F
61D18F61D18F61D18F61D18F61D18F61D18F61D18F61D18F61D18F61D18F61D18F61D18F61D18F61D18F61D18F61D18F61D18F61D18F61D18F61D18F61D18F61D18F61D18F61D18F61D18F61D18F61D18F61D18F61D18F61D18F61D18F61D18F61D18F61D18F61D18F61D18F61D18F61D18F61D18F61D18F61D18F61D18F61D18F61D18F61D18F61D18F61D18F61D18F61D18F61D18F61D18F61D18F61D18F61D18F61D18F61D18F61D18F61D18F61D18F61D18F61D18F61D18F61D18F61D18F61D18F61D18F61D18F61D18F61D18F61D18F61D18F61D18F61D18F61D18F61D18F61D18F61D18F61D18F61D18F61D18F61D18F61D18F61D18F61D18F61D18F
D18F61D18F61D18F61D18F61D18F61D18F61D18F61D18F61D18F61D18F61D18F61D18F61D18F61D18F61D18F61D18F61D18F61D18F61D18F61D18F61D18F61D18F61D18F61D18F61D18F61D18F61D18F61D18F61D18F61D18F61D18F61D18F61D18F61D18F61D18F61D18F61D18F61D18F61D18F61D18F61D18F61D18F61D18F61D18F61D18F61D18F61D18F61D18F61D18F61D18F61D18F61D18F61D18F61D18F61D18F61D18F61D18F61D18F61D18F61D18F61D18F61D18F61D18F61D18F61D18F61D18F61D18F61D18F61D18F61D18F61D18F61D18F61D18F61D18F61D18F61D18F61D18F61D18F61D18F61D18F61D18F61D18F61D18F61D18F61D18F61
D18FD18FD18FD18FD18FD18FD18FD18FD18FD18FD18FD18FD18FD18FD18FD18FD18FD18FD18FD18FD18FD18FD18FD18FD18FD18FD18FD18FD18FD18FD18FD18FD18FD18FD18FD18FD18FD18FD18FD18FD18FD18FD18FD18FD18FD18FD18FD18FD18FD18FD18FD18FD18FD18FD18FD18FD18FD18FD18FD18FD18FD18FD18FD18FD18FD18FD18FD18FD18FD18FD18FD18FD18FD18FD18FD18FD18FD18FD18FD18FD18FD18FD18FD18FD18FD18FD18FD18FD18FD18FD18FD18FD18FD18FD18FD18FD18FD18FD18FD18FD18FD18FD18FD18FD18FD18FD18FD18FD18FD18FD18FD18FD18FD18FD18FD18FD18FD18FD18FD18FD18FD18FD18FD18FD18FD18FD18F
select length(s1),char_length(s1) from t1;
length(s1)	char_length(s1)
255	255
254	127
255	170
255	170
254	127
drop table t1;
create table t1 (s1 text character set utf8);
insert ignore into t1 select repeat('a',66000);
Warnings:
Warning	1265	Data truncated for column 's1' at row 1
insert ignore into t1 select repeat('�',66000);
Warnings:
Warning	1265	Data truncated for column 's1' at row 1
insert ignore into t1 select repeat('a�',66000);
Warnings:
Warning	1265	Data truncated for column 's1' at row 1
insert ignore into t1 select repeat('�a',66000);
Warnings:
Warning	1265	Data truncated for column 's1' at row 1
insert ignore into t1 select repeat('��',66000);
Warnings:
Warning	1265	Data truncated for column 's1' at row 1
select length(s1),char_length(s1) from t1;
length(s1)	char_length(s1)
65535	65535
65534	32767
65535	43690
65535	43690
65534	32767
drop table t1;
create table t1 (s1 char(10) character set utf8);
insert ignore into t1 values (0x41FF);
Warnings:
Warning	1366	Incorrect string value: '\xFF' for column `test`.`t1`.`s1` at row 1
select hex(s1) from t1;
hex(s1)
413F
drop table t1;
create table t1 (s1 varchar(10) character set utf8);
insert ignore into t1 values (0x41FF);
Warnings:
Warning	1366	Incorrect string value: '\xFF' for column `test`.`t1`.`s1` at row 1
select hex(s1) from t1;
hex(s1)
413F
drop table t1;
create table t1 (s1 text character set utf8);
insert ignore into t1 values (0x41FF);
Warnings:
Warning	1366	Incorrect string value: '\xFF' for column `test`.`t1`.`s1` at row 1
select hex(s1) from t1;
hex(s1)
413F
drop table t1;
create table t1 (a text character set utf8, primary key(a(371)));
ERROR 42000: Specified key was too long; max key length is 1000 bytes
CREATE TABLE t1 ( a varchar(10) ) CHARACTER SET utf8;
INSERT INTO t1 VALUES ( 'test' );
SELECT a.a, b.a FROM t1 a, t1 b WHERE a.a = b.a;
a	a
test	test
SELECT a.a, b.a FROM t1 a, t1 b WHERE a.a = 'test' and b.a = 'test';
a	a
test	test
SELECT a.a, b.a FROM t1 a, t1 b WHERE a.a = b.a and a.a = 'test';
a	a
test	test
DROP TABLE t1;
create table t1 (a char(255) character set utf8);
insert into t1 values('b'),('b');
select * from t1 where a = 'b';
a
b
b
select * from t1 where a = 'b' and a = 'b';
a
b
b
select * from t1 where a = 'b' and a != 'b';
a
drop table t1;
CREATE TABLE t1 (a enum ('Y', 'N') DEFAULT 'N' COLLATE utf8_unicode_ci);
ALTER TABLE t1 ADD COLUMN b CHAR(20);
DROP TABLE t1;
set names utf8;
create table t1 (a enum('aaaa','проба') character set utf8);
show create table t1;
Table	Create Table
t1	CREATE TABLE `t1` (
  `a` enum('aaaa','проба') CHARACTER SET utf8mb3 COLLATE utf8mb3_general_ci DEFAULT NULL
) ENGINE=MyISAM DEFAULT CHARSET=utf8mb4 COLLATE=utf8mb4_uca1400_ai_ci
insert into t1 values ('проба');
select * from t1;
a
проба
create table t2 select ifnull(a,a) from t1;
show create table t2;
Table	Create Table
t2	CREATE TABLE `t2` (
  `ifnull(a,a)` varchar(5) CHARACTER SET utf8mb3 COLLATE utf8mb3_general_ci DEFAULT NULL
) ENGINE=MyISAM DEFAULT CHARSET=utf8mb4 COLLATE=utf8mb4_uca1400_ai_ci
select * from t2;
ifnull(a,a)
проба
drop table t1;
drop table t2;
create table t1 (c varchar(30) character set utf8, unique(c(10)));
insert into t1 values ('1'),('2'),('3'),('x'),('y'),('z');
insert into t1 values ('aaaaaaaaaa');
insert into t1 values ('aaaaaaaaaaa');
ERROR 23000: Duplicate entry 'aaaaaaaaaa' for key 'c'
insert into t1 values ('aaaaaaaaaaaa');
ERROR 23000: Duplicate entry 'aaaaaaaaaa' for key 'c'
insert into t1 values (repeat('b',20));
select c c1 from t1 where c='1';
c1
1
select c c2 from t1 where c='2';
c2
2
select c c3 from t1 where c='3';
c3
3
select c cx from t1 where c='x';
cx
x
select c cy from t1 where c='y';
cy
y
select c cz from t1 where c='z';
cz
z
select c ca10 from t1 where c='aaaaaaaaaa';
ca10
aaaaaaaaaa
select c cb20 from t1 where c=repeat('b',20);
cb20
bbbbbbbbbbbbbbbbbbbb
drop table t1;
create table t1 (c varchar(30) character set utf8, unique(c(10))) engine=innodb;
insert into t1 values ('1'),('2'),('3'),('x'),('y'),('z');
insert into t1 values ('aaaaaaaaaa');
insert into t1 values ('aaaaaaaaaaa');
ERROR 23000: Duplicate entry 'aaaaaaaaaa' for key 'c'
insert into t1 values ('aaaaaaaaaaaa');
ERROR 23000: Duplicate entry 'aaaaaaaaaa' for key 'c'
insert into t1 values (repeat('b',20));
select c c1 from t1 where c='1';
c1
1
select c c2 from t1 where c='2';
c2
2
select c c3 from t1 where c='3';
c3
3
select c cx from t1 where c='x';
cx
x
select c cy from t1 where c='y';
cy
y
select c cz from t1 where c='z';
cz
z
select c ca10 from t1 where c='aaaaaaaaaa';
ca10
aaaaaaaaaa
select c cb20 from t1 where c=repeat('b',20);
cb20
bbbbbbbbbbbbbbbbbbbb
drop table t1;
create table t1 (c char(3) character set utf8, unique (c(2)));
insert into t1 values ('1'),('2'),('3'),('4'),('x'),('y'),('z');
insert into t1 values ('a');
insert into t1 values ('aa');
insert into t1 values ('aaa');
ERROR 23000: Duplicate entry 'aa' for key 'c'
insert into t1 values ('b');
insert into t1 values ('bb');
insert into t1 values ('bbb');
ERROR 23000: Duplicate entry 'bb' for key 'c'
insert into t1 values ('а');
insert into t1 values ('аа');
insert into t1 values ('ааа');
ERROR 23000: Duplicate entry 'аа' for key 'c'
insert into t1 values ('б');
insert into t1 values ('бб');
insert into t1 values ('ббб');
ERROR 23000: Duplicate entry 'бб' for key 'c'
insert into t1 values ('ꪪ');
insert into t1 values ('ꪪꪪ');
insert into t1 values ('ꪪꪪꪪ');
ERROR 23000: Duplicate entry 'ꪪꪪ' for key 'c'
drop table t1;
create table t1 (c char(3) character set utf8, unique (c(2))) engine=innodb;
insert into t1 values ('1'),('2'),('3'),('4'),('x'),('y'),('z');
insert into t1 values ('a');
insert into t1 values ('aa');
insert into t1 values ('aaa');
ERROR 23000: Duplicate entry 'aa' for key 'c'
insert into t1 values ('b');
insert into t1 values ('bb');
insert into t1 values ('bbb');
ERROR 23000: Duplicate entry 'bb' for key 'c'
insert into t1 values ('а');
insert into t1 values ('аа');
insert into t1 values ('ааа');
ERROR 23000: Duplicate entry 'аа' for key 'c'
insert into t1 values ('б');
insert into t1 values ('бб');
insert into t1 values ('ббб');
ERROR 23000: Duplicate entry 'бб' for key 'c'
insert into t1 values ('ꪪ');
insert into t1 values ('ꪪꪪ');
insert into t1 values ('ꪪꪪꪪ');
ERROR 23000: Duplicate entry 'ꪪꪪ' for key 'c'
drop table t1;
create table t1 (
c char(10) character set utf8,
unique key a using hash (c(1))
) engine=heap;
show create table t1;
Table	Create Table
t1	CREATE TABLE `t1` (
  `c` char(10) CHARACTER SET utf8mb3 COLLATE utf8mb3_general_ci DEFAULT NULL,
  UNIQUE KEY `a` (`c`(1)) USING HASH
) ENGINE=MEMORY DEFAULT CHARSET=utf8mb4 COLLATE=utf8mb4_uca1400_ai_ci
insert into t1 values ('a'),('b'),('c'),('d'),('e'),('f');
insert into t1 values ('aa');
ERROR 23000: Duplicate entry 'a' for key 'a'
insert into t1 values ('aaa');
ERROR 23000: Duplicate entry 'a' for key 'a'
insert into t1 values ('б');
insert into t1 values ('бб');
ERROR 23000: Duplicate entry 'б' for key 'a'
insert into t1 values ('ббб');
ERROR 23000: Duplicate entry 'б' for key 'a'
select c as c_all from t1 order by c;
c_all
a
b
c
d
e
f
б
select c as c_a from t1 where c='a';
c_a
a
select c as c_a from t1 where c='б';
c_a
б
drop table t1;
create table t1 (
c char(10) character set utf8,
unique key a using btree (c(1))
) engine=heap;
show create table t1;
Table	Create Table
t1	CREATE TABLE `t1` (
  `c` char(10) CHARACTER SET utf8mb3 COLLATE utf8mb3_general_ci DEFAULT NULL,
  UNIQUE KEY `a` (`c`(1)) USING BTREE
) ENGINE=MEMORY DEFAULT CHARSET=utf8mb4 COLLATE=utf8mb4_uca1400_ai_ci
insert into t1 values ('a'),('b'),('c'),('d'),('e'),('f');
insert into t1 values ('aa');
ERROR 23000: Duplicate entry 'a' for key 'a'
insert into t1 values ('aaa');
ERROR 23000: Duplicate entry 'a' for key 'a'
insert into t1 values ('б');
insert into t1 values ('бб');
ERROR 23000: Duplicate entry 'б' for key 'a'
insert into t1 values ('ббб');
ERROR 23000: Duplicate entry 'б' for key 'a'
select c as c_all from t1 order by c;
c_all
a
b
c
d
e
f
б
select c as c_a from t1 where c='a';
c_a
a
select c as c_a from t1 where c='б';
c_a
б
drop table t1;
create table t1 (
c char(10) character set utf8,
unique key a (c(1))
) engine=innodb;
insert into t1 values ('a'),('b'),('c'),('d'),('e'),('f');
insert into t1 values ('aa');
ERROR 23000: Duplicate entry 'a' for key 'a'
insert into t1 values ('aaa');
ERROR 23000: Duplicate entry 'a' for key 'a'
insert into t1 values ('б');
insert into t1 values ('бб');
ERROR 23000: Duplicate entry 'б' for key 'a'
insert into t1 values ('ббб');
ERROR 23000: Duplicate entry 'б' for key 'a'
select c as c_all from t1 order by c;
c_all
a
b
c
d
e
f
б
select c as c_a from t1 where c='a';
c_a
a
select c as c_a from t1 where c='б';
c_a
б
drop table t1;
create table t1 (c varchar(30) character set utf8 collate utf8_bin, unique(c(10)));
insert into t1 values ('1'),('2'),('3'),('x'),('y'),('z');
insert into t1 values ('aaaaaaaaaa');
insert into t1 values ('aaaaaaaaaaa');
ERROR 23000: Duplicate entry 'aaaaaaaaaa' for key 'c'
insert into t1 values ('aaaaaaaaaaaa');
ERROR 23000: Duplicate entry 'aaaaaaaaaa' for key 'c'
insert into t1 values (repeat('b',20));
select c c1 from t1 where c='1';
c1
1
select c c2 from t1 where c='2';
c2
2
select c c3 from t1 where c='3';
c3
3
select c cx from t1 where c='x';
cx
x
select c cy from t1 where c='y';
cy
y
select c cz from t1 where c='z';
cz
z
select c ca10 from t1 where c='aaaaaaaaaa';
ca10
aaaaaaaaaa
select c cb20 from t1 where c=repeat('b',20);
cb20
bbbbbbbbbbbbbbbbbbbb
drop table t1;
create table t1 (c char(3) character set utf8 collate utf8_bin, unique (c(2)));
insert into t1 values ('1'),('2'),('3'),('4'),('x'),('y'),('z');
insert into t1 values ('a');
insert into t1 values ('aa');
insert into t1 values ('aaa');
ERROR 23000: Duplicate entry 'aa' for key 'c'
insert into t1 values ('b');
insert into t1 values ('bb');
insert into t1 values ('bbb');
ERROR 23000: Duplicate entry 'bb' for key 'c'
insert into t1 values ('а');
insert into t1 values ('аа');
insert into t1 values ('ааа');
ERROR 23000: Duplicate entry 'аа' for key 'c'
insert into t1 values ('б');
insert into t1 values ('бб');
insert into t1 values ('ббб');
ERROR 23000: Duplicate entry 'бб' for key 'c'
insert into t1 values ('ꪪ');
insert into t1 values ('ꪪꪪ');
insert into t1 values ('ꪪꪪꪪ');
ERROR 23000: Duplicate entry 'ꪪꪪ' for key 'c'
drop table t1;
create table t1 (
c char(10) character set utf8 collate utf8_bin,
unique key a using hash (c(1))
) engine=heap;
show create table t1;
Table	Create Table
t1	CREATE TABLE `t1` (
  `c` char(10) CHARACTER SET utf8mb3 COLLATE utf8mb3_bin DEFAULT NULL,
  UNIQUE KEY `a` (`c`(1)) USING HASH
) ENGINE=MEMORY DEFAULT CHARSET=utf8mb4 COLLATE=utf8mb4_uca1400_ai_ci
insert into t1 values ('a'),('b'),('c'),('d'),('e'),('f');
insert into t1 values ('aa');
ERROR 23000: Duplicate entry 'a' for key 'a'
insert into t1 values ('aaa');
ERROR 23000: Duplicate entry 'a' for key 'a'
insert into t1 values ('б');
insert into t1 values ('бб');
ERROR 23000: Duplicate entry 'б' for key 'a'
insert into t1 values ('ббб');
ERROR 23000: Duplicate entry 'б' for key 'a'
select c as c_all from t1 order by c;
c_all
a
b
c
d
e
f
б
select c as c_a from t1 where c='a';
c_a
a
select c as c_a from t1 where c='б';
c_a
б
drop table t1;
create table t1 (
c char(10) character set utf8 collate utf8_bin,
unique key a using btree (c(1))
) engine=heap;
show create table t1;
Table	Create Table
t1	CREATE TABLE `t1` (
  `c` char(10) CHARACTER SET utf8mb3 COLLATE utf8mb3_bin DEFAULT NULL,
  UNIQUE KEY `a` (`c`(1)) USING BTREE
) ENGINE=MEMORY DEFAULT CHARSET=utf8mb4 COLLATE=utf8mb4_uca1400_ai_ci
insert into t1 values ('a'),('b'),('c'),('d'),('e'),('f');
insert into t1 values ('aa');
ERROR 23000: Duplicate entry 'a' for key 'a'
insert into t1 values ('aaa');
ERROR 23000: Duplicate entry 'a' for key 'a'
insert into t1 values ('б');
insert into t1 values ('бб');
ERROR 23000: Duplicate entry 'б' for key 'a'
insert into t1 values ('ббб');
ERROR 23000: Duplicate entry 'б' for key 'a'
select c as c_all from t1 order by c;
c_all
a
b
c
d
e
f
б
select c as c_a from t1 where c='a';
c_a
a
select c as c_a from t1 where c='б';
c_a
б
drop table t1;
create table t1 (
c char(10) character set utf8 collate utf8_bin,
unique key a (c(1))
) engine=innodb;
insert into t1 values ('a'),('b'),('c'),('d'),('e'),('f');
insert into t1 values ('aa');
ERROR 23000: Duplicate entry 'a' for key 'a'
insert into t1 values ('aaa');
ERROR 23000: Duplicate entry 'a' for key 'a'
insert into t1 values ('б');
insert into t1 values ('бб');
ERROR 23000: Duplicate entry 'б' for key 'a'
insert into t1 values ('ббб');
ERROR 23000: Duplicate entry 'б' for key 'a'
select c as c_all from t1 order by c;
c_all
a
b
c
d
e
f
б
select c as c_a from t1 where c='a';
c_a
a
select c as c_a from t1 where c='б';
c_a
б
drop table t1;
create table t1 (
str varchar(255) character set utf8 not null,
key str  (str(2))
) engine=myisam;
INSERT INTO t1 VALUES ('str');
INSERT INTO t1 VALUES ('str2');
select * from t1 where str='str';
str
str
drop table t1;
create table t1 (
str varchar(255) character set utf8 not null,
key str  (str(2))
) engine=innodb;
INSERT INTO t1 VALUES ('str');
INSERT INTO t1 VALUES ('str2');
select * from t1 where str='str';
str
str
drop table t1;
create table t1 (
str varchar(255) character set utf8 not null,
key str using btree (str(2))
) engine=heap;
INSERT INTO t1 VALUES ('str');
INSERT INTO t1 VALUES ('str2');
select * from t1 where str='str';
str
str
drop table t1;
create table t1 (
str varchar(255) character set utf8 not null,
key str using hash (str(2))
) engine=heap;
INSERT INTO t1 VALUES ('str');
INSERT INTO t1 VALUES ('str2');
select * from t1 where str='str';
str
str
drop table t1;
create table t1 (
str varchar(255) character set utf8 not null,
key str (str(2))
) engine=innodb;
INSERT INTO t1 VALUES ('str');
INSERT INTO t1 VALUES ('str2');
select * from t1 where str='str';
str
str
drop table t1;
CREATE TABLE t1 (a varchar(32) BINARY) CHARACTER SET utf8;
INSERT INTO t1 VALUES ('test');
SELECT a FROM t1 WHERE a LIKE '%te';
a
DROP TABLE t1;
SET NAMES utf8;
CREATE TABLE t1 (
subject varchar(255) character set utf8 collate utf8_unicode_ci,
p varchar(15) character set utf8
) ENGINE=InnoDB DEFAULT CHARSET=latin1;
INSERT INTO t1 VALUES ('谷川俊二と申しますが、インターネット予約の会員登録をしましたところ、メールアドレスを間違えてしまい会員ＩＤが受け取ることが出来ませんでした。間違えアドレスはtani-shun@n.vodafone.ne.jpを書き込みました。どうすればよいですか？ その他、住所等は間違えありません。連絡ください。よろしくお願いします。m(__)m','040312-000057');
INSERT INTO t1 VALUES ('aaa','bbb');
SELECT length(subject) FROM t1;
length(subject)
432
3
SELECT length(subject) FROM t1 ORDER BY 1;
length(subject)
3
432
DROP TABLE t1;
CREATE TABLE t1 (
id       int unsigned NOT NULL auto_increment,
list_id  smallint unsigned NOT NULL,
term     TEXT NOT NULL,
PRIMARY KEY(id),
INDEX(list_id, term(4))
) ENGINE=MYISAM CHARSET=utf8;
INSERT INTO t1 SET list_id = 1, term = "letterc";
INSERT INTO t1 SET list_id = 1, term = "letterb";
INSERT INTO t1 SET list_id = 1, term = "lettera";
INSERT INTO t1 SET list_id = 1, term = "letterd";
SELECT id FROM t1 WHERE (list_id = 1) AND (term = "letterc");
id
1
SELECT id FROM t1 WHERE (list_id = 1) AND (term = "letterb");
id
2
SELECT id FROM t1 WHERE (list_id = 1) AND (term = "lettera");
id
3
SELECT id FROM t1 WHERE (list_id = 1) AND (term = "letterd");
id
4
DROP TABLE t1;
SET NAMES latin1;
CREATE TABLE t1 (
id int unsigned NOT NULL auto_increment,
list_id smallint unsigned NOT NULL,
term text NOT NULL,
PRIMARY KEY(id),
INDEX(list_id, term(19))
) ENGINE=MyISAM CHARSET=utf8;
INSERT INTO t1 set list_id = 1, term = "test�test";
INSERT INTO t1 set list_id = 1, term = "testetest";
INSERT INTO t1 set list_id = 1, term = "test�test";
SELECT id, term FROM t1 where (list_id = 1) AND (term = "test�test");
id	term
1	test�test
2	testetest
3	test�test
SELECT id, term FROM t1 where (list_id = 1) AND (term = "testetest");
id	term
1	test�test
2	testetest
3	test�test
SELECT id, term FROM t1 where (list_id = 1) AND (term = "test�test");
id	term
1	test�test
2	testetest
3	test�test
DROP TABLE t1;
set names utf8;
create table t1 (
a int primary key,
b varchar(6),
index b3(b(3))
) engine=innodb character set=utf8;
insert into t1 values(1,'foo'),(2,'foobar');
select * from t1 where b like 'foob%';
a	b
2	foobar
alter table t1 engine=innodb;
select * from t1 where b like 'foob%';
a	b
2	foobar
drop table t1;
create table t1 (
a enum('петя','вася','анюта') character set utf8 not null default 'анюта',
b set('петя','вася','анюта') character set utf8 not null default 'анюта'
);
create table t2 select concat(a,_utf8'') as a, concat(b,_utf8'')as b from t1;
show create table t2;
Table	Create Table
t2	CREATE TABLE `t2` (
  `a` varchar(5) CHARACTER SET utf8mb3 COLLATE utf8mb3_general_ci DEFAULT NULL,
  `b` varchar(15) CHARACTER SET utf8mb3 COLLATE utf8mb3_general_ci DEFAULT NULL
) ENGINE=MyISAM DEFAULT CHARSET=utf8mb4 COLLATE=utf8mb4_uca1400_ai_ci
drop table t2;
drop table t1;
select 'c' like '\_' as want0;
want0
0
SELECT SUBSTR('вася',-2);
SUBSTR('вася',-2)
ся
create table t1 (id integer, a varchar(100) character set utf8 collate utf8_unicode_ci);
insert into t1 values (1, 'Test');
select * from t1 where soundex(a) = soundex('Test');
id	a
1	Test
select * from t1 where soundex(a) = soundex('TEST');
id	a
1	Test
select * from t1 where soundex(a) = soundex('test');
id	a
1	Test
drop table t1;
select soundex(_utf8 0xE99885E8A788E99A8FE697B6E69BB4E696B0E79A84E696B0E997BB) as exp;
exp
阅000
select hex(soundex(_utf8 0xE99885E8A788E99A8FE697B6E69BB4E696B0E79A84E696B0E997BB)) as exp;
exp
E99885303030
select soundex(_utf8 0xD091D092D093) as exp;
exp
Б000
select hex(soundex(_utf8 0xD091D092D093)) as exp;
exp
D091303030
SET collation_connection='utf8_general_ci';
create table t1 select repeat('a',4000) a;
delete from t1;
insert into t1 values ('a'), ('a '), ('a\t');
select collation(a),hex(a) from t1 order by a;
collation(a)	hex(a)
utf8mb3_general_ci	6109
utf8mb3_general_ci	61
utf8mb3_general_ci	6120
drop table t1;
#
# MDEV-5453 Assertion `src' fails in my_strnxfrm_unicode on GROUP BY MID(..) WITH ROLLUP
#
SELECT @@collation_connection;
@@collation_connection
utf8mb3_general_ci
CREATE TABLE t1 (i INT) ENGINE=MyISAM;
INSERT INTO t1 VALUES (1),(2);
SELECT * FROM t1 GROUP BY MID(CURRENT_USER,0) WITH ROLLUP;
i
1
1
SELECT * FROM t1 GROUP BY MID('test',0) WITH ROLLUP;
i
1
1
DROP TABLE t1;
#
# MDEV-6170 Incorrect ordering with utf8_bin and utf8mb4_bin collations
#
SELECT @@collation_connection;
@@collation_connection
utf8mb3_general_ci
CREATE TABLE t1 ENGINE=MEMORY AS SELECT REPEAT('a',5) AS a LIMIT 0;
INSERT INTO t1 (a) VALUES ("a");
INSERT INTO t1 (a) VALUES ("b");
INSERT INTO t1 (a) VALUES ("c");
INSERT INTO t1 (a) VALUES ("d");
INSERT INTO t1 (a) VALUES ("e");
INSERT INTO t1 (a) VALUES ("f");
INSERT INTO t1 (a) VALUES ("g");
INSERT INTO t1 (a) VALUES ("h");
INSERT INTO t1 (a) VALUES ("i");
INSERT INTO t1 (a) VALUES ("j");
INSERT INTO t1 (a) VALUES ("k");
INSERT INTO t1 (a) VALUES ("l");
INSERT INTO t1 (a) VALUES ("m");
SELECT * FROM t1 ORDER BY LOWER(a);
a
a
b
c
d
e
f
g
h
i
j
k
l
m
SELECT * FROM t1 ORDER BY LOWER(a) DESC;
a
m
l
k
j
i
h
g
f
e
d
c
b
a
DROP TABLE t1;
select @@collation_connection;
@@collation_connection
utf8mb3_general_ci
create table t1 ROW_FORMAT=DYNAMIC select repeat('a',50) as c1 ;
insert into t1 values('abcdef');
insert into t1 values('_bcdef');
insert into t1 values('a_cdef');
insert into t1 values('ab_def');
insert into t1 values('abc_ef');
insert into t1 values('abcd_f');
insert into t1 values('abcde_');
select c1 as c1u from t1 where c1 like 'ab\_def';
c1u
ab_def
select c1 as c2h from t1 where c1 like 'ab#_def' escape '#';
c2h
ab_def
drop table t1;
SELECT @@collation_connection;
@@collation_connection
utf8mb3_general_ci
SELECT '\%b' LIKE '%\%';
'\%b' LIKE '%\%'
0
"BEGIN ctype_german.inc"
drop table if exists t1;
create table t1 as select repeat(' ', 64) as s1;
select collation(s1) from t1;
collation(s1)
utf8mb3_general_ci
delete from t1;
INSERT INTO t1 VALUES ('ud'),('uf');
INSERT INTO t1 VALUES ('od'),('of');
INSERT INTO t1 VALUES ('e');
INSERT INTO t1 VALUES ('ad'),('af');
insert into t1 values ('a'),('ae'),(_latin1 0xE4);
insert into t1 values ('o'),('oe'),(_latin1 0xF6);
insert into t1 values ('s'),('ss'),(_latin1 0xDF);
insert into t1 values ('u'),('ue'),(_latin1 0xFC);
INSERT INTO t1 VALUES (_latin1 0xE6), (_latin1 0xC6);
INSERT INTO t1 VALUES (_latin1 0x9C), (_latin1 0x8C);
select s1, hex(s1) from t1 order by s1, binary s1;
s1	hex(s1)
a	61
ä	C3A4
ad	6164
ae	6165
af	6166
e	65
o	6F
ö	C3B6
od	6F64
oe	6F65
of	6F66
s	73
ß	C39F
ss	7373
u	75
ü	C3BC
ud	7564
ue	7565
uf	7566
Æ	C386
æ	C3A6
Œ	C592
œ	C593
select group_concat(s1 order by binary s1) from t1 group by s1;
group_concat(s1 order by binary s1)
a,ä
ad
ae
af
e
o,ö
od
oe
of
s,ß
ss
u,ü
ud
ue
uf
Æ,æ
Œ,œ
SELECT s1, hex(s1), hex(weight_string(s1)) FROM t1 ORDER BY s1, BINARY(s1);
s1	hex(s1)	hex(weight_string(s1))
a	61	0041
ä	C3A4	0041
ad	6164	00410044
ae	6165	00410045
af	6166	00410046
e	65	0045
o	6F	004F
ö	C3B6	004F
od	6F64	004F0044
oe	6F65	004F0045
of	6F66	004F0046
s	73	0053
ß	C39F	0053
ss	7373	00530053
u	75	0055
ü	C3BC	0055
ud	7564	00550044
ue	7565	00550045
uf	7566	00550046
Æ	C386	00C6
æ	C3A6	00C6
Œ	C592	0152
œ	C593	0152
SELECT s1, hex(s1) FROM t1 WHERE s1='ae' ORDER BY s1, BINARY(s1);
s1	hex(s1)
ae	6165
drop table t1;
CREATE TABLE t1 AS SELECT REPEAT('a',1) AS a, 1 AS b LIMIT 0;
SHOW CREATE TABLE t1;
Table	Create Table
t1	CREATE TABLE `t1` (
  `a` varchar(1) CHARACTER SET utf8mb3 COLLATE utf8mb3_general_ci DEFAULT NULL,
  `b` int(1) NOT NULL
) ENGINE=MyISAM DEFAULT CHARSET=utf8mb4 COLLATE=utf8mb4_uca1400_ai_ci
INSERT INTO t1 VALUES ('s',0),(_latin1 0xDF,1);
SELECT * FROM t1 ORDER BY a, b;
a	b
s	0
ß	1
SELECT * FROM t1 ORDER BY a DESC, b;
a	b
s	0
ß	1
SELECT * FROM t1 ORDER BY CONCAT(a), b;
a	b
s	0
ß	1
SELECT * FROM t1 ORDER BY CONCAT(a) DESC, b;
a	b
s	0
ß	1
DROP TABLE t1;
"END ctype_german.inc"
#
# MDEV-4842 STR_TO_DATE does not work with UCS2/UTF16/UTF32
#
SELECT @@character_set_connection, HEX(CAST(_utf8'÷' AS CHAR));
@@character_set_connection	HEX(CAST(_utf8'÷' AS CHAR))
utf8mb3	C3B7
SELECT STR_TO_DATE(CAST(_utf8'2001÷01÷01' AS CHAR),CAST(_utf8'%Y÷%m÷%d' AS CHAR)) as exp;
exp
2001-01-01
CREATE TABLE t1 AS SELECT REPEAT(' ', 64) AS subject, REPEAT(' ',64) AS pattern LIMIT 0;
SHOW COLUMNS FROM t1;
Field	Type	Null	Key	Default	Extra
subject	varchar(64)	YES		NULL	
pattern	varchar(64)	YES		NULL	
INSERT INTO t1 VALUES (_utf8'2001÷01÷01',_utf8'%Y÷%m÷%d');
SELECT HEX(subject),HEX(pattern),STR_TO_DATE(subject, pattern) FROM t1;
HEX(subject)	HEX(pattern)	STR_TO_DATE(subject, pattern)
32303031C3B73031C3B73031	2559C3B7256DC3B72564	2001-01-01 00:00:00.000000
DROP TABLE t1;
SET collation_connection='utf8_bin';
create table t1 select repeat('a',4000) a;
delete from t1;
insert into t1 values ('a'), ('a '), ('a\t');
select collation(a),hex(a) from t1 order by a;
collation(a)	hex(a)
utf8mb3_bin	6109
utf8mb3_bin	61
utf8mb3_bin	6120
drop table t1;
#
# MDEV-5453 Assertion `src' fails in my_strnxfrm_unicode on GROUP BY MID(..) WITH ROLLUP
#
SELECT @@collation_connection;
@@collation_connection
utf8mb3_bin
CREATE TABLE t1 (i INT) ENGINE=MyISAM;
INSERT INTO t1 VALUES (1),(2);
SELECT * FROM t1 GROUP BY MID(CURRENT_USER,0) WITH ROLLUP;
i
1
1
SELECT * FROM t1 GROUP BY MID('test',0) WITH ROLLUP;
i
1
1
DROP TABLE t1;
#
# MDEV-6170 Incorrect ordering with utf8_bin and utf8mb4_bin collations
#
SELECT @@collation_connection;
@@collation_connection
utf8mb3_bin
CREATE TABLE t1 ENGINE=MEMORY AS SELECT REPEAT('a',5) AS a LIMIT 0;
INSERT INTO t1 (a) VALUES ("a");
INSERT INTO t1 (a) VALUES ("b");
INSERT INTO t1 (a) VALUES ("c");
INSERT INTO t1 (a) VALUES ("d");
INSERT INTO t1 (a) VALUES ("e");
INSERT INTO t1 (a) VALUES ("f");
INSERT INTO t1 (a) VALUES ("g");
INSERT INTO t1 (a) VALUES ("h");
INSERT INTO t1 (a) VALUES ("i");
INSERT INTO t1 (a) VALUES ("j");
INSERT INTO t1 (a) VALUES ("k");
INSERT INTO t1 (a) VALUES ("l");
INSERT INTO t1 (a) VALUES ("m");
SELECT * FROM t1 ORDER BY LOWER(a);
a
a
b
c
d
e
f
g
h
i
j
k
l
m
SELECT * FROM t1 ORDER BY LOWER(a) DESC;
a
m
l
k
j
i
h
g
f
e
d
c
b
a
DROP TABLE t1;
select @@collation_connection;
@@collation_connection
utf8mb3_bin
create table t1 ROW_FORMAT=DYNAMIC select repeat('a',50) as c1 ;
insert into t1 values('abcdef');
insert into t1 values('_bcdef');
insert into t1 values('a_cdef');
insert into t1 values('ab_def');
insert into t1 values('abc_ef');
insert into t1 values('abcd_f');
insert into t1 values('abcde_');
select c1 as c1u from t1 where c1 like 'ab\_def';
c1u
ab_def
select c1 as c2h from t1 where c1 like 'ab#_def' escape '#';
c2h
ab_def
drop table t1;
SELECT @@collation_connection;
@@collation_connection
utf8mb3_bin
SELECT '\%b' LIKE '%\%';
'\%b' LIKE '%\%'
0
CREATE TABLE t1 (
user varchar(255) NOT NULL default ''
) ENGINE=MyISAM DEFAULT CHARSET=latin1;
INSERT INTO t1 VALUES ('one'),('two');
SELECT CHARSET('a');
CHARSET('a')
utf8mb3
SELECT user, CONCAT('<', user, '>') AS c FROM t1;
user	c
one	<one>
two	<two>
DROP TABLE t1;
create table t1 (f1 varchar(1) not null) default charset utf8;
insert into t1 values (''), ('');
select concat(concat(_latin1'->',f1),_latin1'<-') from t1;
concat(concat(_latin1'->',f1),_latin1'<-')
-><-
-><-
drop table t1;
select convert(_koi8r'�' using utf8) < convert(_koi8r'�' using utf8) as exp;
exp
1
set names latin1;
create table t1 (a varchar(10)) character set utf8;
insert into t1 values ('test');
select ifnull(a,'') from t1;
ifnull(a,'')
test
drop table t1;
select repeat(_utf8'+',3) as h union select NULL;
h
+++
NULL
select ifnull(NULL, _utf8'string');
ifnull(NULL, _utf8'string')
string
set names utf8;
create table t1 (s1 char(5) character set utf8 collate utf8_lithuanian_ci);
insert into t1 values ('I'),('K'),('Y');
select * from t1 where s1 < 'K' and s1 = 'Y';
s1
I
Y
select * from t1 where 'K' > s1 and s1 = 'Y';
s1
I
Y
drop table t1;
create table t1 (s1 char(5) character set utf8 collate utf8_czech_ci);
insert into t1 values ('c'),('d'),('h'),('ch'),('CH'),('cH'),('Ch'),('i');
select * from t1 where s1 > 'd' and s1 = 'CH';
s1
ch
CH
Ch
select * from t1 where 'd' < s1 and s1 = 'CH';
s1
ch
CH
Ch
select * from t1 where s1 = 'cH' and s1 <> 'ch';
s1
cH
select * from t1 where 'cH' = s1 and s1 <> 'ch';
s1
cH
drop table t1;
create table t1 (a varchar(255)) default character set utf8;
insert into t1 values (1.0);
drop table t1;
create table t1 (
id int not null,
city varchar(20) not null,
key (city(7),id)
) character set=utf8;
insert into t1 values (1,'Durban North');
insert into t1 values (2,'Durban');
select * from t1 where city = 'Durban';
id	city
2	Durban
select * from t1 where city = 'Durban ';
id	city
2	Durban
drop table t1;
create table t1 (x set('A', 'B') default 0) character set utf8;
ERROR 42000: Invalid default value for 'x'
create table t1 (x enum('A', 'B') default 0) character set utf8;
ERROR 42000: Invalid default value for 'x'
SET NAMES UTF8;
CREATE TABLE t1 (
`id` int(20) NOT NULL auto_increment,
`country` varchar(100) NOT NULL default '',
`shortcode` varchar(100) NOT NULL default '',
`operator` varchar(100) NOT NULL default '',
`momid` varchar(30) NOT NULL default '',
`keyword` varchar(160) NOT NULL default '',
`content` varchar(160) NOT NULL default '',
`second_token` varchar(160) default NULL,
`gateway_id` int(11) NOT NULL default '0',
`created` datetime NOT NULL default '0000-00-00 00:00:00',
`msisdn` varchar(15) NOT NULL default '',
PRIMARY KEY  (`id`),
UNIQUE KEY `MSCCSPK_20030521130957121` (`momid`),
KEY `IX_mobile_originated_message_keyword` (`keyword`),
KEY `IX_mobile_originated_message_created` (`created`),
KEY `IX_mobile_originated_message_support` (`msisdn`,`momid`,`keyword`,`gateway_id`,`created`)
) ENGINE=MyISAM DEFAULT CHARSET=utf8;
INSERT INTO t1 VALUES 
(1,'blah','464','aaa','fkc1c9ilc20x0hgae7lx6j09','ERR','ERR Имри.Афимим.Аеимимримдмримрмрирор имримримримр имридм ирбднримрфмририримрфмфмим.Ад.Д имдимримрад.Адимримримрмдиримримримр м.Дадимфшьмримд им.Адимимрн имадми','ИМРИ.АФИМИМ.АЕИМИМРИМДМРИМРМРИРОР',3,'2005-06-01 17:30:43','1234567890'),
(2,'blah','464','aaa','haxpl2ilc20x00bj4tt2m5ti','11','11 g','G',3,'2005-06-02 22:43:10','1234567890');
CREATE TABLE t2 (
`msisdn` varchar(15) NOT NULL default '',
`operator_id` int(11) NOT NULL default '0',
`created` datetime NOT NULL default '0000-00-00 00:00:00',
UNIQUE KEY `PK_user` (`msisdn`)
) ENGINE=InnoDB DEFAULT CHARSET=utf8;
INSERT INTO t2 VALUES ('1234567890',2,'2005-05-24 13:53:25');
SELECT content, t2.msisdn FROM t1, t2 WHERE t1.msisdn = '1234567890';
content	msisdn
ERR Имри.Афимим.Аеимимримдмримрмрирор имримримримр имридм ирбднримрфмририримрфмфмим.Ад.Д имдимримрад.Адимримримрмдиримримримр м.Дадимфшьмримд им.Адимимрн имадми	1234567890
11 g	1234567890
DROP TABLE t1,t2;
create table t1 (a char(20) character set utf8);
insert into t1 values ('123456'),('андрей');
SET STATEMENT sql_mode = 'NO_ENGINE_SUBSTITUTION' FOR
alter table t1 modify a char(2) character set utf8;
Warnings:
Warning	1265	Data truncated for column 'a' at row 1
Warning	1265	Data truncated for column 'a' at row 2
select char_length(a), length(a), a from t1 order by a;
char_length(a)	length(a)	a
2	2	12
2	4	ан
drop table t1;
set names utf8;
select 'andre%' like 'andreñ%' escape 'ñ';
'andre%' like 'andreñ%' escape 'ñ'
1
set names utf8;
select 'a\\' like 'a\\';
'a\\' like 'a\\'
1
select 'aa\\' like 'a%\\';
'aa\\' like 'a%\\'
1
create table t1 (a char(10), key(a)) character set utf8;
insert into t1 values ("a"),("abc"),("abcd"),("hello"),("test");
select * from t1 where a like "abc%";
a
abc
abcd
select * from t1 where a like concat("abc","%");
a
abc
abcd
select * from t1 where a like "ABC%";
a
abc
abcd
select * from t1 where a like "test%";
a
test
select * from t1 where a like "te_t";
a
test
select * from t1 where a like "%a%";
a
a
abc
abcd
select * from t1 where a like "%abcd%";
a
abcd
select * from t1 where a like "%abc\d%";
a
abcd
drop table t1;
CREATE TABLE t1 (
a varchar(255) NOT NULL default '',
KEY a (a)
) ENGINE=MyISAM DEFAULT CHARSET=utf8 COLLATE utf8_general_ci;
insert into t1 values (_utf8 0xe880bd);
insert into t1 values (_utf8 0x5b);
select hex(a) from t1;
hex(a)
5B
E880BD
drop table t1;
set names 'latin1';
create table t1 (a varchar(255)) default charset=utf8;
select * from t1 where find_in_set('-1', a);
a
drop table t1;
create table t1 (a int);
insert into t1 values (48),(49),(50);
set names utf8;
select distinct char(a) from t1;
char(a)
0
1
2
drop table t1;
CREATE TABLE t1 (t TINYTEXT CHARACTER SET utf8);
INSERT INTO t1 VALUES(REPEAT('a', 100));
CREATE TEMPORARY TABLE t2 SELECT COALESCE(t) AS bug FROM t1;
SELECT LENGTH(bug) FROM t2;
LENGTH(bug)
100
DROP TABLE t2;
DROP TABLE t1;
CREATE TABLE t1 (item varchar(255)) default character set utf8;
INSERT INTO t1 VALUES (N'\\');
INSERT INTO t1 VALUES (_utf8'\\');
INSERT INTO t1 VALUES (N'Cote d\'Ivoire');
INSERT INTO t1 VALUES (_utf8'Cote d\'Ivoire');
SELECT item FROM t1 ORDER BY item;
item
Cote d'Ivoire
Cote d'Ivoire
\
\
DROP TABLE t1;
SET NAMES utf8;
DROP TABLE IF EXISTS t1;
Warnings:
Note	1051	Unknown table 'test.t1'
CREATE TABLE t1(a VARCHAR(255), KEY(a)) ENGINE=MyISAM DEFAULT CHARSET=utf8;
INSERT INTO t1 VALUES('uuABCDEFGHIGKLMNOPRSTUVWXYZ̈bbbbbbbbbbbbbbbbbbbbbbbbbbbbbbbbbbbbbbbbbbbbbbbbbbbbbbbbbbbbbbbbbbbbbbbbbbbbbbbbbbbbbbbbbbbbbbbbbbbbbbbbbbbbbbbbbbbbbbbbbbbbbbbbbbbbbbbbbbbbbbbbbbbbbbbbbbbbbbbbbbbbbbbbbbbbbbbbbbbbbbbbbbbbbbbbbbbbbbbbbbbbbbbbbbbbbbbbbbbbbbbbbbb');
INSERT INTO t1 VALUES('uu');
check table t1;
Table	Op	Msg_type	Msg_text
test.t1	check	status	OK
INSERT INTO t1 VALUES('uU');
check table t1;
Table	Op	Msg_type	Msg_text
test.t1	check	status	OK
INSERT INTO t1 VALUES('uu');
check table t1;
Table	Op	Msg_type	Msg_text
test.t1	check	status	OK
INSERT INTO t1 VALUES('uuABC');
check table t1;
Table	Op	Msg_type	Msg_text
test.t1	check	status	OK
INSERT INTO t1 VALUES('UuABC');
check table t1;
Table	Op	Msg_type	Msg_text
test.t1	check	status	OK
INSERT INTO t1 VALUES('uuABC');
check table t1;
Table	Op	Msg_type	Msg_text
test.t1	check	status	OK
alter table t1 add b int;
INSERT INTO t1 VALUES('uuABCDEFGHIGKLMNOPRSTUVWXYZ̈bbbbbbbbbbbbbbbbbbbbbbbbbbbbbbbbbbbbbbbbbbbbbbbbbbbbbbbbbbbbbbbbbbbbbbbbbbbbbbbbbbbbbbbbbbbbbbbbbbbbbbbbbbbbbbbbbbbbbbbbbbbbbbbbbbbbbbbbbbbbbbbbbbbbbbbbbbbbbbbbbbbbbbbbbbbbbbbbbbbbbbbbbbbbbbbbbbbbbbbbbbbbbbbbbbbbbbbbbbbbbbbbbbb',1);
INSERT INTO t1 VALUES('uuABCDEFGHIGKLMNOPRSTUVWXYZ̈bbbbbbbbbbbbbbbbbbbbbbbbbbbbbbbbbbbbbbbbbbbbbbbbbbbbbbbbbbbbbbbbbbbbbbbbbbbbbbbbbbbbbbbbbbbbbbbbbbbbbbbbbbbbbbbbbbbbbbbbbbbbbbbbbbbbbbbbbbbbbbbbbbbbbbbbbbbbbbbbbbbbbbbbbbbbbbbbbbbbbbbbbbbbbbbbbbbbbbbbbbbbbbbbbbbbbbbbbbbbbbbbbbb',2);
delete from t1 where b=1;
INSERT INTO t1 VALUES('UUABCDEFGHIGKLMNOPRSTUVWXYZ̈bbbbbbbbbbbbbbbbbbbbbbbbbbbbbbbbbbbbbbbbbbbbbbbbbbbbbbbbbbbbbbbbbbbbbbbbbbbbbbbbbbbbbbbbbbbbbbbbbbbbbbbbbbbbbbbbbbbbbbbbbbbbbbbbbbbbbbbbbbbbbbbbbbbbbbbbbbbbbbbbbbbbbbbbbbbbbbbbbbbbbbbbbbbbbbbbbbbbbbbbbbbbbbbbbbbbbbbbbbbbbbbbbbb',1);
check table t1;
Table	Op	Msg_type	Msg_text
test.t1	check	status	OK
INSERT INTO t1 VALUES('uuABCDEFGHIGKLMNOPRSTUVWXYZ̈bbbbbbbbbbbbbbbbbbbbbbbbbbbbbbbbbbbbbbbbbbbbbbbbbbbbbbbbbbbbbbbbbbbbbbbbbbbbbbbbbbbbbbbbbbbbbbbbbbbbbbbbbbbbbbbbbbbbbbbbbbbbbbbbbbbbbbbbbbbbbbbbbbbbbbbbbbbbbbbbbbbbbbbbbbbbbbbbbbbbbbbbbbbbbbbbbbbbbbbbbbbbbbbbbbbbbbbbbbbbbbbbbbb',3);
INSERT INTO t1 VALUES('uuABCDEFGHIGKLMNOPRSTUVWXYZ̈bbbbbbbbbbbbbbbbbbbbbbbbbbbbbbbbbbbbbbbbbbbbbbbbbbbbbbbbbbbbbbbbbbbbbbbbbbbbbbbbbbbbbbbbbbbbbbbbbbbbbbbbbbbbbbbbbbbbbbbbbbbbbbbbbbbbbbbbbbbbbbbbbbbbbbbbbbbbbbbbbbbbbbbbbbbbbbbbbbbbbbbbbbbbbbbbbbbbbbbbbbbbbbbbbbbbbbbbbbbbbbbbbbb',4);
delete from t1 where b=3;
INSERT INTO t1 VALUES('uUABCDEFGHIGKLMNOPRSTUVWXYZ̈bbbbbbbbbbbbbbbbbbbbbbbbbbbbbbbbbbbbbbbbbbbbbbbbbbbbbbbbbbbbbbbbbbbbbbbbbbbbbbbbbbbbbbbbbbbbbbbbbbbbbbbbbbbbbbbbbbbbbbbbbbbbbbbbbbbbbbbbbbbbbbbbbbbbbbbbbbbbbbbbbbbbbbbbbbbbbbbbbbbbbbbbbbbbbbbbbbbbbbbbbbbbbbbbbbbbbbbbbbbbbbbbbbb',3);
check table t1;
Table	Op	Msg_type	Msg_text
test.t1	check	status	OK
drop table t1;
set names utf8;
create table t1 (s1 char(5) character set utf8);
insert into t1 values
('a'),('b'),(null),('ペテルグル'),('ü'),('Y');
create index it1 on t1 (s1);
select s1 as before_delete_general_ci from t1 where s1 like 'ペテ%';
before_delete_general_ci
ペテルグル
delete from t1 where s1 = 'Y';
select s1 as after_delete_general_ci from t1 where s1 like 'ペテ%';
after_delete_general_ci
ペテルグル
drop table t1;
set names utf8;
create table t1 (s1 char(5) character set utf8 collate utf8_unicode_ci);
insert into t1 values
('a'),('b'),(null),('ペテルグル'),('ü'),('Y');
create index it1 on t1 (s1);
select s1 as before_delete_unicode_ci from t1 where s1 like 'ペテ%';
before_delete_unicode_ci
ペテルグル
delete from t1 where s1 = 'Y';
select s1 as after_delete_unicode_ci from t1 where s1 like 'ペテ%';
after_delete_unicode_ci
ペテルグル
drop table t1;
set names utf8;
create table t1 (s1 char(5) character set utf8 collate utf8_bin);
insert into t1 values
('a'),('b'),(null),('ペテルグル'),('ü'),('Y');
create index it1 on t1 (s1);
select s1 as before_delete_bin from t1 where s1 like 'ペテ%';
before_delete_bin
ペテルグル
delete from t1 where s1 = 'Y';
select s1 as after_delete_bin from t1 where s1 like 'ペテ%';
after_delete_bin
ペテルグル
drop table t1;
set names utf8;
create table t1 (a varchar(30) not null primary key)
engine=innodb  default character set utf8 collate utf8_general_ci;
insert into t1 values ('あいうえおかきくけこさしすせそ');
insert into t1 values ('さしすせそかきくけこあいうえお');
select a as gci1 from t1 where a like 'さしすせそかきくけこあいうえお%';
gci1
さしすせそかきくけこあいうえお
select a as gci2 from t1 where a like 'あいうえおかきくけこさしすせそ';
gci2
あいうえおかきくけこさしすせそ
drop table t1;
set names utf8;
create table t1 (a varchar(30) not null primary key)
engine=innodb default character set utf8 collate utf8_unicode_ci;
insert into t1 values ('あいうえおかきくけこさしすせそ');
insert into t1 values ('さしすせそかきくけこあいうえお');
select a as uci1 from t1 where a like 'さしすせそかきくけこあいうえお%';
uci1
さしすせそかきくけこあいうえお
select a as uci2 from t1 where a like 'あいうえおかきくけこさしすせそ';
uci2
あいうえおかきくけこさしすせそ
drop table t1;
set names utf8;
create table t1 (a varchar(30) not null primary key)
engine=innodb default character set utf8 collate utf8_bin;
insert into t1 values ('あいうえおかきくけこさしすせそ');
insert into t1 values ('さしすせそかきくけこあいうえお');
select a as bin1 from t1 where a like 'さしすせそかきくけこあいうえお%';
bin1
さしすせそかきくけこあいうえお
select a as bin2 from t1 where a like 'あいうえおかきくけこさしすせそ';
bin2
あいうえおかきくけこさしすせそ
drop table t1;
SET NAMES utf8;
CREATE TABLE t1 (id int PRIMARY KEY,
a varchar(16) collate utf8_unicode_ci NOT NULL default '',
b int,
f varchar(128) default 'XXX',
INDEX (a(4))
) ENGINE=MyISAM DEFAULT CHARSET=utf8 COLLATE=utf8_unicode_ci;
INSERT INTO t1(id, a, b) VALUES
(1, 'cccc', 50), (2, 'cccc', 70), (3, 'cccc', 30),
(4, 'cccc', 30), (5, 'cccc', 20), (6, 'bbbbbb', 40),
(7, 'dddd', 30), (8, 'aaaa', 10), (9, 'aaaa', 50),
(10, 'eeeee', 40), (11, 'bbbbbb', 60);
SELECT id, a, b FROM t1;
id	a	b
1	cccc	50
2	cccc	70
3	cccc	30
4	cccc	30
5	cccc	20
6	bbbbbb	40
7	dddd	30
8	aaaa	10
9	aaaa	50
10	eeeee	40
11	bbbbbb	60
SELECT id, a, b FROM t1 WHERE a BETWEEN 'aaaa' AND 'bbbbbb';
id	a	b
8	aaaa	10
9	aaaa	50
6	bbbbbb	40
11	bbbbbb	60
SELECT id, a FROM t1 WHERE a='bbbbbb';
id	a
6	bbbbbb
11	bbbbbb
SELECT id, a FROM t1 WHERE a='bbbbbb' ORDER BY b;
id	a
6	bbbbbb
11	bbbbbb
DROP TABLE t1;
SET NAMES utf8;
CREATE TABLE t1 (
a CHAR(13) DEFAULT '',
INDEX(a)
) ENGINE=MyISAM DEFAULT CHARSET=utf8 COLLATE=utf8_general_ci;
INSERT INTO t1 VALUES 
('Käli Käli 2-4'), ('Käli Käli 2-4'),
('Käli Käli 2+4'), ('Käli Käli 2+4'),
('Käli Käli 2-6'), ('Käli Käli 2-6');
INSERT INTO t1 SELECT * FROM t1;
CREATE TABLE t2 (
a CHAR(13) DEFAULT '',
INDEX(a)
) ENGINE=MyISAM DEFAULT CHARSET=latin1 COLLATE=latin1_general_ci;
INSERT INTO t2 VALUES
('Kali Kali 2-4'), ('Kali Kali 2-4'),
('Kali Kali 2+4'), ('Kali Kali 2+4'),
('Kali Kali 2-6'), ('Kali Kali 2-6');
INSERT INTO t2 SELECT * FROM t2;
SELECT a FROM t1 WHERE a LIKE 'Käli Käli 2+4';
a
Käli Käli 2+4
Käli Käli 2+4
Käli Käli 2+4
Käli Käli 2+4
SELECT a FROM t2 WHERE a LIKE 'Kali Kali 2+4';
a
Kali Kali 2+4
Kali Kali 2+4
Kali Kali 2+4
Kali Kali 2+4
EXPLAIN SELECT a FROM t1 WHERE a LIKE 'Käli Käli 2+4';
id	select_type	table	type	possible_keys	key	key_len	ref	rows	Extra
1	SIMPLE	t1	range	a	a	40	NULL	4	Using where; Using index
EXPLAIN SELECT a FROM t1 WHERE a = 'Käli Käli 2+4';
id	select_type	table	type	possible_keys	key	key_len	ref	rows	Extra
1	SIMPLE	t1	ref	a	a	40	const	4	Using where; Using index
EXPLAIN SELECT a FROM t2 WHERE a LIKE 'Kali Kali 2+4';
id	select_type	table	type	possible_keys	key	key_len	ref	rows	Extra
1	SIMPLE	t2	range	a	a	14	NULL	4	Using where; Using index
EXPLAIN SELECT a FROM t2 WHERE a = 'Kali Kali 2+4';
id	select_type	table	type	possible_keys	key	key_len	ref	rows	Extra
1	SIMPLE	t2	ref	a	a	14	const	4	Using where; Using index
DROP TABLE t1,t2;
CREATE TABLE t1 (
a char(255) DEFAULT '', 
KEY(a(10))
) ENGINE=MyISAM DEFAULT CHARSET=utf8 COLLATE=utf8_general_ci;
INSERT INTO t1 VALUES ('Käli Käli 2-4');
SELECT * FROM t1 WHERE a LIKE 'Käli Käli 2%';
a
Käli Käli 2-4
INSERT INTO t1 VALUES ('Käli Käli 2-4');
SELECT * FROM t1 WHERE a LIKE 'Käli Käli 2%';
a
Käli Käli 2-4
Käli Käli 2-4
DROP TABLE t1;
CREATE TABLE t1 (
a char(255) DEFAULT ''
) ENGINE=MyISAM DEFAULT CHARSET=utf8 COLLATE=utf8_general_ci;
INSERT INTO t1 VALUES ('Käli Käli 2-4');
INSERT INTO t1 VALUES ('Käli Käli 2-4');
SELECT * FROM t1 WHERE a LIKE 'Käli Käli 2%';
a
Käli Käli 2-4
Käli Käli 2-4
ALTER TABLE t1 ADD KEY (a(10));
SELECT * FROM t1 WHERE a LIKE 'Käli Käli 2%';
a
Käli Käli 2-4
Käli Käli 2-4
DROP TABLE t1;
SET NAMES latin2;
CREATE TABLE t1 (
id int(11) NOT NULL default '0',
tid int(11) NOT NULL default '0',
val text NOT NULL,
INDEX idx(tid, val(10))
) ENGINE=MyISAM DEFAULT CHARSET=utf8;
INSERT INTO t1 VALUES
(40988,72,'VOLN� ADSL'),(41009,72,'VOLN� ADSL'),
(41032,72,'VOLN� ADSL'),(41038,72,'VOLN� ADSL'),
(41063,72,'VOLN� ADSL'),(41537,72,'VOLN� ADSL Office'),
(42141,72,'VOLN� ADSL'),(42565,72,'VOLN� ADSL Combi'),
(42749,72,'VOLN� ADSL'),(44205,72,'VOLN� ADSL');
SELECT * FROM t1 WHERE tid=72 and val LIKE 'VOLNY ADSL';
id	tid	val
40988	72	VOLN� ADSL
41009	72	VOLN� ADSL
41032	72	VOLN� ADSL
41038	72	VOLN� ADSL
41063	72	VOLN� ADSL
42141	72	VOLN� ADSL
42749	72	VOLN� ADSL
44205	72	VOLN� ADSL
SELECT * FROM t1 WHERE tid=72 and val LIKE 'VOLN� ADSL';
id	tid	val
40988	72	VOLN� ADSL
41009	72	VOLN� ADSL
41032	72	VOLN� ADSL
41038	72	VOLN� ADSL
41063	72	VOLN� ADSL
42141	72	VOLN� ADSL
42749	72	VOLN� ADSL
44205	72	VOLN� ADSL
SELECT * FROM t1 WHERE tid=72 and val LIKE '%VOLN� ADSL';
id	tid	val
40988	72	VOLN� ADSL
41009	72	VOLN� ADSL
41032	72	VOLN� ADSL
41038	72	VOLN� ADSL
41063	72	VOLN� ADSL
42141	72	VOLN� ADSL
42749	72	VOLN� ADSL
44205	72	VOLN� ADSL
ALTER TABLE t1 DROP KEY idx;
ALTER TABLE t1 ADD KEY idx (tid,val(11));
SELECT * FROM t1 WHERE tid=72 and val LIKE 'VOLN� ADSL';
id	tid	val
40988	72	VOLN� ADSL
41009	72	VOLN� ADSL
41032	72	VOLN� ADSL
41038	72	VOLN� ADSL
41063	72	VOLN� ADSL
42141	72	VOLN� ADSL
42749	72	VOLN� ADSL
44205	72	VOLN� ADSL
DROP TABLE t1;
create table t1(a char(200) collate utf8_unicode_ci NOT NULL default '')
default charset=utf8 collate=utf8_unicode_ci;
insert into t1 values (unhex('65')), (unhex('C3A9')), (unhex('65'));
explain select distinct a from t1;
id	select_type	table	type	possible_keys	key	key_len	ref	rows	Extra
1	SIMPLE	t1	ALL	NULL	NULL	NULL	NULL	3	Using temporary
select distinct a from t1;
a
e
explain select a from t1 group by a;
id	select_type	table	type	possible_keys	key	key_len	ref	rows	Extra
1	SIMPLE	t1	ALL	NULL	NULL	NULL	NULL	3	Using temporary; Using filesort
select a from t1 group by a;
a
e
drop table t1;
create table t1(a char(10)) default charset utf8;
insert into t1 values ('123'), ('456');
explain
select substr(Z.a,-1), Z.a from t1 as Y join t1 as Z on Y.a=Z.a order by 1;
id	select_type	table	type	possible_keys	key	key_len	ref	rows	Extra
1	SIMPLE	Y	ALL	NULL	NULL	NULL	NULL	2	Using temporary; Using filesort
1	SIMPLE	Z	ALL	NULL	NULL	NULL	NULL	2	Using where; Using join buffer (flat, BNL join)
select substr(Z.a,-1), Z.a from t1 as Y join t1 as Z on Y.a=Z.a order by 1;
substr(Z.a,-1)	a
3	123
6	456
drop table t1;
SET CHARACTER SET utf8;
SHOW VARIABLES LIKE 'character\_set\_%';
Variable_name	Value
character_set_client	utf8mb3
character_set_collations	ucs2=ucs2_uca1400_ai_ci,utf8mb4=utf8mb4_uca1400_ai_ci,utf16=utf16_uca1400_ai_ci,utf32=utf32_uca1400_ai_ci
character_set_connection	utf8mb4
character_set_database	utf8mb4
character_set_filesystem	binary
character_set_results	utf8mb3
character_set_server	utf8mb4
character_set_system	utf8mb3
CREATE DATABASE crashtest DEFAULT CHARACTER SET utf8 COLLATE utf8_bin;
USE crashtest;
CREATE TABLE crashtest (crash char(10)) DEFAULT CHARSET=utf8;
INSERT INTO crashtest VALUES ('35'), ('36'), ('37');
SELECT * FROM crashtest ORDER BY CHAR(crash USING utf8);
crash
35
36
37
INSERT INTO crashtest VALUES ('-1000');
EXPLAIN SELECT * FROM crashtest ORDER BY CHAR(crash USING utf8);
id	select_type	table	type	possible_keys	key	key_len	ref	rows	Extra
1	SIMPLE	crashtest	ALL	NULL	NULL	NULL	NULL	4	Using filesort
SELECT * FROM crashtest ORDER BY CHAR(crash USING utf8);
crash
-1000
35
36
37
Warnings:
Warning	1300	Invalid utf8mb3 character string: 'FFFFFC'
DROP TABLE crashtest;
DROP DATABASE crashtest;
USE test;
SET CHARACTER SET default;
CREATE TABLE t1(id varchar(20) NOT NULL) DEFAULT CHARSET=utf8;
INSERT INTO t1 VALUES ('xxx'), ('aa'), ('yyy'), ('aa');
SELECT id FROM t1;
id
xxx
aa
yyy
aa
SELECT DISTINCT id FROM t1;
id
xxx
aa
yyy
SELECT DISTINCT id FROM t1 ORDER BY id;
id
aa
xxx
yyy
DROP TABLE t1;
create table t1 (
a varchar(26) not null
) default character set utf8;
insert into t1 (a) values ('abcdefghijklmnopqrstuvwxyz');
select * from t1;
a
abcdefghijklmnopqrstuvwxyz
SET STATEMENT sql_mode = 'NO_ENGINE_SUBSTITUTION' FOR
alter table t1 change a a varchar(20) character set utf8 not null;
Warnings:
Warning	1265	Data truncated for column 'a' at row 1
select * from t1;
a
abcdefghijklmnopqrst
SET STATEMENT sql_mode = 'NO_ENGINE_SUBSTITUTION' FOR
alter table t1 change a a char(15) character set utf8 not null;
Warnings:
Warning	1265	Data truncated for column 'a' at row 1
select * from t1;
a
abcdefghijklmno
SET STATEMENT sql_mode = 'NO_ENGINE_SUBSTITUTION' FOR
alter table t1 change a a char(10) character set utf8 not null;
Warnings:
Warning	1265	Data truncated for column 'a' at row 1
select * from t1;
a
abcdefghij
SET STATEMENT sql_mode = 'NO_ENGINE_SUBSTITUTION' FOR
alter table t1 change a a varchar(5) character set utf8 not null;
Warnings:
Warning	1265	Data truncated for column 'a' at row 1
select * from t1;
a
abcde
drop table t1;
create table t1 (
a varchar(4000) not null
) default character set utf8;
insert into t1 values (repeat('a',4000));
SET STATEMENT sql_mode = 'NO_ENGINE_SUBSTITUTION' FOR
alter table t1 change a a varchar(3000) character set utf8 not null;
Warnings:
Warning	1265	Data truncated for column 'a' at row 1
select length(a) from t1;
length(a)
3000
drop table t1;
set names utf8;
select hex(char(1 using utf8));
hex(char(1 using utf8))
01
select char(0xd1,0x8f using utf8);
char(0xd1,0x8f using utf8)
я
select char(0xd18f using utf8);
char(0xd18f using utf8)
я
select char(53647 using utf8);
char(53647 using utf8)
я
select char(0xff,0x8f using utf8);
char(0xff,0x8f using utf8)
NULL
Warnings:
Warning	1300	Invalid utf8mb3 character string: 'FF8F'
select convert(char(0xff,0x8f) using utf8);
convert(char(0xff,0x8f) using utf8)
??
Warnings:
Warning	1300	Invalid utf8mb3 character string: '\xFF\x8F'
set sql_mode=traditional;
select char(0xff,0x8f using utf8);
char(0xff,0x8f using utf8)
NULL
Warnings:
Warning	1300	Invalid utf8mb3 character string: 'FF8F'
select char(195 using utf8);
char(195 using utf8)
NULL
Warnings:
Warning	1300	Invalid utf8mb3 character string: 'C3'
select char(196 using utf8);
char(196 using utf8)
NULL
Warnings:
Warning	1300	Invalid utf8mb3 character string: 'C4'
select char(2557 using utf8);
char(2557 using utf8)
NULL
Warnings:
Warning	1300	Invalid utf8mb3 character string: 'FD'
select convert(char(0xff,0x8f) using utf8);
convert(char(0xff,0x8f) using utf8)
??
Warnings:
Warning	1300	Invalid utf8mb3 character string: '\xFF\x8F'
select hex(convert(char(2557 using latin1) using utf8));
hex(convert(char(2557 using latin1) using utf8))
09C3BD
select hex(char(195));
hex(char(195))
C3
select hex(char(196));
hex(char(196))
C4
select hex(char(2557));
hex(char(2557))
09FD
set names utf8;
create table t1 (a char(1)) default character set utf8;
create table t2 (a char(1)) default character set utf8;
insert into t1 values('a'),('a'),(0xE38182),(0xE38182);
insert into t1 values('i'),('i'),(0xE38184),(0xE38184);
select * from t1 union distinct select * from t2;
a
a
あ
i
い
drop table t1,t2;
set names utf8;
create table t1 (a char(10), b varchar(10));
insert into t1 values ('bar','kostja');
insert into t1 values ('kostja','bar');
prepare my_stmt from "select * from t1 where a=?";
set @a:='bar';
execute my_stmt using @a;
a	b
bar	kostja
set @a:='kostja';
execute my_stmt using @a;
a	b
kostja	bar
set @a:=null;
execute my_stmt using @a;
a	b
drop table if exists t1;
drop table if exists t1;
drop view if exists v1, v2;
set names utf8;
create table t1(col1 varchar(12) character set utf8 collate utf8_unicode_ci);
insert into t1 values('t1_val');
create view v1 as select 'v1_val' as col1;
select coercibility(col1), collation(col1) from v1;
coercibility(col1)	collation(col1)
6	utf8mb3_general_ci
create view v2 as select col1 from v1 union select col1 from t1;
select coercibility(col1), collation(col1)from v2;
coercibility(col1)	collation(col1)
2	utf8mb3_unicode_ci
2	utf8mb3_unicode_ci
drop view v1, v2;
create view v1 as select 'v1_val' collate utf8_swedish_ci as col1;
select coercibility(col1), collation(col1) from v1;
coercibility(col1)	collation(col1)
0	utf8mb3_swedish_ci
create view v2 as select col1 from v1 union select col1 from t1;
select coercibility(col1), collation(col1) from v2;
coercibility(col1)	collation(col1)
0	utf8mb3_swedish_ci
0	utf8mb3_swedish_ci
drop view v1, v2;
drop table t1;
set names utf8;
create table t1 (a varchar(10) character set latin1, b int);
insert into t1 values ('a',1);
select concat(a, if(b>10, N'x', N'y')) from t1;
concat(a, if(b>10, N'x', N'y'))
ay
select concat(a, if(b>10, N'æ', N'ß')) from t1;
ERROR HY000: Illegal mix of collations (latin1_swedish_ci,IMPLICIT) and (utf8mb3_general_ci,COERCIBLE) for operation 'concat'
drop table t1;
set names utf8;
create table t1 (a varchar(10) character set latin1, b int);
insert into t1 values ('a',1);
select concat(a, if(b>10, _utf8'x', _utf8'y')) from t1;
concat(a, if(b>10, _utf8'x', _utf8'y'))
ay
select concat(a, if(b>10, _utf8'æ', _utf8'ß')) from t1;
ERROR HY000: Illegal mix of collations (latin1_swedish_ci,IMPLICIT) and (utf8mb3_general_ci,COERCIBLE) for operation 'concat'
drop table t1;
set names utf8;
create table t1 (a varchar(10) character set latin1, b int);
insert into t1 values ('a',1);
select concat(a, if(b>10, _utf8 0x78, _utf8 0x79)) from t1;
concat(a, if(b>10, _utf8 0x78, _utf8 0x79))
ay
select concat(a, if(b>10, _utf8 0xC3A6, _utf8 0xC3AF)) from t1;
ERROR HY000: Illegal mix of collations (latin1_swedish_ci,IMPLICIT) and (utf8mb3_general_ci,COERCIBLE) for operation 'concat'
drop table t1;
set names utf8;
create table t1 (a varchar(10) character set latin1, b int);
insert into t1 values ('a',1);
select concat(a, if(b>10, 'x' 'x', 'y' 'y')) from t1;
concat(a, if(b>10, 'x' 'x', 'y' 'y'))
ayy
select concat(a, if(b>10, 'x' 'æ', 'y' 'ß')) from t1;
ERROR HY000: Illegal mix of collations (latin1_swedish_ci,IMPLICIT) and (utf8mb3_general_ci,COERCIBLE) for operation 'concat'
drop table t1;
CREATE TABLE t1 (
colA int(11) NOT NULL,
colB varchar(255) character set utf8 NOT NULL,
PRIMARY KEY  (colA)
) ENGINE=InnoDB DEFAULT CHARSET=latin1;
INSERT INTO t1 (colA, colB) VALUES (1, 'foo'), (2, 'foo bar');
CREATE TABLE t2 (
colA int(11) NOT NULL,
colB varchar(255) character set utf8 NOT NULL,
KEY bad  (colA,colB(3))
) ENGINE=InnoDB DEFAULT CHARSET=latin1;
INSERT INTO t2 (colA, colB) VALUES (1, 'foo'),(2, 'foo bar');
SELECT * FROM t1 JOIN t2 ON t1.colA=t2.colA AND t1.colB=t2.colB
WHERE t1.colA < 3;
colA	colB	colA	colB
1	foo	1	foo
2	foo bar	2	foo bar
DROP TABLE t1, t2;
SELECT 'н1234567890' UNION SELECT _binary '1';
н1234567890
н1234567890
1
SELECT 'н1234567890' UNION SELECT 1;
н1234567890
н1234567890
1
SELECT '1' UNION SELECT 'н1234567890';
1
1
н1234567890
SELECT 1 UNION SELECT 'н1234567890';
1
1
н1234567890
CREATE TABLE t1 (c VARCHAR(11)) CHARACTER SET utf8;
CREATE TABLE t2 (b CHAR(1) CHARACTER SET binary, i INT);
INSERT INTO t1 (c) VALUES ('н1234567890');
INSERT INTO t2 (b, i) VALUES ('1', 1);
SELECT c FROM t1 UNION SELECT b FROM t2;
c
н1234567890
1
SELECT c FROM t1 UNION SELECT i FROM t2;
c
н1234567890
1
SELECT b FROM t2 UNION SELECT c FROM t1;
b
1
н1234567890
SELECT i FROM t2 UNION SELECT c FROM t1;
i
1
н1234567890
DROP TABLE t1, t2;
set sql_mode=traditional;
select hex(char(0xFF using utf8));
hex(char(0xFF using utf8))
NULL
Warnings:
Warning	1300	Invalid utf8mb3 character string: 'FF'
select hex(convert(0xFF using utf8));
hex(convert(0xFF using utf8))
3F
Warnings:
Warning	1300	Invalid utf8mb3 character string: '\xFF'
select hex(_utf8 0x616263FF);
ERROR HY000: Invalid utf8mb3 character string: 'FF'
select hex(_utf8 X'616263FF');
ERROR HY000: Invalid utf8mb3 character string: 'FF'
select hex(_utf8 B'001111111111');
ERROR HY000: Invalid utf8mb3 character string: 'FF'
select (_utf8 X'616263FF');
ERROR HY000: Invalid utf8mb3 character string: 'FF'
set sql_mode=default;
select hex(char(0xFF using utf8));
hex(char(0xFF using utf8))
NULL
Warnings:
Warning	1300	Invalid utf8mb3 character string: 'FF'
select hex(convert(0xFF using utf8));
hex(convert(0xFF using utf8))
3F
Warnings:
Warning	1300	Invalid utf8mb3 character string: '\xFF'
select hex(_utf8 0x616263FF);
ERROR HY000: Invalid utf8mb3 character string: 'FF'
select hex(_utf8 X'616263FF');
ERROR HY000: Invalid utf8mb3 character string: 'FF'
select hex(_utf8 B'001111111111');
ERROR HY000: Invalid utf8mb3 character string: 'FF'
select (_utf8 X'616263FF');
ERROR HY000: Invalid utf8mb3 character string: 'FF'
#
# Bug#44131 Binary-mode "order by" returns records in incorrect order for UTF-8 strings
#
CREATE TABLE t1 (id int not null primary key, name varchar(10)) character set utf8;
INSERT INTO t1 VALUES
(2,'一二三01'),(3,'一二三09'),(4,'一二三02'),(5,'一二三08'),
(6,'一二三11'),(7,'一二三91'),(8,'一二三21'),(9,'一二三81');
SELECT * FROM t1 ORDER BY BINARY(name);
id	name
2	一二三01
4	一二三02
5	一二三08
3	一二三09
6	一二三11
8	一二三21
9	一二三81
7	一二三91
DROP TABLE t1;
CREATE TABLE t1 (a INT NOT NULL, b INT NOT NULL);
INSERT INTO t1 VALUES (70000, 1092), (70001, 1085), (70002, 1065);
SELECT CONVERT(a, CHAR), CONVERT(b, CHAR) FROM t1 GROUP BY b;
CONVERT(a, CHAR)	CONVERT(b, CHAR)
70002	1065
70001	1085
70000	1092
SELECT CONVERT(a, CHAR), CONVERT(b, CHAR) FROM t1;
CONVERT(a, CHAR)	CONVERT(b, CHAR)
70000	1092
70001	1085
70002	1065
ALTER TABLE t1 ADD UNIQUE (b);
SELECT CONVERT(a, CHAR), CONVERT(b, CHAR) FROM t1 GROUP BY b;
CONVERT(a, CHAR)	CONVERT(b, CHAR)
70002	1065
70001	1085
70000	1092
DROP INDEX b ON t1;
SELECT CONVERT(a, CHAR), CONVERT(b, CHAR) FROM t1 GROUP BY b;
CONVERT(a, CHAR)	CONVERT(b, CHAR)
70002	1065
70001	1085
70000	1092
ALTER TABLE t1 ADD INDEX (b);
SELECT CONVERT(a, CHAR), CONVERT(b, CHAR) from t1 GROUP BY b;
CONVERT(a, CHAR)	CONVERT(b, CHAR)
70002	1065
70001	1085
70000	1092
DROP TABLE t1;
End of 5.0 tests
SELECT LENGTH(RPAD(0.0115E88, 61297, _utf8'яэюя'));
LENGTH(RPAD(0.0115E88, 61297, _utf8'яэюя'))
122587
SELECT LENGTH(RPAD(0.0115E88, 61297, _utf8'йцуя'));
LENGTH(RPAD(0.0115E88, 61297, _utf8'йцуя'))
122587
SELECT HEX(RPAD(0x20, 2, _utf8 0xD18F));
HEX(RPAD(0x20, 2, _utf8 0xD18F))
20D1
SELECT HEX(RPAD(0x20, 4, _utf8 0xD18F));
HEX(RPAD(0x20, 4, _utf8 0xD18F))
20D18FD1
SELECT HEX(LPAD(0x20, 2, _utf8 0xD18F));
HEX(LPAD(0x20, 2, _utf8 0xD18F))
D120
SELECT HEX(LPAD(0x20, 4, _utf8 0xD18F));
HEX(LPAD(0x20, 4, _utf8 0xD18F))
D18FD120
SELECT HEX(RPAD(_utf8 0xD18F, 3, 0x20));
HEX(RPAD(_utf8 0xD18F, 3, 0x20))
D18F20
SELECT HEX(LPAD(_utf8 0xD18F, 3, 0x20));
HEX(LPAD(_utf8 0xD18F, 3, 0x20))
20D18F
SELECT HEX(INSERT(_utf8 0xD18F, 2, 1, 0x20));
HEX(INSERT(_utf8 0xD18F, 2, 1, 0x20))
D120
SELECT HEX(INSERT(_utf8 0xD18FD18E, 2, 1, 0x20));
HEX(INSERT(_utf8 0xD18FD18E, 2, 1, 0x20))
D120D18E
#
# Bug#11752408 - 43593: DUMP/BACKUP/RESTORE/UPGRADE TOOLS FAILS BECAUSE OF UTF8_GENERAL_CI
#
CREATE TABLE t1 (a VARCHAR(10) CHARACTER SET utf8 COLLATE utf8_general_mysql500_ci);
INSERT INTO t1 VALUES ('a'),('r'),('s'),(_latin1 0xDF),(_latin1 0xF7),('t'),('z');
SELECT * FROM t1 ORDER BY a;
a
a
r
s
t
z
ß
÷
SELECT a, COUNT(*) FROM t1 GROUP BY a;
a	COUNT(*)
a	1
r	1
s	1
t	1
z	1
ß	1
÷	1
DROP TABLE t1;
End of 5.1 tests
Start of 5.4 tests
SET NAMES utf8mb3;
SHOW VARIABLES LIKE 'character_set_results%';
Variable_name	Value
character_set_results	utf8mb3
CREATE TABLE t1 (a CHAR CHARACTER SET utf8mb3 COLLATE utf8mb3_bin);
SHOW CREATE TABLE t1;
Table	Create Table
t1	CREATE TABLE `t1` (
  `a` char(1) CHARACTER SET utf8mb3 COLLATE utf8mb3_bin DEFAULT NULL
) ENGINE=MyISAM DEFAULT CHARSET=utf8mb4 COLLATE=utf8mb4_uca1400_ai_ci
DROP TABLE t1;
SELECT _utf8mb3'test';
test
test
CREATE TABLE t1 (
clipid INT NOT NULL,
Tape TINYTEXT,
PRIMARY KEY (clipid),
KEY tape(Tape(255))
) CHARACTER SET=utf8;
ALTER TABLE t1 ADD mos TINYINT DEFAULT 0 AFTER clipid;
SHOW CREATE TABLE t1;
Table	Create Table
t1	CREATE TABLE `t1` (
  `clipid` int(11) NOT NULL,
  `mos` tinyint(4) DEFAULT 0,
  `Tape` tinytext DEFAULT NULL,
  PRIMARY KEY (`clipid`),
  KEY `tape` (`Tape`(255))
) ENGINE=MyISAM DEFAULT CHARSET=utf8mb3 COLLATE=utf8mb3_general_ci
DROP TABLE t1;
DROP TABLE IF EXISTS t1;
CREATE TABLE t1 (
predicted_order int NOT NULL,
utf8_encoding VARCHAR(10) NOT NULL
) CHARACTER SET utf8;
INSERT INTO t1 VALUES (19, x'E0B696'), (30, x'E0B69AE0B798'), (61, x'E0B6AF'), (93, x'E0B799'), (52, x'E0B6A6'), (73, x'E0B6BBE0B78AE2808D'), (3, x'E0B686'), (56, x'E0B6AA'), (55, x'E0B6A9'), (70, x'E0B6B9'), (94, x'E0B79A'), (80, x'E0B785'), (25, x'E0B69AE0B791'), (48, x'E0B6A2'), (13, x'E0B690'), (86, x'E0B793'), (91, x'E0B79F'), (81, x'E0B786'), (79, x'E0B784'), (14, x'E0B691'), (99, x'E0B78A'), (8, x'E0B68B'), (68, x'E0B6B7'), (22, x'E0B69A'), (16, x'E0B693'), (33, x'E0B69AE0B7B3'), (38, x'E0B69AE0B79D'), (21, x'E0B683'), (11, x'E0B68E'), (77, x'E0B782'), (40, x'E0B69AE0B78A'), (101, x'E0B78AE2808DE0B6BB'), (35, x'E0B69AE0B79A'), (1, x'E0B7B4'), (9, x'E0B68C'), (96, x'E0B79C'), (6, x'E0B689'), (95, x'E0B79B'), (88, x'E0B796'), (64, x'E0B6B3'), (26, x'E0B69AE0B792'), (82, x'E0B78F'), (28, x'E0B69AE0B794'), (39, x'E0B69AE0B79E'), (97, x'E0B79D'), (2, x'E0B685'), (75, x'E0B780'), (34, x'E0B69AE0B799'), (69, x'E0B6B8'), (83, x'E0B790'), (18, x'E0B695'), (90, x'E0B7B2'), (17, x'E0B694'), (72, x'E0B6BB'), (66, x'E0B6B5'), (59, x'E0B6AD'), (44, x'E0B69E'), (15, x'E0B692'), (23, x'E0B69AE0B78F'), (65, x'E0B6B4'), (42, x'E0B69C'), (63, x'E0B6B1'), (85, x'E0B792'), (47, x'E0B6A1'), (49, x'E0B6A3'), (92, x'E0B7B3'), (78, x'E0B783'), (36, x'E0B69AE0B79B'), (4, x'E0B687'), (24, x'E0B69AE0B790'), (87, x'E0B794'), (37, x'E0B69AE0B79C'), (32, x'E0B69AE0B79F'), (29, x'E0B69AE0B796'), (43, x'E0B69D'), (62, x'E0B6B0'), (100, x'E0B78AE2808DE0B6BA'), (60, x'E0B6AE'), (45, x'E0B69F'), (12, x'E0B68F'), (46, x'E0B6A0'), (50, x'E0B6A5'), (51, x'E0B6A4'), (5, x'E0B688'), (76, x'E0B781'), (89, x'E0B798'), (74, x'E0B6BD'), (10, x'E0B68D'), (57, x'E0B6AB'), (71, x'E0B6BA'), (58, x'E0B6AC'), (27, x'E0B69AE0B793'), (54, x'E0B6A8'), (84, x'E0B791'), (31, x'E0B69AE0B7B2'), (98, x'E0B79E'), (53, x'E0B6A7'), (41, x'E0B69B'), (67, x'E0B6B6'), (7, x'E0B68A'), (20, x'E0B682');
SELECT predicted_order, hex(utf8_encoding) FROM t1 ORDER BY utf8_encoding COLLATE utf8_sinhala_ci;
predicted_order	hex(utf8_encoding)
1	E0B7B4
2	E0B685
3	E0B686
4	E0B687
5	E0B688
6	E0B689
7	E0B68A
8	E0B68B
9	E0B68C
10	E0B68D
11	E0B68E
12	E0B68F
13	E0B690
14	E0B691
15	E0B692
16	E0B693
17	E0B694
18	E0B695
19	E0B696
20	E0B682
21	E0B683
22	E0B69A
23	E0B69AE0B78F
24	E0B69AE0B790
25	E0B69AE0B791
26	E0B69AE0B792
27	E0B69AE0B793
28	E0B69AE0B794
29	E0B69AE0B796
30	E0B69AE0B798
31	E0B69AE0B7B2
32	E0B69AE0B79F
33	E0B69AE0B7B3
34	E0B69AE0B799
35	E0B69AE0B79A
36	E0B69AE0B79B
37	E0B69AE0B79C
38	E0B69AE0B79D
39	E0B69AE0B79E
40	E0B69AE0B78A
41	E0B69B
42	E0B69C
43	E0B69D
44	E0B69E
45	E0B69F
46	E0B6A0
47	E0B6A1
48	E0B6A2
49	E0B6A3
50	E0B6A5
51	E0B6A4
52	E0B6A6
53	E0B6A7
54	E0B6A8
55	E0B6A9
56	E0B6AA
57	E0B6AB
58	E0B6AC
59	E0B6AD
60	E0B6AE
61	E0B6AF
62	E0B6B0
63	E0B6B1
64	E0B6B3
65	E0B6B4
66	E0B6B5
67	E0B6B6
68	E0B6B7
69	E0B6B8
70	E0B6B9
71	E0B6BA
72	E0B6BB
73	E0B6BBE0B78AE2808D
74	E0B6BD
75	E0B780
76	E0B781
77	E0B782
78	E0B783
79	E0B784
80	E0B785
81	E0B786
82	E0B78F
83	E0B790
84	E0B791
85	E0B792
86	E0B793
87	E0B794
88	E0B796
89	E0B798
90	E0B7B2
91	E0B79F
92	E0B7B3
93	E0B799
94	E0B79A
95	E0B79B
96	E0B79C
97	E0B79D
98	E0B79E
99	E0B78A
100	E0B78AE2808DE0B6BA
101	E0B78AE2808DE0B6BB
DROP TABLE t1;
SET NAMES utf8 COLLATE utf8_sinhala_ci;
CREATE TABLE t1 (s1 VARCHAR(10) COLLATE utf8_sinhala_ci);
INSERT INTO t1 VALUES ('a'),('ae'),('af');
SELECT s1,hex(s1) FROM t1 ORDER BY s1;
s1	hex(s1)
a	61
ae	6165
af	6166
SELECT * FROM t1 ORDER BY s1;
s1
a
ae
af
DROP TABLE t1;
End of 5.4 tests
#
# Start of 5.5 tests
#
#
# Bug#52520 Difference in tinytext utf column metadata
#
CREATE TABLE t1 (
s1 TINYTEXT CHARACTER SET utf8,
s2 TEXT CHARACTER SET utf8,
s3 MEDIUMTEXT CHARACTER SET utf8,
s4 LONGTEXT CHARACTER SET utf8
);
SET NAMES utf8, @@character_set_results=NULL;
SELECT *, HEX(s1) FROM t1;
Catalog	Database	Table	Table_alias	Column	Column_alias	Type	Length	Max length	Is_null	Flags	Decimals	Charsetnr
def	test	t1	t1	s1	s1	252	255	0	Y	16	0	33
def	test	t1	t1	s2	s2	252	65535	0	Y	16	0	33
def	test	t1	t1	s3	s3	252	16777215	0	Y	16	0	33
def	test	t1	t1	s4	s4	252	4294967295	0	Y	16	0	33
def					HEX(s1)	253	4590	0	Y	0	0	33
s1	s2	s3	s4	HEX(s1)
SET NAMES latin1;
SELECT *, HEX(s1) FROM t1;
Catalog	Database	Table	Table_alias	Column	Column_alias	Type	Length	Max length	Is_null	Flags	Decimals	Charsetnr
def	test	t1	t1	s1	s1	252	255	0	Y	16	0	8
def	test	t1	t1	s2	s2	252	65535	0	Y	16	0	8
def	test	t1	t1	s3	s3	252	16777215	0	Y	16	0	8
def	test	t1	t1	s4	s4	252	4294967295	0	Y	16	0	8
def					HEX(s1)	253	1530	0	Y	0	0	8
s1	s2	s3	s4	HEX(s1)
SET NAMES utf8;
SELECT *, HEX(s1) FROM t1;
Catalog	Database	Table	Table_alias	Column	Column_alias	Type	Length	Max length	Is_null	Flags	Decimals	Charsetnr
def	test	t1	t1	s1	s1	252	765	0	Y	16	0	33
def	test	t1	t1	s2	s2	252	196605	0	Y	16	0	33
def	test	t1	t1	s3	s3	252	50331645	0	Y	16	0	33
def	test	t1	t1	s4	s4	252	4294967295	0	Y	16	0	33
def					HEX(s1)	253	4590	0	Y	0	0	33
s1	s2	s3	s4	HEX(s1)
CREATE TABLE t2 AS SELECT CONCAT(s1) FROM t1;
SHOW CREATE TABLE t2;
Table	Create Table
t2	CREATE TABLE `t2` (
  `CONCAT(s1)` varchar(255) CHARACTER SET utf8mb3 COLLATE utf8mb3_general_ci DEFAULT NULL
) ENGINE=MyISAM DEFAULT CHARSET=utf8mb4 COLLATE=utf8mb4_uca1400_ai_ci
DROP TABLE t1, t2;
SET NAMES utf8;
SET TIME_ZONE = _latin1 '+03:00';
#
# Start of WL#2649 Number-to-string conversions
#
select hex(concat(1));
hex(concat(1))
31
create table t1 as select concat(1) as c1;
show create table t1;
Table	Create Table
t1	CREATE TABLE `t1` (
  `c1` varchar(1) CHARACTER SET utf8mb3 COLLATE utf8mb3_general_ci DEFAULT NULL
) ENGINE=MyISAM DEFAULT CHARSET=utf8mb4 COLLATE=utf8mb4_uca1400_ai_ci
select hex(c1) from t1;
hex(c1)
31
drop table t1;
select hex(concat(18446744073709551615));
hex(concat(18446744073709551615))
3138343436373434303733373039353531363135
create table t1 as select concat(18446744073709551615) as c1;
show create table t1;
Table	Create Table
t1	CREATE TABLE `t1` (
  `c1` varchar(20) CHARACTER SET utf8mb3 COLLATE utf8mb3_general_ci DEFAULT NULL
) ENGINE=MyISAM DEFAULT CHARSET=utf8mb4 COLLATE=utf8mb4_uca1400_ai_ci
select hex(c1) from t1;
hex(c1)
3138343436373434303733373039353531363135
drop table t1;
select hex(concat(1.1));
hex(concat(1.1))
312E31
create table t1 as select concat(1.1) as c1;
show create table t1;
Table	Create Table
t1	CREATE TABLE `t1` (
  `c1` varchar(4) CHARACTER SET utf8mb3 COLLATE utf8mb3_general_ci DEFAULT NULL
) ENGINE=MyISAM DEFAULT CHARSET=utf8mb4 COLLATE=utf8mb4_uca1400_ai_ci
select hex(c1) from t1;
hex(c1)
312E31
drop table t1;
select hex(concat('a', 1+2)), charset(concat(1+2));
hex(concat('a', 1+2))	charset(concat(1+2))
6133	utf8mb3
create table t1 as select concat(1+2) as c1;
show create table t1;
Table	Create Table
t1	CREATE TABLE `t1` (
  `c1` varchar(3) CHARACTER SET utf8mb3 COLLATE utf8mb3_general_ci DEFAULT NULL
) ENGINE=MyISAM DEFAULT CHARSET=utf8mb4 COLLATE=utf8mb4_uca1400_ai_ci
drop table t1;
select hex(concat(1-2));
hex(concat(1-2))
2D31
create table t1 as select concat(1-2) as c1;
show create table t1;
Table	Create Table
t1	CREATE TABLE `t1` (
  `c1` varchar(3) CHARACTER SET utf8mb3 COLLATE utf8mb3_general_ci DEFAULT NULL
) ENGINE=MyISAM DEFAULT CHARSET=utf8mb4 COLLATE=utf8mb4_uca1400_ai_ci
drop table t1;
select hex(concat(1*2));
hex(concat(1*2))
32
create table t1 as select concat(1*2) as c1;
show create table t1;
Table	Create Table
t1	CREATE TABLE `t1` (
  `c1` varchar(3) CHARACTER SET utf8mb3 COLLATE utf8mb3_general_ci DEFAULT NULL
) ENGINE=MyISAM DEFAULT CHARSET=utf8mb4 COLLATE=utf8mb4_uca1400_ai_ci
drop table t1;
select hex(concat(1/2));
hex(concat(1/2))
302E35303030
create table t1 as select concat(1/2) as c1;
show create table t1;
Table	Create Table
t1	CREATE TABLE `t1` (
  `c1` varchar(7) CHARACTER SET utf8mb3 COLLATE utf8mb3_general_ci DEFAULT NULL
) ENGINE=MyISAM DEFAULT CHARSET=utf8mb4 COLLATE=utf8mb4_uca1400_ai_ci
drop table t1;
select hex(concat(1 div 2));
hex(concat(1 div 2))
30
create table t1 as select concat(1 div 2) as c1;
show create table t1;
Table	Create Table
t1	CREATE TABLE `t1` (
  `c1` varchar(1) CHARACTER SET utf8mb3 COLLATE utf8mb3_general_ci DEFAULT NULL
) ENGINE=MyISAM DEFAULT CHARSET=utf8mb4 COLLATE=utf8mb4_uca1400_ai_ci
drop table t1;
select hex(concat(1 % 2));
hex(concat(1 % 2))
31
create table t1 as select concat(1 % 2) as c1;
show create table t1;
Table	Create Table
t1	CREATE TABLE `t1` (
  `c1` varchar(2) CHARACTER SET utf8mb3 COLLATE utf8mb3_general_ci DEFAULT NULL
) ENGINE=MyISAM DEFAULT CHARSET=utf8mb4 COLLATE=utf8mb4_uca1400_ai_ci
drop table t1;
select hex(concat(-1));
hex(concat(-1))
2D31
create table t1 as select concat(-1) as c1;
show create table t1;
Table	Create Table
t1	CREATE TABLE `t1` (
  `c1` varchar(2) CHARACTER SET utf8mb3 COLLATE utf8mb3_general_ci DEFAULT NULL
) ENGINE=MyISAM DEFAULT CHARSET=utf8mb4 COLLATE=utf8mb4_uca1400_ai_ci
drop table t1;
select hex(concat(-(1+2)));
hex(concat(-(1+2)))
2D33
create table t1 as select concat(-(1+2)) as c1;
show create table t1;
Table	Create Table
t1	CREATE TABLE `t1` (
  `c1` varchar(4) CHARACTER SET utf8mb3 COLLATE utf8mb3_general_ci DEFAULT NULL
) ENGINE=MyISAM DEFAULT CHARSET=utf8mb4 COLLATE=utf8mb4_uca1400_ai_ci
drop table t1;
select hex(concat(1|2));
hex(concat(1|2))
33
create table t1 as select concat(1|2) as c1;
show create table t1;
Table	Create Table
t1	CREATE TABLE `t1` (
  `c1` varchar(21) CHARACTER SET utf8mb3 COLLATE utf8mb3_general_ci DEFAULT NULL
) ENGINE=MyISAM DEFAULT CHARSET=utf8mb4 COLLATE=utf8mb4_uca1400_ai_ci
drop table t1;
select hex(concat(1&2));
hex(concat(1&2))
30
create table t1 as select concat(1&2) as c1;
show create table t1;
Table	Create Table
t1	CREATE TABLE `t1` (
  `c1` varchar(21) CHARACTER SET utf8mb3 COLLATE utf8mb3_general_ci DEFAULT NULL
) ENGINE=MyISAM DEFAULT CHARSET=utf8mb4 COLLATE=utf8mb4_uca1400_ai_ci
drop table t1;
select hex(concat(bit_count(12)));
hex(concat(bit_count(12)))
32
create table t1 as select concat(bit_count(12)) as c1;
show create table t1;
Table	Create Table
t1	CREATE TABLE `t1` (
  `c1` varchar(2) CHARACTER SET utf8mb3 COLLATE utf8mb3_general_ci DEFAULT NULL
) ENGINE=MyISAM DEFAULT CHARSET=utf8mb4 COLLATE=utf8mb4_uca1400_ai_ci
drop table t1;
select hex(concat(2<<1));
hex(concat(2<<1))
34
create table t1 as select concat(2<<1) as c1;
show create table t1;
Table	Create Table
t1	CREATE TABLE `t1` (
  `c1` varchar(21) CHARACTER SET utf8mb3 COLLATE utf8mb3_general_ci DEFAULT NULL
) ENGINE=MyISAM DEFAULT CHARSET=utf8mb4 COLLATE=utf8mb4_uca1400_ai_ci
drop table t1;
select hex(concat(2>>1));
hex(concat(2>>1))
31
create table t1 as select concat(2>>1) as c1;
show create table t1;
Table	Create Table
t1	CREATE TABLE `t1` (
  `c1` varchar(21) CHARACTER SET utf8mb3 COLLATE utf8mb3_general_ci DEFAULT NULL
) ENGINE=MyISAM DEFAULT CHARSET=utf8mb4 COLLATE=utf8mb4_uca1400_ai_ci
drop table t1;
select hex(concat(~0));
hex(concat(~0))
3138343436373434303733373039353531363135
create table t1 as select concat(~0) as c1;
show create table t1;
Table	Create Table
t1	CREATE TABLE `t1` (
  `c1` varchar(21) CHARACTER SET utf8mb3 COLLATE utf8mb3_general_ci DEFAULT NULL
) ENGINE=MyISAM DEFAULT CHARSET=utf8mb4 COLLATE=utf8mb4_uca1400_ai_ci
drop table t1;
select hex(concat(3^2));
hex(concat(3^2))
31
create table t1 as select concat(3^2) as c1;
show create table t1;
Table	Create Table
t1	CREATE TABLE `t1` (
  `c1` varchar(21) CHARACTER SET utf8mb3 COLLATE utf8mb3_general_ci DEFAULT NULL
) ENGINE=MyISAM DEFAULT CHARSET=utf8mb4 COLLATE=utf8mb4_uca1400_ai_ci
drop table t1;
select hex(concat(abs(-2)));
hex(concat(abs(-2)))
32
create table t1 as select concat(abs(-2)) as c1;
show create table t1;
Table	Create Table
t1	CREATE TABLE `t1` (
  `c1` varchar(2) CHARACTER SET utf8mb3 COLLATE utf8mb3_general_ci DEFAULT NULL
) ENGINE=MyISAM DEFAULT CHARSET=utf8mb4 COLLATE=utf8mb4_uca1400_ai_ci
drop table t1;
select hex(left(concat(exp(2)),1));
hex(left(concat(exp(2)),1))
37
create table t1 as select concat(exp(2)) as c1;
show create table t1;
Table	Create Table
t1	CREATE TABLE `t1` (
  `c1` varchar(23) CHARACTER SET utf8mb3 COLLATE utf8mb3_general_ci DEFAULT NULL
) ENGINE=MyISAM DEFAULT CHARSET=utf8mb4 COLLATE=utf8mb4_uca1400_ai_ci
drop table t1;
select hex(left(concat(log(2)),1));
hex(left(concat(log(2)),1))
30
create table t1 as select concat(log(2)) as c1;
show create table t1;
Table	Create Table
t1	CREATE TABLE `t1` (
  `c1` varchar(23) CHARACTER SET utf8mb3 COLLATE utf8mb3_general_ci DEFAULT NULL
) ENGINE=MyISAM DEFAULT CHARSET=utf8mb4 COLLATE=utf8mb4_uca1400_ai_ci
drop table t1;
select hex(left(concat(log2(2)),1));
hex(left(concat(log2(2)),1))
31
create table t1 as select concat(log2(2)) as c1;
show create table t1;
Table	Create Table
t1	CREATE TABLE `t1` (
  `c1` varchar(23) CHARACTER SET utf8mb3 COLLATE utf8mb3_general_ci DEFAULT NULL
) ENGINE=MyISAM DEFAULT CHARSET=utf8mb4 COLLATE=utf8mb4_uca1400_ai_ci
drop table t1;
select hex(left(concat(log10(2)),1));
hex(left(concat(log10(2)),1))
30
create table t1 as select concat(log10(2)) as c1;
show create table t1;
Table	Create Table
t1	CREATE TABLE `t1` (
  `c1` varchar(23) CHARACTER SET utf8mb3 COLLATE utf8mb3_general_ci DEFAULT NULL
) ENGINE=MyISAM DEFAULT CHARSET=utf8mb4 COLLATE=utf8mb4_uca1400_ai_ci
drop table t1;
select hex(left(concat(sqrt(2)),1));
hex(left(concat(sqrt(2)),1))
31
create table t1 as select concat(sqrt(2)) as c1;
show create table t1;
Table	Create Table
t1	CREATE TABLE `t1` (
  `c1` varchar(23) CHARACTER SET utf8mb3 COLLATE utf8mb3_general_ci DEFAULT NULL
) ENGINE=MyISAM DEFAULT CHARSET=utf8mb4 COLLATE=utf8mb4_uca1400_ai_ci
drop table t1;
select hex(left(concat(pow(2,2)),1));
hex(left(concat(pow(2,2)),1))
34
create table t1 as select concat(pow(2,2)) as c1;
show create table t1;
Table	Create Table
t1	CREATE TABLE `t1` (
  `c1` varchar(23) CHARACTER SET utf8mb3 COLLATE utf8mb3_general_ci DEFAULT NULL
) ENGINE=MyISAM DEFAULT CHARSET=utf8mb4 COLLATE=utf8mb4_uca1400_ai_ci
drop table t1;
select hex(left(concat(acos(0.5)),1));
hex(left(concat(acos(0.5)),1))
31
create table t1 as select concat(acos(0.5)) as c1;
show create table t1;
Table	Create Table
t1	CREATE TABLE `t1` (
  `c1` varchar(23) CHARACTER SET utf8mb3 COLLATE utf8mb3_general_ci DEFAULT NULL
) ENGINE=MyISAM DEFAULT CHARSET=utf8mb4 COLLATE=utf8mb4_uca1400_ai_ci
drop table t1;
select hex(left(concat(asin(0.5)),1));
hex(left(concat(asin(0.5)),1))
30
create table t1 as select concat(asin(0.5)) as c1;
show create table t1;
Table	Create Table
t1	CREATE TABLE `t1` (
  `c1` varchar(23) CHARACTER SET utf8mb3 COLLATE utf8mb3_general_ci DEFAULT NULL
) ENGINE=MyISAM DEFAULT CHARSET=utf8mb4 COLLATE=utf8mb4_uca1400_ai_ci
drop table t1;
select hex(left(concat(atan(0.5)),1));
hex(left(concat(atan(0.5)),1))
30
create table t1 as select concat(atan(0.5)) as c1;
show create table t1;
Table	Create Table
t1	CREATE TABLE `t1` (
  `c1` varchar(23) CHARACTER SET utf8mb3 COLLATE utf8mb3_general_ci DEFAULT NULL
) ENGINE=MyISAM DEFAULT CHARSET=utf8mb4 COLLATE=utf8mb4_uca1400_ai_ci
drop table t1;
select hex(left(concat(cos(0.5)),1));
hex(left(concat(cos(0.5)),1))
30
create table t1 as select concat(cos(0.5)) as c1;
show create table t1;
Table	Create Table
t1	CREATE TABLE `t1` (
  `c1` varchar(23) CHARACTER SET utf8mb3 COLLATE utf8mb3_general_ci DEFAULT NULL
) ENGINE=MyISAM DEFAULT CHARSET=utf8mb4 COLLATE=utf8mb4_uca1400_ai_ci
drop table t1;
select hex(left(concat(sin(0.5)),1));
hex(left(concat(sin(0.5)),1))
30
create table t1 as select concat(sin(0.5)) as c1;
show create table t1;
Table	Create Table
t1	CREATE TABLE `t1` (
  `c1` varchar(23) CHARACTER SET utf8mb3 COLLATE utf8mb3_general_ci DEFAULT NULL
) ENGINE=MyISAM DEFAULT CHARSET=utf8mb4 COLLATE=utf8mb4_uca1400_ai_ci
drop table t1;
select hex(left(concat(tan(0.5)),1));
hex(left(concat(tan(0.5)),1))
30
create table t1 as select concat(tan(0.5)) as c1;
show create table t1;
Table	Create Table
t1	CREATE TABLE `t1` (
  `c1` varchar(23) CHARACTER SET utf8mb3 COLLATE utf8mb3_general_ci DEFAULT NULL
) ENGINE=MyISAM DEFAULT CHARSET=utf8mb4 COLLATE=utf8mb4_uca1400_ai_ci
drop table t1;
select hex(concat(degrees(0)));
hex(concat(degrees(0)))
30
create table t1 as select concat(degrees(0)) as c1;
show create table t1;
Table	Create Table
t1	CREATE TABLE `t1` (
  `c1` varchar(23) CHARACTER SET utf8mb3 COLLATE utf8mb3_general_ci DEFAULT NULL
) ENGINE=MyISAM DEFAULT CHARSET=utf8mb4 COLLATE=utf8mb4_uca1400_ai_ci
drop table t1;
select hex(concat(radians(0)));
hex(concat(radians(0)))
30
create table t1 as select concat(radians(0)) as c1;
show create table t1;
Table	Create Table
t1	CREATE TABLE `t1` (
  `c1` varchar(23) CHARACTER SET utf8mb3 COLLATE utf8mb3_general_ci DEFAULT NULL
) ENGINE=MyISAM DEFAULT CHARSET=utf8mb4 COLLATE=utf8mb4_uca1400_ai_ci
drop table t1;
select hex(concat(ceiling(0.5)));
hex(concat(ceiling(0.5)))
31
create table t1 as select ceiling(0.5) as c0, concat(ceiling(0.5)) as c1;
show create table t1;
Table	Create Table
t1	CREATE TABLE `t1` (
  `c0` int(3) NOT NULL,
  `c1` varchar(3) CHARACTER SET utf8mb3 COLLATE utf8mb3_general_ci DEFAULT NULL
) ENGINE=MyISAM DEFAULT CHARSET=utf8mb4 COLLATE=utf8mb4_uca1400_ai_ci
drop table t1;
select hex(concat(floor(0.5)));
hex(concat(floor(0.5)))
30
create table t1 as select floor(0.5) as c0, concat(floor(0.5)) as c1;
show create table t1;
Table	Create Table
t1	CREATE TABLE `t1` (
  `c0` int(3) NOT NULL,
  `c1` varchar(3) CHARACTER SET utf8mb3 COLLATE utf8mb3_general_ci DEFAULT NULL
) ENGINE=MyISAM DEFAULT CHARSET=utf8mb4 COLLATE=utf8mb4_uca1400_ai_ci
drop table t1;
select hex(concat(round(0.5)));
hex(concat(round(0.5)))
31
create table t1 as select concat(round(0.5)) as c1;
show create table t1;
Table	Create Table
t1	CREATE TABLE `t1` (
  `c1` varchar(3) CHARACTER SET utf8mb3 COLLATE utf8mb3_general_ci DEFAULT NULL
) ENGINE=MyISAM DEFAULT CHARSET=utf8mb4 COLLATE=utf8mb4_uca1400_ai_ci
drop table t1;
select hex(concat(sign(0.5)));
hex(concat(sign(0.5)))
31
create table t1 as select concat(sign(0.5)) as c1;
show create table t1;
Table	Create Table
t1	CREATE TABLE `t1` (
  `c1` varchar(2) CHARACTER SET utf8mb3 COLLATE utf8mb3_general_ci DEFAULT NULL
) ENGINE=MyISAM DEFAULT CHARSET=utf8mb4 COLLATE=utf8mb4_uca1400_ai_ci
drop table t1;
create table t1 as select concat(rand()) as c1;
show create table t1;
Table	Create Table
t1	CREATE TABLE `t1` (
  `c1` varchar(23) CHARACTER SET utf8mb3 COLLATE utf8mb3_general_ci DEFAULT NULL
) ENGINE=MyISAM DEFAULT CHARSET=utf8mb4 COLLATE=utf8mb4_uca1400_ai_ci
drop table t1;
select hex(concat(length('a')));
hex(concat(length('a')))
31
create table t1 as select concat(length('a')) as c1;
show create table t1;
Table	Create Table
t1	CREATE TABLE `t1` (
  `c1` varchar(10) CHARACTER SET utf8mb3 COLLATE utf8mb3_general_ci DEFAULT NULL
) ENGINE=MyISAM DEFAULT CHARSET=utf8mb4 COLLATE=utf8mb4_uca1400_ai_ci
drop table t1;
select hex(concat(char_length('a')));
hex(concat(char_length('a')))
31
create table t1 as select concat(char_length('a')) as c1;
show create table t1;
Table	Create Table
t1	CREATE TABLE `t1` (
  `c1` varchar(10) CHARACTER SET utf8mb3 COLLATE utf8mb3_general_ci DEFAULT NULL
) ENGINE=MyISAM DEFAULT CHARSET=utf8mb4 COLLATE=utf8mb4_uca1400_ai_ci
drop table t1;
select hex(concat(bit_length('a')));
hex(concat(bit_length('a')))
38
create table t1 as select concat(bit_length('a')) as c1;
show create table t1;
Table	Create Table
t1	CREATE TABLE `t1` (
  `c1` varchar(11) CHARACTER SET utf8mb3 COLLATE utf8mb3_general_ci DEFAULT NULL
) ENGINE=MyISAM DEFAULT CHARSET=utf8mb4 COLLATE=utf8mb4_uca1400_ai_ci
drop table t1;
select hex(concat(coercibility('a')));
hex(concat(coercibility('a')))
36
create table t1 as select concat(coercibility('a')) as c1;
show create table t1;
Table	Create Table
t1	CREATE TABLE `t1` (
  `c1` varchar(10) CHARACTER SET utf8mb3 COLLATE utf8mb3_general_ci DEFAULT NULL
) ENGINE=MyISAM DEFAULT CHARSET=utf8mb4 COLLATE=utf8mb4_uca1400_ai_ci
drop table t1;
select hex(concat(locate('a','a')));
hex(concat(locate('a','a')))
31
create table t1 as select concat(locate('a','a')) as c1;
show create table t1;
Table	Create Table
t1	CREATE TABLE `t1` (
  `c1` varchar(11) CHARACTER SET utf8mb3 COLLATE utf8mb3_general_ci DEFAULT NULL
) ENGINE=MyISAM DEFAULT CHARSET=utf8mb4 COLLATE=utf8mb4_uca1400_ai_ci
drop table t1;
select hex(concat(field('c','a','b','c')));
hex(concat(field('c','a','b','c')))
33
create table t1 as select concat(field('c','a','b','c')) as c1;
show create table t1;
Table	Create Table
t1	CREATE TABLE `t1` (
  `c1` varchar(3) CHARACTER SET utf8mb3 COLLATE utf8mb3_general_ci DEFAULT NULL
) ENGINE=MyISAM DEFAULT CHARSET=utf8mb4 COLLATE=utf8mb4_uca1400_ai_ci
drop table t1;
select hex(concat(ascii(61)));
hex(concat(ascii(61)))
3534
create table t1 as select concat(ascii(61)) as c1;
show create table t1;
Table	Create Table
t1	CREATE TABLE `t1` (
  `c1` varchar(3) CHARACTER SET utf8mb3 COLLATE utf8mb3_general_ci DEFAULT NULL
) ENGINE=MyISAM DEFAULT CHARSET=utf8mb4 COLLATE=utf8mb4_uca1400_ai_ci
drop table t1;
select hex(concat(ord(61)));
hex(concat(ord(61)))
3534
create table t1 as select concat(ord(61)) as c1;
show create table t1;
Table	Create Table
t1	CREATE TABLE `t1` (
  `c1` varchar(7) CHARACTER SET utf8mb3 COLLATE utf8mb3_general_ci DEFAULT NULL
) ENGINE=MyISAM DEFAULT CHARSET=utf8mb4 COLLATE=utf8mb4_uca1400_ai_ci
drop table t1;
select hex(concat(find_in_set('b','a,b,c,d')));
hex(concat(find_in_set('b','a,b,c,d')))
32
create table t1 as select concat(find_in_set('b','a,b,c,d')) as c1;
show create table t1;
Table	Create Table
t1	CREATE TABLE `t1` (
  `c1` varchar(3) CHARACTER SET utf8mb3 COLLATE utf8mb3_general_ci DEFAULT NULL
) ENGINE=MyISAM DEFAULT CHARSET=utf8mb4 COLLATE=utf8mb4_uca1400_ai_ci
drop table t1;
select md5('a'), hex(md5('a'));
md5('a')	hex(md5('a'))
0cc175b9c0f1b6a831c399e269772661	3063633137356239633066316236613833316333393965323639373732363631
create table t1 as select md5('a') as c1;
show create table t1;
Table	Create Table
t1	CREATE TABLE `t1` (
  `c1` varchar(32) CHARACTER SET utf8mb3 COLLATE utf8mb3_general_ci DEFAULT NULL
) ENGINE=MyISAM DEFAULT CHARSET=utf8mb4 COLLATE=utf8mb4_uca1400_ai_ci
drop table t1;
select old_password('a'), hex(old_password('a'));
old_password('a')	hex(old_password('a'))
60671c896665c3fa	36303637316338393636363563336661
create table t1 as select old_password('a') as c1;
show create table t1;
Table	Create Table
t1	CREATE TABLE `t1` (
  `c1` varchar(16) CHARACTER SET utf8mb3 COLLATE utf8mb3_general_ci DEFAULT NULL
) ENGINE=MyISAM DEFAULT CHARSET=utf8mb4 COLLATE=utf8mb4_uca1400_ai_ci
drop table t1;
select password('a'), hex(password('a'));
password('a')	hex(password('a'))
*667F407DE7C6AD07358FA38DAED7828A72014B4E	2A36363746343037444537433641443037333538464133384441454437383238413732303134423445
create table t1 as select password('a') as c1;
show create table t1;
Table	Create Table
t1	CREATE TABLE `t1` (
  `c1` varchar(41) CHARACTER SET utf8mb3 COLLATE utf8mb3_general_ci DEFAULT NULL
) ENGINE=MyISAM DEFAULT CHARSET=utf8mb4 COLLATE=utf8mb4_uca1400_ai_ci
drop table t1;
select sha('a'), hex(sha('a'));
sha('a')	hex(sha('a'))
86f7e437faa5a7fce15d1ddcb9eaeaea377667b8	38366637653433376661613561376663653135643164646362396561656165613337373636376238
create table t1 as select sha('a') as c1;
show create table t1;
Table	Create Table
t1	CREATE TABLE `t1` (
  `c1` varchar(40) CHARACTER SET utf8mb3 COLLATE utf8mb3_general_ci DEFAULT NULL
) ENGINE=MyISAM DEFAULT CHARSET=utf8mb4 COLLATE=utf8mb4_uca1400_ai_ci
drop table t1;
select sha1('a'), hex(sha1('a'));
sha1('a')	hex(sha1('a'))
86f7e437faa5a7fce15d1ddcb9eaeaea377667b8	38366637653433376661613561376663653135643164646362396561656165613337373636376238
create table t1 as select sha1('a') as c1;
show create table t1;
Table	Create Table
t1	CREATE TABLE `t1` (
  `c1` varchar(40) CHARACTER SET utf8mb3 COLLATE utf8mb3_general_ci DEFAULT NULL
) ENGINE=MyISAM DEFAULT CHARSET=utf8mb4 COLLATE=utf8mb4_uca1400_ai_ci
drop table t1;
select hex(concat(cast('-1' as signed)));
hex(concat(cast('-1' as signed)))
2D31
create table t1 as select concat(cast('-1' as signed)) as c1;
show create table t1;
Table	Create Table
t1	CREATE TABLE `t1` (
  `c1` varchar(2) CHARACTER SET utf8mb3 COLLATE utf8mb3_general_ci DEFAULT NULL
) ENGINE=MyISAM DEFAULT CHARSET=utf8mb4 COLLATE=utf8mb4_uca1400_ai_ci
drop table t1;
select hex(concat(cast('1' as unsigned)));
hex(concat(cast('1' as unsigned)))
31
create table t1 as select concat(cast('1' as unsigned)) as c1;
show create table t1;
Table	Create Table
t1	CREATE TABLE `t1` (
  `c1` varchar(1) CHARACTER SET utf8mb3 COLLATE utf8mb3_general_ci DEFAULT NULL
) ENGINE=MyISAM DEFAULT CHARSET=utf8mb4 COLLATE=utf8mb4_uca1400_ai_ci
drop table t1;
select hex(concat(cast(1/2 as decimal(5,5))));
hex(concat(cast(1/2 as decimal(5,5))))
302E3530303030
create table t1 as select concat(cast(1/2 as decimal(5,5))) as c1;
show create table t1;
Table	Create Table
t1	CREATE TABLE `t1` (
  `c1` varchar(7) CHARACTER SET utf8mb3 COLLATE utf8mb3_general_ci DEFAULT NULL
) ENGINE=MyISAM DEFAULT CHARSET=utf8mb4 COLLATE=utf8mb4_uca1400_ai_ci
drop table t1;
select hex(concat(cast('2001-01-02 03:04:05' as date)));
hex(concat(cast('2001-01-02 03:04:05' as date)))
323030312D30312D3032
create table t1 as select concat(cast('2001-01-02 03:04:05' as date)) as c1;
show create table t1;
Table	Create Table
t1	CREATE TABLE `t1` (
  `c1` varchar(10) CHARACTER SET utf8mb3 COLLATE utf8mb3_general_ci DEFAULT NULL
) ENGINE=MyISAM DEFAULT CHARSET=utf8mb4 COLLATE=utf8mb4_uca1400_ai_ci
select * from t1;
c1
2001-01-02
drop table t1;
select hex(concat(cast('2001-01-02 03:04:05' as time)));
hex(concat(cast('2001-01-02 03:04:05' as time)))
30333A30343A3035
create table t1 as select concat(cast('2001-01-02 03:04:05' as time)) as c1;
show create table t1;
Table	Create Table
t1	CREATE TABLE `t1` (
  `c1` varchar(10) CHARACTER SET utf8mb3 COLLATE utf8mb3_general_ci DEFAULT NULL
) ENGINE=MyISAM DEFAULT CHARSET=utf8mb4 COLLATE=utf8mb4_uca1400_ai_ci
select * from t1;
c1
03:04:05
drop table t1;
select hex(concat(cast('2001-01-02' as datetime)));
hex(concat(cast('2001-01-02' as datetime)))
323030312D30312D30322030303A30303A3030
create table t1 as select concat(cast('2001-01-02' as datetime)) as c1;
show create table t1;
Table	Create Table
t1	CREATE TABLE `t1` (
  `c1` varchar(19) CHARACTER SET utf8mb3 COLLATE utf8mb3_general_ci DEFAULT NULL
) ENGINE=MyISAM DEFAULT CHARSET=utf8mb4 COLLATE=utf8mb4_uca1400_ai_ci
select * from t1;
c1
2001-01-02 00:00:00
drop table t1;
select hex(concat(least(1,2)));
hex(concat(least(1,2)))
31
create table t1 as select concat(least(1,2)) as c1;
show create table t1;
Table	Create Table
t1	CREATE TABLE `t1` (
  `c1` varchar(2) CHARACTER SET utf8mb3 COLLATE utf8mb3_general_ci DEFAULT NULL
) ENGINE=MyISAM DEFAULT CHARSET=utf8mb4 COLLATE=utf8mb4_uca1400_ai_ci
drop table t1;
select hex(concat(greatest(1,2)));
hex(concat(greatest(1,2)))
32
create table t1 as select concat(greatest(1,2)) as c1;
show create table t1;
Table	Create Table
t1	CREATE TABLE `t1` (
  `c1` varchar(2) CHARACTER SET utf8mb3 COLLATE utf8mb3_general_ci DEFAULT NULL
) ENGINE=MyISAM DEFAULT CHARSET=utf8mb4 COLLATE=utf8mb4_uca1400_ai_ci
drop table t1;
select hex(concat(case when 11 then 22 else 33 end));
hex(concat(case when 11 then 22 else 33 end))
3232
create table t1 as select concat(case when 11 then 22 else 33 end) as c1;
show create table t1;
Table	Create Table
t1	CREATE TABLE `t1` (
  `c1` varchar(3) CHARACTER SET utf8mb3 COLLATE utf8mb3_general_ci DEFAULT NULL
) ENGINE=MyISAM DEFAULT CHARSET=utf8mb4 COLLATE=utf8mb4_uca1400_ai_ci
drop table t1;
select hex(concat(coalesce(1,2)));
hex(concat(coalesce(1,2)))
31
create table t1 as select concat(coalesce(1,2)) as c1;
show create table t1;
Table	Create Table
t1	CREATE TABLE `t1` (
  `c1` varchar(2) CHARACTER SET utf8mb3 COLLATE utf8mb3_general_ci DEFAULT NULL
) ENGINE=MyISAM DEFAULT CHARSET=utf8mb4 COLLATE=utf8mb4_uca1400_ai_ci
drop table t1;
select hex(concat_ws(1,2,3));
hex(concat_ws(1,2,3))
323133
create table t1 as select concat_ws(1,2,3) as c1;
show create table t1;
Table	Create Table
t1	CREATE TABLE `t1` (
  `c1` varchar(3) CHARACTER SET utf8mb3 COLLATE utf8mb3_general_ci DEFAULT NULL
) ENGINE=MyISAM DEFAULT CHARSET=utf8mb4 COLLATE=utf8mb4_uca1400_ai_ci
drop table t1;
select hex(group_concat(1,2,3));
hex(group_concat(1,2,3))
313233
create table t1 as select group_concat(1,2,3) as c1;
show create table t1;
Table	Create Table
t1	CREATE TABLE `t1` (
  `c1` mediumtext CHARACTER SET utf8mb3 COLLATE utf8mb3_general_ci DEFAULT NULL
) ENGINE=MyISAM DEFAULT CHARSET=utf8mb4 COLLATE=utf8mb4_uca1400_ai_ci
drop table t1;
create table t1 as select 1 as c1 union select 'a';
show create table t1;
Table	Create Table
t1	CREATE TABLE `t1` (
  `c1` varchar(1) CHARACTER SET utf8mb3 COLLATE utf8mb3_general_ci NOT NULL DEFAULT ''
) ENGINE=MyISAM DEFAULT CHARSET=utf8mb4 COLLATE=utf8mb4_uca1400_ai_ci
select hex(c1) from t1 order by c1;
hex(c1)
31
61
drop table t1;
create table t1 as select concat(last_insert_id()) as c1;
show create table t1;
Table	Create Table
t1	CREATE TABLE `t1` (
  `c1` varchar(21) CHARACTER SET utf8mb3 COLLATE utf8mb3_general_ci DEFAULT NULL
) ENGINE=MyISAM DEFAULT CHARSET=utf8mb4 COLLATE=utf8mb4_uca1400_ai_ci
drop table t1;
select hex(concat(benchmark(0,0)));
hex(concat(benchmark(0,0)))
30
create table t1 as select concat(benchmark(0,0)) as c1;
show create table t1;
Table	Create Table
t1	CREATE TABLE `t1` (
  `c1` varchar(1) CHARACTER SET utf8mb3 COLLATE utf8mb3_general_ci DEFAULT NULL
) ENGINE=MyISAM DEFAULT CHARSET=utf8mb4 COLLATE=utf8mb4_uca1400_ai_ci
drop table t1;
select hex(concat(sleep(0)));
hex(concat(sleep(0)))
30
create table t1 as select concat(sleep(0)) as c1;
show create table t1;
Table	Create Table
t1	CREATE TABLE `t1` (
  `c1` varchar(1) CHARACTER SET utf8mb3 COLLATE utf8mb3_general_ci DEFAULT NULL
) ENGINE=MyISAM DEFAULT CHARSET=utf8mb4 COLLATE=utf8mb4_uca1400_ai_ci
drop table t1;
select hex(concat(is_free_lock('xxxx')));
hex(concat(is_free_lock('xxxx')))
31
create table t1 as select concat(is_free_lock('xxxx')) as c1;
show create table t1;
Table	Create Table
t1	CREATE TABLE `t1` (
  `c1` varchar(1) CHARACTER SET utf8mb3 COLLATE utf8mb3_general_ci DEFAULT NULL
) ENGINE=MyISAM DEFAULT CHARSET=utf8mb4 COLLATE=utf8mb4_uca1400_ai_ci
drop table t1;
create table t1 as select concat(is_used_lock('a')) as c1;
show create table t1;
Table	Create Table
t1	CREATE TABLE `t1` (
  `c1` varchar(10) CHARACTER SET utf8mb3 COLLATE utf8mb3_general_ci DEFAULT NULL
) ENGINE=MyISAM DEFAULT CHARSET=utf8mb4 COLLATE=utf8mb4_uca1400_ai_ci
drop table t1;
create table t1 as select concat(release_lock('a')) as c1;
show create table t1;
Table	Create Table
t1	CREATE TABLE `t1` (
  `c1` varchar(1) CHARACTER SET utf8mb3 COLLATE utf8mb3_general_ci DEFAULT NULL
) ENGINE=MyISAM DEFAULT CHARSET=utf8mb4 COLLATE=utf8mb4_uca1400_ai_ci
drop table t1;
select hex(concat(crc32('')));
hex(concat(crc32('')))
30
create table t1 as select concat(crc32('')) as c1;
show create table t1;
Table	Create Table
t1	CREATE TABLE `t1` (
  `c1` varchar(10) CHARACTER SET utf8mb3 COLLATE utf8mb3_general_ci DEFAULT NULL
) ENGINE=MyISAM DEFAULT CHARSET=utf8mb4 COLLATE=utf8mb4_uca1400_ai_ci
drop table t1;
select hex(concat(uncompressed_length('')));
hex(concat(uncompressed_length('')))
30
create table t1 as select concat(uncompressed_length('')) as c1;
show create table t1;
Table	Create Table
t1	CREATE TABLE `t1` (
  `c1` varchar(10) CHARACTER SET utf8mb3 COLLATE utf8mb3_general_ci DEFAULT NULL
) ENGINE=MyISAM DEFAULT CHARSET=utf8mb4 COLLATE=utf8mb4_uca1400_ai_ci
drop table t1;
create table t1 as select concat(connection_id()) as c1;
show create table t1;
Table	Create Table
t1	CREATE TABLE `t1` (
  `c1` varchar(10) CHARACTER SET utf8mb3 COLLATE utf8mb3_general_ci DEFAULT NULL
) ENGINE=MyISAM DEFAULT CHARSET=utf8mb4 COLLATE=utf8mb4_uca1400_ai_ci
drop table t1;
select hex(concat(inet_aton('127.1.1.1')));
hex(concat(inet_aton('127.1.1.1')))
32313330373732323235
create table t1 as select concat(inet_aton('127.1.1.1')) as c1;
show create table t1;
Table	Create Table
t1	CREATE TABLE `t1` (
  `c1` varchar(21) CHARACTER SET utf8mb3 COLLATE utf8mb3_general_ci DEFAULT NULL
) ENGINE=MyISAM DEFAULT CHARSET=utf8mb4 COLLATE=utf8mb4_uca1400_ai_ci
drop table t1;
select hex(concat(inet_ntoa(2130772225)));
hex(concat(inet_ntoa(2130772225)))
3132372E312E312E31
create table t1 as select concat(inet_ntoa(2130772225)) as c1;
select * from t1;
c1
127.1.1.1
show create table t1;
Table	Create Table
t1	CREATE TABLE `t1` (
  `c1` varchar(31) CHARACTER SET utf8mb3 COLLATE utf8mb3_general_ci DEFAULT NULL
) ENGINE=MyISAM DEFAULT CHARSET=utf8mb4 COLLATE=utf8mb4_uca1400_ai_ci
drop table t1;
select 1;
1
1
select hex(concat(row_count()));
hex(concat(row_count()))
2D31
create table t1 as select concat(row_count()) as c1;
show create table t1;
Table	Create Table
t1	CREATE TABLE `t1` (
  `c1` varchar(21) CHARACTER SET utf8mb3 COLLATE utf8mb3_general_ci DEFAULT NULL
) ENGINE=MyISAM DEFAULT CHARSET=utf8mb4 COLLATE=utf8mb4_uca1400_ai_ci
drop table t1;
select hex(concat(found_rows()));
hex(concat(found_rows()))
30
create table t1 as select concat(found_rows()) as c1;
show create table t1;
Table	Create Table
t1	CREATE TABLE `t1` (
  `c1` varchar(21) CHARACTER SET utf8mb3 COLLATE utf8mb3_general_ci DEFAULT NULL
) ENGINE=MyISAM DEFAULT CHARSET=utf8mb4 COLLATE=utf8mb4_uca1400_ai_ci
drop table t1;
create table t1 as select concat(uuid_short()) as c1;
show create table t1;
Table	Create Table
t1	CREATE TABLE `t1` (
  `c1` varchar(21) CHARACTER SET utf8mb3 COLLATE utf8mb3_general_ci DEFAULT NULL
) ENGINE=MyISAM DEFAULT CHARSET=utf8mb4 COLLATE=utf8mb4_uca1400_ai_ci
drop table t1;
create table t1 as select concat(uuid()) as c1;
show create table t1;
Table	Create Table
t1	CREATE TABLE `t1` (
  `c1` varchar(36) CHARACTER SET utf8mb3 COLLATE utf8mb3_general_ci DEFAULT NULL
) ENGINE=MyISAM DEFAULT CHARSET=utf8mb4 COLLATE=utf8mb4_uca1400_ai_ci
drop table t1;
select coercibility(uuid()), coercibility(cast('a' as char character set latin1));
coercibility(uuid())	coercibility(cast('a' as char character set latin1))
7	4
select charset(concat(uuid(), cast('a' as char character set latin1)));
charset(concat(uuid(), cast('a' as char character set latin1)))
latin1
create table t1 as select concat(uuid(), cast('a' as char character set latin1)) as c1;
show create table t1;
Table	Create Table
t1	CREATE TABLE `t1` (
  `c1` varchar(37) CHARACTER SET latin1 COLLATE latin1_swedish_ci DEFAULT NULL
) ENGINE=MyISAM DEFAULT CHARSET=utf8mb4 COLLATE=utf8mb4_uca1400_ai_ci
drop table t1;
create table t1 as select concat(master_pos_wait('non-existent',0,2)) as c1;
show create table t1;
Table	Create Table
t1	CREATE TABLE `t1` (
  `c1` varchar(21) CHARACTER SET utf8mb3 COLLATE utf8mb3_general_ci DEFAULT NULL
) ENGINE=MyISAM DEFAULT CHARSET=utf8mb4 COLLATE=utf8mb4_uca1400_ai_ci
drop table t1;
select hex(concat(@a1:=1));
hex(concat(@a1:=1))
31
create table t1 as select concat(@a2:=2) as c1, @a3:=3 as c2;
select hex(c1) from t1;
hex(c1)
32
show create table t1;
Table	Create Table
t1	CREATE TABLE `t1` (
  `c1` varchar(1) CHARACTER SET utf8mb3 COLLATE utf8mb3_general_ci DEFAULT NULL,
  `c2` int(1) NOT NULL
) ENGINE=MyISAM DEFAULT CHARSET=utf8mb4 COLLATE=utf8mb4_uca1400_ai_ci
drop table t1;
set @a2=1;
select hex(concat(@a2));
hex(concat(@a2))
31
create table t1 as select concat(@a2) as c1, @a2 as c2;
select hex(c1) from t1;
hex(c1)
31
show create table t1;
Table	Create Table
t1	CREATE TABLE `t1` (
  `c1` varchar(20) CHARACTER SET utf8mb3 COLLATE utf8mb3_general_ci DEFAULT NULL,
  `c2` bigint(20) DEFAULT NULL
) ENGINE=MyISAM DEFAULT CHARSET=utf8mb4 COLLATE=utf8mb4_uca1400_ai_ci
drop table t1;
select hex(concat(@a1:=sqrt(1)));
hex(concat(@a1:=sqrt(1)))
31
create table t1 as select concat(@a2:=sqrt(1)) as c1, @a3:=sqrt(1) as c2;
select hex(c1) from t1;
hex(c1)
31
show create table t1;
Table	Create Table
t1	CREATE TABLE `t1` (
  `c1` varchar(23) CHARACTER SET utf8mb3 COLLATE utf8mb3_general_ci DEFAULT NULL,
  `c2` double DEFAULT NULL
) ENGINE=MyISAM DEFAULT CHARSET=utf8mb4 COLLATE=utf8mb4_uca1400_ai_ci
drop table t1;
set @a2=sqrt(1);
select hex(concat(@a2));
hex(concat(@a2))
31
create table t1 as select concat(@a2) as c1, @a2 as c2;
select hex(c1) from t1;
hex(c1)
31
show create table t1;
Table	Create Table
t1	CREATE TABLE `t1` (
  `c1` varchar(23) CHARACTER SET utf8mb3 COLLATE utf8mb3_general_ci DEFAULT NULL,
  `c2` double DEFAULT NULL
) ENGINE=MyISAM DEFAULT CHARSET=utf8mb4 COLLATE=utf8mb4_uca1400_ai_ci
drop table t1;
select hex(concat(@a1:=1.1));
hex(concat(@a1:=1.1))
312E31
create table t1 as select concat(@a2:=1.1) as c1, @a3:=1.1 as c2;
select hex(c1) from t1;
hex(c1)
312E31
show create table t1;
Table	Create Table
t1	CREATE TABLE `t1` (
  `c1` varchar(4) CHARACTER SET utf8mb3 COLLATE utf8mb3_general_ci DEFAULT NULL,
  `c2` decimal(2,1) NOT NULL
) ENGINE=MyISAM DEFAULT CHARSET=utf8mb4 COLLATE=utf8mb4_uca1400_ai_ci
drop table t1;
set @a2=1.1;
select hex(concat(@a2));
hex(concat(@a2))
312E31
create table t1 as select concat(@a2) as c1, @a2 as c2;
select hex(c1) from t1;
hex(c1)
312E31
show create table t1;
Table	Create Table
t1	CREATE TABLE `t1` (
  `c1` varchar(83) CHARACTER SET utf8mb3 COLLATE utf8mb3_general_ci DEFAULT NULL,
  `c2` decimal(65,38) DEFAULT NULL
) ENGINE=MyISAM DEFAULT CHARSET=utf8mb4 COLLATE=utf8mb4_uca1400_ai_ci
drop table t1;
select hex(concat(@@ft_max_word_len));
hex(concat(@@ft_max_word_len))
3834
create table t1 as select concat(@@ft_max_word_len) as c1;
select hex(c1) from t1;
hex(c1)
3834
show create table t1;
Table	Create Table
t1	CREATE TABLE `t1` (
  `c1` varchar(21) CHARACTER SET utf8mb3 COLLATE utf8mb3_general_ci DEFAULT NULL
) ENGINE=MyISAM DEFAULT CHARSET=utf8mb4 COLLATE=utf8mb4_uca1400_ai_ci
drop table t1;
select hex(concat('a'='a' IS TRUE));
hex(concat('a'='a' IS TRUE))
31
create table t1 as select concat('a'='a' IS TRUE) as c1;
show create table t1;
Table	Create Table
t1	CREATE TABLE `t1` (
  `c1` varchar(1) CHARACTER SET utf8mb3 COLLATE utf8mb3_general_ci DEFAULT NULL
) ENGINE=MyISAM DEFAULT CHARSET=utf8mb4 COLLATE=utf8mb4_uca1400_ai_ci
drop table t1;
select hex(concat('a'='a' IS NOT TRUE));
hex(concat('a'='a' IS NOT TRUE))
30
create table t1 as select concat('a'='a' IS NOT TRUE) as c1;
show create table t1;
Table	Create Table
t1	CREATE TABLE `t1` (
  `c1` varchar(1) CHARACTER SET utf8mb3 COLLATE utf8mb3_general_ci DEFAULT NULL
) ENGINE=MyISAM DEFAULT CHARSET=utf8mb4 COLLATE=utf8mb4_uca1400_ai_ci
drop table t1;
select hex(concat(NOT 'a'='a'));
hex(concat(NOT 'a'='a'))
30
create table t1 as select concat(NOT 'a'='a') as c1;
show create table t1;
Table	Create Table
t1	CREATE TABLE `t1` (
  `c1` varchar(1) CHARACTER SET utf8mb3 COLLATE utf8mb3_general_ci DEFAULT NULL
) ENGINE=MyISAM DEFAULT CHARSET=utf8mb4 COLLATE=utf8mb4_uca1400_ai_ci
drop table t1;
select hex(concat('a' IS NULL));
hex(concat('a' IS NULL))
30
create table t1 as select concat('a' IS NULL) as c1;
show create table t1;
Table	Create Table
t1	CREATE TABLE `t1` (
  `c1` varchar(1) CHARACTER SET utf8mb3 COLLATE utf8mb3_general_ci DEFAULT NULL
) ENGINE=MyISAM DEFAULT CHARSET=utf8mb4 COLLATE=utf8mb4_uca1400_ai_ci
drop table t1;
select hex(concat('a' IS NOT NULL));
hex(concat('a' IS NOT NULL))
31
create table t1 as select concat('a' IS NOT NULL) as c1;
show create table t1;
Table	Create Table
t1	CREATE TABLE `t1` (
  `c1` varchar(1) CHARACTER SET utf8mb3 COLLATE utf8mb3_general_ci DEFAULT NULL
) ENGINE=MyISAM DEFAULT CHARSET=utf8mb4 COLLATE=utf8mb4_uca1400_ai_ci
drop table t1;
select hex(concat('a' rlike 'a'));
hex(concat('a' rlike 'a'))
31
create table t1 as select concat('a' IS NOT NULL) as c1;
show create table t1;
Table	Create Table
t1	CREATE TABLE `t1` (
  `c1` varchar(1) CHARACTER SET utf8mb3 COLLATE utf8mb3_general_ci DEFAULT NULL
) ENGINE=MyISAM DEFAULT CHARSET=utf8mb4 COLLATE=utf8mb4_uca1400_ai_ci
drop table t1;
select hex(concat(strcmp('a','b')));
hex(concat(strcmp('a','b')))
2D31
create table t1 as select concat(strcmp('a','b')) as c1;
show create table t1;
Table	Create Table
t1	CREATE TABLE `t1` (
  `c1` varchar(2) CHARACTER SET utf8mb3 COLLATE utf8mb3_general_ci DEFAULT NULL
) ENGINE=MyISAM DEFAULT CHARSET=utf8mb4 COLLATE=utf8mb4_uca1400_ai_ci
drop table t1;
select hex(concat('a' like 'a'));
hex(concat('a' like 'a'))
31
create table t1 as select concat('a' like 'b') as c1;
show create table t1;
Table	Create Table
t1	CREATE TABLE `t1` (
  `c1` varchar(1) CHARACTER SET utf8mb3 COLLATE utf8mb3_general_ci DEFAULT NULL
) ENGINE=MyISAM DEFAULT CHARSET=utf8mb4 COLLATE=utf8mb4_uca1400_ai_ci
drop table t1;
select hex(concat('a' between 'b' and 'c'));
hex(concat('a' between 'b' and 'c'))
30
create table t1 as select concat('a' between 'b' and 'c') as c1;
show create table t1;
Table	Create Table
t1	CREATE TABLE `t1` (
  `c1` varchar(1) CHARACTER SET utf8mb3 COLLATE utf8mb3_general_ci DEFAULT NULL
) ENGINE=MyISAM DEFAULT CHARSET=utf8mb4 COLLATE=utf8mb4_uca1400_ai_ci
drop table t1;
select hex(concat('a' in ('a','b')));
hex(concat('a' in ('a','b')))
31
create table t1 as select concat('a' in ('a','b')) as c1;
show create table t1;
Table	Create Table
t1	CREATE TABLE `t1` (
  `c1` varchar(1) CHARACTER SET utf8mb3 COLLATE utf8mb3_general_ci DEFAULT NULL
) ENGINE=MyISAM DEFAULT CHARSET=utf8mb4 COLLATE=utf8mb4_uca1400_ai_ci
drop table t1;
select hex(concat(interval(23, 1, 15, 17, 30, 44, 200)));
hex(concat(interval(23, 1, 15, 17, 30, 44, 200)))
33
create table t1 as select concat(interval(23, 1, 15, 17, 30, 44, 200)) as c1;
show create table t1;
Table	Create Table
t1	CREATE TABLE `t1` (
  `c1` varchar(2) CHARACTER SET utf8mb3 COLLATE utf8mb3_general_ci DEFAULT NULL
) ENGINE=MyISAM DEFAULT CHARSET=utf8mb4 COLLATE=utf8mb4_uca1400_ai_ci
drop table t1;
create table t1 (a varchar(10), fulltext key(a));
insert into t1 values ('a');
select hex(concat(match (a) against ('a'))) from t1;
hex(concat(match (a) against ('a')))
30
create table t2 as select concat(match (a) against ('a')) as a from t1;
show create table t2;
Table	Create Table
t2	CREATE TABLE `t2` (
  `a` varchar(23) CHARACTER SET utf8mb3 COLLATE utf8mb3_general_ci DEFAULT NULL
) ENGINE=MyISAM DEFAULT CHARSET=utf8mb4 COLLATE=utf8mb4_uca1400_ai_ci
drop table t1, t2;
select hex(ifnull(1,'a'));
hex(ifnull(1,'a'))
31
create table t1 as select ifnull(1,'a') as c1;
show create table t1;
Table	Create Table
t1	CREATE TABLE `t1` (
  `c1` varchar(1) CHARACTER SET utf8mb3 COLLATE utf8mb3_general_ci NOT NULL
) ENGINE=MyISAM DEFAULT CHARSET=utf8mb4 COLLATE=utf8mb4_uca1400_ai_ci
drop table t1;
select hex(concat(ifnull(1,1)));
hex(concat(ifnull(1,1)))
31
create table t1 as select concat(ifnull(1,1)) as c1;
show create table t1;
Table	Create Table
t1	CREATE TABLE `t1` (
  `c1` varchar(2) CHARACTER SET utf8mb3 COLLATE utf8mb3_general_ci DEFAULT NULL
) ENGINE=MyISAM DEFAULT CHARSET=utf8mb4 COLLATE=utf8mb4_uca1400_ai_ci
drop table t1;
select hex(concat(ifnull(1.1,1.1)));
hex(concat(ifnull(1.1,1.1)))
312E31
create table t1 as select concat(ifnull(1.1,1.1)) as c1;
show create table t1;
Table	Create Table
t1	CREATE TABLE `t1` (
  `c1` varchar(4) CHARACTER SET utf8mb3 COLLATE utf8mb3_general_ci DEFAULT NULL
) ENGINE=MyISAM DEFAULT CHARSET=utf8mb4 COLLATE=utf8mb4_uca1400_ai_ci
drop table t1;
select hex(if(1,'b',1));
hex(if(1,'b',1))
62
create table t1 as select if(1,'b',1) as c1;
show create table t1;
Table	Create Table
t1	CREATE TABLE `t1` (
  `c1` varchar(1) CHARACTER SET utf8mb3 COLLATE utf8mb3_general_ci NOT NULL
) ENGINE=MyISAM DEFAULT CHARSET=utf8mb4 COLLATE=utf8mb4_uca1400_ai_ci
drop table t1;
select hex(if(1,1,'b'));
hex(if(1,1,'b'))
31
create table t1 as select if(1,1,'b') as c1;
show create table t1;
Table	Create Table
t1	CREATE TABLE `t1` (
  `c1` varchar(1) CHARACTER SET utf8mb3 COLLATE utf8mb3_general_ci NOT NULL
) ENGINE=MyISAM DEFAULT CHARSET=utf8mb4 COLLATE=utf8mb4_uca1400_ai_ci
drop table t1;
select hex(concat(if(1,1,1)));
hex(concat(if(1,1,1)))
31
create table t1 as select concat(if(1,1,1)) as c1;
show create table t1;
Table	Create Table
t1	CREATE TABLE `t1` (
  `c1` varchar(2) CHARACTER SET utf8mb3 COLLATE utf8mb3_general_ci DEFAULT NULL
) ENGINE=MyISAM DEFAULT CHARSET=utf8mb4 COLLATE=utf8mb4_uca1400_ai_ci
drop table t1;
select hex(concat(nullif(1,2)));
hex(concat(nullif(1,2)))
31
create table t1 as select concat(nullif(1,2)) as c1;
show create table t1;
Table	Create Table
t1	CREATE TABLE `t1` (
  `c1` varchar(1) CHARACTER SET utf8mb3 COLLATE utf8mb3_general_ci DEFAULT NULL
) ENGINE=MyISAM DEFAULT CHARSET=utf8mb4 COLLATE=utf8mb4_uca1400_ai_ci
drop table t1;
select hex(concat(Dimension(GeomFromText('LINESTRING(0 0,10 10)'))));
hex(concat(Dimension(GeomFromText('LINESTRING(0 0,10 10)'))))
31
create table t1 as select concat(Dimension(GeomFromText('LINSTRING(0 0,10 10)'))) as c1;
show create table t1;
Table	Create Table
t1	CREATE TABLE `t1` (
  `c1` varchar(10) CHARACTER SET utf8mb3 COLLATE utf8mb3_general_ci DEFAULT NULL
) ENGINE=MyISAM DEFAULT CHARSET=utf8mb4 COLLATE=utf8mb4_uca1400_ai_ci
drop table t1;
select hex(concat(NumGeometries(MultiPointFromText('MULTIPOINT(0 0,10 10)')))) as exp;
exp
32
create table t1 as select concat(NumGeometries(MultiPointFromText('MULTIPOINT(0 0,10 10)'))) as c1;
show create table t1;
Table	Create Table
t1	CREATE TABLE `t1` (
  `c1` varchar(10) CHARACTER SET utf8mb3 COLLATE utf8mb3_general_ci DEFAULT NULL
) ENGINE=MyISAM DEFAULT CHARSET=utf8mb4 COLLATE=utf8mb4_uca1400_ai_ci
drop table t1;
select hex(concat(NumPoints(MultiPointFromText('LINESTRING(0 0,10 10)')))) as exp;
exp
32
create table t1 as select concat(NumPoints(MultiPointFromText('LINESTRING(0 0,10 10)'))) as c1;
show create table t1;
Table	Create Table
t1	CREATE TABLE `t1` (
  `c1` varchar(10) CHARACTER SET utf8mb3 COLLATE utf8mb3_general_ci DEFAULT NULL
) ENGINE=MyISAM DEFAULT CHARSET=utf8mb4 COLLATE=utf8mb4_uca1400_ai_ci
drop table t1;
select hex(concat(SRID(MultiPointFromText('MULTIPOINT(0 0,10 10)')))) as exp;
exp
30
create table t1 as select concat(SRID(MultiPointFromText('MULTIPOINT(0 0,10 10)'))) as c1;
show create table t1;
Table	Create Table
t1	CREATE TABLE `t1` (
  `c1` varchar(10) CHARACTER SET utf8mb3 COLLATE utf8mb3_general_ci DEFAULT NULL
) ENGINE=MyISAM DEFAULT CHARSET=utf8mb4 COLLATE=utf8mb4_uca1400_ai_ci
drop table t1;
select hex(concat(NumInteriorRings(PolygonFromText('POLYGON((0 0,50 0,50 50,0 50,0 0), (10 10,20 10,20 20,10 20,10 10))')))) as exp;
exp
31
create table t1 as select concat(NumInteriorRings(PolygonFromText('POLYGON((0 0,50 0,50 50,0 50,0 0), (10 10,20 10,20 20,10 20,10 10))'))) as c1;
show create table t1;
Table	Create Table
t1	CREATE TABLE `t1` (
  `c1` varchar(10) CHARACTER SET utf8mb3 COLLATE utf8mb3_general_ci DEFAULT NULL
) ENGINE=MyISAM DEFAULT CHARSET=utf8mb4 COLLATE=utf8mb4_uca1400_ai_ci
drop table t1;
select hex(concat(IsEmpty(GeomFromText('POINT(1 1)')))) as exp;
exp
30
create table t1 as select concat(IsEmpty(GeomFromText('Point(1 1)'))) as c1;
show create table t1;
Table	Create Table
t1	CREATE TABLE `t1` (
  `c1` varchar(21) CHARACTER SET utf8mb3 COLLATE utf8mb3_general_ci DEFAULT NULL
) ENGINE=MyISAM DEFAULT CHARSET=utf8mb4 COLLATE=utf8mb4_uca1400_ai_ci
drop table t1;
select hex(concat(IsSimple(GeomFromText('POINT(1 1)')))) as exp;
exp
31
create table t1 as select concat(IsSimple(GeomFromText('Point(1 1)'))) as c1;
show create table t1;
Table	Create Table
t1	CREATE TABLE `t1` (
  `c1` varchar(2) CHARACTER SET utf8mb3 COLLATE utf8mb3_general_ci DEFAULT NULL
) ENGINE=MyISAM DEFAULT CHARSET=utf8mb4 COLLATE=utf8mb4_uca1400_ai_ci
drop table t1;
select hex(concat(IsClosed(GeomFromText('LineString(1 1,2 2)')))) as exp;
exp
30
create table t1 as select concat(IsClosed(GeomFromText('LineString(1 1,2 2)'))) as c1;
show create table t1;
Table	Create Table
t1	CREATE TABLE `t1` (
  `c1` varchar(2) CHARACTER SET utf8mb3 COLLATE utf8mb3_general_ci DEFAULT NULL
) ENGINE=MyISAM DEFAULT CHARSET=utf8mb4 COLLATE=utf8mb4_uca1400_ai_ci
drop table t1;
select hex(concat(Equals(GeomFromText('Point(1 1)'),GeomFromText('Point(1 1)')))) as exp;
exp
31
create table t1 as select concat(Equals(GeomFromText('Point(1 1)'),GeomFromText('Point(1 1)'))) as c1;
drop table t1;
select hex(concat(x(GeomFromText('Point(1 2)')))) as exp;
exp
31
create table t1 as select concat(x(GeomFromText('Point(1 2)'))) as c1;
show create table t1;
Table	Create Table
t1	CREATE TABLE `t1` (
  `c1` varchar(23) CHARACTER SET utf8mb3 COLLATE utf8mb3_general_ci DEFAULT NULL
) ENGINE=MyISAM DEFAULT CHARSET=utf8mb4 COLLATE=utf8mb4_uca1400_ai_ci
drop table t1;
select hex(concat(y(GeomFromText('Point(1 2)')))) as exp;
exp
32
create table t1 as select concat(x(GeomFromText('Point(1 2)'))) as c1;
show create table t1;
Table	Create Table
t1	CREATE TABLE `t1` (
  `c1` varchar(23) CHARACTER SET utf8mb3 COLLATE utf8mb3_general_ci DEFAULT NULL
) ENGINE=MyISAM DEFAULT CHARSET=utf8mb4 COLLATE=utf8mb4_uca1400_ai_ci
drop table t1;
select hex(concat(GLength(GeomFromText('LineString(1 2,2 2)')))) as exp;
exp
31
create table t1 as select concat(GLength(GeomFromText('LineString(1 2, 2 2)'))) as c1;
show create table t1;
Table	Create Table
t1	CREATE TABLE `t1` (
  `c1` varchar(23) CHARACTER SET utf8mb3 COLLATE utf8mb3_general_ci DEFAULT NULL
) ENGINE=MyISAM DEFAULT CHARSET=utf8mb4 COLLATE=utf8mb4_uca1400_ai_ci
drop table t1;
select hex(concat(Area(GeomFromText('Polygon((0 0,1 0,1 1,0 1,0 0))')))) as exp;
exp
31
create table t1 as select concat(Area(GeomFromText('Polygon((0 0,1 0,1 1,0 1,0 0))'))) as c1;
show create table t1;
Table	Create Table
t1	CREATE TABLE `t1` (
  `c1` varchar(23) CHARACTER SET utf8mb3 COLLATE utf8mb3_general_ci DEFAULT NULL
) ENGINE=MyISAM DEFAULT CHARSET=utf8mb4 COLLATE=utf8mb4_uca1400_ai_ci
drop table t1;
select hex(concat(GeometryType(GeomFromText('Point(1 2)')))) as exp;
exp
504F494E54
create table t1 as select concat(GeometryType(GeomFromText('Point(1 2)'))) as c1;
show create table t1;
Table	Create Table
t1	CREATE TABLE `t1` (
  `c1` varchar(20) CHARACTER SET utf8mb3 COLLATE utf8mb3_general_ci DEFAULT NULL
) ENGINE=MyISAM DEFAULT CHARSET=utf8mb4 COLLATE=utf8mb4_uca1400_ai_ci
drop table t1;
select hex(concat(AsText(GeomFromText('Point(1 2)')))) as exp;
exp
504F494E542831203229
create table t1 as select concat(AsText(GeomFromText('Point(1 2)'))) as c1;
show create table t1;
Table	Create Table
t1	CREATE TABLE `t1` (
  `c1` longtext CHARACTER SET utf8mb3 COLLATE utf8mb3_general_ci DEFAULT NULL
) ENGINE=MyISAM DEFAULT CHARSET=utf8mb4 COLLATE=utf8mb4_uca1400_ai_ci
drop table t1;
select hex(concat(period_add(200902, 2)));
hex(concat(period_add(200902, 2)))
323030393034
create table t1 as select concat(period_add(200902, 2)) as c1;
show create table t1;
Table	Create Table
t1	CREATE TABLE `t1` (
  `c1` varchar(6) CHARACTER SET utf8mb3 COLLATE utf8mb3_general_ci DEFAULT NULL
) ENGINE=MyISAM DEFAULT CHARSET=utf8mb4 COLLATE=utf8mb4_uca1400_ai_ci
drop table t1;
select hex(concat(period_diff(200902, 200802)));
hex(concat(period_diff(200902, 200802)))
3132
SET STATEMENT sql_mode = 'NO_ENGINE_SUBSTITUTION' FOR
create table t1 as select concat(period_add(200902, 200802)) as c1;
Warnings:
Warning	1265	Data truncated for column 'c1' at row 1
show create table t1;
Table	Create Table
t1	CREATE TABLE `t1` (
  `c1` varchar(6) CHARACTER SET utf8mb3 COLLATE utf8mb3_general_ci NOT NULL
) ENGINE=MyISAM DEFAULT CHARSET=utf8mb4 COLLATE=utf8mb4_uca1400_ai_ci
drop table t1;
select hex(concat(to_days(20090224)));
hex(concat(to_days(20090224)))
373333383237
create table t1 as select concat(to_days(20090224)) as c1;
show create table t1;
Table	Create Table
t1	CREATE TABLE `t1` (
  `c1` varchar(6) CHARACTER SET utf8mb3 COLLATE utf8mb3_general_ci DEFAULT NULL
) ENGINE=MyISAM DEFAULT CHARSET=utf8mb4 COLLATE=utf8mb4_uca1400_ai_ci
drop table t1;
select hex(concat(dayofmonth(20090224)));
hex(concat(dayofmonth(20090224)))
3234
create table t1 as select concat(dayofmonth(20090224)) as c1;
show create table t1;
Table	Create Table
t1	CREATE TABLE `t1` (
  `c1` varchar(2) CHARACTER SET utf8mb3 COLLATE utf8mb3_general_ci DEFAULT NULL
) ENGINE=MyISAM DEFAULT CHARSET=utf8mb4 COLLATE=utf8mb4_uca1400_ai_ci
drop table t1;
select hex(concat(dayofyear(20090224)));
hex(concat(dayofyear(20090224)))
3535
create table t1 as select concat(dayofyear(20090224)) as c1;
show create table t1;
Table	Create Table
t1	CREATE TABLE `t1` (
  `c1` varchar(3) CHARACTER SET utf8mb3 COLLATE utf8mb3_general_ci DEFAULT NULL
) ENGINE=MyISAM DEFAULT CHARSET=utf8mb4 COLLATE=utf8mb4_uca1400_ai_ci
drop table t1;
select hex(concat(hour('10:11:12')));
hex(concat(hour('10:11:12')))
3130
create table t1 as select concat(hour('10:11:12')) as c1;
show create table t1;
Table	Create Table
t1	CREATE TABLE `t1` (
  `c1` varchar(2) CHARACTER SET utf8mb3 COLLATE utf8mb3_general_ci DEFAULT NULL
) ENGINE=MyISAM DEFAULT CHARSET=utf8mb4 COLLATE=utf8mb4_uca1400_ai_ci
drop table t1;
select hex(concat(minute('10:11:12')));
hex(concat(minute('10:11:12')))
3131
create table t1 as select concat(minute('10:11:12')) as c1;
show create table t1;
Table	Create Table
t1	CREATE TABLE `t1` (
  `c1` varchar(2) CHARACTER SET utf8mb3 COLLATE utf8mb3_general_ci DEFAULT NULL
) ENGINE=MyISAM DEFAULT CHARSET=utf8mb4 COLLATE=utf8mb4_uca1400_ai_ci
drop table t1;
select hex(concat(second('10:11:12')));
hex(concat(second('10:11:12')))
3132
create table t1 as select concat(second('10:11:12')) as c1;
show create table t1;
Table	Create Table
t1	CREATE TABLE `t1` (
  `c1` varchar(2) CHARACTER SET utf8mb3 COLLATE utf8mb3_general_ci DEFAULT NULL
) ENGINE=MyISAM DEFAULT CHARSET=utf8mb4 COLLATE=utf8mb4_uca1400_ai_ci
drop table t1;
select hex(concat(quarter(20090224)));
hex(concat(quarter(20090224)))
31
create table t1 as select concat(quarter(20090224)) as c1;
show create table t1;
Table	Create Table
t1	CREATE TABLE `t1` (
  `c1` varchar(1) CHARACTER SET utf8mb3 COLLATE utf8mb3_general_ci DEFAULT NULL
) ENGINE=MyISAM DEFAULT CHARSET=utf8mb4 COLLATE=utf8mb4_uca1400_ai_ci
drop table t1;
select hex(concat(week(20090224)));
hex(concat(week(20090224)))
38
create table t1 as select concat(week(20090224)) as c1;
show create table t1;
Table	Create Table
t1	CREATE TABLE `t1` (
  `c1` varchar(2) CHARACTER SET utf8mb3 COLLATE utf8mb3_general_ci DEFAULT NULL
) ENGINE=MyISAM DEFAULT CHARSET=utf8mb4 COLLATE=utf8mb4_uca1400_ai_ci
drop table t1;
select hex(concat(yearweek(20090224)));
hex(concat(yearweek(20090224)))
323030393038
create table t1 as select concat(yearweek(20090224)) as c1;
show create table t1;
Table	Create Table
t1	CREATE TABLE `t1` (
  `c1` varchar(6) CHARACTER SET utf8mb3 COLLATE utf8mb3_general_ci DEFAULT NULL
) ENGINE=MyISAM DEFAULT CHARSET=utf8mb4 COLLATE=utf8mb4_uca1400_ai_ci
drop table t1;
select hex(concat(year(20090224)));
hex(concat(year(20090224)))
32303039
create table t1 as select concat(year(20090224)) as c1;
show create table t1;
Table	Create Table
t1	CREATE TABLE `t1` (
  `c1` varchar(4) CHARACTER SET utf8mb3 COLLATE utf8mb3_general_ci DEFAULT NULL
) ENGINE=MyISAM DEFAULT CHARSET=utf8mb4 COLLATE=utf8mb4_uca1400_ai_ci
drop table t1;
select hex(concat(weekday(20090224)));
hex(concat(weekday(20090224)))
31
create table t1 as select concat(weekday(20090224)) as c1;
show create table t1;
Table	Create Table
t1	CREATE TABLE `t1` (
  `c1` varchar(1) CHARACTER SET utf8mb3 COLLATE utf8mb3_general_ci DEFAULT NULL
) ENGINE=MyISAM DEFAULT CHARSET=utf8mb4 COLLATE=utf8mb4_uca1400_ai_ci
drop table t1;
select hex(concat(dayofweek(20090224)));
hex(concat(dayofweek(20090224)))
33
create table t1 as select concat(dayofweek(20090224)) as c1;
show create table t1;
Table	Create Table
t1	CREATE TABLE `t1` (
  `c1` varchar(1) CHARACTER SET utf8mb3 COLLATE utf8mb3_general_ci DEFAULT NULL
) ENGINE=MyISAM DEFAULT CHARSET=utf8mb4 COLLATE=utf8mb4_uca1400_ai_ci
drop table t1;
select hex(concat(unix_timestamp(20090224)));
hex(concat(unix_timestamp(20090224)))
31323335343232383030
create table t1 as select concat(unix_timestamp(20090224)) as c1;
show create table t1;
Table	Create Table
t1	CREATE TABLE `t1` (
  `c1` varchar(17) CHARACTER SET utf8mb3 COLLATE utf8mb3_general_ci DEFAULT NULL
) ENGINE=MyISAM DEFAULT CHARSET=utf8mb4 COLLATE=utf8mb4_uca1400_ai_ci
drop table t1;
select hex(concat(time_to_sec('10:11:12')));
hex(concat(time_to_sec('10:11:12')))
3336363732
create table t1 as select concat(time_to_sec('10:11:12')) as c1;
show create table t1;
Table	Create Table
t1	CREATE TABLE `t1` (
  `c1` varchar(17) CHARACTER SET utf8mb3 COLLATE utf8mb3_general_ci DEFAULT NULL
) ENGINE=MyISAM DEFAULT CHARSET=utf8mb4 COLLATE=utf8mb4_uca1400_ai_ci
drop table t1;
select hex(concat(extract(year from 20090702)));
hex(concat(extract(year from 20090702)))
32303039
create table t1 as select concat(extract(year from 20090702)) as c1;
show create table t1;
Table	Create Table
t1	CREATE TABLE `t1` (
  `c1` varchar(4) CHARACTER SET utf8mb3 COLLATE utf8mb3_general_ci DEFAULT NULL
) ENGINE=MyISAM DEFAULT CHARSET=utf8mb4 COLLATE=utf8mb4_uca1400_ai_ci
drop table t1;
select hex(concat(microsecond('12:00:00.123456')));
hex(concat(microsecond('12:00:00.123456')))
313233343536
create table t1 as select concat(microsecond('12:00:00.123456')) as c1;
show create table t1;
Table	Create Table
t1	CREATE TABLE `t1` (
  `c1` varchar(6) CHARACTER SET utf8mb3 COLLATE utf8mb3_general_ci DEFAULT NULL
) ENGINE=MyISAM DEFAULT CHARSET=utf8mb4 COLLATE=utf8mb4_uca1400_ai_ci
drop table t1;
select hex(concat(month(20090224)));
hex(concat(month(20090224)))
32
create table t1 as select concat(month(20090224)) as c1;
show create table t1;
Table	Create Table
t1	CREATE TABLE `t1` (
  `c1` varchar(2) CHARACTER SET utf8mb3 COLLATE utf8mb3_general_ci DEFAULT NULL
) ENGINE=MyISAM DEFAULT CHARSET=utf8mb4 COLLATE=utf8mb4_uca1400_ai_ci
drop table t1;
create table t1 as select concat(last_day('2003-02-05')) as c1;
show create table t1;
Table	Create Table
t1	CREATE TABLE `t1` (
  `c1` varchar(10) CHARACTER SET utf8mb3 COLLATE utf8mb3_general_ci DEFAULT NULL
) ENGINE=MyISAM DEFAULT CHARSET=utf8mb4 COLLATE=utf8mb4_uca1400_ai_ci
select c1, hex(c1) from t1;
c1	hex(c1)
2003-02-28	323030332D30322D3238
drop table t1;
create table t1 as select concat(from_days(730669)) as c1;
show create table t1;
Table	Create Table
t1	CREATE TABLE `t1` (
  `c1` varchar(10) CHARACTER SET utf8mb3 COLLATE utf8mb3_general_ci DEFAULT NULL
) ENGINE=MyISAM DEFAULT CHARSET=utf8mb4 COLLATE=utf8mb4_uca1400_ai_ci
select c1, hex(c1) from t1;
c1	hex(c1)
2000-07-03	323030302D30372D3033
drop table t1;
create table t1 as select concat(curdate()) as c1;
show create table t1;
Table	Create Table
t1	CREATE TABLE `t1` (
  `c1` varchar(10) CHARACTER SET utf8mb3 COLLATE utf8mb3_general_ci DEFAULT NULL
) ENGINE=MyISAM DEFAULT CHARSET=utf8mb4 COLLATE=utf8mb4_uca1400_ai_ci
drop table t1;
create table t1 as select concat(utc_date()) as c1;
show create table t1;
Table	Create Table
t1	CREATE TABLE `t1` (
  `c1` varchar(10) CHARACTER SET utf8mb3 COLLATE utf8mb3_general_ci DEFAULT NULL
) ENGINE=MyISAM DEFAULT CHARSET=utf8mb4 COLLATE=utf8mb4_uca1400_ai_ci
drop table t1;
create table t1 as select concat(curtime()) as c1;
show create table t1;
Table	Create Table
t1	CREATE TABLE `t1` (
  `c1` varchar(10) CHARACTER SET utf8mb3 COLLATE utf8mb3_general_ci DEFAULT NULL
) ENGINE=MyISAM DEFAULT CHARSET=utf8mb4 COLLATE=utf8mb4_uca1400_ai_ci
drop table t1;
create table t1 as select repeat('a',20) as c1 limit 0;
set timestamp=1216359724;
insert into t1 values (current_date);
insert into t1 values (current_time);
select c1, hex(c1) from t1;
c1	hex(c1)
2008-07-18	323030382D30372D3138
08:42:04	30383A34323A3034
drop table t1;
create table t1 as select concat(utc_time()) as c1;
show create table t1;
Table	Create Table
t1	CREATE TABLE `t1` (
  `c1` varchar(10) CHARACTER SET utf8mb3 COLLATE utf8mb3_general_ci DEFAULT NULL
) ENGINE=MyISAM DEFAULT CHARSET=utf8mb4 COLLATE=utf8mb4_uca1400_ai_ci
drop table t1;
select hex(concat(sec_to_time(2378)));
hex(concat(sec_to_time(2378)))
30303A33393A3338
create table t1 as select concat(sec_to_time(2378)) as c1;
show create table t1;
Table	Create Table
t1	CREATE TABLE `t1` (
  `c1` varchar(10) CHARACTER SET utf8mb3 COLLATE utf8mb3_general_ci DEFAULT NULL
) ENGINE=MyISAM DEFAULT CHARSET=utf8mb4 COLLATE=utf8mb4_uca1400_ai_ci
drop table t1;
select hex(concat(timediff('2001-01-02 00:00:00', '2001-01-01 00:00:00'))) as exp;
exp
32343A30303A3030
create table t1 as select concat(timediff('2001-01-02 00:00:00', '2001-01-01 00:00:00')) as c1;
show create table t1;
Table	Create Table
t1	CREATE TABLE `t1` (
  `c1` varchar(10) CHARACTER SET utf8mb3 COLLATE utf8mb3_general_ci DEFAULT NULL
) ENGINE=MyISAM DEFAULT CHARSET=utf8mb4 COLLATE=utf8mb4_uca1400_ai_ci
drop table t1;
select hex(concat(maketime(10,11,12)));
hex(concat(maketime(10,11,12)))
31303A31313A3132
create table t1 as select concat(maketime(10,11,12)) as c1;
show create table t1;
Table	Create Table
t1	CREATE TABLE `t1` (
  `c1` varchar(10) CHARACTER SET utf8mb3 COLLATE utf8mb3_general_ci DEFAULT NULL
) ENGINE=MyISAM DEFAULT CHARSET=utf8mb4 COLLATE=utf8mb4_uca1400_ai_ci
drop table t1;
select hex(get_format(DATE,'USA'));
hex(get_format(DATE,'USA'))
256D2E25642E2559
create table t1 as select get_format(DATE,'USA') as c1;
show create table t1;
Table	Create Table
t1	CREATE TABLE `t1` (
  `c1` varchar(17) CHARACTER SET utf8mb3 COLLATE utf8mb3_general_ci DEFAULT NULL
) ENGINE=MyISAM DEFAULT CHARSET=utf8mb4 COLLATE=utf8mb4_uca1400_ai_ci
drop table t1;
select hex(left(concat(from_unixtime(1111885200)),4));
hex(left(concat(from_unixtime(1111885200)),4))
32303035
create table t1 as select concat(from_unixtime(1111885200)) as c1;
show create table t1;
Table	Create Table
t1	CREATE TABLE `t1` (
  `c1` varchar(19) CHARACTER SET utf8mb3 COLLATE utf8mb3_general_ci DEFAULT NULL
) ENGINE=MyISAM DEFAULT CHARSET=utf8mb4 COLLATE=utf8mb4_uca1400_ai_ci
drop table t1;
select hex(concat(convert_tz('2004-01-01 12:00:00','+10:00','-6:00'))) as exp;
exp
323030332D31322D33312032303A30303A3030
create table t1 as select concat(convert_tz('2004-01-01 12:00:00','+10:00','-6:00')) as c1;
show create table t1;
Table	Create Table
t1	CREATE TABLE `t1` (
  `c1` varchar(19) CHARACTER SET utf8mb3 COLLATE utf8mb3_general_ci DEFAULT NULL
) ENGINE=MyISAM DEFAULT CHARSET=utf8mb4 COLLATE=utf8mb4_uca1400_ai_ci
drop table t1;
select hex(concat(date_add('2004-01-01 12:00:00', interval 1 day))) as exp;
exp
323030342D30312D30322031323A30303A3030
create table t1 as select concat(date_add('2004-01-01 12:00:00', interval 1 day)) as c1;
show create table t1;
Table	Create Table
t1	CREATE TABLE `t1` (
  `c1` varchar(19) CHARACTER SET utf8mb3 COLLATE utf8mb3_general_ci DEFAULT NULL
) ENGINE=MyISAM DEFAULT CHARSET=utf8mb4 COLLATE=utf8mb4_uca1400_ai_ci
select * from t1;
c1
2004-01-02 12:00:00
drop table t1;
select hex(concat(makedate(2009,1)));
hex(concat(makedate(2009,1)))
323030392D30312D3031
create table t1 as select concat(makedate(2009,1)) as c1;
show create table t1;
Table	Create Table
t1	CREATE TABLE `t1` (
  `c1` varchar(10) CHARACTER SET utf8mb3 COLLATE utf8mb3_general_ci DEFAULT NULL
) ENGINE=MyISAM DEFAULT CHARSET=utf8mb4 COLLATE=utf8mb4_uca1400_ai_ci
select * from t1;
c1
2009-01-01
drop table t1;
create table t1 as select concat(now()) as c1;
show create table t1;
Table	Create Table
t1	CREATE TABLE `t1` (
  `c1` varchar(19) CHARACTER SET utf8mb3 COLLATE utf8mb3_general_ci DEFAULT NULL
) ENGINE=MyISAM DEFAULT CHARSET=utf8mb4 COLLATE=utf8mb4_uca1400_ai_ci
drop table t1;
create table t1 as select concat(utc_timestamp()) as c1;
show create table t1;
Table	Create Table
t1	CREATE TABLE `t1` (
  `c1` varchar(19) CHARACTER SET utf8mb3 COLLATE utf8mb3_general_ci DEFAULT NULL
) ENGINE=MyISAM DEFAULT CHARSET=utf8mb4 COLLATE=utf8mb4_uca1400_ai_ci
drop table t1;
create table t1 as select concat(sysdate()) as c1;
show create table t1;
Table	Create Table
t1	CREATE TABLE `t1` (
  `c1` varchar(19) CHARACTER SET utf8mb3 COLLATE utf8mb3_general_ci DEFAULT NULL
) ENGINE=MyISAM DEFAULT CHARSET=utf8mb4 COLLATE=utf8mb4_uca1400_ai_ci
drop table t1;
select hex(concat(addtime('00:00:00','11:22:33')));
hex(concat(addtime('00:00:00','11:22:33')))
31313A32323A3333
create table t1 as select concat(addtime('00:00:00','11:22:33')) as c1;
show create table t1;
Table	Create Table
t1	CREATE TABLE `t1` (
  `c1` varchar(26) CHARACTER SET utf8mb3 COLLATE utf8mb3_general_ci DEFAULT NULL
) ENGINE=MyISAM DEFAULT CHARSET=utf8mb4 COLLATE=utf8mb4_uca1400_ai_ci
drop table t1;
select hex(concat(subtime('23:59:59','11:22:33')));
hex(concat(subtime('23:59:59','11:22:33')))
31323A33373A3236
create table t1 as select concat(subtime('23:59:59','11:22:33')) as c1;
show create table t1;
Table	Create Table
t1	CREATE TABLE `t1` (
  `c1` varchar(26) CHARACTER SET utf8mb3 COLLATE utf8mb3_general_ci DEFAULT NULL
) ENGINE=MyISAM DEFAULT CHARSET=utf8mb4 COLLATE=utf8mb4_uca1400_ai_ci
drop table t1;
select hex(elt(1,2,3));
hex(elt(1,2,3))
32
create table t1 as select elt(1,2,3) as c1;
show create table t1;
Table	Create Table
t1	CREATE TABLE `t1` (
  `c1` varchar(1) CHARACTER SET utf8mb3 COLLATE utf8mb3_general_ci DEFAULT NULL
) ENGINE=MyISAM DEFAULT CHARSET=utf8mb4 COLLATE=utf8mb4_uca1400_ai_ci
drop table t1;
select hex(export_set(1,2,3,4,2));
hex(export_set(1,2,3,4,2))
323433
create table t1 as select export_set(1,2,3,4,2) as c1;
show create table t1;
Table	Create Table
t1	CREATE TABLE `t1` (
  `c1` varchar(127) CHARACTER SET utf8mb3 COLLATE utf8mb3_general_ci DEFAULT NULL
) ENGINE=MyISAM DEFAULT CHARSET=utf8mb4 COLLATE=utf8mb4_uca1400_ai_ci
drop table t1;
select hex(insert(1133,3,0,22));
hex(insert(1133,3,0,22))
313132323333
create table t1 as select insert(1133,3,0,22) as c1;
show create table t1;
Table	Create Table
t1	CREATE TABLE `t1` (
  `c1` varchar(6) CHARACTER SET utf8mb3 COLLATE utf8mb3_general_ci DEFAULT NULL
) ENGINE=MyISAM DEFAULT CHARSET=utf8mb4 COLLATE=utf8mb4_uca1400_ai_ci
drop table t1;
select hex(lcase(123));
hex(lcase(123))
313233
create table t1 as select lcase(123) as c1;
show create table t1;
Table	Create Table
t1	CREATE TABLE `t1` (
  `c1` varchar(3) CHARACTER SET utf8mb3 COLLATE utf8mb3_general_ci DEFAULT NULL
) ENGINE=MyISAM DEFAULT CHARSET=utf8mb4 COLLATE=utf8mb4_uca1400_ai_ci
drop table t1;
select hex(left(123,1));
hex(left(123,1))
31
create table t1 as select left(123,1) as c1;
show create table t1;
Table	Create Table
t1	CREATE TABLE `t1` (
  `c1` varchar(1) CHARACTER SET utf8mb3 COLLATE utf8mb3_general_ci DEFAULT NULL
) ENGINE=MyISAM DEFAULT CHARSET=utf8mb4 COLLATE=utf8mb4_uca1400_ai_ci
drop table t1;
select hex(lower(123));
hex(lower(123))
313233
create table t1 as select lower(123) as c1;
show create table t1;
Table	Create Table
t1	CREATE TABLE `t1` (
  `c1` varchar(3) CHARACTER SET utf8mb3 COLLATE utf8mb3_general_ci DEFAULT NULL
) ENGINE=MyISAM DEFAULT CHARSET=utf8mb4 COLLATE=utf8mb4_uca1400_ai_ci
drop table t1;
select hex(lpad(1,2,0));
hex(lpad(1,2,0))
3031
create table t1 as select lpad(1,2,0) as c1;
show create table t1;
Table	Create Table
t1	CREATE TABLE `t1` (
  `c1` varchar(2) CHARACTER SET utf8mb3 COLLATE utf8mb3_general_ci DEFAULT NULL
) ENGINE=MyISAM DEFAULT CHARSET=utf8mb4 COLLATE=utf8mb4_uca1400_ai_ci
drop table t1;
select hex(ltrim(1));
hex(ltrim(1))
31
create table t1 as select ltrim(1) as c1;
show create table t1;
Table	Create Table
t1	CREATE TABLE `t1` (
  `c1` varchar(1) CHARACTER SET utf8mb3 COLLATE utf8mb3_general_ci DEFAULT NULL
) ENGINE=MyISAM DEFAULT CHARSET=utf8mb4 COLLATE=utf8mb4_uca1400_ai_ci
drop table t1;
select hex(mid(1,1,1));
hex(mid(1,1,1))
31
create table t1 as select mid(1,1,1) as c1;
show create table t1;
Table	Create Table
t1	CREATE TABLE `t1` (
  `c1` varchar(1) CHARACTER SET utf8mb3 COLLATE utf8mb3_general_ci DEFAULT NULL
) ENGINE=MyISAM DEFAULT CHARSET=utf8mb4 COLLATE=utf8mb4_uca1400_ai_ci
drop table t1;
select hex(repeat(1,2));
hex(repeat(1,2))
3131
create table t1 as select repeat(1,2) as c1;
show create table t1;
Table	Create Table
t1	CREATE TABLE `t1` (
  `c1` varchar(2) CHARACTER SET utf8mb3 COLLATE utf8mb3_general_ci DEFAULT NULL
) ENGINE=MyISAM DEFAULT CHARSET=utf8mb4 COLLATE=utf8mb4_uca1400_ai_ci
drop table t1;
select hex(replace(1,1,2));
hex(replace(1,1,2))
32
create table t1 as select replace(1,1,2) as c1;
show create table t1;
Table	Create Table
t1	CREATE TABLE `t1` (
  `c1` varchar(1) CHARACTER SET utf8mb3 COLLATE utf8mb3_general_ci DEFAULT NULL
) ENGINE=MyISAM DEFAULT CHARSET=utf8mb4 COLLATE=utf8mb4_uca1400_ai_ci
drop table t1;
select hex(reverse(12));
hex(reverse(12))
3231
create table t1 as select reverse(12) as c1;
show create table t1;
Table	Create Table
t1	CREATE TABLE `t1` (
  `c1` varchar(2) CHARACTER SET utf8mb3 COLLATE utf8mb3_general_ci DEFAULT NULL
) ENGINE=MyISAM DEFAULT CHARSET=utf8mb4 COLLATE=utf8mb4_uca1400_ai_ci
drop table t1;
select hex(right(123,1));
hex(right(123,1))
33
create table t1 as select right(123,1) as c1;
show create table t1;
Table	Create Table
t1	CREATE TABLE `t1` (
  `c1` varchar(1) CHARACTER SET utf8mb3 COLLATE utf8mb3_general_ci DEFAULT NULL
) ENGINE=MyISAM DEFAULT CHARSET=utf8mb4 COLLATE=utf8mb4_uca1400_ai_ci
drop table t1;
select hex(rpad(1,2,0));
hex(rpad(1,2,0))
3130
create table t1 as select rpad(1,2,0) as c1;
show create table t1;
Table	Create Table
t1	CREATE TABLE `t1` (
  `c1` varchar(2) CHARACTER SET utf8mb3 COLLATE utf8mb3_general_ci DEFAULT NULL
) ENGINE=MyISAM DEFAULT CHARSET=utf8mb4 COLLATE=utf8mb4_uca1400_ai_ci
drop table t1;
select hex(rtrim(1));
hex(rtrim(1))
31
create table t1 as select rtrim(1) as c1;
show create table t1;
Table	Create Table
t1	CREATE TABLE `t1` (
  `c1` varchar(1) CHARACTER SET utf8mb3 COLLATE utf8mb3_general_ci DEFAULT NULL
) ENGINE=MyISAM DEFAULT CHARSET=utf8mb4 COLLATE=utf8mb4_uca1400_ai_ci
drop table t1;
select hex(soundex(1));
hex(soundex(1))

create table t1 as select soundex(1) as c1;
show create table t1;
Table	Create Table
t1	CREATE TABLE `t1` (
  `c1` varchar(4) CHARACTER SET utf8mb3 COLLATE utf8mb3_general_ci DEFAULT NULL
) ENGINE=MyISAM DEFAULT CHARSET=utf8mb4 COLLATE=utf8mb4_uca1400_ai_ci
drop table t1;
select hex(substring(1,1,1));
hex(substring(1,1,1))
31
create table t1 as select substring(1,1,1) as c1;
show create table t1;
Table	Create Table
t1	CREATE TABLE `t1` (
  `c1` varchar(1) CHARACTER SET utf8mb3 COLLATE utf8mb3_general_ci DEFAULT NULL
) ENGINE=MyISAM DEFAULT CHARSET=utf8mb4 COLLATE=utf8mb4_uca1400_ai_ci
drop table t1;
select hex(trim(1));
hex(trim(1))
31
create table t1 as select trim(1) as c1;
show create table t1;
Table	Create Table
t1	CREATE TABLE `t1` (
  `c1` varchar(1) CHARACTER SET utf8mb3 COLLATE utf8mb3_general_ci DEFAULT NULL
) ENGINE=MyISAM DEFAULT CHARSET=utf8mb4 COLLATE=utf8mb4_uca1400_ai_ci
drop table t1;
select hex(ucase(1));
hex(ucase(1))
31
create table t1 as select ucase(1) as c1;
show create table t1;
Table	Create Table
t1	CREATE TABLE `t1` (
  `c1` varchar(1) CHARACTER SET utf8mb3 COLLATE utf8mb3_general_ci DEFAULT NULL
) ENGINE=MyISAM DEFAULT CHARSET=utf8mb4 COLLATE=utf8mb4_uca1400_ai_ci
drop table t1;
select hex(upper(1));
hex(upper(1))
31
create table t1 as select upper(1) as c1;
show create table t1;
Table	Create Table
t1	CREATE TABLE `t1` (
  `c1` varchar(1) CHARACTER SET utf8mb3 COLLATE utf8mb3_general_ci DEFAULT NULL
) ENGINE=MyISAM DEFAULT CHARSET=utf8mb4 COLLATE=utf8mb4_uca1400_ai_ci
drop table t1;
create table t1 as select repeat(' ', 64) as a limit 0;
show create table t1;
Table	Create Table
t1	CREATE TABLE `t1` (
  `a` varchar(64) CHARACTER SET utf8mb3 COLLATE utf8mb3_general_ci DEFAULT NULL
) ENGINE=MyISAM DEFAULT CHARSET=utf8mb4 COLLATE=utf8mb4_uca1400_ai_ci
insert into t1 values ("1.1"), ("2.1");
select a, hex(a) from t1;
a	hex(a)
1.1	312E31
2.1	322E31
update t1 set a= a + 0.1;
select a, hex(a) from t1;
a	hex(a)
1.2000000000000002	312E32303030303030303030303030303032
2.2	322E32
drop table t1;
create table t1 (a tinyint);
insert into t1 values (1);
select hex(concat(a)) from t1;
hex(concat(a))
31
create table t2 as select concat(a) from t1;
show create table t2;
Table	Create Table
t2	CREATE TABLE `t2` (
  `concat(a)` varchar(4) CHARACTER SET utf8mb3 COLLATE utf8mb3_general_ci DEFAULT NULL
) ENGINE=MyISAM DEFAULT CHARSET=utf8mb4 COLLATE=utf8mb4_uca1400_ai_ci
drop table t1, t2;
create table t1 (a tinyint zerofill);
insert into t1 values (1), (10), (100);
select hex(concat(a)), a from t1;
hex(concat(a))	a
303031	001
303130	010
313030	100
drop table t1;
create table t1 (a tinyint(4) zerofill);
insert into t1 values (1), (10), (100);
select hex(concat(a)), a from t1;
hex(concat(a))	a
30303031	0001
30303130	0010
30313030	0100
drop table t1;
create table t1 (a decimal(10,2));
insert into t1 values (123.45);
select hex(concat(a)) from t1;
hex(concat(a))
3132332E3435
create table t2 as select concat(a) from t1;
show create table t2;
Table	Create Table
t2	CREATE TABLE `t2` (
  `concat(a)` varchar(12) CHARACTER SET utf8mb3 COLLATE utf8mb3_general_ci DEFAULT NULL
) ENGINE=MyISAM DEFAULT CHARSET=utf8mb4 COLLATE=utf8mb4_uca1400_ai_ci
drop table t1, t2;
create table t1 (a smallint);
insert into t1 values (1);
select hex(concat(a)) from t1;
hex(concat(a))
31
create table t2 as select concat(a) from t1;
show create table t2;
Table	Create Table
t2	CREATE TABLE `t2` (
  `concat(a)` varchar(6) CHARACTER SET utf8mb3 COLLATE utf8mb3_general_ci DEFAULT NULL
) ENGINE=MyISAM DEFAULT CHARSET=utf8mb4 COLLATE=utf8mb4_uca1400_ai_ci
drop table t1, t2;
create table t1 (a smallint zerofill);
insert into t1 values (1), (10), (100), (1000), (10000);
select hex(concat(a)), a from t1;
hex(concat(a))	a
3030303031	00001
3030303130	00010
3030313030	00100
3031303030	01000
3130303030	10000
drop table t1;
create table t1 (a mediumint);
insert into t1 values (1);
select hex(concat(a)) from t1;
hex(concat(a))
31
create table t2 as select concat(a) from t1;
show create table t2;
Table	Create Table
t2	CREATE TABLE `t2` (
  `concat(a)` varchar(9) CHARACTER SET utf8mb3 COLLATE utf8mb3_general_ci DEFAULT NULL
) ENGINE=MyISAM DEFAULT CHARSET=utf8mb4 COLLATE=utf8mb4_uca1400_ai_ci
drop table t1, t2;
create table t1 (a mediumint zerofill);
insert into t1 values (1), (10), (100), (1000), (10000);
select hex(concat(a)), a from t1;
hex(concat(a))	a
3030303030303031	00000001
3030303030303130	00000010
3030303030313030	00000100
3030303031303030	00001000
3030303130303030	00010000
drop table t1;
create table t1 (a int);
insert into t1 values (1);
select hex(concat(a)) from t1;
hex(concat(a))
31
create table t2 as select concat(a) from t1;
show create table t2;
Table	Create Table
t2	CREATE TABLE `t2` (
  `concat(a)` varchar(11) CHARACTER SET utf8mb3 COLLATE utf8mb3_general_ci DEFAULT NULL
) ENGINE=MyISAM DEFAULT CHARSET=utf8mb4 COLLATE=utf8mb4_uca1400_ai_ci
drop table t1, t2;
create table t1 (a int zerofill);
insert into t1 values (1), (10), (100), (1000), (10000);
select hex(concat(a)), a from t1;
hex(concat(a))	a
30303030303030303031	0000000001
30303030303030303130	0000000010
30303030303030313030	0000000100
30303030303031303030	0000001000
30303030303130303030	0000010000
drop table t1;
create table t1 (a bigint);
insert into t1 values (1);
select hex(concat(a)) from t1;
hex(concat(a))
31
create table t2 as select concat(a) from t1;
show create table t2;
Table	Create Table
t2	CREATE TABLE `t2` (
  `concat(a)` varchar(20) CHARACTER SET utf8mb3 COLLATE utf8mb3_general_ci DEFAULT NULL
) ENGINE=MyISAM DEFAULT CHARSET=utf8mb4 COLLATE=utf8mb4_uca1400_ai_ci
drop table t1, t2;
create table t1 (a bigint zerofill);
insert into t1 values (1), (10), (100), (1000), (10000);
select hex(concat(a)), a from t1;
hex(concat(a))	a
3030303030303030303030303030303030303031	00000000000000000001
3030303030303030303030303030303030303130	00000000000000000010
3030303030303030303030303030303030313030	00000000000000000100
3030303030303030303030303030303031303030	00000000000000001000
3030303030303030303030303030303130303030	00000000000000010000
drop table t1;
create table t1 (a float);
insert into t1 values (123.456);
select hex(concat(a)) from t1;
hex(concat(a))
3132332E343536
select concat(a) from t1;
concat(a)
123.456
create table t2 as select concat(a) from t1;
show create table t2;
Table	Create Table
t2	CREATE TABLE `t2` (
  `concat(a)` varchar(12) CHARACTER SET utf8mb3 COLLATE utf8mb3_general_ci DEFAULT NULL
) ENGINE=MyISAM DEFAULT CHARSET=utf8mb4 COLLATE=utf8mb4_uca1400_ai_ci
drop table t1, t2;
create table t1 (a float zerofill);
insert into t1 values (1.1), (10.1), (100.1), (1000.1), (10000.1);
select hex(concat(a)), a from t1;
hex(concat(a))	a
303030303030303030312E31	0000000001.1
303030303030303031302E31	0000000010.1
303030303030303130302E31	0000000100.1
303030303030313030302E31	0000001000.1
303030303031303030302E31	0000010000.1
drop table t1;
create table t1 (a double);
insert into t1 values (123.456);
select hex(concat(a)) from t1;
hex(concat(a))
3132332E343536
select concat(a) from t1;
concat(a)
123.456
create table t2 as select concat(a) from t1;
show create table t2;
Table	Create Table
t2	CREATE TABLE `t2` (
  `concat(a)` varchar(22) CHARACTER SET utf8mb3 COLLATE utf8mb3_general_ci DEFAULT NULL
) ENGINE=MyISAM DEFAULT CHARSET=utf8mb4 COLLATE=utf8mb4_uca1400_ai_ci
drop table t1, t2;
create table t1 (a double zerofill);
insert into t1 values (1.1), (10.1), (100.1), (1000.1), (10000.1);
select hex(concat(a)), a from t1;
hex(concat(a))	a
30303030303030303030303030303030303030312E31	00000000000000000001.1
30303030303030303030303030303030303031302E31	00000000000000000010.1
30303030303030303030303030303030303130302E31	00000000000000000100.1
30303030303030303030303030303030313030302E31	00000000000000001000.1
30303030303030303030303030303031303030302E31	00000000000000010000.1
drop table t1;
create table t1 (a year(2));
Warnings:
Warning	1287	'YEAR(2)' is deprecated and will be removed in a future release. Please use 'YEAR(4)' instead
insert into t1 values (1);
select hex(concat(a)) from t1;
hex(concat(a))
3031
create table t2 as select concat(a) from t1;
show create table t2;
Table	Create Table
t2	CREATE TABLE `t2` (
  `concat(a)` varchar(2) CHARACTER SET utf8mb3 COLLATE utf8mb3_general_ci DEFAULT NULL
) ENGINE=MyISAM DEFAULT CHARSET=utf8mb4 COLLATE=utf8mb4_uca1400_ai_ci
drop table t1, t2;
create table t1 (a year);
insert into t1 values (1);
select hex(concat(a)) from t1;
hex(concat(a))
32303031
create table t2 as select concat(a) from t1;
show create table t2;
Table	Create Table
t2	CREATE TABLE `t2` (
  `concat(a)` varchar(4) CHARACTER SET utf8mb3 COLLATE utf8mb3_general_ci DEFAULT NULL
) ENGINE=MyISAM DEFAULT CHARSET=utf8mb4 COLLATE=utf8mb4_uca1400_ai_ci
drop table t1, t2;
create table t1 (a bit(64));
insert into t1 values (1);
select hex(concat(a)) from t1;
hex(concat(a))
0000000000000001
create table t2 as select concat(a) from t1;
show create table t2;
Table	Create Table
t2	CREATE TABLE `t2` (
  `concat(a)` varbinary(64) DEFAULT NULL
) ENGINE=MyISAM DEFAULT CHARSET=utf8mb4 COLLATE=utf8mb4_uca1400_ai_ci
drop table t1, t2;
create table t1 (a timestamp NOT NULL DEFAULT CURRENT_TIMESTAMP ON UPDATE CURRENT_TIMESTAMP);
insert into t1 values (0);
insert into t1 values (20010203040506);
insert into t1 values (19800203040506);
insert into t1 values ('2001-02-03 04:05:06');
select hex(concat(a)) from t1;
hex(concat(a))
303030302D30302D30302030303A30303A3030
323030312D30322D30332030343A30353A3036
313938302D30322D30332030343A30353A3036
323030312D30322D30332030343A30353A3036
select concat(a) from t1;
concat(a)
0000-00-00 00:00:00
2001-02-03 04:05:06
1980-02-03 04:05:06
2001-02-03 04:05:06
create table t2 as select concat(a) from t1;
show create table t2;
Table	Create Table
t2	CREATE TABLE `t2` (
  `concat(a)` varchar(19) CHARACTER SET utf8mb3 COLLATE utf8mb3_general_ci DEFAULT NULL
) ENGINE=MyISAM DEFAULT CHARSET=utf8mb4 COLLATE=utf8mb4_uca1400_ai_ci
drop table t1, t2;
create table t1 (a date);
insert into t1 values ('2001-02-03');
insert into t1 values (20010203);
select hex(concat(a)) from t1;
hex(concat(a))
323030312D30322D3033
323030312D30322D3033
create table t2 as select concat(a) from t1;
show create table t2;
Table	Create Table
t2	CREATE TABLE `t2` (
  `concat(a)` varchar(10) CHARACTER SET utf8mb3 COLLATE utf8mb3_general_ci DEFAULT NULL
) ENGINE=MyISAM DEFAULT CHARSET=utf8mb4 COLLATE=utf8mb4_uca1400_ai_ci
drop table t1, t2;
create table t1 (a time);
insert into t1 values (1);
insert into t1 values ('01:02:03');
select hex(concat(a)) from t1;
hex(concat(a))
30303A30303A3031
30313A30323A3033
select concat(a) from t1;
concat(a)
00:00:01
01:02:03
create table t2 as select concat(a) from t1;
show create table t2;
Table	Create Table
t2	CREATE TABLE `t2` (
  `concat(a)` varchar(10) CHARACTER SET utf8mb3 COLLATE utf8mb3_general_ci DEFAULT NULL
) ENGINE=MyISAM DEFAULT CHARSET=utf8mb4 COLLATE=utf8mb4_uca1400_ai_ci
drop table t1, t2;
create table t1 (a datetime);
insert into t1 values ('2001-02-03 04:05:06');
insert into t1 values (20010203040506);
select hex(concat(a)) from t1;
hex(concat(a))
323030312D30322D30332030343A30353A3036
323030312D30322D30332030343A30353A3036
create table t2 as select concat(a) from t1;
show create table t2;
Table	Create Table
t2	CREATE TABLE `t2` (
  `concat(a)` varchar(19) CHARACTER SET utf8mb3 COLLATE utf8mb3_general_ci DEFAULT NULL
) ENGINE=MyISAM DEFAULT CHARSET=utf8mb4 COLLATE=utf8mb4_uca1400_ai_ci
drop table t1, t2;
create table t1 (a tinyint);
insert into t1 values (1);
create view v1(a) as select concat(a) from t1;
show columns from v1;
Field	Type	Null	Key	Default	Extra
a	varchar(4)	YES		NULL	
select hex(a) from v1;
hex(a)
31
drop table t1;
drop view v1;
create table t1 (a tinyint zerofill);
insert into t1 values (1), (10), (100);
create view v1(a) as select concat(a) from t1;
show columns from v1;
Field	Type	Null	Key	Default	Extra
a	varchar(3)	YES		NULL	
select hex(a) from v1;
hex(a)
303031
303130
313030
drop table t1;
drop view v1;
create table t1 (a tinyint(30) zerofill);
insert into t1 values (1), (10), (100);
create view v1(a) as select concat(a) from t1;
show columns from v1;
Field	Type	Null	Key	Default	Extra
a	varchar(30)	YES		NULL	
select hex(a) from v1;
hex(a)
303030303030303030303030303030303030303030303030303030303031
303030303030303030303030303030303030303030303030303030303130
303030303030303030303030303030303030303030303030303030313030
drop table t1;
drop view v1;
create table t1 (a decimal(10,2));
insert into t1 values (123.45);
create view v1(a) as select concat(a) from t1;
show columns from v1;
Field	Type	Null	Key	Default	Extra
a	varchar(12)	YES		NULL	
select hex(a) from v1;
hex(a)
3132332E3435
drop table t1;
drop view v1;
create table t1 (a smallint);
insert into t1 values (1);
create view v1(a) as select concat(a) from t1;
show columns from v1;
Field	Type	Null	Key	Default	Extra
a	varchar(6)	YES		NULL	
select hex(a) from v1;
hex(a)
31
drop table t1;
drop view v1;
create table t1 (a smallint zerofill);
insert into t1 values (1), (10), (100), (1000), (10000);
create view v1(a) as select concat(a) from t1;
show columns from v1;
Field	Type	Null	Key	Default	Extra
a	varchar(5)	YES		NULL	
select hex(a) from v1;
hex(a)
3030303031
3030303130
3030313030
3031303030
3130303030
drop table t1;
drop view v1;
create table t1 (a mediumint);
insert into t1 values (1);
create view v1(a) as select concat(a) from t1;
show columns from v1;
Field	Type	Null	Key	Default	Extra
a	varchar(9)	YES		NULL	
select hex(a) from v1;
hex(a)
31
drop table t1;
drop view v1;
create table t1 (a mediumint zerofill);
insert into t1 values (1), (10), (100), (1000), (10000);
create view v1(a) as select concat(a) from t1;
show columns from v1;
Field	Type	Null	Key	Default	Extra
a	varchar(8)	YES		NULL	
select hex(a) from v1;
hex(a)
3030303030303031
3030303030303130
3030303030313030
3030303031303030
3030303130303030
drop table t1;
drop view v1;
create table t1 (a int);
insert into t1 values (1);
create view v1(a) as select concat(a) from t1;
show columns from v1;
Field	Type	Null	Key	Default	Extra
a	varchar(11)	YES		NULL	
select hex(a) from v1;
hex(a)
31
drop table t1;
drop view v1;
create table t1 (a int zerofill);
insert into t1 values (1), (10), (100), (1000), (10000);
create view v1(a) as select concat(a) from t1;
show columns from v1;
Field	Type	Null	Key	Default	Extra
a	varchar(10)	YES		NULL	
select hex(a) from v1;
hex(a)
30303030303030303031
30303030303030303130
30303030303030313030
30303030303031303030
30303030303130303030
drop table t1;
drop view v1;
create table t1 (a bigint);
insert into t1 values (1);
create view v1(a) as select concat(a) from t1;
show columns from v1;
Field	Type	Null	Key	Default	Extra
a	varchar(20)	YES		NULL	
select hex(a) from v1;
hex(a)
31
drop table t1;
drop view v1;
create table t1 (a bigint zerofill);
insert into t1 values (1), (10), (100), (1000), (10000);
create view v1(a) as select concat(a) from t1;
show columns from v1;
Field	Type	Null	Key	Default	Extra
a	varchar(20)	YES		NULL	
select hex(a) from v1;
hex(a)
3030303030303030303030303030303030303031
3030303030303030303030303030303030303130
3030303030303030303030303030303030313030
3030303030303030303030303030303031303030
3030303030303030303030303030303130303030
drop table t1;
drop view v1;
create table t1 (a float);
insert into t1 values (123.456);
create view v1(a) as select concat(a) from t1;
show columns from v1;
Field	Type	Null	Key	Default	Extra
a	varchar(12)	YES		NULL	
select hex(a) from v1;
hex(a)
3132332E343536
drop table t1;
drop view v1;
create table t1 (a float zerofill);
insert into t1 values (1.1), (10.1), (100.1), (1000.1), (10000.1);
create view v1(a) as select concat(a) from t1;
show columns from v1;
Field	Type	Null	Key	Default	Extra
a	varchar(12)	YES		NULL	
select hex(a) from v1;
hex(a)
303030303030303030312E31
303030303030303031302E31
303030303030303130302E31
303030303030313030302E31
303030303031303030302E31
drop table t1;
drop view v1;
create table t1 (a double);
insert into t1 values (123.456);
select concat(a) from t1;
concat(a)
123.456
create view v1(a) as select concat(a) from t1;
show columns from v1;
Field	Type	Null	Key	Default	Extra
a	varchar(22)	YES		NULL	
select hex(a) from v1;
hex(a)
3132332E343536
drop table t1;
drop view v1;
create table t1 (a double zerofill);
insert into t1 values (1.1), (10.1), (100.1), (1000.1), (10000.1);
create view v1(a) as select concat(a) from t1;
show columns from v1;
Field	Type	Null	Key	Default	Extra
a	varchar(22)	YES		NULL	
select hex(a) from v1;
hex(a)
30303030303030303030303030303030303030312E31
30303030303030303030303030303030303031302E31
30303030303030303030303030303030303130302E31
30303030303030303030303030303030313030302E31
30303030303030303030303030303031303030302E31
drop table t1;
drop view v1;
create table t1 (a year(2));
Warnings:
Warning	1287	'YEAR(2)' is deprecated and will be removed in a future release. Please use 'YEAR(4)' instead
insert into t1 values (1);
create view v1(a) as select concat(a) from t1;
show columns from v1;
Field	Type	Null	Key	Default	Extra
a	varchar(2)	YES		NULL	
select hex(a) from v1;
hex(a)
3031
drop table t1;
drop view v1;
create table t1 (a year);
insert into t1 values (1);
create view v1(a) as select concat(a) from t1;
show columns from v1;
Field	Type	Null	Key	Default	Extra
a	varchar(4)	YES		NULL	
select hex(a) from v1;
hex(a)
32303031
drop table t1;
drop view v1;
create table t1 (a bit(64));
insert into t1 values (1);
create view v1(a) as select concat(a) from t1;
show columns from v1;
Field	Type	Null	Key	Default	Extra
a	varbinary(64)	YES		NULL	
select hex(a) from v1;
hex(a)
0000000000000001
drop table t1;
drop view v1;
create table t1 (a timestamp NOT NULL DEFAULT CURRENT_TIMESTAMP ON UPDATE CURRENT_TIMESTAMP);
insert into t1 values (0);
insert into t1 values (20010203040506);
insert into t1 values (19800203040506);
insert into t1 values ('2001-02-03 04:05:06');
create view v1(a) as select concat(a) from t1;
show columns from v1;
Field	Type	Null	Key	Default	Extra
a	varchar(19)	YES		NULL	
select hex(a) from v1;
hex(a)
303030302D30302D30302030303A30303A3030
323030312D30322D30332030343A30353A3036
313938302D30322D30332030343A30353A3036
323030312D30322D30332030343A30353A3036
drop table t1;
drop view v1;
create table t1 (a date);
insert into t1 values ('2001-02-03');
insert into t1 values (20010203);
create view v1(a) as select concat(a) from t1;
show columns from v1;
Field	Type	Null	Key	Default	Extra
a	varchar(10)	YES		NULL	
select hex(a) from v1;
hex(a)
323030312D30322D3033
323030312D30322D3033
drop table t1;
drop view v1;
create table t1 (a time);
insert into t1 values (1);
insert into t1 values ('01:02:03');
create view v1(a) as select concat(a) from t1;
show columns from v1;
Field	Type	Null	Key	Default	Extra
a	varchar(10)	YES		NULL	
select hex(a) from v1;
hex(a)
30303A30303A3031
30313A30323A3033
drop table t1;
drop view v1;
create table t1 (a datetime);
insert into t1 values ('2001-02-03 04:05:06');
insert into t1 values (20010203040506);
create view v1(a) as select concat(a) from t1;
show columns from v1;
Field	Type	Null	Key	Default	Extra
a	varchar(19)	YES		NULL	
select hex(a) from v1;
hex(a)
323030312D30322D30332030343A30353A3036
323030312D30322D30332030343A30353A3036
drop table t1;
drop view v1;
create function f1 (par1 int) returns int
begin
return concat(par1);
end|
set @a= f1(1);
select hex(@a);
hex(@a)
1
select hex(concat(f1(1)));
hex(concat(f1(1)))
31
create table t1 as select f1(1) as c1;
show create table t1;
Table	Create Table
t1	CREATE TABLE `t1` (
  `c1` int(11) DEFAULT NULL
) ENGINE=MyISAM DEFAULT CHARSET=utf8mb4 COLLATE=utf8mb4_uca1400_ai_ci
drop table t1;
create table t1 as select concat(f1(1)) as c1;
show create table t1;
Table	Create Table
t1	CREATE TABLE `t1` (
  `c1` varchar(11) CHARACTER SET latin1 COLLATE latin1_swedish_ci DEFAULT NULL
) ENGINE=MyISAM DEFAULT CHARSET=utf8mb4 COLLATE=utf8mb4_uca1400_ai_ci
create view v1 as select concat(f1(1)) as c1;
show columns from v1;
Field	Type	Null	Key	Default	Extra
c1	varchar(11)	YES		NULL	
drop table t1;
drop view v1;
drop function f1;
create function f1 (par1 decimal(18,2)) returns decimal(18,2)
begin
return concat(par1);
end|
set @a= f1(123.45);
select hex(@a);
hex(@a)
7B
select hex(concat(f1(123.45)));
hex(concat(f1(123.45)))
3132332E3435
create table t1 as select f1(123.45) as c1;
show create table t1;
Table	Create Table
t1	CREATE TABLE `t1` (
  `c1` decimal(18,2) DEFAULT NULL
) ENGINE=MyISAM DEFAULT CHARSET=utf8mb4 COLLATE=utf8mb4_uca1400_ai_ci
drop table t1;
create table t1 as select concat(f1(123.45)) as c1;
show create table t1;
Table	Create Table
t1	CREATE TABLE `t1` (
  `c1` varchar(20) CHARACTER SET latin1 COLLATE latin1_swedish_ci DEFAULT NULL
) ENGINE=MyISAM DEFAULT CHARSET=utf8mb4 COLLATE=utf8mb4_uca1400_ai_ci
create view v1 as select concat(f1(123.45)) as c1;
show columns from v1;
Field	Type	Null	Key	Default	Extra
c1	varchar(20)	YES		NULL	
drop table t1;
drop view v1;
drop function f1;
create function f1 (par1 float) returns float
begin
return concat(par1);
end|
set @a= f1(123.45);
select hex(@a);
hex(@a)
7B
select hex(concat(f1(123.45)));
hex(concat(f1(123.45)))
3132332E3435
create table t1 as select f1(123.45) as c1;
show create table t1;
Table	Create Table
t1	CREATE TABLE `t1` (
  `c1` float DEFAULT NULL
) ENGINE=MyISAM DEFAULT CHARSET=utf8mb4 COLLATE=utf8mb4_uca1400_ai_ci
drop table t1;
create table t1 as select concat(f1(123.45)) as c1;
show create table t1;
Table	Create Table
t1	CREATE TABLE `t1` (
  `c1` varchar(12) CHARACTER SET latin1 COLLATE latin1_swedish_ci DEFAULT NULL
) ENGINE=MyISAM DEFAULT CHARSET=utf8mb4 COLLATE=utf8mb4_uca1400_ai_ci
create view v1 as select concat(f1(123.45)) as c1;
show columns from v1;
Field	Type	Null	Key	Default	Extra
c1	varchar(12)	YES		NULL	
drop table t1;
drop view v1;
drop function f1;
create function f1 (par1 date) returns date
begin
return concat(par1);
end|
set @a= f1(cast('2001-01-02' as date));
select hex(@a);
hex(@a)
323030312D30312D3032
select hex(concat(f1(cast('2001-01-02' as date))));
hex(concat(f1(cast('2001-01-02' as date))))
323030312D30312D3032
create table t1 as select f1(cast('2001-01-02' as date)) as c1;
show create table t1;
Table	Create Table
t1	CREATE TABLE `t1` (
  `c1` date DEFAULT NULL
) ENGINE=MyISAM DEFAULT CHARSET=utf8mb4 COLLATE=utf8mb4_uca1400_ai_ci
drop table t1;
create table t1 as select concat(f1(cast('2001-01-02' as date))) as c1;
show create table t1;
Table	Create Table
t1	CREATE TABLE `t1` (
  `c1` varchar(10) CHARACTER SET latin1 COLLATE latin1_swedish_ci DEFAULT NULL
) ENGINE=MyISAM DEFAULT CHARSET=utf8mb4 COLLATE=utf8mb4_uca1400_ai_ci
create view v1 as select concat(f1(cast('2001-01-02' as date))) as c1;
show columns from v1;
Field	Type	Null	Key	Default	Extra
c1	varchar(10)	YES		NULL	
drop table t1;
drop view v1;
drop function f1;
#
# End of WL#2649 Number-to-string conversions
#
#
# Bug#54668 User variable assignments get wrong type
#
SET @x=md5('a');
SELECT charset(@x), collation(@x);
charset(@x)	collation(@x)
utf8mb3	utf8mb3_general_ci
SET @x=old_password('a');
SELECT charset(@x), collation(@x);
charset(@x)	collation(@x)
utf8mb3	utf8mb3_general_ci
SET @x=password('a');
SELECT charset(@x), collation(@x);
charset(@x)	collation(@x)
utf8mb3	utf8mb3_general_ci
SET @x=sha('a');
SELECT charset(@x), collation(@x);
charset(@x)	collation(@x)
utf8mb3	utf8mb3_general_ci
SET @x=sha1('a');
SELECT charset(@x), collation(@x);
charset(@x)	collation(@x)
utf8mb3	utf8mb3_general_ci
SET @x=astext(point(1,2));
SELECT charset(@x), collation(@x);
charset(@x)	collation(@x)
utf8mb3	utf8mb3_general_ci
SET @x=aswkt(point(1,2));
SELECT charset(@x), collation(@x);
charset(@x)	collation(@x)
utf8mb3	utf8mb3_general_ci
#
# Bug#54916 GROUP_CONCAT + IFNULL truncates output
#
SELECT @@collation_connection;
@@collation_connection
utf8mb3_general_ci
CREATE TABLE t1 (a MEDIUMINT NULL) ENGINE=MYISAM;
INSERT INTO t1 VALUES (1234567);
SELECT GROUP_CONCAT(IFNULL(a,'')) FROM t1;
GROUP_CONCAT(IFNULL(a,''))
1234567
SELECT GROUP_CONCAT(IF(a,a,'')) FROM t1;
GROUP_CONCAT(IF(a,a,''))
1234567
SELECT GROUP_CONCAT(CASE WHEN a THEN a ELSE '' END) FROM t1;
GROUP_CONCAT(CASE WHEN a THEN a ELSE '' END)
1234567
SELECT COALESCE(a,'') FROM t1 GROUP BY 1;
Catalog	Database	Table	Table_alias	Column	Column_alias	Type	Length	Max length	Is_null	Flags	Decimals	Charsetnr
def					COALESCE(a,'')	253	27	7	N	1	39	33
COALESCE(a,'')
1234567
# All columns must be VARCHAR(9) with the same length:
CREATE TABLE t2 AS
SELECT
CONCAT(a),
IFNULL(a,''),
IF(a,a,''),
CASE WHEN a THEN a ELSE '' END,
COALESCE(a,'')
FROM t1;
SHOW CREATE TABLE t2;
Table	Create Table
t2	CREATE TABLE `t2` (
  `CONCAT(a)` varchar(9) CHARACTER SET utf8mb3 COLLATE utf8mb3_general_ci DEFAULT NULL,
  `IFNULL(a,'')` varchar(9) CHARACTER SET utf8mb3 COLLATE utf8mb3_general_ci NOT NULL,
  `IF(a,a,'')` varchar(9) CHARACTER SET utf8mb3 COLLATE utf8mb3_general_ci DEFAULT NULL,
  `CASE WHEN a THEN a ELSE '' END` varchar(9) CHARACTER SET utf8mb3 COLLATE utf8mb3_general_ci DEFAULT NULL,
  `COALESCE(a,'')` varchar(9) CHARACTER SET utf8mb3 COLLATE utf8mb3_general_ci NOT NULL
) ENGINE=MyISAM DEFAULT CHARSET=utf8mb4 COLLATE=utf8mb4_uca1400_ai_ci
DROP TABLE t2;
CREATE TABLE t2 AS SELECT CONCAT_WS(1,2,3) FROM t1;
SHOW CREATE TABLE t2;
Table	Create Table
t2	CREATE TABLE `t2` (
  `CONCAT_WS(1,2,3)` varchar(3) CHARACTER SET utf8mb3 COLLATE utf8mb3_general_ci DEFAULT NULL
) ENGINE=MyISAM DEFAULT CHARSET=utf8mb4 COLLATE=utf8mb4_uca1400_ai_ci
DROP TABLE t2;
CREATE TABLE t2 AS SELECT INSERT(1133,3,0,22) FROM t1;
SHOW CREATE TABLE t2;
Table	Create Table
t2	CREATE TABLE `t2` (
  `INSERT(1133,3,0,22)` varchar(6) CHARACTER SET utf8mb3 COLLATE utf8mb3_general_ci DEFAULT NULL
) ENGINE=MyISAM DEFAULT CHARSET=utf8mb4 COLLATE=utf8mb4_uca1400_ai_ci
DROP TABLE t2;
CREATE TABLE t2 AS SELECT LCASE(a) FROM t1;
SHOW CREATE TABLE t2;
Table	Create Table
t2	CREATE TABLE `t2` (
  `LCASE(a)` varchar(9) CHARACTER SET utf8mb3 COLLATE utf8mb3_general_ci DEFAULT NULL
) ENGINE=MyISAM DEFAULT CHARSET=utf8mb4 COLLATE=utf8mb4_uca1400_ai_ci
DROP TABLE t2;
CREATE TABLE t2 AS SELECT UCASE(a) FROM t1;
SHOW CREATE TABLE t2;
Table	Create Table
t2	CREATE TABLE `t2` (
  `UCASE(a)` varchar(9) CHARACTER SET utf8mb3 COLLATE utf8mb3_general_ci DEFAULT NULL
) ENGINE=MyISAM DEFAULT CHARSET=utf8mb4 COLLATE=utf8mb4_uca1400_ai_ci
DROP TABLE t2;
CREATE TABLE t2 AS SELECT REPEAT(1,2) FROM t1;
SHOW CREATE TABLE t2;
Table	Create Table
t2	CREATE TABLE `t2` (
  `REPEAT(1,2)` varchar(2) CHARACTER SET utf8mb3 COLLATE utf8mb3_general_ci DEFAULT NULL
) ENGINE=MyISAM DEFAULT CHARSET=utf8mb4 COLLATE=utf8mb4_uca1400_ai_ci
DROP TABLE t2;
CREATE TABLE t2 AS SELECT LEFT(123,2) FROM t1;
SHOW CREATE TABLE t2;
Table	Create Table
t2	CREATE TABLE `t2` (
  `LEFT(123,2)` varchar(2) CHARACTER SET utf8mb3 COLLATE utf8mb3_general_ci DEFAULT NULL
) ENGINE=MyISAM DEFAULT CHARSET=utf8mb4 COLLATE=utf8mb4_uca1400_ai_ci
DROP TABLE t2;
CREATE TABLE t2 AS SELECT RIGHT(123,2) FROM t1;
SHOW CREATE TABLE t2;
Table	Create Table
t2	CREATE TABLE `t2` (
  `RIGHT(123,2)` varchar(2) CHARACTER SET utf8mb3 COLLATE utf8mb3_general_ci DEFAULT NULL
) ENGINE=MyISAM DEFAULT CHARSET=utf8mb4 COLLATE=utf8mb4_uca1400_ai_ci
DROP TABLE t2;
CREATE TABLE t2 AS SELECT LTRIM(123) FROM t1;
SHOW CREATE TABLE t2;
Table	Create Table
t2	CREATE TABLE `t2` (
  `LTRIM(123)` varchar(3) CHARACTER SET utf8mb3 COLLATE utf8mb3_general_ci DEFAULT NULL
) ENGINE=MyISAM DEFAULT CHARSET=utf8mb4 COLLATE=utf8mb4_uca1400_ai_ci
DROP TABLE t2;
CREATE TABLE t2 AS SELECT RTRIM(123) FROM t1;
SHOW CREATE TABLE t2;
Table	Create Table
t2	CREATE TABLE `t2` (
  `RTRIM(123)` varchar(3) CHARACTER SET utf8mb3 COLLATE utf8mb3_general_ci DEFAULT NULL
) ENGINE=MyISAM DEFAULT CHARSET=utf8mb4 COLLATE=utf8mb4_uca1400_ai_ci
DROP TABLE t2;
CREATE TABLE t2 AS SELECT ELT(1,111,222,333) FROM t1;
SHOW CREATE TABLE t2;
Table	Create Table
t2	CREATE TABLE `t2` (
  `ELT(1,111,222,333)` varchar(3) CHARACTER SET utf8mb3 COLLATE utf8mb3_general_ci DEFAULT NULL
) ENGINE=MyISAM DEFAULT CHARSET=utf8mb4 COLLATE=utf8mb4_uca1400_ai_ci
DROP TABLE t2;
CREATE TABLE t2 AS SELECT REPLACE(111,2,3) FROM t1;
SHOW CREATE TABLE t2;
Table	Create Table
t2	CREATE TABLE `t2` (
  `REPLACE(111,2,3)` varchar(3) CHARACTER SET utf8mb3 COLLATE utf8mb3_general_ci DEFAULT NULL
) ENGINE=MyISAM DEFAULT CHARSET=utf8mb4 COLLATE=utf8mb4_uca1400_ai_ci
DROP TABLE t2;
CREATE TABLE t2 AS SELECT SUBSTRING_INDEX(111,111,1) FROM t1;
SHOW CREATE TABLE t2;
Table	Create Table
t2	CREATE TABLE `t2` (
  `SUBSTRING_INDEX(111,111,1)` varchar(3) CHARACTER SET utf8mb3 COLLATE utf8mb3_general_ci DEFAULT NULL
) ENGINE=MyISAM DEFAULT CHARSET=utf8mb4 COLLATE=utf8mb4_uca1400_ai_ci
DROP TABLE t2;
CREATE TABLE t2 AS SELECT MAKE_SET(111,222,3) FROM t1;
SHOW CREATE TABLE t2;
Table	Create Table
t2	CREATE TABLE `t2` (
  `MAKE_SET(111,222,3)` varchar(5) CHARACTER SET utf8mb3 COLLATE utf8mb3_general_ci DEFAULT NULL
) ENGINE=MyISAM DEFAULT CHARSET=utf8mb4 COLLATE=utf8mb4_uca1400_ai_ci
DROP TABLE t2;
CREATE TABLE t2 AS SELECT SOUNDEX(1) FROM t1;
SHOW CREATE TABLE t2;
Table	Create Table
t2	CREATE TABLE `t2` (
  `SOUNDEX(1)` varchar(4) CHARACTER SET utf8mb3 COLLATE utf8mb3_general_ci DEFAULT NULL
) ENGINE=MyISAM DEFAULT CHARSET=utf8mb4 COLLATE=utf8mb4_uca1400_ai_ci
DROP TABLE t2;
CREATE TABLE t2 AS SELECT EXPORT_SET(1,'Y','N','',8);
SHOW CREATE TABLE t2;
Table	Create Table
t2	CREATE TABLE `t2` (
  `EXPORT_SET(1,'Y','N','',8)` varchar(64) CHARACTER SET utf8mb3 COLLATE utf8mb3_general_ci DEFAULT NULL
) ENGINE=MyISAM DEFAULT CHARSET=utf8mb4 COLLATE=utf8mb4_uca1400_ai_ci
DROP TABLE t2;
DROP TABLE t1;
#
# End of Bug#54916
#
#
# Bug#58190 BETWEEN no longer uses indexes for date or datetime fields
#
SELECT @@collation_connection;
@@collation_connection
utf8mb3_general_ci
CREATE TABLE t1 (
id INT(11) DEFAULT NULL,
date_column DATE DEFAULT NULL,
KEY(date_column));
INSERT INTO t1 VALUES (1,'2010-09-01'),(2,'2010-10-01');
INSERT INTO t1 VALUES (3,'2012-09-01'),(4,'2012-10-01'),(5,'2012-10-01');
EXPLAIN SELECT * FROM t1 WHERE date_column BETWEEN '2010-09-01' AND '2010-10-01';
id	select_type	table	type	possible_keys	key	key_len	ref	rows	Extra
1	SIMPLE	t1	range	date_column	date_column	4	NULL	2	Using index condition
ALTER TABLE t1 MODIFY date_column DATETIME DEFAULT NULL;
EXPLAIN SELECT * FROM t1 WHERE date_column BETWEEN '2010-09-01' AND '2010-10-01';
id	select_type	table	type	possible_keys	key	key_len	ref	rows	Extra
1	SIMPLE	t1	range	date_column	date_column	6	NULL	2	Using index condition
DROP TABLE t1;
#
# Bug #31384 	DATE_ADD() and DATE_SUB() return binary data
#
SELECT @@collation_connection, @@character_set_results;
@@collation_connection	@@character_set_results
utf8mb3_general_ci	utf8mb3
SELECT
CHARSET(DATE_SUB('2007-08-03', INTERVAL 1 MINUTE)) AS field_str1,
CHARSET(DATE_SUB('2007-08-03 17:33:00', INTERVAL 1 MINUTE)) AS field_str2,
CHARSET(DATE_SUB(DATE('2007-08-03'), INTERVAL 1 DAY)) AS field_date,
CHARSET(DATE_SUB(CAST('2007-08-03 17:33:00' AS DATETIME), INTERVAL 1 MINUTE)) AS field_datetime;
field_str1	field_str2	field_date	field_datetime
utf8mb3	utf8mb3	binary	binary
CREATE TABLE t1 AS
SELECT
DATE_SUB('2007-08-03', INTERVAL 1 MINUTE) AS field_str1,
DATE_SUB('2007-08-03 17:33:00', INTERVAL 1 MINUTE) AS field1_str2,
DATE_SUB(DATE('2007-08-03'), INTERVAL 1 DAY) AS field_date,
DATE_SUB(CAST('2007-08-03 17:33:00' AS DATETIME), INTERVAL 1 MINUTE) AS field_datetime;
SHOW CREATE TABLE t1;
Table	Create Table
t1	CREATE TABLE `t1` (
  `field_str1` varchar(19) CHARACTER SET utf8mb3 COLLATE utf8mb3_general_ci DEFAULT NULL,
  `field1_str2` varchar(19) CHARACTER SET utf8mb3 COLLATE utf8mb3_general_ci DEFAULT NULL,
  `field_date` date DEFAULT NULL,
  `field_datetime` datetime DEFAULT NULL
) ENGINE=MyISAM DEFAULT CHARSET=utf8mb4 COLLATE=utf8mb4_uca1400_ai_ci
DROP TABLE t1;
SELECT
DATE_SUB('2007-08-03', INTERVAL 1 DAY) AS field_str1,
DATE_SUB('2007-08-03 17:33:00', INTERVAL 1 MINUTE) AS field1_str2,
DATE_SUB(DATE('2007-08-03'), INTERVAL 1 DAY) AS field_date,
DATE_SUB(CAST('2007-08-03 17:33:00' AS DATETIME), INTERVAL 1 MINUTE) AS field_datetime;
Catalog	Database	Table	Table_alias	Column	Column_alias	Type	Length	Max length	Is_null	Flags	Decimals	Charsetnr
def					field_str1	254	57	10	Y	0	0	33
def					field1_str2	254	57	19	Y	0	0	33
def					field_date	10	10	10	Y	128	0	63
def					field_datetime	12	19	19	Y	128	0	63
field_str1	field1_str2	field_date	field_datetime
2007-08-02	2007-08-03 17:32:00	2007-08-02	2007-08-03 17:32:00
SELECT
HEX(DATE_SUB('2007-08-03', INTERVAL 1 MINUTE)) AS field_str1,
HEX(DATE_SUB('2007-08-03 17:33:00', INTERVAL 1 MINUTE)) AS field1_str2,
HEX(DATE_SUB(DATE('2007-08-03'), INTERVAL 1 DAY)) AS field_date,
HEX(DATE_SUB(CAST('2007-08-03 17:33:00' AS DATETIME), INTERVAL 1 MINUTE)) AS field_datetime;
field_str1	field1_str2	field_date	field_datetime
323030372D30382D30322032333A35393A3030	323030372D30382D30332031373A33323A3030	323030372D30382D3032	323030372D30382D30332031373A33323A3030
#
# MDEV-4841 Wrong character set of ADDTIME() and DATE_ADD()
#
SELECT @@collation_connection, @@character_set_results;
@@collation_connection	@@character_set_results
utf8mb3_general_ci	utf8mb3
SELECT
CHARSET(ADDTIME(_latin1'10:01:01',_latin1'10:00:00')) AS addtime1,
CHARSET(ADDTIME('10:01:01','10:00:00')) AS addtime2,
CHARSET(DATE_ADD(_latin1'2001-01-01 10:01:01',interval 10 second)) AS date_add1,
CHARSET(DATE_ADD('2001-01-01 10:01:01',interval 10 second)) AS date_add2;
addtime1	addtime2	date_add1	date_add2
utf8mb3	utf8mb3	utf8mb3	utf8mb3
CREATE TABLE t1 AS
SELECT
ADDTIME(_latin1'10:01:01',_latin1'10:00:00') AS addtime1,
ADDTIME('10:01:01','10:00:00') AS addtime2,
DATE_ADD(_latin1'2001-01-01 10:01:01',interval 10 second) AS date_add1,
DATE_ADD('2001-01-01 10:01:01',interval 10 second) AS date_add2;
SHOW CREATE TABLE t1;
Table	Create Table
t1	CREATE TABLE `t1` (
  `addtime1` varchar(26) CHARACTER SET utf8mb3 COLLATE utf8mb3_general_ci DEFAULT NULL,
  `addtime2` varchar(26) CHARACTER SET utf8mb3 COLLATE utf8mb3_general_ci DEFAULT NULL,
  `date_add1` varchar(19) CHARACTER SET utf8mb3 COLLATE utf8mb3_general_ci DEFAULT NULL,
  `date_add2` varchar(19) CHARACTER SET utf8mb3 COLLATE utf8mb3_general_ci DEFAULT NULL
) ENGINE=MyISAM DEFAULT CHARSET=utf8mb4 COLLATE=utf8mb4_uca1400_ai_ci
SELECT * FROM t1;
addtime1	addtime2	date_add1	date_add2
20:01:01	20:01:01	2001-01-01 10:01:11	2001-01-01 10:01:11
DROP TABLE t1;
#
# Bug#11926811 / Bug#60625 Illegal mix of collations
#
SELECT @@collation_connection;
@@collation_connection
utf8mb3_general_ci
CREATE PROCEDURE p1()
BEGIN
DECLARE v_LastPaymentDate DATETIME DEFAULT NULL;
SELECT v_LastPaymentDate < NOW();
EXPLAIN EXTENDED SELECT v_LastPaymentDate < NOW();
SHOW WARNINGS;
EXPLAIN EXTENDED SELECT CONCAT(v_LastPaymentDate, NOW());
END//
CALL p1;
v_LastPaymentDate < NOW()
NULL
id	select_type	table	type	possible_keys	key	key_len	ref	rows	filtered	Extra
1	SIMPLE	NULL	NULL	NULL	NULL	NULL	NULL	NULL	NULL	No tables used
Level	Code	Message
Note	1003	select v_LastPaymentDate@0 < current_timestamp() AS `v_LastPaymentDate < NOW()`
id	select_type	table	type	possible_keys	key	key_len	ref	rows	filtered	Extra
1	SIMPLE	NULL	NULL	NULL	NULL	NULL	NULL	NULL	NULL	No tables used
Warnings:
Note	1003	select concat(convert(v_LastPaymentDate@0 using utf8mb3),current_timestamp()) AS `CONCAT(v_LastPaymentDate, NOW())`
DROP PROCEDURE p1;
#
# Bug#52159 returning time type from function and empty left join causes debug assertion
#
CREATE FUNCTION f1() RETURNS TIME RETURN 1;
CREATE TABLE t1 (b INT);
INSERT INTO t1 VALUES (0);
SELECT f1() FROM t1 LEFT JOIN (SELECT 1 AS a FROM t1 LIMIT 0) AS d ON 1 GROUP BY a;
f1()
00:00:01
DROP FUNCTION f1;
DROP TABLE t1;
#
# MDEV-9662 Assertion `precision || !scale' failed in my_decimal_precision_to_length_no_truncation(uint, uint8, bool)
#
SELECT @@collation_connection;
@@collation_connection
utf8mb3_general_ci
SELECT CASE 1 WHEN 2 THEN ( - '3' ) END;
CASE 1 WHEN 2 THEN ( - '3' ) END
NULL
#
# MDEV-5702 Incorrect results are returned with NULLIF()
#
CREATE TABLE t1 (d DATE);
INSERT INTO t1 VALUES ('1999-11-11'),('2014-02-04');
SELECT DISTINCT d, CAST(d AS CHAR), NULLIF(d,"2000-01-01") AS bad, NULLIF(CAST(d AS CHAR),"2000-01-01") AS good FROM t1;
d	CAST(d AS CHAR)	bad	good
1999-11-11	1999-11-11	1999-11-11	1999-11-11
2014-02-04	2014-02-04	2014-02-04	2014-02-04
CREATE TABLE t2 AS SELECT DISTINCT d, NULLIF(d,'2000-01-01') AS bad FROM t1;
SHOW CREATE TABLE t2;
Table	Create Table
t2	CREATE TABLE `t2` (
  `d` date DEFAULT NULL,
  `bad` date DEFAULT NULL
) ENGINE=MyISAM DEFAULT CHARSET=utf8mb4 COLLATE=utf8mb4_uca1400_ai_ci
DROP TABLE t1, t2;
SET NAMES latin1;
SET sql_mode='';
CREATE TABLE t1(a char(215) CHARACTER SET utf8 NOT NULL DEFAULT '', KEY(a));
INSERT INTO t1 VALUES ();
SELECT maketime(`a`,`a`,`a`) FROM t1 GROUP BY 1;
maketime(`a`,`a`,`a`)
00:00:00.000000
DROP TABLE t1;
SET sql_mode=default;
#
# Bug#57687 crash when reporting duplicate group_key error and utf8
# Bug#58081 Duplicate entry error when doing GROUP BY
# MDEV-9332 Bug after upgrade to 10.1.10
#
SET NAMES utf8;
CREATE TABLE t1 (a INT);
INSERT INTO t1 VALUES (0), (0), (1), (0), (0);
SELECT COUNT(*) FROM t1, t1 t2
GROUP BY INSERT('', t2.a, t1.a, (@@global.max_binlog_size));
COUNT(*)
25
DROP TABLE t1;
#
# Bug#11764503 (Bug#57341) Query in EXPLAIN EXTENDED shows wrong characters
#
# Emulate utf8 client erroneously started with --default-character-set=latin1,
# # as in the bug report. EXPLAIN output should still be pretty readable
SET NAMES latin1;
EXPLAIN EXTENDED SELECT 'abcdÁÂÃÄÅ', _latin1'abcdÁÂÃÄÅ', _utf8'abcdÁÂÃÄÅ' AS u;
id	select_type	table	type	possible_keys	key	key_len	ref	rows	filtered	Extra
1	SIMPLE	NULL	NULL	NULL	NULL	NULL	NULL	NULL	NULL	No tables used
Warnings:
Note	1003	select 'abcd�\0081ÂÃÄÅ' AS `abcd�\0081ÂÃÄÅ`,_latin1'abcd\xC3\x81\xC3\x82\xC3\x83\xC3\x84\xC3\x85' AS `abcd�\0081ÂÃÄÅ`,_utf8mb3'abcd\xC3\x81\xC3\x82\xC3\x83\xC3\x84\xC3\x85' AS `u`
# Test normal utf8
SET NAMES utf8;
EXPLAIN EXTENDED SELECT 'abcdÁÂÃÄÅ', _latin1'abcdÁÂÃÄÅ', _utf8'abcdÁÂÃÄÅ';
id	select_type	table	type	possible_keys	key	key_len	ref	rows	filtered	Extra
1	SIMPLE	NULL	NULL	NULL	NULL	NULL	NULL	NULL	NULL	No tables used
Warnings:
Note	1003	select 'abcdÁÂÃÄÅ' AS `abcdÁÂÃÄÅ`,_latin1'abcd\xC3\x81\xC3\x82\xC3\x83\xC3\x84\xC3\x85' AS `abcdÃ\0081Ã‚ÃƒÃ„Ã…`,_utf8mb3'abcd\xC3\x81\xC3\x82\xC3\x83\xC3\x84\xC3\x85' AS `abcdÁÂÃÄÅ`
#
# Bug#11750518 41090: ORDER BY TRUNCATES GROUP_CONCAT RESULT
#
SET NAMES utf8;
SELECT id, CHAR_LENGTH(GROUP_CONCAT(body)) AS l
FROM (SELECT 'a' AS id, REPEAT('foo bar', 100) AS body
UNION ALL
SELECT 'a' AS id, REPEAT('bla bla', 100) AS body) t1
GROUP BY id
ORDER BY l DESC;
id	l
a	1401
SELECT id, CHAR_LENGTH(GROUP_CONCAT(body)) AS l
FROM (SELECT 'a' AS id, REPEAT('foo bar', 100) AS body
UNION ALL
SELECT 'a' AS id, REPEAT('bla bla', 100) AS body) t1;
id	l
a	1401
#
# MDEV-7814 Assertion `args[0]->fixed' fails in Item_func_conv_charset::Item_func_conv_charset
#
CREATE TABLE t1(a CHAR(1) CHARACTER SET latin1, b INT NOT NULL);
CREATE TABLE t2(a CHAR(1) CHARACTER SET utf8 COLLATE utf8_general_ci, b INT NOT NULL);
SELECT (SELECT t2.a FROM t2 WHERE t2.a=t1.a) AS aa, b, COUNT(b) FROM t1 GROUP BY aa;
aa	b	COUNT(b)
DROP TABLE t1,t2;
#
# MDEV-7649 wrong result when comparing utf8 column with an invalid literal
#
SET NAMES utf8 COLLATE utf8_general_ci;
#
# Start of ctype_utf8_ilseq.inc
#
CREATE TABLE t1 ENGINE=InnoDB AS SELECT REPEAT(' ', 60) AS ch LIMIT 0;;
ALTER TABLE t1
ADD id BIGINT UNSIGNED NOT NULL AUTO_INCREMENT PRIMARY KEY,
ADD KEY(ch);
SHOW CREATE TABLE t1;
Table	Create Table
t1	CREATE TABLE `t1` (
  `ch` varchar(60) CHARACTER SET utf8mb3 COLLATE utf8mb3_general_ci DEFAULT NULL,
  `id` bigint(20) unsigned NOT NULL AUTO_INCREMENT,
  PRIMARY KEY (`id`),
  KEY `ch` (`ch`)
) ENGINE=InnoDB DEFAULT CHARSET=utf8mb4 COLLATE=utf8mb4_uca1400_ai_ci
INSERT INTO t1 (ch) VALUES ('admin'),('admin1');
SELECT ch FROM t1 WHERE ch='admin𝌆';
ch
EXPLAIN SELECT ch FROM t1 WHERE ch='admin𝌆';
id	select_type	table	type	possible_keys	key	key_len	ref	rows	Extra
1	SIMPLE	NULL	NULL	NULL	NULL	NULL	NULL	NULL	Impossible WHERE noticed after reading const tables
SELECT ch FROM t1 IGNORE KEY (ch) WHERE ch='admin𝌆';
ch
SELECT ch FROM t1 FORCE KEY (ch) WHERE ch='admin𝌆';
ch
DELETE FROM t1;
INSERT INTO t1 (ch) VALUES ('a'), ('a?'), ('a??'), ('a???'), ('a????');
INSERT INTO t1 (ch) VALUES ('ab'),('a?b'),('a??b'),('a???b'),('a????b');
INSERT INTO t1 (ch) VALUES ('az'),('a?z'),('a??z'),('a???z'),('a????z');
INSERT INTO t1 (ch) VALUES ('z');
INSERT INTO t1 (ch) VALUES (_utf8 0x61D080);
INSERT INTO t1 (ch) VALUES (_utf8 0x61D680);
SELECT ch FROM t1 IGNORE KEY (ch) WHERE ch='a𝌆' ORDER BY ch;
ch
SELECT ch FROM t1 IGNORE KEY (ch) WHERE ch='a𝌆b' ORDER BY ch;
ch
EXPLAIN
SELECT ch FROM t1 FORCE KEY (ch) WHERE ch='a𝌆' ORDER BY ch;
id	select_type	table	type	possible_keys	key	key_len	ref	rows	Extra
1	SIMPLE	NULL	NULL	NULL	NULL	NULL	NULL	#	Impossible WHERE noticed after reading const tables
SELECT ch FROM t1 FORCE KEY (ch) WHERE ch='a𝌆' ORDER BY ch;
ch
EXPLAIN
SELECT ch FROM t1 FORCE KEY (ch) WHERE ch='a𝌆b' ORDER BY ch;
id	select_type	table	type	possible_keys	key	key_len	ref	rows	Extra
1	SIMPLE	NULL	NULL	NULL	NULL	NULL	NULL	#	Impossible WHERE noticed after reading const tables
SELECT ch FROM t1 FORCE KEY (ch) WHERE ch='a𝌆b' ORDER BY ch;
ch
SELECT ch FROM t1 IGNORE KEY (ch) WHERE ch<'a𝌆' ORDER BY ch;
ch
a
a?
a??
a???
a????
a????b
a????z
a???b
a???z
a??b
a??z
a?b
a?z
ab
az
aЀ
aր
SELECT ch FROM t1 IGNORE KEY (ch) WHERE ch<'a𝌆b' ORDER BY ch;
ch
a
a?
a??
a???
a????
a????b
a????z
a???b
a???z
a??b
a??z
a?b
a?z
ab
az
aЀ
aր
EXPLAIN
SELECT ch FROM t1 FORCE KEY (ch) WHERE ch<'a𝌆' ORDER BY ch;
id	select_type	table	type	possible_keys	key	key_len	ref	rows	Extra
1	SIMPLE	t1	index	ch	ch	183	NULL	#	Using where; Using index
SELECT ch FROM t1 FORCE KEY (ch) WHERE ch<'a𝌆' ORDER BY ch;
ch
a
a?
a??
a???
a????
a????b
a????z
a???b
a???z
a??b
a??z
a?b
a?z
ab
az
aЀ
aր
EXPLAIN
SELECT ch FROM t1 FORCE KEY (ch) WHERE ch<'a𝌆b' ORDER BY ch;
id	select_type	table	type	possible_keys	key	key_len	ref	rows	Extra
1	SIMPLE	t1	index	ch	ch	183	NULL	#	Using where; Using index
SELECT ch FROM t1 FORCE KEY (ch) WHERE ch<'a𝌆b' ORDER BY ch;
ch
a
a?
a??
a???
a????
a????b
a????z
a???b
a???z
a??b
a??z
a?b
a?z
ab
az
aЀ
aր
SELECT ch FROM t1 IGNORE KEY (ch) WHERE ch>'a𝌆' ORDER BY ch;
ch
z
SELECT ch FROM t1 IGNORE KEY (ch) WHERE ch>'a𝌆b' ORDER BY ch;
ch
z
EXPLAIN
SELECT ch FROM t1 FORCE KEY (ch) WHERE ch>'a𝌆' ORDER BY ch;
id	select_type	table	type	possible_keys	key	key_len	ref	rows	Extra
1	SIMPLE	t1	index	ch	ch	183	NULL	#	Using where; Using index
SELECT ch FROM t1 FORCE KEY (ch) WHERE ch>'a𝌆' ORDER BY ch;
ch
z
EXPLAIN
SELECT ch FROM t1 FORCE KEY (ch) WHERE ch>'a𝌆b' ORDER BY ch;
id	select_type	table	type	possible_keys	key	key_len	ref	rows	Extra
1	SIMPLE	t1	index	ch	ch	183	NULL	#	Using where; Using index
SELECT ch FROM t1 FORCE KEY (ch) WHERE ch>'a𝌆b' ORDER BY ch;
ch
z
ALTER TABLE t1 DROP KEY ch;
# 0xD18F would be a good 2-byte character, 0xD1 is an incomplete sequence
SET @query=CONCAT('SELECT ch FROM t1 WHERE ch=''a', 0xD1,'''');
PREPARE stmt FROM @query;
EXECUTE stmt;
ch
SET @query=CONCAT('SELECT ch FROM t1 WHERE ch=''a', 0xD1,'b''');
PREPARE stmt FROM @query;
EXECUTE stmt;
ch
SET @query=CONCAT('SELECT ch FROM t1 WHERE ch<''a', 0xD1,''' ORDER BY ch');
PREPARE stmt FROM @query;
EXECUTE stmt;
ch
a
a?
a??
a???
a????
a????b
a????z
a???b
a???z
a??b
a??z
a?b
a?z
ab
az
aЀ
aր
SET @query=CONCAT('SELECT ch FROM t1 WHERE ch>''a', 0xD1,''' ORDER BY ch');
PREPARE stmt FROM @query;
EXECUTE stmt;
ch
z
# 0xEA9A96 would be a good 3-byte character, 0xEA9A is an incomplete sequence
SET @query=CONCAT('SELECT ch FROM t1 WHERE ch=''a', 0xEA9A,''' ORDER BY ch');
PREPARE stmt FROM @query;
EXECUTE stmt;
ch
SET @query=CONCAT('SELECT ch FROM t1 WHERE ch=''a', 0xEA9A,'b'' ORDER BY ch');
PREPARE stmt FROM @query;
EXECUTE stmt;
ch
# 0x8F is a bad byte sequence (an mb2tail without mb2head)
SET @query=CONCAT('SELECT ch FROM t1 WHERE ch=''a', 0x8F,''' ORDER BY ch');
PREPARE stmt FROM @query;
EXECUTE stmt;
ch
SET @query=CONCAT('SELECT ch FROM t1 WHERE ch=''a', 0x8F,'b'' ORDER BY ch');
PREPARE stmt FROM @query;
EXECUTE stmt;
ch
# 0x8F8F is a bad byte sequence (an mb2tail without mb2head, two times)
SET @query=CONCAT('SELECT ch FROM t1 WHERE ch=''a', 0x8F8F,''' ORDER BY ch');
PREPARE stmt FROM @query;
EXECUTE stmt;
ch
SET @query=CONCAT('SELECT ch FROM t1 WHERE ch=''a', 0x8F8F,'b'' ORDER BY ch');
PREPARE stmt FROM @query;
EXECUTE stmt;
ch
DROP TABLE t1;
#
# End of ctype_utf8_ilseq.inc
#
#
# Start of ctype_utf8_ilseq.inc
#
CREATE TABLE t1 ENGINE=MyISAM AS SELECT REPEAT(' ', 60) AS ch LIMIT 0;;
ALTER TABLE t1
ADD id BIGINT UNSIGNED NOT NULL AUTO_INCREMENT PRIMARY KEY,
ADD KEY(ch);
SHOW CREATE TABLE t1;
Table	Create Table
t1	CREATE TABLE `t1` (
  `ch` varchar(60) CHARACTER SET utf8mb3 COLLATE utf8mb3_general_ci DEFAULT NULL,
  `id` bigint(20) unsigned NOT NULL AUTO_INCREMENT,
  PRIMARY KEY (`id`),
  KEY `ch` (`ch`)
) ENGINE=MyISAM DEFAULT CHARSET=utf8mb4 COLLATE=utf8mb4_uca1400_ai_ci
INSERT INTO t1 (ch) VALUES ('admin'),('admin1');
SELECT ch FROM t1 WHERE ch='admin𝌆';
ch
EXPLAIN SELECT ch FROM t1 WHERE ch='admin𝌆';
id	select_type	table	type	possible_keys	key	key_len	ref	rows	Extra
1	SIMPLE	NULL	NULL	NULL	NULL	NULL	NULL	NULL	Impossible WHERE noticed after reading const tables
SELECT ch FROM t1 IGNORE KEY (ch) WHERE ch='admin𝌆';
ch
SELECT ch FROM t1 FORCE KEY (ch) WHERE ch='admin𝌆';
ch
DELETE FROM t1;
INSERT INTO t1 (ch) VALUES ('a'), ('a?'), ('a??'), ('a???'), ('a????');
INSERT INTO t1 (ch) VALUES ('ab'),('a?b'),('a??b'),('a???b'),('a????b');
INSERT INTO t1 (ch) VALUES ('az'),('a?z'),('a??z'),('a???z'),('a????z');
INSERT INTO t1 (ch) VALUES ('z');
INSERT INTO t1 (ch) VALUES (_utf8 0x61D080);
INSERT INTO t1 (ch) VALUES (_utf8 0x61D680);
SELECT ch FROM t1 IGNORE KEY (ch) WHERE ch='a𝌆' ORDER BY ch;
ch
SELECT ch FROM t1 IGNORE KEY (ch) WHERE ch='a𝌆b' ORDER BY ch;
ch
EXPLAIN
SELECT ch FROM t1 FORCE KEY (ch) WHERE ch='a𝌆' ORDER BY ch;
id	select_type	table	type	possible_keys	key	key_len	ref	rows	Extra
1	SIMPLE	NULL	NULL	NULL	NULL	NULL	NULL	#	Impossible WHERE noticed after reading const tables
SELECT ch FROM t1 FORCE KEY (ch) WHERE ch='a𝌆' ORDER BY ch;
ch
EXPLAIN
SELECT ch FROM t1 FORCE KEY (ch) WHERE ch='a𝌆b' ORDER BY ch;
id	select_type	table	type	possible_keys	key	key_len	ref	rows	Extra
1	SIMPLE	NULL	NULL	NULL	NULL	NULL	NULL	#	Impossible WHERE noticed after reading const tables
SELECT ch FROM t1 FORCE KEY (ch) WHERE ch='a𝌆b' ORDER BY ch;
ch
SELECT ch FROM t1 IGNORE KEY (ch) WHERE ch<'a𝌆' ORDER BY ch;
ch
a
a?
a??
a???
a????
a????b
a????z
a???b
a???z
a??b
a??z
a?b
a?z
ab
az
aЀ
aր
SELECT ch FROM t1 IGNORE KEY (ch) WHERE ch<'a𝌆b' ORDER BY ch;
ch
a
a?
a??
a???
a????
a????b
a????z
a???b
a???z
a??b
a??z
a?b
a?z
ab
az
aЀ
aր
EXPLAIN
SELECT ch FROM t1 FORCE KEY (ch) WHERE ch<'a𝌆' ORDER BY ch;
id	select_type	table	type	possible_keys	key	key_len	ref	rows	Extra
1	SIMPLE	t1	index	ch	ch	183	NULL	#	Using where; Using index
SELECT ch FROM t1 FORCE KEY (ch) WHERE ch<'a𝌆' ORDER BY ch;
ch
a
a?
a??
a???
a????
a????b
a????z
a???b
a???z
a??b
a??z
a?b
a?z
ab
az
aЀ
aր
EXPLAIN
SELECT ch FROM t1 FORCE KEY (ch) WHERE ch<'a𝌆b' ORDER BY ch;
id	select_type	table	type	possible_keys	key	key_len	ref	rows	Extra
1	SIMPLE	t1	index	ch	ch	183	NULL	#	Using where; Using index
SELECT ch FROM t1 FORCE KEY (ch) WHERE ch<'a𝌆b' ORDER BY ch;
ch
a
a?
a??
a???
a????
a????b
a????z
a???b
a???z
a??b
a??z
a?b
a?z
ab
az
aЀ
aր
SELECT ch FROM t1 IGNORE KEY (ch) WHERE ch>'a𝌆' ORDER BY ch;
ch
z
SELECT ch FROM t1 IGNORE KEY (ch) WHERE ch>'a𝌆b' ORDER BY ch;
ch
z
EXPLAIN
SELECT ch FROM t1 FORCE KEY (ch) WHERE ch>'a𝌆' ORDER BY ch;
id	select_type	table	type	possible_keys	key	key_len	ref	rows	Extra
1	SIMPLE	t1	index	ch	ch	183	NULL	#	Using where; Using index
SELECT ch FROM t1 FORCE KEY (ch) WHERE ch>'a𝌆' ORDER BY ch;
ch
z
EXPLAIN
SELECT ch FROM t1 FORCE KEY (ch) WHERE ch>'a𝌆b' ORDER BY ch;
id	select_type	table	type	possible_keys	key	key_len	ref	rows	Extra
1	SIMPLE	t1	index	ch	ch	183	NULL	#	Using where; Using index
SELECT ch FROM t1 FORCE KEY (ch) WHERE ch>'a𝌆b' ORDER BY ch;
ch
z
ALTER TABLE t1 DROP KEY ch;
# 0xD18F would be a good 2-byte character, 0xD1 is an incomplete sequence
SET @query=CONCAT('SELECT ch FROM t1 WHERE ch=''a', 0xD1,'''');
PREPARE stmt FROM @query;
EXECUTE stmt;
ch
SET @query=CONCAT('SELECT ch FROM t1 WHERE ch=''a', 0xD1,'b''');
PREPARE stmt FROM @query;
EXECUTE stmt;
ch
SET @query=CONCAT('SELECT ch FROM t1 WHERE ch<''a', 0xD1,''' ORDER BY ch');
PREPARE stmt FROM @query;
EXECUTE stmt;
ch
a
a?
a??
a???
a????
a????b
a????z
a???b
a???z
a??b
a??z
a?b
a?z
ab
az
aЀ
aր
SET @query=CONCAT('SELECT ch FROM t1 WHERE ch>''a', 0xD1,''' ORDER BY ch');
PREPARE stmt FROM @query;
EXECUTE stmt;
ch
z
# 0xEA9A96 would be a good 3-byte character, 0xEA9A is an incomplete sequence
SET @query=CONCAT('SELECT ch FROM t1 WHERE ch=''a', 0xEA9A,''' ORDER BY ch');
PREPARE stmt FROM @query;
EXECUTE stmt;
ch
SET @query=CONCAT('SELECT ch FROM t1 WHERE ch=''a', 0xEA9A,'b'' ORDER BY ch');
PREPARE stmt FROM @query;
EXECUTE stmt;
ch
# 0x8F is a bad byte sequence (an mb2tail without mb2head)
SET @query=CONCAT('SELECT ch FROM t1 WHERE ch=''a', 0x8F,''' ORDER BY ch');
PREPARE stmt FROM @query;
EXECUTE stmt;
ch
SET @query=CONCAT('SELECT ch FROM t1 WHERE ch=''a', 0x8F,'b'' ORDER BY ch');
PREPARE stmt FROM @query;
EXECUTE stmt;
ch
# 0x8F8F is a bad byte sequence (an mb2tail without mb2head, two times)
SET @query=CONCAT('SELECT ch FROM t1 WHERE ch=''a', 0x8F8F,''' ORDER BY ch');
PREPARE stmt FROM @query;
EXECUTE stmt;
ch
SET @query=CONCAT('SELECT ch FROM t1 WHERE ch=''a', 0x8F8F,'b'' ORDER BY ch');
PREPARE stmt FROM @query;
EXECUTE stmt;
ch
DROP TABLE t1;
#
# End of ctype_utf8_ilseq.inc
#
#
# Start of ctype_utf8_ilseq.inc
#
CREATE TABLE t1 ENGINE=HEAP AS SELECT REPEAT(' ', 60) AS ch LIMIT 0;;
ALTER TABLE t1
ADD id BIGINT UNSIGNED NOT NULL AUTO_INCREMENT PRIMARY KEY,
ADD KEY(ch);
SHOW CREATE TABLE t1;
Table	Create Table
t1	CREATE TABLE `t1` (
  `ch` varchar(60) CHARACTER SET utf8mb3 COLLATE utf8mb3_general_ci DEFAULT NULL,
  `id` bigint(20) unsigned NOT NULL AUTO_INCREMENT,
  PRIMARY KEY (`id`),
  KEY `ch` (`ch`)
) ENGINE=MEMORY DEFAULT CHARSET=utf8mb4 COLLATE=utf8mb4_uca1400_ai_ci
INSERT INTO t1 (ch) VALUES ('admin'),('admin1');
SELECT ch FROM t1 WHERE ch='admin𝌆';
ch
EXPLAIN SELECT ch FROM t1 WHERE ch='admin𝌆';
id	select_type	table	type	possible_keys	key	key_len	ref	rows	Extra
1	SIMPLE	NULL	NULL	NULL	NULL	NULL	NULL	NULL	Impossible WHERE noticed after reading const tables
SELECT ch FROM t1 IGNORE KEY (ch) WHERE ch='admin𝌆';
ch
SELECT ch FROM t1 FORCE KEY (ch) WHERE ch='admin𝌆';
ch
DELETE FROM t1;
INSERT INTO t1 (ch) VALUES ('a'), ('a?'), ('a??'), ('a???'), ('a????');
INSERT INTO t1 (ch) VALUES ('ab'),('a?b'),('a??b'),('a???b'),('a????b');
INSERT INTO t1 (ch) VALUES ('az'),('a?z'),('a??z'),('a???z'),('a????z');
INSERT INTO t1 (ch) VALUES ('z');
INSERT INTO t1 (ch) VALUES (_utf8 0x61D080);
INSERT INTO t1 (ch) VALUES (_utf8 0x61D680);
SELECT ch FROM t1 IGNORE KEY (ch) WHERE ch='a𝌆' ORDER BY ch;
ch
SELECT ch FROM t1 IGNORE KEY (ch) WHERE ch='a𝌆b' ORDER BY ch;
ch
EXPLAIN
SELECT ch FROM t1 FORCE KEY (ch) WHERE ch='a𝌆' ORDER BY ch;
id	select_type	table	type	possible_keys	key	key_len	ref	rows	Extra
1	SIMPLE	NULL	NULL	NULL	NULL	NULL	NULL	#	Impossible WHERE noticed after reading const tables
SELECT ch FROM t1 FORCE KEY (ch) WHERE ch='a𝌆' ORDER BY ch;
ch
EXPLAIN
SELECT ch FROM t1 FORCE KEY (ch) WHERE ch='a𝌆b' ORDER BY ch;
id	select_type	table	type	possible_keys	key	key_len	ref	rows	Extra
1	SIMPLE	NULL	NULL	NULL	NULL	NULL	NULL	#	Impossible WHERE noticed after reading const tables
SELECT ch FROM t1 FORCE KEY (ch) WHERE ch='a𝌆b' ORDER BY ch;
ch
SELECT ch FROM t1 IGNORE KEY (ch) WHERE ch<'a𝌆' ORDER BY ch;
ch
a
a?
a??
a???
a????
a????b
a????z
a???b
a???z
a??b
a??z
a?b
a?z
ab
az
aЀ
aր
SELECT ch FROM t1 IGNORE KEY (ch) WHERE ch<'a𝌆b' ORDER BY ch;
ch
a
a?
a??
a???
a????
a????b
a????z
a???b
a???z
a??b
a??z
a?b
a?z
ab
az
aЀ
aր
EXPLAIN
SELECT ch FROM t1 FORCE KEY (ch) WHERE ch<'a𝌆' ORDER BY ch;
id	select_type	table	type	possible_keys	key	key_len	ref	rows	Extra
1	SIMPLE	t1	ALL	ch	NULL	NULL	NULL	#	Using where; Using filesort
SELECT ch FROM t1 FORCE KEY (ch) WHERE ch<'a𝌆' ORDER BY ch;
ch
a
a?
a??
a???
a????
a????b
a????z
a???b
a???z
a??b
a??z
a?b
a?z
ab
az
aЀ
aր
EXPLAIN
SELECT ch FROM t1 FORCE KEY (ch) WHERE ch<'a𝌆b' ORDER BY ch;
id	select_type	table	type	possible_keys	key	key_len	ref	rows	Extra
1	SIMPLE	t1	ALL	ch	NULL	NULL	NULL	#	Using where; Using filesort
SELECT ch FROM t1 FORCE KEY (ch) WHERE ch<'a𝌆b' ORDER BY ch;
ch
a
a?
a??
a???
a????
a????b
a????z
a???b
a???z
a??b
a??z
a?b
a?z
ab
az
aЀ
aր
SELECT ch FROM t1 IGNORE KEY (ch) WHERE ch>'a𝌆' ORDER BY ch;
ch
z
SELECT ch FROM t1 IGNORE KEY (ch) WHERE ch>'a𝌆b' ORDER BY ch;
ch
z
EXPLAIN
SELECT ch FROM t1 FORCE KEY (ch) WHERE ch>'a𝌆' ORDER BY ch;
id	select_type	table	type	possible_keys	key	key_len	ref	rows	Extra
1	SIMPLE	t1	ALL	ch	NULL	NULL	NULL	#	Using where; Using filesort
SELECT ch FROM t1 FORCE KEY (ch) WHERE ch>'a𝌆' ORDER BY ch;
ch
z
EXPLAIN
SELECT ch FROM t1 FORCE KEY (ch) WHERE ch>'a𝌆b' ORDER BY ch;
id	select_type	table	type	possible_keys	key	key_len	ref	rows	Extra
1	SIMPLE	t1	ALL	ch	NULL	NULL	NULL	#	Using where; Using filesort
SELECT ch FROM t1 FORCE KEY (ch) WHERE ch>'a𝌆b' ORDER BY ch;
ch
z
ALTER TABLE t1 DROP KEY ch;
# 0xD18F would be a good 2-byte character, 0xD1 is an incomplete sequence
SET @query=CONCAT('SELECT ch FROM t1 WHERE ch=''a', 0xD1,'''');
PREPARE stmt FROM @query;
EXECUTE stmt;
ch
SET @query=CONCAT('SELECT ch FROM t1 WHERE ch=''a', 0xD1,'b''');
PREPARE stmt FROM @query;
EXECUTE stmt;
ch
SET @query=CONCAT('SELECT ch FROM t1 WHERE ch<''a', 0xD1,''' ORDER BY ch');
PREPARE stmt FROM @query;
EXECUTE stmt;
ch
a
a?
a??
a???
a????
a????b
a????z
a???b
a???z
a??b
a??z
a?b
a?z
ab
az
aЀ
aր
SET @query=CONCAT('SELECT ch FROM t1 WHERE ch>''a', 0xD1,''' ORDER BY ch');
PREPARE stmt FROM @query;
EXECUTE stmt;
ch
z
# 0xEA9A96 would be a good 3-byte character, 0xEA9A is an incomplete sequence
SET @query=CONCAT('SELECT ch FROM t1 WHERE ch=''a', 0xEA9A,''' ORDER BY ch');
PREPARE stmt FROM @query;
EXECUTE stmt;
ch
SET @query=CONCAT('SELECT ch FROM t1 WHERE ch=''a', 0xEA9A,'b'' ORDER BY ch');
PREPARE stmt FROM @query;
EXECUTE stmt;
ch
# 0x8F is a bad byte sequence (an mb2tail without mb2head)
SET @query=CONCAT('SELECT ch FROM t1 WHERE ch=''a', 0x8F,''' ORDER BY ch');
PREPARE stmt FROM @query;
EXECUTE stmt;
ch
SET @query=CONCAT('SELECT ch FROM t1 WHERE ch=''a', 0x8F,'b'' ORDER BY ch');
PREPARE stmt FROM @query;
EXECUTE stmt;
ch
# 0x8F8F is a bad byte sequence (an mb2tail without mb2head, two times)
SET @query=CONCAT('SELECT ch FROM t1 WHERE ch=''a', 0x8F8F,''' ORDER BY ch');
PREPARE stmt FROM @query;
EXECUTE stmt;
ch
SET @query=CONCAT('SELECT ch FROM t1 WHERE ch=''a', 0x8F8F,'b'' ORDER BY ch');
PREPARE stmt FROM @query;
EXECUTE stmt;
ch
DROP TABLE t1;
#
# End of ctype_utf8_ilseq.inc
#
#
# MDEV-8067 correct fix for MySQL Bug # 19699237: UNINITIALIZED VARIABLE IN ITEM_FIELD::STR_RESULT
#
CREATE TABLE t1 (a VARCHAR(10) CHARACTER SET utf8);
CREATE TABLE t2 (a VARCHAR(10) CHARACTER SET latin1);
INSERT INTO t1 VALUES ('aaa');
INSERT INTO t2 VALUES ('aaa');
SELECT (SELECT CONCAT(a),1 FROM t1) <=> (SELECT CONCAT(a),1 FROM t2);
(SELECT CONCAT(a),1 FROM t1) <=> (SELECT CONCAT(a),1 FROM t2)
1
INSERT INTO t1 VALUES ('aaa');
INSERT INTO t2 VALUES ('aaa');
SELECT (SELECT CONCAT(a),1 FROM t1) <=> (SELECT CONCAT(a),1 FROM t2);
ERROR 21000: Subquery returns more than 1 row
DROP TABLE t1, t2;
#
# MDEV-8630 Datetime value dropped in "INSERT ... SELECT ... ON DUPLICATE KEY"
#
SET NAMES utf8;
CREATE TABLE t1 (id2 int, ts timestamp not null);
INSERT INTO t1 VALUES (1,'2012-06-11 15:17:34'),(2,'2012-06-11 15:18:24');
CREATE TABLE t2 AS SELECT
COALESCE(ts, 0) AS c0,
GREATEST(COALESCE(ts, 0), COALESCE(ts, 0)) AS c1,
GREATEST(CASE WHEN 1 THEN ts ELSE 0 END, CASE WHEN 1 THEN ts ELSE 0 END) AS c2,
GREATEST(IFNULL(ts,0), IFNULL(ts,0)) AS c3,
GREATEST(IF(1,ts,0), IF(1,ts,0)) AS c4
FROM t1;
SHOW CREATE TABLE t2;
Table	Create Table
t2	CREATE TABLE `t2` (
  `c0` varchar(19) CHARACTER SET utf8mb3 COLLATE utf8mb3_general_ci NOT NULL,
  `c1` varchar(19) CHARACTER SET utf8mb3 COLLATE utf8mb3_general_ci NOT NULL,
  `c2` varchar(19) CHARACTER SET utf8mb3 COLLATE utf8mb3_general_ci NOT NULL,
  `c3` varchar(19) CHARACTER SET utf8mb3 COLLATE utf8mb3_general_ci NOT NULL,
  `c4` varchar(19) CHARACTER SET utf8mb3 COLLATE utf8mb3_general_ci NOT NULL
) ENGINE=MyISAM DEFAULT CHARSET=utf8mb4 COLLATE=utf8mb4_uca1400_ai_ci
SELECT * FROM t2;
c0	c1	c2	c3	c4
2012-06-11 15:17:34	2012-06-11 15:17:34	2012-06-11 15:17:34	2012-06-11 15:17:34	2012-06-11 15:17:34
2012-06-11 15:18:24	2012-06-11 15:18:24	2012-06-11 15:18:24	2012-06-11 15:18:24	2012-06-11 15:18:24
DROP TABLE t2, t1;
#
# MDEV-9319 ALTER from a bigger to a smaller blob type truncates too much data
#
SET NAMES utf8;
CREATE TABLE t1 (a TEXT CHARACTER SET utf8);
INSERT INTO t1 VALUES (REPEAT('Ａ',100));
SELECT OCTET_LENGTH(a) FROM t1;
OCTET_LENGTH(a)
300
SET STATEMENT sql_mode = 'NO_ENGINE_SUBSTITUTION' FOR
ALTER TABLE t1 MODIFY a TINYTEXT CHARACTER SET utf8;
Warnings:
Warning	1265	Data truncated for column 'a' at row 1
SELECT OCTET_LENGTH(a),a FROM t1;
OCTET_LENGTH(a)	a
255	ＡＡＡＡＡＡＡＡＡＡＡＡＡＡＡＡＡＡＡＡＡＡＡＡＡＡＡＡＡＡＡＡＡＡＡＡＡＡＡＡＡＡＡＡＡＡＡＡＡＡＡＡＡＡＡＡＡＡＡＡＡＡＡＡＡＡＡＡＡＡＡＡＡＡＡＡＡＡＡＡＡＡＡＡＡ
DROP TABLE t1;
#
# MDEV-8402 Bug#77473 Bug#21317406 TRUNCATED DATA WITH SUBQUERY & UTF8
#
#
SET NAMES utf8;
SELECT length(rpad(_utf8 0xD0B1, 65536, _utf8 0xD0B2)) AS data;
data
131072
SELECT length(data) AS len FROM (
SELECT rpad(_utf8 0xD0B1, 65536, _utf8 0xD0B2) AS data
) AS sub;
len
131072
SELECT length(rpad(_utf8 0xD0B1, 65535, _utf8 0xD0B2)) AS data;
data
131070
SELECT length(data) AS len FROM (
SELECT rpad(_utf8 0xD0B1, 65535, _utf8 0xD0B2) AS data
) AS sub;
len
131070
SELECT length(data) AS len FROM (SELECT REPEAT('ä', 36766) AS data) AS sub;
len
73532
SELECT length(data) AS len FROM (SELECT REPEAT('ä', 36767) AS data) AS sub;
len
73534
SELECT length(data) AS len FROM (SELECT REPEAT('ä', 36778) AS data) AS sub;
len
73556
SELECT length(data) AS len FROM (SELECT REPEAT('ä', 65535) AS data) AS sub;
len
131070
SELECT length(data) AS len FROM (SELECT REPEAT('ä', 65536) AS data) AS sub;
len
131072
SELECT length(data) AS len FROM (SELECT REPEAT('ä', 65537) AS data) AS sub;
len
131074
#
# MDEV-10717 Assertion `!null_value' failed in virtual bool Item::send(Protocol*, String*)
#
CREATE TABLE t1 (i INT, KEY(i));
INSERT INTO t1 VALUES (20081205),(20050327);
SELECT HEX(i), HEX(CHAR(i USING utf8)) FROM t1;
HEX(i)	HEX(CHAR(i USING utf8))
131F197	NULL
1326A35	01326A35
Warnings:
Warning	1300	Invalid utf8mb3 character string: 'F197'
SET sql_mode='STRICT_ALL_TABLES';
SELECT HEX(i), HEX(CHAR(i USING utf8)) FROM t1;
HEX(i)	HEX(CHAR(i USING utf8))
131F197	NULL
1326A35	01326A35
Warnings:
Warning	1300	Invalid utf8mb3 character string: 'F197'
SELECT CHAR(i USING utf8) FROM t1;
CHAR(i USING utf8)
###
###
Warnings:
###	1300	Invalid utf8mb3 character string: 'F197'
SET sql_mode=DEFAULT;
DROP TABLE t1;
#
# MDEV-13530 VARBINARY doesn't convert to to BLOB for sizes 65533, 65534 and 65535
#
SET sql_mode='';
CREATE TABLE t1 (c1 VARCHAR(21844) CHARACTER SET utf8);
DESCRIBE t1;
Field	Type	Null	Key	Default	Extra
c1	varchar(21844)	YES		NULL	
DROP TABLE t1;
CREATE TABLE t1 (c1 VARCHAR(21845) CHARACTER SET utf8);
Warnings:
Note	1246	Converting column 'c1' from VARCHAR to TEXT
DESCRIBE t1;
Field	Type	Null	Key	Default	Extra
c1	text	YES		NULL	
DROP TABLE t1;
CREATE TABLE t1 (c1 VARCHAR(21846) CHARACTER SET utf8);
Warnings:
Note	1246	Converting column 'c1' from VARCHAR to TEXT
DESCRIBE t1;
Field	Type	Null	Key	Default	Extra
c1	mediumtext	YES		NULL	
DROP TABLE t1;
SET sql_mode=default;
#
# End of 5.5 tests
#
#
# Start of 5.6 tests
#
#
# WL#3664 WEIGHT_STRING
#
#
# Checking strnxfrm() with odd length
#
set max_sort_length=9;
Warnings:
Warning	1292	Truncated incorrect max_sort_length value: '9'
select @@max_sort_length;
@@max_sort_length
64
create table t1 (a varchar(128) character set utf8 collate utf8_general_ci);
insert into t1 values ('a'),('b'),('c');
select * from t1 order by a;
a
a
b
c
alter table t1 modify a varchar(128) character set utf8 collate utf8_bin;
select * from t1 order by a;
a
a
b
c
drop table t1;
set max_sort_length=default;
#
# End of 5.6 tests
#
#
# Start of 10.0 tests
#
#
# MDEV-6666 Malformed result for CONCAT(utf8_column, binary_string)
#
CREATE TABLE t1 (a VARCHAR(10) CHARACTER SET utf8);
INSERT INTO t1 VALUES ('a');
SELECT CONCAT(a,0xFF) FROM t1;
ERROR HY000: Invalid utf8mb3 character string: 'FF'
SELECT CONCAT(a,0xC3BF) FROM t1;
CONCAT(a,0xC3BF)
aÿ
DROP TABLE t1;
SELECT CONCAT('a' COLLATE utf8_unicode_ci, _binary 0xFF);
ERROR HY000: Invalid utf8mb3 character string: 'FF'
PREPARE stmt FROM "SELECT CONCAT('a' COLLATE utf8_unicode_ci, ?)";
SET @arg00=_binary 0xFF;
EXECUTE stmt USING @arg00;
ERROR HY000: Invalid utf8mb3 character string: 'FF'
DEALLOCATE PREPARE stmt;
SET NAMES latin1;
PREPARE stmt FROM "SELECT CONCAT(_utf8'a' COLLATE utf8_unicode_ci, ?)";
EXECUTE stmt USING @no_such_var;
CONCAT(_utf8'a' COLLATE utf8_unicode_ci, ?)
NULL
DEALLOCATE PREPARE stmt;
SET NAMES utf8;
#
# MDEV-6679 Different optimizer plan for "a BETWEEN 'string' AND ?" and "a BETWEEN ? AND 'string'"
#
SET NAMES utf8, collation_connection=utf8_swedish_ci;
CREATE TABLE t1 (a VARCHAR(10) CHARACTER SET utf8, b INT NOT NULL DEFAULT 0, key(a));
INSERT INTO t1 (a) VALUES ('a'),('b'),('c'),('d'),('¢');
SET @arg='¢';
PREPARE stmt FROM "EXPLAIN SELECT * FROM t1 WHERE a BETWEEN _utf8'¢' and ?";
EXECUTE stmt USING @arg;
id	select_type	table	type	possible_keys	key	key_len	ref	rows	Extra
1	SIMPLE	t1	range	a	a	33	NULL	1	Using index condition
PREPARE stmt FROM "EXPLAIN SELECT * FROM t1 WHERE a between ? and _utf8'¢'";
EXECUTE stmt USING @arg;
id	select_type	table	type	possible_keys	key	key_len	ref	rows	Extra
1	SIMPLE	t1	range	a	a	33	NULL	1	Using index condition
DEALLOCATE PREPARE stmt;
DROP TABLE t1;
#
# MDEV-6683 A parameter and a string literal with the same values are not recognized as equal by the optimizer
#
SET NAMES utf8, collation_connection=utf8_swedish_ci;
CREATE TABLE t1 (a VARCHAR(10) CHARACTER SET latin1, b INT NOT NULL DEFAULT 0, key(a));
INSERT INTO t1 (a) VALUES ('a'),('b'),('c'),('d'),('¢');
SET @arg='¢';
PREPARE stmt FROM "EXPLAIN SELECT * FROM t1 WHERE a BETWEEN _utf8'¢' and ?";
EXECUTE stmt USING @arg;
id	select_type	table	type	possible_keys	key	key_len	ref	rows	Extra
1	SIMPLE	t1	ref	a	a	13	const	1	Using index condition
PREPARE stmt FROM "EXPLAIN SELECT * FROM t1 WHERE a between ? and _utf8'¢'";
EXECUTE stmt USING @arg;
id	select_type	table	type	possible_keys	key	key_len	ref	rows	Extra
1	SIMPLE	t1	ref	a	a	13	const	1	Using index condition
DEALLOCATE PREPARE stmt;
DROP TABLE t1;
#
# MDEV-6688 Illegal mix of collation with bit string B'01100001'
#
CREATE TABLE t1 (a VARCHAR(10) CHARACTER SET latin1, b INT);
INSERT INTO t1 VALUES ('a',1);
SELECT CONCAT(a, IF(b>10, _utf8 X'61', _utf8 X'61')) FROM t1;
CONCAT(a, IF(b>10, _utf8 X'61', _utf8 X'61'))
aa
SELECT CONCAT(a, IF(b>10, _utf8 X'61', _utf8 B'01100001')) FROM t1;
CONCAT(a, IF(b>10, _utf8 X'61', _utf8 B'01100001'))
aa
DROP TABLE t1;
#
#  MDEV-6694 Illegal mix of collation with a PS parameter
#
SET NAMES utf8;
CREATE TABLE t1 (a INT, b VARCHAR(10) CHARACTER SET latin1);
INSERT INTO t1 VALUES (1,'a');
SELECT CONCAT(b,IF(a,'b','b')) FROM t1;
CONCAT(b,IF(a,'b','b'))
ab
PREPARE stmt FROM "SELECT CONCAT(b,IF(a,?,?)) FROM t1";
SET @b='b';
EXECUTE stmt USING @b,@b;
CONCAT(b,IF(a,?,?))
ab
SET @b='';
EXECUTE stmt USING @b,@b;
CONCAT(b,IF(a,?,?))
a
SET @b='я';
EXECUTE stmt USING @b,@b;
ERROR HY000: Illegal mix of collations (latin1_swedish_ci,IMPLICIT) and (utf8mb3_general_ci,COERCIBLE) for operation 'concat'
DEALLOCATE PREPARE stmt;
DROP TABLE t1;
#
# MDEV-7629 Regression: Bit and hex string literals changed column names in 10.0.14
#
SELECT _utf8 0x7E, _utf8 X'7E', _utf8 B'01111110';
_utf8 0x7E	_utf8 X'7E'	_utf8 B'01111110'
~	~	~
# Start of ctype_unescape.inc
SET sql_mode = '';
SET @query=_binary'SELECT CHARSET(\'test\'),@@character_set_client,@@character_set_connection';
PREPARE stmt FROM @query;
EXECUTE stmt;
CHARSET('test')	@@character_set_client	@@character_set_connection
utf8mb3	utf8mb3	utf8mb3
DEALLOCATE PREPARE stmt;
CREATE TABLE allbytes (a VARBINARY(10));
# Using selected bytes combinations
CREATE TABLE halfs (a INT);
INSERT INTO halfs VALUES (0x00),(0x01),(0x02),(0x03),(0x04),(0x05),(0x06),(0x07);
INSERT INTO halfs VALUES (0x08),(0x09),(0x0A),(0x0B),(0x0C),(0x0D),(0x0E),(0x0F);
CREATE TEMPORARY TABLE bytes (a BINARY(1), KEY(a)) ENGINE=MyISAM;
INSERT INTO bytes SELECT CHAR((t1.a << 4) | t2.a USING BINARY) FROM halfs t1, halfs t2;
DROP TABLE halfs;
CREATE TABLE selected_bytes (a VARBINARY(10));
INSERT INTO selected_bytes (a) VALUES ('\0'),('\b'),('\t'),('\r'),('\n'),('\Z');
INSERT INTO selected_bytes (a) VALUES ('0'),('b'),('t'),('r'),('n'),('Z');
INSERT INTO selected_bytes (a) VALUES ('\\'),('_'),('%'),(0x22),(0x27);
INSERT INTO selected_bytes (a) VALUES ('a');
INSERT INTO selected_bytes (a) VALUES
(0x3F), # 7bit
(0x40), # 7bit          mbtail
(0x7E), # 7bit          mbtail  nonascii-8bit
(0x7F), # 7bit                  nonascii-8bit
(0x80), #               mbtail                 bad-mb
(0x81), #       mbhead  mbtail
(0x9F), #       mbhead  mbtail                 bad-mb
(0xA0), #       mbhead  mbtail                 bad-mb
(0xA1), #       mbhead  mbtail  nonascii-8bit
(0xE0), #       mbhead  mbtai
(0xEF), #       mbhead  mbtail
(0xF9), #       mbhead  mbtail
(0xFA), #       mbhead  mbtail                 bad-mb
(0xFC), #       mbhead  mbtail                 bad-mb
(0xFD), #       mbhead  mbtail                 bad-mb
(0xFE), #       mbhead  mbtial                 bad-mb
(0xFF);
INSERT INTO allbytes (a) SELECT a FROM bytes;
INSERT INTO allbytes (a) SELECT CONCAT(t1.a,t2.a) FROM selected_bytes t1,selected_bytes t2;
INSERT INTO allbytes (a) SELECT CONCAT(0x5C,t1.a,t2.a) FROM selected_bytes t1,selected_bytes t2;
INSERT INTO allbytes (a) SELECT CONCAT(0x5C,t1.a,0x5C,t2.a) FROM selected_bytes t1,selected_bytes t2;
DROP TABLE selected_bytes;
DELETE FROM allbytes WHERE
OCTET_LENGTH(a)>1 AND
LOCATE(0x5C,a)=0 AND
a NOT LIKE '%\'%' AND
  a NOT LIKE '%"%';
CREATE PROCEDURE p1(val VARBINARY(10))
BEGIN
DECLARE EXIT HANDLER FOR SQLSTATE '42000' INSERT INTO t1 (a,b) VALUES(val,NULL);
SET @query=CONCAT(_binary"INSERT INTO t1 (a,b) VALUES (0x",HEX(val),",'",val,"')");
PREPARE stmt FROM @query;
EXECUTE stmt;
DEALLOCATE PREPARE stmt;
END//
CREATE PROCEDURE p2()
BEGIN
DECLARE val VARBINARY(10);
DECLARE done INT DEFAULT FALSE;
DECLARE stmt CURSOR FOR SELECT a FROM allbytes;
DECLARE CONTINUE HANDLER FOR NOT FOUND SET done=TRUE;
OPEN stmt;
read_loop1: LOOP
FETCH stmt INTO val;
IF done THEN
LEAVE read_loop1;
END IF;
CALL p1(val);
END LOOP;  
CLOSE stmt;
END//
CREATE FUNCTION iswellformed(a VARBINARY(256)) RETURNS INT RETURN a=BINARY CONVERT(a USING utf8mb3);//
CREATE FUNCTION unescape(a VARBINARY(256)) RETURNS VARBINARY(256)
BEGIN
# We need to do it in a way to avoid producing new escape sequences
# First, enclose all known escsape sequences to '{{xx}}'
  # - Backslash not followed by a LIKE pattern characters _ and %
# - Double escapes
# This uses PCRE Branch Reset Groups: (?|(alt1)|(alt2)|(alt3)).
# So '\\1' in the last argument always means the match, no matter
# which alternative it came from.
SET a=REGEXP_REPLACE(a,'(?|(\\\\[^_%])|(\\x{27}\\x{27}))','{{\\1}}');
# Now unescape all enclosed standard escape sequences
SET a=REPLACE(a,'{{\\0}}', '\0');
SET a=REPLACE(a,'{{\\b}}', '\b');
SET a=REPLACE(a,'{{\\t}}', '\t');
SET a=REPLACE(a,'{{\\r}}', '\r');
SET a=REPLACE(a,'{{\\n}}', '\n');
SET a=REPLACE(a,'{{\\Z}}', '\Z');
SET a=REPLACE(a,'{{\\\'}}', '\'');
# Unescape double quotes
SET a=REPLACE(a,'{{\'\'}}', '\'');
  # Unescape the rest: all other \x sequences mean just 'x'
  SET a=REGEXP_REPLACE(a, '{{\\\\(.|\\R)}}', '\\1');
  RETURN a;
END//
CREATE FUNCTION unescape_type(a VARBINARY(256),b VARBINARY(256)) RETURNS VARBINARY(256)
BEGIN
RETURN CASE
WHEN b IS NULL THEN '[SyntErr]'
  WHEN a=b THEN CASE
WHEN OCTET_LENGTH(a)=1 THEN '[Preserve]'
    WHEN a RLIKE '\\\\[_%]' THEN '[Preserve][LIKE]'
    WHEN a RLIKE '^[[:ascii:]]+$' THEN '[Preserve][ASCII]'
    ELSE '[Preserv][MB]' END
WHEN REPLACE(a,0x5C,'')=b THEN '[Trivial]'
  WHEN UNESCAPE(a)=b THEN '[Regular]'
  ELSE '[Special]' END;
END//
CREATE FUNCTION wellformedness(a VARBINARY(256), b VARBINARY(256))
RETURNS VARBINARY(256)
BEGIN
RETURN CASE
WHEN b IS NULL THEN ''
  WHEN NOT iswellformed(a) AND iswellformed(b) THEN '[FIXED]'
  WHEN iswellformed(a) AND NOT iswellformed(b) THEN '[BROKE]'
  WHEN NOT iswellformed(a) AND NOT iswellformed(b) THEN '[ILSEQ]'
  ELSE ''
  END;
END//
CREATE FUNCTION mysql_real_escape_string_generated(a VARBINARY(256))
RETURNS VARBINARY(256)
BEGIN
DECLARE a1 BINARY(1) DEFAULT SUBSTR(a,1,1);
DECLARE a2 BINARY(1) DEFAULT SUBSTR(a,2,1);
DECLARE a3 BINARY(1) DEFAULT SUBSTR(a,3,1);
DECLARE a4 BINARY(1) DEFAULT SUBSTR(a,4,1);
DECLARE a2a4 BINARY(2) DEFAULT CONCAT(a2,a4);
RETURN CASE
WHEN (a1=0x5C) AND 
(a3=0x5C) AND
(a2>0x7F) AND
(a4 NOT IN ('_','%','0','t','r','n','Z')) AND
iswellformed(a2a4) THEN '[USER]'
  ELSE ''
  END;
END//
CREATE TABLE t1 (a VARBINARY(10),b VARBINARY(10));
CALL p2();
SELECT HEX(a),HEX(b),
CONCAT(unescape_type(a,b),
wellformedness(a,b),
mysql_real_escape_string_generated(a),
IF(UNESCAPE(a)<>b,CONCAT('[BAD',HEX(UNESCAPE(a)),']'),'')) AS comment
FROM t1 ORDER BY LENGTH(a),a;
HEX(a)	HEX(b)	comment
00	00	[Preserve]
01	01	[Preserve]
02	02	[Preserve]
03	03	[Preserve]
04	04	[Preserve]
05	05	[Preserve]
06	06	[Preserve]
07	07	[Preserve]
08	08	[Preserve]
09	09	[Preserve]
0A	0A	[Preserve]
0B	0B	[Preserve]
0C	0C	[Preserve]
0D	0D	[Preserve]
0E	0E	[Preserve]
0F	0F	[Preserve]
10	10	[Preserve]
11	11	[Preserve]
12	12	[Preserve]
13	13	[Preserve]
14	14	[Preserve]
15	15	[Preserve]
16	16	[Preserve]
17	17	[Preserve]
18	18	[Preserve]
19	19	[Preserve]
1A	1A	[Preserve]
1B	1B	[Preserve]
1C	1C	[Preserve]
1D	1D	[Preserve]
1E	1E	[Preserve]
1F	1F	[Preserve]
20	20	[Preserve]
21	21	[Preserve]
22	22	[Preserve]
23	23	[Preserve]
24	24	[Preserve]
25	25	[Preserve]
26	26	[Preserve]
27	NULL	[SyntErr]
28	28	[Preserve]
29	29	[Preserve]
2A	2A	[Preserve]
2B	2B	[Preserve]
2C	2C	[Preserve]
2D	2D	[Preserve]
2E	2E	[Preserve]
2F	2F	[Preserve]
30	30	[Preserve]
31	31	[Preserve]
32	32	[Preserve]
33	33	[Preserve]
34	34	[Preserve]
35	35	[Preserve]
36	36	[Preserve]
37	37	[Preserve]
38	38	[Preserve]
39	39	[Preserve]
3A	3A	[Preserve]
3B	3B	[Preserve]
3C	3C	[Preserve]
3D	3D	[Preserve]
3E	3E	[Preserve]
3F	3F	[Preserve]
40	40	[Preserve]
41	41	[Preserve]
42	42	[Preserve]
43	43	[Preserve]
44	44	[Preserve]
45	45	[Preserve]
46	46	[Preserve]
47	47	[Preserve]
48	48	[Preserve]
49	49	[Preserve]
4A	4A	[Preserve]
4B	4B	[Preserve]
4C	4C	[Preserve]
4D	4D	[Preserve]
4E	4E	[Preserve]
4F	4F	[Preserve]
50	50	[Preserve]
51	51	[Preserve]
52	52	[Preserve]
53	53	[Preserve]
54	54	[Preserve]
55	55	[Preserve]
56	56	[Preserve]
57	57	[Preserve]
58	58	[Preserve]
59	59	[Preserve]
5A	5A	[Preserve]
5B	5B	[Preserve]
5C	NULL	[SyntErr]
5D	5D	[Preserve]
5E	5E	[Preserve]
5F	5F	[Preserve]
60	60	[Preserve]
61	61	[Preserve]
62	62	[Preserve]
63	63	[Preserve]
64	64	[Preserve]
65	65	[Preserve]
66	66	[Preserve]
67	67	[Preserve]
68	68	[Preserve]
69	69	[Preserve]
6A	6A	[Preserve]
6B	6B	[Preserve]
6C	6C	[Preserve]
6D	6D	[Preserve]
6E	6E	[Preserve]
6F	6F	[Preserve]
70	70	[Preserve]
71	71	[Preserve]
72	72	[Preserve]
73	73	[Preserve]
74	74	[Preserve]
75	75	[Preserve]
76	76	[Preserve]
77	77	[Preserve]
78	78	[Preserve]
79	79	[Preserve]
7A	7A	[Preserve]
7B	7B	[Preserve]
7C	7C	[Preserve]
7D	7D	[Preserve]
7E	7E	[Preserve]
7F	7F	[Preserve]
80	80	[Preserve][ILSEQ]
81	81	[Preserve][ILSEQ]
82	82	[Preserve][ILSEQ]
83	83	[Preserve][ILSEQ]
84	84	[Preserve][ILSEQ]
85	85	[Preserve][ILSEQ]
86	86	[Preserve][ILSEQ]
87	87	[Preserve][ILSEQ]
88	88	[Preserve][ILSEQ]
89	89	[Preserve][ILSEQ]
8A	8A	[Preserve][ILSEQ]
8B	8B	[Preserve][ILSEQ]
8C	8C	[Preserve][ILSEQ]
8D	8D	[Preserve][ILSEQ]
8E	8E	[Preserve][ILSEQ]
8F	8F	[Preserve][ILSEQ]
90	90	[Preserve][ILSEQ]
91	91	[Preserve][ILSEQ]
92	92	[Preserve][ILSEQ]
93	93	[Preserve][ILSEQ]
94	94	[Preserve][ILSEQ]
95	95	[Preserve][ILSEQ]
96	96	[Preserve][ILSEQ]
97	97	[Preserve][ILSEQ]
98	98	[Preserve][ILSEQ]
99	99	[Preserve][ILSEQ]
9A	9A	[Preserve][ILSEQ]
9B	9B	[Preserve][ILSEQ]
9C	9C	[Preserve][ILSEQ]
9D	9D	[Preserve][ILSEQ]
9E	9E	[Preserve][ILSEQ]
9F	9F	[Preserve][ILSEQ]
A0	A0	[Preserve][ILSEQ]
A1	A1	[Preserve][ILSEQ]
A2	A2	[Preserve][ILSEQ]
A3	A3	[Preserve][ILSEQ]
A4	A4	[Preserve][ILSEQ]
A5	A5	[Preserve][ILSEQ]
A6	A6	[Preserve][ILSEQ]
A7	A7	[Preserve][ILSEQ]
A8	A8	[Preserve][ILSEQ]
A9	A9	[Preserve][ILSEQ]
AA	AA	[Preserve][ILSEQ]
AB	AB	[Preserve][ILSEQ]
AC	AC	[Preserve][ILSEQ]
AD	AD	[Preserve][ILSEQ]
AE	AE	[Preserve][ILSEQ]
AF	AF	[Preserve][ILSEQ]
B0	B0	[Preserve][ILSEQ]
B1	B1	[Preserve][ILSEQ]
B2	B2	[Preserve][ILSEQ]
B3	B3	[Preserve][ILSEQ]
B4	B4	[Preserve][ILSEQ]
B5	B5	[Preserve][ILSEQ]
B6	B6	[Preserve][ILSEQ]
B7	B7	[Preserve][ILSEQ]
B8	B8	[Preserve][ILSEQ]
B9	B9	[Preserve][ILSEQ]
BA	BA	[Preserve][ILSEQ]
BB	BB	[Preserve][ILSEQ]
BC	BC	[Preserve][ILSEQ]
BD	BD	[Preserve][ILSEQ]
BE	BE	[Preserve][ILSEQ]
BF	BF	[Preserve][ILSEQ]
C0	C0	[Preserve][ILSEQ]
C1	C1	[Preserve][ILSEQ]
C2	C2	[Preserve][ILSEQ]
C3	C3	[Preserve][ILSEQ]
C4	C4	[Preserve][ILSEQ]
C5	C5	[Preserve][ILSEQ]
C6	C6	[Preserve][ILSEQ]
C7	C7	[Preserve][ILSEQ]
C8	C8	[Preserve][ILSEQ]
C9	C9	[Preserve][ILSEQ]
CA	CA	[Preserve][ILSEQ]
CB	CB	[Preserve][ILSEQ]
CC	CC	[Preserve][ILSEQ]
CD	CD	[Preserve][ILSEQ]
CE	CE	[Preserve][ILSEQ]
CF	CF	[Preserve][ILSEQ]
D0	D0	[Preserve][ILSEQ]
D1	D1	[Preserve][ILSEQ]
D2	D2	[Preserve][ILSEQ]
D3	D3	[Preserve][ILSEQ]
D4	D4	[Preserve][ILSEQ]
D5	D5	[Preserve][ILSEQ]
D6	D6	[Preserve][ILSEQ]
D7	D7	[Preserve][ILSEQ]
D8	D8	[Preserve][ILSEQ]
D9	D9	[Preserve][ILSEQ]
DA	DA	[Preserve][ILSEQ]
DB	DB	[Preserve][ILSEQ]
DC	DC	[Preserve][ILSEQ]
DD	DD	[Preserve][ILSEQ]
DE	DE	[Preserve][ILSEQ]
DF	DF	[Preserve][ILSEQ]
E0	E0	[Preserve][ILSEQ]
E1	E1	[Preserve][ILSEQ]
E2	E2	[Preserve][ILSEQ]
E3	E3	[Preserve][ILSEQ]
E4	E4	[Preserve][ILSEQ]
E5	E5	[Preserve][ILSEQ]
E6	E6	[Preserve][ILSEQ]
E7	E7	[Preserve][ILSEQ]
E8	E8	[Preserve][ILSEQ]
E9	E9	[Preserve][ILSEQ]
EA	EA	[Preserve][ILSEQ]
EB	EB	[Preserve][ILSEQ]
EC	EC	[Preserve][ILSEQ]
ED	ED	[Preserve][ILSEQ]
EE	EE	[Preserve][ILSEQ]
EF	EF	[Preserve][ILSEQ]
F0	F0	[Preserve][ILSEQ]
F1	F1	[Preserve][ILSEQ]
F2	F2	[Preserve][ILSEQ]
F3	F3	[Preserve][ILSEQ]
F4	F4	[Preserve][ILSEQ]
F5	F5	[Preserve][ILSEQ]
F6	F6	[Preserve][ILSEQ]
F7	F7	[Preserve][ILSEQ]
F8	F8	[Preserve][ILSEQ]
F9	F9	[Preserve][ILSEQ]
FA	FA	[Preserve][ILSEQ]
FB	FB	[Preserve][ILSEQ]
FC	FC	[Preserve][ILSEQ]
FD	FD	[Preserve][ILSEQ]
FE	FE	[Preserve][ILSEQ]
FF	FF	[Preserve][ILSEQ]
0022	0022	[Preserve][ASCII]
0027	NULL	[SyntErr]
005C	NULL	[SyntErr]
0822	0822	[Preserve][ASCII]
0827	NULL	[SyntErr]
085C	NULL	[SyntErr]
0922	0922	[Preserve][ASCII]
0927	NULL	[SyntErr]
095C	NULL	[SyntErr]
0A22	0A22	[Preserve][ASCII]
0A27	NULL	[SyntErr]
0A5C	NULL	[SyntErr]
0D22	0D22	[Preserve][ASCII]
0D27	NULL	[SyntErr]
0D5C	NULL	[SyntErr]
1A22	1A22	[Preserve][ASCII]
1A27	NULL	[SyntErr]
1A5C	NULL	[SyntErr]
2200	2200	[Preserve][ASCII]
2208	2208	[Preserve][ASCII]
2209	2209	[Preserve][ASCII]
220A	220A	[Preserve][ASCII]
220D	220D	[Preserve][ASCII]
221A	221A	[Preserve][ASCII]
2222	2222	[Preserve][ASCII]
2225	2225	[Preserve][ASCII]
2227	NULL	[SyntErr]
2230	2230	[Preserve][ASCII]
223F	223F	[Preserve][ASCII]
2240	2240	[Preserve][ASCII]
225A	225A	[Preserve][ASCII]
225C	NULL	[SyntErr]
225F	225F	[Preserve][ASCII]
2261	2261	[Preserve][ASCII]
2262	2262	[Preserve][ASCII]
226E	226E	[Preserve][ASCII]
2272	2272	[Preserve][ASCII]
2274	2274	[Preserve][ASCII]
227E	227E	[Preserve][ASCII]
227F	227F	[Preserve][ASCII]
2280	2280	[Preserv][MB][ILSEQ]
2281	2281	[Preserv][MB][ILSEQ]
229F	229F	[Preserv][MB][ILSEQ]
22A0	22A0	[Preserv][MB][ILSEQ]
22A1	22A1	[Preserv][MB][ILSEQ]
22E0	22E0	[Preserv][MB][ILSEQ]
22EF	22EF	[Preserv][MB][ILSEQ]
22F9	22F9	[Preserv][MB][ILSEQ]
22FA	22FA	[Preserv][MB][ILSEQ]
22FC	22FC	[Preserv][MB][ILSEQ]
22FD	22FD	[Preserv][MB][ILSEQ]
22FE	22FE	[Preserv][MB][ILSEQ]
22FF	22FF	[Preserv][MB][ILSEQ]
2522	2522	[Preserve][ASCII]
2527	NULL	[SyntErr]
255C	NULL	[SyntErr]
2700	NULL	[SyntErr]
2708	NULL	[SyntErr]
2709	NULL	[SyntErr]
270A	NULL	[SyntErr]
270D	NULL	[SyntErr]
271A	NULL	[SyntErr]
2722	NULL	[SyntErr]
2725	NULL	[SyntErr]
2727	27	[Regular]
2730	NULL	[SyntErr]
273F	NULL	[SyntErr]
2740	NULL	[SyntErr]
275A	NULL	[SyntErr]
275C	NULL	[SyntErr]
275F	NULL	[SyntErr]
2761	NULL	[SyntErr]
2762	NULL	[SyntErr]
276E	NULL	[SyntErr]
2772	NULL	[SyntErr]
2774	NULL	[SyntErr]
277E	NULL	[SyntErr]
277F	NULL	[SyntErr]
2780	NULL	[SyntErr]
2781	NULL	[SyntErr]
279F	NULL	[SyntErr]
27A0	NULL	[SyntErr]
27A1	NULL	[SyntErr]
27E0	NULL	[SyntErr]
27EF	NULL	[SyntErr]
27F9	NULL	[SyntErr]
27FA	NULL	[SyntErr]
27FC	NULL	[SyntErr]
27FD	NULL	[SyntErr]
27FE	NULL	[SyntErr]
27FF	NULL	[SyntErr]
3022	3022	[Preserve][ASCII]
3027	NULL	[SyntErr]
305C	NULL	[SyntErr]
3F22	3F22	[Preserve][ASCII]
3F27	NULL	[SyntErr]
3F5C	NULL	[SyntErr]
4022	4022	[Preserve][ASCII]
4027	NULL	[SyntErr]
405C	NULL	[SyntErr]
5A22	5A22	[Preserve][ASCII]
5A27	NULL	[SyntErr]
5A5C	NULL	[SyntErr]
5C00	00	[Trivial]
5C08	08	[Trivial]
5C09	09	[Trivial]
5C0A	0A	[Trivial]
5C0D	0D	[Trivial]
5C1A	1A	[Trivial]
5C22	22	[Trivial]
5C25	5C25	[Preserve][LIKE]
5C27	27	[Trivial]
5C30	00	[Regular]
5C3F	3F	[Trivial]
5C40	40	[Trivial]
5C5A	1A	[Regular]
5C5C	5C	[Regular]
5C5F	5C5F	[Preserve][LIKE]
5C61	61	[Trivial]
5C62	08	[Regular]
5C6E	0A	[Regular]
5C72	0D	[Regular]
5C74	09	[Regular]
5C7E	7E	[Trivial]
5C7F	7F	[Trivial]
5C80	80	[Trivial][ILSEQ]
5C81	81	[Trivial][ILSEQ]
5C9F	9F	[Trivial][ILSEQ]
5CA0	A0	[Trivial][ILSEQ]
5CA1	A1	[Trivial][ILSEQ]
5CE0	E0	[Trivial][ILSEQ]
5CEF	EF	[Trivial][ILSEQ]
5CF9	F9	[Trivial][ILSEQ]
5CFA	FA	[Trivial][ILSEQ]
5CFC	FC	[Trivial][ILSEQ]
5CFD	FD	[Trivial][ILSEQ]
5CFE	FE	[Trivial][ILSEQ]
5CFF	FF	[Trivial][ILSEQ]
5F22	5F22	[Preserve][ASCII]
5F27	NULL	[SyntErr]
5F5C	NULL	[SyntErr]
6122	6122	[Preserve][ASCII]
6127	NULL	[SyntErr]
615C	NULL	[SyntErr]
6222	6222	[Preserve][ASCII]
6227	NULL	[SyntErr]
625C	NULL	[SyntErr]
6E22	6E22	[Preserve][ASCII]
6E27	NULL	[SyntErr]
6E5C	NULL	[SyntErr]
7222	7222	[Preserve][ASCII]
7227	NULL	[SyntErr]
725C	NULL	[SyntErr]
7422	7422	[Preserve][ASCII]
7427	NULL	[SyntErr]
745C	NULL	[SyntErr]
7E22	7E22	[Preserve][ASCII]
7E27	NULL	[SyntErr]
7E5C	NULL	[SyntErr]
7F22	7F22	[Preserve][ASCII]
7F27	NULL	[SyntErr]
7F5C	NULL	[SyntErr]
8022	8022	[Preserv][MB][ILSEQ]
8027	NULL	[SyntErr]
805C	NULL	[SyntErr]
8122	8122	[Preserv][MB][ILSEQ]
8127	NULL	[SyntErr]
815C	NULL	[SyntErr]
9F22	9F22	[Preserv][MB][ILSEQ]
9F27	NULL	[SyntErr]
9F5C	NULL	[SyntErr]
A022	A022	[Preserv][MB][ILSEQ]
A027	NULL	[SyntErr]
A05C	NULL	[SyntErr]
A122	A122	[Preserv][MB][ILSEQ]
A127	NULL	[SyntErr]
A15C	NULL	[SyntErr]
E022	E022	[Preserv][MB][ILSEQ]
E027	NULL	[SyntErr]
E05C	NULL	[SyntErr]
EF22	EF22	[Preserv][MB][ILSEQ]
EF27	NULL	[SyntErr]
EF5C	NULL	[SyntErr]
F922	F922	[Preserv][MB][ILSEQ]
F927	NULL	[SyntErr]
F95C	NULL	[SyntErr]
FA22	FA22	[Preserv][MB][ILSEQ]
FA27	NULL	[SyntErr]
FA5C	NULL	[SyntErr]
FC22	FC22	[Preserv][MB][ILSEQ]
FC27	NULL	[SyntErr]
FC5C	NULL	[SyntErr]
FD22	FD22	[Preserv][MB][ILSEQ]
FD27	NULL	[SyntErr]
FD5C	NULL	[SyntErr]
FE22	FE22	[Preserv][MB][ILSEQ]
FE27	NULL	[SyntErr]
FE5C	NULL	[SyntErr]
FF22	FF22	[Preserv][MB][ILSEQ]
FF27	NULL	[SyntErr]
FF5C	NULL	[SyntErr]
5C0000	0000	[Trivial]
5C0008	0008	[Trivial]
5C0009	0009	[Trivial]
5C000A	000A	[Trivial]
5C000D	000D	[Trivial]
5C001A	001A	[Trivial]
5C0022	0022	[Trivial]
5C0025	0025	[Trivial]
5C0027	NULL	[SyntErr]
5C0030	0030	[Trivial]
5C003F	003F	[Trivial]
5C0040	0040	[Trivial]
5C005A	005A	[Trivial]
5C005C	NULL	[SyntErr]
5C005F	005F	[Trivial]
5C0061	0061	[Trivial]
5C0062	0062	[Trivial]
5C006E	006E	[Trivial]
5C0072	0072	[Trivial]
5C0074	0074	[Trivial]
5C007E	007E	[Trivial]
5C007F	007F	[Trivial]
5C0080	0080	[Trivial][ILSEQ]
5C0081	0081	[Trivial][ILSEQ]
5C009F	009F	[Trivial][ILSEQ]
5C00A0	00A0	[Trivial][ILSEQ]
5C00A1	00A1	[Trivial][ILSEQ]
5C00E0	00E0	[Trivial][ILSEQ]
5C00EF	00EF	[Trivial][ILSEQ]
5C00F9	00F9	[Trivial][ILSEQ]
5C00FA	00FA	[Trivial][ILSEQ]
5C00FC	00FC	[Trivial][ILSEQ]
5C00FD	00FD	[Trivial][ILSEQ]
5C00FE	00FE	[Trivial][ILSEQ]
5C00FF	00FF	[Trivial][ILSEQ]
5C0800	0800	[Trivial]
5C0808	0808	[Trivial]
5C0809	0809	[Trivial]
5C080A	080A	[Trivial]
5C080D	080D	[Trivial]
5C081A	081A	[Trivial]
5C0822	0822	[Trivial]
5C0825	0825	[Trivial]
5C0827	NULL	[SyntErr]
5C0830	0830	[Trivial]
5C083F	083F	[Trivial]
5C0840	0840	[Trivial]
5C085A	085A	[Trivial]
5C085C	NULL	[SyntErr]
5C085F	085F	[Trivial]
5C0861	0861	[Trivial]
5C0862	0862	[Trivial]
5C086E	086E	[Trivial]
5C0872	0872	[Trivial]
5C0874	0874	[Trivial]
5C087E	087E	[Trivial]
5C087F	087F	[Trivial]
5C0880	0880	[Trivial][ILSEQ]
5C0881	0881	[Trivial][ILSEQ]
5C089F	089F	[Trivial][ILSEQ]
5C08A0	08A0	[Trivial][ILSEQ]
5C08A1	08A1	[Trivial][ILSEQ]
5C08E0	08E0	[Trivial][ILSEQ]
5C08EF	08EF	[Trivial][ILSEQ]
5C08F9	08F9	[Trivial][ILSEQ]
5C08FA	08FA	[Trivial][ILSEQ]
5C08FC	08FC	[Trivial][ILSEQ]
5C08FD	08FD	[Trivial][ILSEQ]
5C08FE	08FE	[Trivial][ILSEQ]
5C08FF	08FF	[Trivial][ILSEQ]
5C0900	0900	[Trivial]
5C0908	0908	[Trivial]
5C0909	0909	[Trivial]
5C090A	090A	[Trivial]
5C090D	090D	[Trivial]
5C091A	091A	[Trivial]
5C0922	0922	[Trivial]
5C0925	0925	[Trivial]
5C0927	NULL	[SyntErr]
5C0930	0930	[Trivial]
5C093F	093F	[Trivial]
5C0940	0940	[Trivial]
5C095A	095A	[Trivial]
5C095C	NULL	[SyntErr]
5C095F	095F	[Trivial]
5C0961	0961	[Trivial]
5C0962	0962	[Trivial]
5C096E	096E	[Trivial]
5C0972	0972	[Trivial]
5C0974	0974	[Trivial]
5C097E	097E	[Trivial]
5C097F	097F	[Trivial]
5C0980	0980	[Trivial][ILSEQ]
5C0981	0981	[Trivial][ILSEQ]
5C099F	099F	[Trivial][ILSEQ]
5C09A0	09A0	[Trivial][ILSEQ]
5C09A1	09A1	[Trivial][ILSEQ]
5C09E0	09E0	[Trivial][ILSEQ]
5C09EF	09EF	[Trivial][ILSEQ]
5C09F9	09F9	[Trivial][ILSEQ]
5C09FA	09FA	[Trivial][ILSEQ]
5C09FC	09FC	[Trivial][ILSEQ]
5C09FD	09FD	[Trivial][ILSEQ]
5C09FE	09FE	[Trivial][ILSEQ]
5C09FF	09FF	[Trivial][ILSEQ]
5C0A00	0A00	[Trivial]
5C0A08	0A08	[Trivial]
5C0A09	0A09	[Trivial]
5C0A0A	0A0A	[Trivial]
5C0A0D	0A0D	[Trivial]
5C0A1A	0A1A	[Trivial]
5C0A22	0A22	[Trivial]
5C0A25	0A25	[Trivial]
5C0A27	NULL	[SyntErr]
5C0A30	0A30	[Trivial]
5C0A3F	0A3F	[Trivial]
5C0A40	0A40	[Trivial]
5C0A5A	0A5A	[Trivial]
5C0A5C	NULL	[SyntErr]
5C0A5F	0A5F	[Trivial]
5C0A61	0A61	[Trivial]
5C0A62	0A62	[Trivial]
5C0A6E	0A6E	[Trivial]
5C0A72	0A72	[Trivial]
5C0A74	0A74	[Trivial]
5C0A7E	0A7E	[Trivial]
5C0A7F	0A7F	[Trivial]
5C0A80	0A80	[Trivial][ILSEQ]
5C0A81	0A81	[Trivial][ILSEQ]
5C0A9F	0A9F	[Trivial][ILSEQ]
5C0AA0	0AA0	[Trivial][ILSEQ]
5C0AA1	0AA1	[Trivial][ILSEQ]
5C0AE0	0AE0	[Trivial][ILSEQ]
5C0AEF	0AEF	[Trivial][ILSEQ]
5C0AF9	0AF9	[Trivial][ILSEQ]
5C0AFA	0AFA	[Trivial][ILSEQ]
5C0AFC	0AFC	[Trivial][ILSEQ]
5C0AFD	0AFD	[Trivial][ILSEQ]
5C0AFE	0AFE	[Trivial][ILSEQ]
5C0AFF	0AFF	[Trivial][ILSEQ]
5C0D00	0D00	[Trivial]
5C0D08	0D08	[Trivial]
5C0D09	0D09	[Trivial]
5C0D0A	0D0A	[Trivial]
5C0D0D	0D0D	[Trivial]
5C0D1A	0D1A	[Trivial]
5C0D22	0D22	[Trivial]
5C0D25	0D25	[Trivial]
5C0D27	NULL	[SyntErr]
5C0D30	0D30	[Trivial]
5C0D3F	0D3F	[Trivial]
5C0D40	0D40	[Trivial]
5C0D5A	0D5A	[Trivial]
5C0D5C	NULL	[SyntErr]
5C0D5F	0D5F	[Trivial]
5C0D61	0D61	[Trivial]
5C0D62	0D62	[Trivial]
5C0D6E	0D6E	[Trivial]
5C0D72	0D72	[Trivial]
5C0D74	0D74	[Trivial]
5C0D7E	0D7E	[Trivial]
5C0D7F	0D7F	[Trivial]
5C0D80	0D80	[Trivial][ILSEQ]
5C0D81	0D81	[Trivial][ILSEQ]
5C0D9F	0D9F	[Trivial][ILSEQ]
5C0DA0	0DA0	[Trivial][ILSEQ]
5C0DA1	0DA1	[Trivial][ILSEQ]
5C0DE0	0DE0	[Trivial][ILSEQ]
5C0DEF	0DEF	[Trivial][ILSEQ]
5C0DF9	0DF9	[Trivial][ILSEQ]
5C0DFA	0DFA	[Trivial][ILSEQ]
5C0DFC	0DFC	[Trivial][ILSEQ]
5C0DFD	0DFD	[Trivial][ILSEQ]
5C0DFE	0DFE	[Trivial][ILSEQ]
5C0DFF	0DFF	[Trivial][ILSEQ]
5C1A00	1A00	[Trivial]
5C1A08	1A08	[Trivial]
5C1A09	1A09	[Trivial]
5C1A0A	1A0A	[Trivial]
5C1A0D	1A0D	[Trivial]
5C1A1A	1A1A	[Trivial]
5C1A22	1A22	[Trivial]
5C1A25	1A25	[Trivial]
5C1A27	NULL	[SyntErr]
5C1A30	1A30	[Trivial]
5C1A3F	1A3F	[Trivial]
5C1A40	1A40	[Trivial]
5C1A5A	1A5A	[Trivial]
5C1A5C	NULL	[SyntErr]
5C1A5F	1A5F	[Trivial]
5C1A61	1A61	[Trivial]
5C1A62	1A62	[Trivial]
5C1A6E	1A6E	[Trivial]
5C1A72	1A72	[Trivial]
5C1A74	1A74	[Trivial]
5C1A7E	1A7E	[Trivial]
5C1A7F	1A7F	[Trivial]
5C1A80	1A80	[Trivial][ILSEQ]
5C1A81	1A81	[Trivial][ILSEQ]
5C1A9F	1A9F	[Trivial][ILSEQ]
5C1AA0	1AA0	[Trivial][ILSEQ]
5C1AA1	1AA1	[Trivial][ILSEQ]
5C1AE0	1AE0	[Trivial][ILSEQ]
5C1AEF	1AEF	[Trivial][ILSEQ]
5C1AF9	1AF9	[Trivial][ILSEQ]
5C1AFA	1AFA	[Trivial][ILSEQ]
5C1AFC	1AFC	[Trivial][ILSEQ]
5C1AFD	1AFD	[Trivial][ILSEQ]
5C1AFE	1AFE	[Trivial][ILSEQ]
5C1AFF	1AFF	[Trivial][ILSEQ]
5C2200	2200	[Trivial]
5C2208	2208	[Trivial]
5C2209	2209	[Trivial]
5C220A	220A	[Trivial]
5C220D	220D	[Trivial]
5C221A	221A	[Trivial]
5C2222	2222	[Trivial]
5C2225	2225	[Trivial]
5C2227	NULL	[SyntErr]
5C2230	2230	[Trivial]
5C223F	223F	[Trivial]
5C2240	2240	[Trivial]
5C225A	225A	[Trivial]
5C225C	NULL	[SyntErr]
5C225F	225F	[Trivial]
5C2261	2261	[Trivial]
5C2262	2262	[Trivial]
5C226E	226E	[Trivial]
5C2272	2272	[Trivial]
5C2274	2274	[Trivial]
5C227E	227E	[Trivial]
5C227F	227F	[Trivial]
5C2280	2280	[Trivial][ILSEQ]
5C2281	2281	[Trivial][ILSEQ]
5C229F	229F	[Trivial][ILSEQ]
5C22A0	22A0	[Trivial][ILSEQ]
5C22A1	22A1	[Trivial][ILSEQ]
5C22E0	22E0	[Trivial][ILSEQ]
5C22EF	22EF	[Trivial][ILSEQ]
5C22F9	22F9	[Trivial][ILSEQ]
5C22FA	22FA	[Trivial][ILSEQ]
5C22FC	22FC	[Trivial][ILSEQ]
5C22FD	22FD	[Trivial][ILSEQ]
5C22FE	22FE	[Trivial][ILSEQ]
5C22FF	22FF	[Trivial][ILSEQ]
5C2500	5C2500	[Preserve][LIKE]
5C2508	5C2508	[Preserve][LIKE]
5C2509	5C2509	[Preserve][LIKE]
5C250A	5C250A	[Preserve][LIKE]
5C250D	5C250D	[Preserve][LIKE]
5C251A	5C251A	[Preserve][LIKE]
5C2522	5C2522	[Preserve][LIKE]
5C2525	5C2525	[Preserve][LIKE]
5C2527	NULL	[SyntErr]
5C2530	5C2530	[Preserve][LIKE]
5C253F	5C253F	[Preserve][LIKE]
5C2540	5C2540	[Preserve][LIKE]
5C255A	5C255A	[Preserve][LIKE]
5C255C	NULL	[SyntErr]
5C255F	5C255F	[Preserve][LIKE]
5C2561	5C2561	[Preserve][LIKE]
5C2562	5C2562	[Preserve][LIKE]
5C256E	5C256E	[Preserve][LIKE]
5C2572	5C2572	[Preserve][LIKE]
5C2574	5C2574	[Preserve][LIKE]
5C257E	5C257E	[Preserve][LIKE]
5C257F	5C257F	[Preserve][LIKE]
5C2580	5C2580	[Preserve][LIKE][ILSEQ]
5C2581	5C2581	[Preserve][LIKE][ILSEQ]
5C259F	5C259F	[Preserve][LIKE][ILSEQ]
5C25A0	5C25A0	[Preserve][LIKE][ILSEQ]
5C25A1	5C25A1	[Preserve][LIKE][ILSEQ]
5C25E0	5C25E0	[Preserve][LIKE][ILSEQ]
5C25EF	5C25EF	[Preserve][LIKE][ILSEQ]
5C25F9	5C25F9	[Preserve][LIKE][ILSEQ]
5C25FA	5C25FA	[Preserve][LIKE][ILSEQ]
5C25FC	5C25FC	[Preserve][LIKE][ILSEQ]
5C25FD	5C25FD	[Preserve][LIKE][ILSEQ]
5C25FE	5C25FE	[Preserve][LIKE][ILSEQ]
5C25FF	5C25FF	[Preserve][LIKE][ILSEQ]
5C2700	2700	[Trivial]
5C2708	2708	[Trivial]
5C2709	2709	[Trivial]
5C270A	270A	[Trivial]
5C270D	270D	[Trivial]
5C271A	271A	[Trivial]
5C2722	2722	[Trivial]
5C2725	2725	[Trivial]
5C2727	NULL	[SyntErr]
5C2730	2730	[Trivial]
5C273F	273F	[Trivial]
5C2740	2740	[Trivial]
5C275A	275A	[Trivial]
5C275C	NULL	[SyntErr]
5C275F	275F	[Trivial]
5C2761	2761	[Trivial]
5C2762	2762	[Trivial]
5C276E	276E	[Trivial]
5C2772	2772	[Trivial]
5C2774	2774	[Trivial]
5C277E	277E	[Trivial]
5C277F	277F	[Trivial]
5C2780	2780	[Trivial][ILSEQ]
5C2781	2781	[Trivial][ILSEQ]
5C279F	279F	[Trivial][ILSEQ]
5C27A0	27A0	[Trivial][ILSEQ]
5C27A1	27A1	[Trivial][ILSEQ]
5C27E0	27E0	[Trivial][ILSEQ]
5C27EF	27EF	[Trivial][ILSEQ]
5C27F9	27F9	[Trivial][ILSEQ]
5C27FA	27FA	[Trivial][ILSEQ]
5C27FC	27FC	[Trivial][ILSEQ]
5C27FD	27FD	[Trivial][ILSEQ]
5C27FE	27FE	[Trivial][ILSEQ]
5C27FF	27FF	[Trivial][ILSEQ]
5C3000	0000	[Regular]
5C3008	0008	[Regular]
5C3009	0009	[Regular]
5C300A	000A	[Regular]
5C300D	000D	[Regular]
5C301A	001A	[Regular]
5C3022	0022	[Regular]
5C3025	0025	[Regular]
5C3027	NULL	[SyntErr]
5C3030	0030	[Regular]
5C303F	003F	[Regular]
5C3040	0040	[Regular]
5C305A	005A	[Regular]
5C305C	NULL	[SyntErr]
5C305F	005F	[Regular]
5C3061	0061	[Regular]
5C3062	0062	[Regular]
5C306E	006E	[Regular]
5C3072	0072	[Regular]
5C3074	0074	[Regular]
5C307E	007E	[Regular]
5C307F	007F	[Regular]
5C3080	0080	[Regular][ILSEQ]
5C3081	0081	[Regular][ILSEQ]
5C309F	009F	[Regular][ILSEQ]
5C30A0	00A0	[Regular][ILSEQ]
5C30A1	00A1	[Regular][ILSEQ]
5C30E0	00E0	[Regular][ILSEQ]
5C30EF	00EF	[Regular][ILSEQ]
5C30F9	00F9	[Regular][ILSEQ]
5C30FA	00FA	[Regular][ILSEQ]
5C30FC	00FC	[Regular][ILSEQ]
5C30FD	00FD	[Regular][ILSEQ]
5C30FE	00FE	[Regular][ILSEQ]
5C30FF	00FF	[Regular][ILSEQ]
5C3F00	3F00	[Trivial]
5C3F08	3F08	[Trivial]
5C3F09	3F09	[Trivial]
5C3F0A	3F0A	[Trivial]
5C3F0D	3F0D	[Trivial]
5C3F1A	3F1A	[Trivial]
5C3F22	3F22	[Trivial]
5C3F25	3F25	[Trivial]
5C3F27	NULL	[SyntErr]
5C3F30	3F30	[Trivial]
5C3F3F	3F3F	[Trivial]
5C3F40	3F40	[Trivial]
5C3F5A	3F5A	[Trivial]
5C3F5C	NULL	[SyntErr]
5C3F5F	3F5F	[Trivial]
5C3F61	3F61	[Trivial]
5C3F62	3F62	[Trivial]
5C3F6E	3F6E	[Trivial]
5C3F72	3F72	[Trivial]
5C3F74	3F74	[Trivial]
5C3F7E	3F7E	[Trivial]
5C3F7F	3F7F	[Trivial]
5C3F80	3F80	[Trivial][ILSEQ]
5C3F81	3F81	[Trivial][ILSEQ]
5C3F9F	3F9F	[Trivial][ILSEQ]
5C3FA0	3FA0	[Trivial][ILSEQ]
5C3FA1	3FA1	[Trivial][ILSEQ]
5C3FE0	3FE0	[Trivial][ILSEQ]
5C3FEF	3FEF	[Trivial][ILSEQ]
5C3FF9	3FF9	[Trivial][ILSEQ]
5C3FFA	3FFA	[Trivial][ILSEQ]
5C3FFC	3FFC	[Trivial][ILSEQ]
5C3FFD	3FFD	[Trivial][ILSEQ]
5C3FFE	3FFE	[Trivial][ILSEQ]
5C3FFF	3FFF	[Trivial][ILSEQ]
5C4000	4000	[Trivial]
5C4008	4008	[Trivial]
5C4009	4009	[Trivial]
5C400A	400A	[Trivial]
5C400D	400D	[Trivial]
5C401A	401A	[Trivial]
5C4022	4022	[Trivial]
5C4025	4025	[Trivial]
5C4027	NULL	[SyntErr]
5C4030	4030	[Trivial]
5C403F	403F	[Trivial]
5C4040	4040	[Trivial]
5C405A	405A	[Trivial]
5C405C	NULL	[SyntErr]
5C405F	405F	[Trivial]
5C4061	4061	[Trivial]
5C4062	4062	[Trivial]
5C406E	406E	[Trivial]
5C4072	4072	[Trivial]
5C4074	4074	[Trivial]
5C407E	407E	[Trivial]
5C407F	407F	[Trivial]
5C4080	4080	[Trivial][ILSEQ]
5C4081	4081	[Trivial][ILSEQ]
5C409F	409F	[Trivial][ILSEQ]
5C40A0	40A0	[Trivial][ILSEQ]
5C40A1	40A1	[Trivial][ILSEQ]
5C40E0	40E0	[Trivial][ILSEQ]
5C40EF	40EF	[Trivial][ILSEQ]
5C40F9	40F9	[Trivial][ILSEQ]
5C40FA	40FA	[Trivial][ILSEQ]
5C40FC	40FC	[Trivial][ILSEQ]
5C40FD	40FD	[Trivial][ILSEQ]
5C40FE	40FE	[Trivial][ILSEQ]
5C40FF	40FF	[Trivial][ILSEQ]
5C5A00	1A00	[Regular]
5C5A08	1A08	[Regular]
5C5A09	1A09	[Regular]
5C5A0A	1A0A	[Regular]
5C5A0D	1A0D	[Regular]
5C5A1A	1A1A	[Regular]
5C5A22	1A22	[Regular]
5C5A25	1A25	[Regular]
5C5A27	NULL	[SyntErr]
5C5A30	1A30	[Regular]
5C5A3F	1A3F	[Regular]
5C5A40	1A40	[Regular]
5C5A5A	1A5A	[Regular]
5C5A5C	NULL	[SyntErr]
5C5A5F	1A5F	[Regular]
5C5A61	1A61	[Regular]
5C5A62	1A62	[Regular]
5C5A6E	1A6E	[Regular]
5C5A72	1A72	[Regular]
5C5A74	1A74	[Regular]
5C5A7E	1A7E	[Regular]
5C5A7F	1A7F	[Regular]
5C5A80	1A80	[Regular][ILSEQ]
5C5A81	1A81	[Regular][ILSEQ]
5C5A9F	1A9F	[Regular][ILSEQ]
5C5AA0	1AA0	[Regular][ILSEQ]
5C5AA1	1AA1	[Regular][ILSEQ]
5C5AE0	1AE0	[Regular][ILSEQ]
5C5AEF	1AEF	[Regular][ILSEQ]
5C5AF9	1AF9	[Regular][ILSEQ]
5C5AFA	1AFA	[Regular][ILSEQ]
5C5AFC	1AFC	[Regular][ILSEQ]
5C5AFD	1AFD	[Regular][ILSEQ]
5C5AFE	1AFE	[Regular][ILSEQ]
5C5AFF	1AFF	[Regular][ILSEQ]
5C5C00	5C00	[Regular]
5C5C08	5C08	[Regular]
5C5C09	5C09	[Regular]
5C5C0A	5C0A	[Regular]
5C5C0D	5C0D	[Regular]
5C5C1A	5C1A	[Regular]
5C5C22	5C22	[Regular]
5C5C25	5C25	[Regular]
5C5C27	NULL	[SyntErr]
5C5C30	5C30	[Regular]
5C5C3F	5C3F	[Regular]
5C5C40	5C40	[Regular]
5C5C5A	5C5A	[Regular]
5C5C5C	NULL	[SyntErr]
5C5C5F	5C5F	[Regular]
5C5C61	5C61	[Regular]
5C5C62	5C62	[Regular]
5C5C6E	5C6E	[Regular]
5C5C72	5C72	[Regular]
5C5C74	5C74	[Regular]
5C5C7E	5C7E	[Regular]
5C5C7F	5C7F	[Regular]
5C5C80	5C80	[Regular][ILSEQ]
5C5C81	5C81	[Regular][ILSEQ]
5C5C9F	5C9F	[Regular][ILSEQ]
5C5CA0	5CA0	[Regular][ILSEQ]
5C5CA1	5CA1	[Regular][ILSEQ]
5C5CE0	5CE0	[Regular][ILSEQ]
5C5CEF	5CEF	[Regular][ILSEQ]
5C5CF9	5CF9	[Regular][ILSEQ]
5C5CFA	5CFA	[Regular][ILSEQ]
5C5CFC	5CFC	[Regular][ILSEQ]
5C5CFD	5CFD	[Regular][ILSEQ]
5C5CFE	5CFE	[Regular][ILSEQ]
5C5CFF	5CFF	[Regular][ILSEQ]
5C5F00	5C5F00	[Preserve][LIKE]
5C5F08	5C5F08	[Preserve][LIKE]
5C5F09	5C5F09	[Preserve][LIKE]
5C5F0A	5C5F0A	[Preserve][LIKE]
5C5F0D	5C5F0D	[Preserve][LIKE]
5C5F1A	5C5F1A	[Preserve][LIKE]
5C5F22	5C5F22	[Preserve][LIKE]
5C5F25	5C5F25	[Preserve][LIKE]
5C5F27	NULL	[SyntErr]
5C5F30	5C5F30	[Preserve][LIKE]
5C5F3F	5C5F3F	[Preserve][LIKE]
5C5F40	5C5F40	[Preserve][LIKE]
5C5F5A	5C5F5A	[Preserve][LIKE]
5C5F5C	NULL	[SyntErr]
5C5F5F	5C5F5F	[Preserve][LIKE]
5C5F61	5C5F61	[Preserve][LIKE]
5C5F62	5C5F62	[Preserve][LIKE]
5C5F6E	5C5F6E	[Preserve][LIKE]
5C5F72	5C5F72	[Preserve][LIKE]
5C5F74	5C5F74	[Preserve][LIKE]
5C5F7E	5C5F7E	[Preserve][LIKE]
5C5F7F	5C5F7F	[Preserve][LIKE]
5C5F80	5C5F80	[Preserve][LIKE][ILSEQ]
5C5F81	5C5F81	[Preserve][LIKE][ILSEQ]
5C5F9F	5C5F9F	[Preserve][LIKE][ILSEQ]
5C5FA0	5C5FA0	[Preserve][LIKE][ILSEQ]
5C5FA1	5C5FA1	[Preserve][LIKE][ILSEQ]
5C5FE0	5C5FE0	[Preserve][LIKE][ILSEQ]
5C5FEF	5C5FEF	[Preserve][LIKE][ILSEQ]
5C5FF9	5C5FF9	[Preserve][LIKE][ILSEQ]
5C5FFA	5C5FFA	[Preserve][LIKE][ILSEQ]
5C5FFC	5C5FFC	[Preserve][LIKE][ILSEQ]
5C5FFD	5C5FFD	[Preserve][LIKE][ILSEQ]
5C5FFE	5C5FFE	[Preserve][LIKE][ILSEQ]
5C5FFF	5C5FFF	[Preserve][LIKE][ILSEQ]
5C6100	6100	[Trivial]
5C6108	6108	[Trivial]
5C6109	6109	[Trivial]
5C610A	610A	[Trivial]
5C610D	610D	[Trivial]
5C611A	611A	[Trivial]
5C6122	6122	[Trivial]
5C6125	6125	[Trivial]
5C6127	NULL	[SyntErr]
5C6130	6130	[Trivial]
5C613F	613F	[Trivial]
5C6140	6140	[Trivial]
5C615A	615A	[Trivial]
5C615C	NULL	[SyntErr]
5C615F	615F	[Trivial]
5C6161	6161	[Trivial]
5C6162	6162	[Trivial]
5C616E	616E	[Trivial]
5C6172	6172	[Trivial]
5C6174	6174	[Trivial]
5C617E	617E	[Trivial]
5C617F	617F	[Trivial]
5C6180	6180	[Trivial][ILSEQ]
5C6181	6181	[Trivial][ILSEQ]
5C619F	619F	[Trivial][ILSEQ]
5C61A0	61A0	[Trivial][ILSEQ]
5C61A1	61A1	[Trivial][ILSEQ]
5C61E0	61E0	[Trivial][ILSEQ]
5C61EF	61EF	[Trivial][ILSEQ]
5C61F9	61F9	[Trivial][ILSEQ]
5C61FA	61FA	[Trivial][ILSEQ]
5C61FC	61FC	[Trivial][ILSEQ]
5C61FD	61FD	[Trivial][ILSEQ]
5C61FE	61FE	[Trivial][ILSEQ]
5C61FF	61FF	[Trivial][ILSEQ]
5C6200	0800	[Regular]
5C6208	0808	[Regular]
5C6209	0809	[Regular]
5C620A	080A	[Regular]
5C620D	080D	[Regular]
5C621A	081A	[Regular]
5C6222	0822	[Regular]
5C6225	0825	[Regular]
5C6227	NULL	[SyntErr]
5C6230	0830	[Regular]
5C623F	083F	[Regular]
5C6240	0840	[Regular]
5C625A	085A	[Regular]
5C625C	NULL	[SyntErr]
5C625F	085F	[Regular]
5C6261	0861	[Regular]
5C6262	0862	[Regular]
5C626E	086E	[Regular]
5C6272	0872	[Regular]
5C6274	0874	[Regular]
5C627E	087E	[Regular]
5C627F	087F	[Regular]
5C6280	0880	[Regular][ILSEQ]
5C6281	0881	[Regular][ILSEQ]
5C629F	089F	[Regular][ILSEQ]
5C62A0	08A0	[Regular][ILSEQ]
5C62A1	08A1	[Regular][ILSEQ]
5C62E0	08E0	[Regular][ILSEQ]
5C62EF	08EF	[Regular][ILSEQ]
5C62F9	08F9	[Regular][ILSEQ]
5C62FA	08FA	[Regular][ILSEQ]
5C62FC	08FC	[Regular][ILSEQ]
5C62FD	08FD	[Regular][ILSEQ]
5C62FE	08FE	[Regular][ILSEQ]
5C62FF	08FF	[Regular][ILSEQ]
5C6E00	0A00	[Regular]
5C6E08	0A08	[Regular]
5C6E09	0A09	[Regular]
5C6E0A	0A0A	[Regular]
5C6E0D	0A0D	[Regular]
5C6E1A	0A1A	[Regular]
5C6E22	0A22	[Regular]
5C6E25	0A25	[Regular]
5C6E27	NULL	[SyntErr]
5C6E30	0A30	[Regular]
5C6E3F	0A3F	[Regular]
5C6E40	0A40	[Regular]
5C6E5A	0A5A	[Regular]
5C6E5C	NULL	[SyntErr]
5C6E5F	0A5F	[Regular]
5C6E61	0A61	[Regular]
5C6E62	0A62	[Regular]
5C6E6E	0A6E	[Regular]
5C6E72	0A72	[Regular]
5C6E74	0A74	[Regular]
5C6E7E	0A7E	[Regular]
5C6E7F	0A7F	[Regular]
5C6E80	0A80	[Regular][ILSEQ]
5C6E81	0A81	[Regular][ILSEQ]
5C6E9F	0A9F	[Regular][ILSEQ]
5C6EA0	0AA0	[Regular][ILSEQ]
5C6EA1	0AA1	[Regular][ILSEQ]
5C6EE0	0AE0	[Regular][ILSEQ]
5C6EEF	0AEF	[Regular][ILSEQ]
5C6EF9	0AF9	[Regular][ILSEQ]
5C6EFA	0AFA	[Regular][ILSEQ]
5C6EFC	0AFC	[Regular][ILSEQ]
5C6EFD	0AFD	[Regular][ILSEQ]
5C6EFE	0AFE	[Regular][ILSEQ]
5C6EFF	0AFF	[Regular][ILSEQ]
5C7200	0D00	[Regular]
5C7208	0D08	[Regular]
5C7209	0D09	[Regular]
5C720A	0D0A	[Regular]
5C720D	0D0D	[Regular]
5C721A	0D1A	[Regular]
5C7222	0D22	[Regular]
5C7225	0D25	[Regular]
5C7227	NULL	[SyntErr]
5C7230	0D30	[Regular]
5C723F	0D3F	[Regular]
5C7240	0D40	[Regular]
5C725A	0D5A	[Regular]
5C725C	NULL	[SyntErr]
5C725F	0D5F	[Regular]
5C7261	0D61	[Regular]
5C7262	0D62	[Regular]
5C726E	0D6E	[Regular]
5C7272	0D72	[Regular]
5C7274	0D74	[Regular]
5C727E	0D7E	[Regular]
5C727F	0D7F	[Regular]
5C7280	0D80	[Regular][ILSEQ]
5C7281	0D81	[Regular][ILSEQ]
5C729F	0D9F	[Regular][ILSEQ]
5C72A0	0DA0	[Regular][ILSEQ]
5C72A1	0DA1	[Regular][ILSEQ]
5C72E0	0DE0	[Regular][ILSEQ]
5C72EF	0DEF	[Regular][ILSEQ]
5C72F9	0DF9	[Regular][ILSEQ]
5C72FA	0DFA	[Regular][ILSEQ]
5C72FC	0DFC	[Regular][ILSEQ]
5C72FD	0DFD	[Regular][ILSEQ]
5C72FE	0DFE	[Regular][ILSEQ]
5C72FF	0DFF	[Regular][ILSEQ]
5C7400	0900	[Regular]
5C7408	0908	[Regular]
5C7409	0909	[Regular]
5C740A	090A	[Regular]
5C740D	090D	[Regular]
5C741A	091A	[Regular]
5C7422	0922	[Regular]
5C7425	0925	[Regular]
5C7427	NULL	[SyntErr]
5C7430	0930	[Regular]
5C743F	093F	[Regular]
5C7440	0940	[Regular]
5C745A	095A	[Regular]
5C745C	NULL	[SyntErr]
5C745F	095F	[Regular]
5C7461	0961	[Regular]
5C7462	0962	[Regular]
5C746E	096E	[Regular]
5C7472	0972	[Regular]
5C7474	0974	[Regular]
5C747E	097E	[Regular]
5C747F	097F	[Regular]
5C7480	0980	[Regular][ILSEQ]
5C7481	0981	[Regular][ILSEQ]
5C749F	099F	[Regular][ILSEQ]
5C74A0	09A0	[Regular][ILSEQ]
5C74A1	09A1	[Regular][ILSEQ]
5C74E0	09E0	[Regular][ILSEQ]
5C74EF	09EF	[Regular][ILSEQ]
5C74F9	09F9	[Regular][ILSEQ]
5C74FA	09FA	[Regular][ILSEQ]
5C74FC	09FC	[Regular][ILSEQ]
5C74FD	09FD	[Regular][ILSEQ]
5C74FE	09FE	[Regular][ILSEQ]
5C74FF	09FF	[Regular][ILSEQ]
5C7E00	7E00	[Trivial]
5C7E08	7E08	[Trivial]
5C7E09	7E09	[Trivial]
5C7E0A	7E0A	[Trivial]
5C7E0D	7E0D	[Trivial]
5C7E1A	7E1A	[Trivial]
5C7E22	7E22	[Trivial]
5C7E25	7E25	[Trivial]
5C7E27	NULL	[SyntErr]
5C7E30	7E30	[Trivial]
5C7E3F	7E3F	[Trivial]
5C7E40	7E40	[Trivial]
5C7E5A	7E5A	[Trivial]
5C7E5C	NULL	[SyntErr]
5C7E5F	7E5F	[Trivial]
5C7E61	7E61	[Trivial]
5C7E62	7E62	[Trivial]
5C7E6E	7E6E	[Trivial]
5C7E72	7E72	[Trivial]
5C7E74	7E74	[Trivial]
5C7E7E	7E7E	[Trivial]
5C7E7F	7E7F	[Trivial]
5C7E80	7E80	[Trivial][ILSEQ]
5C7E81	7E81	[Trivial][ILSEQ]
5C7E9F	7E9F	[Trivial][ILSEQ]
5C7EA0	7EA0	[Trivial][ILSEQ]
5C7EA1	7EA1	[Trivial][ILSEQ]
5C7EE0	7EE0	[Trivial][ILSEQ]
5C7EEF	7EEF	[Trivial][ILSEQ]
5C7EF9	7EF9	[Trivial][ILSEQ]
5C7EFA	7EFA	[Trivial][ILSEQ]
5C7EFC	7EFC	[Trivial][ILSEQ]
5C7EFD	7EFD	[Trivial][ILSEQ]
5C7EFE	7EFE	[Trivial][ILSEQ]
5C7EFF	7EFF	[Trivial][ILSEQ]
5C7F00	7F00	[Trivial]
5C7F08	7F08	[Trivial]
5C7F09	7F09	[Trivial]
5C7F0A	7F0A	[Trivial]
5C7F0D	7F0D	[Trivial]
5C7F1A	7F1A	[Trivial]
5C7F22	7F22	[Trivial]
5C7F25	7F25	[Trivial]
5C7F27	NULL	[SyntErr]
5C7F30	7F30	[Trivial]
5C7F3F	7F3F	[Trivial]
5C7F40	7F40	[Trivial]
5C7F5A	7F5A	[Trivial]
5C7F5C	NULL	[SyntErr]
5C7F5F	7F5F	[Trivial]
5C7F61	7F61	[Trivial]
5C7F62	7F62	[Trivial]
5C7F6E	7F6E	[Trivial]
5C7F72	7F72	[Trivial]
5C7F74	7F74	[Trivial]
5C7F7E	7F7E	[Trivial]
5C7F7F	7F7F	[Trivial]
5C7F80	7F80	[Trivial][ILSEQ]
5C7F81	7F81	[Trivial][ILSEQ]
5C7F9F	7F9F	[Trivial][ILSEQ]
5C7FA0	7FA0	[Trivial][ILSEQ]
5C7FA1	7FA1	[Trivial][ILSEQ]
5C7FE0	7FE0	[Trivial][ILSEQ]
5C7FEF	7FEF	[Trivial][ILSEQ]
5C7FF9	7FF9	[Trivial][ILSEQ]
5C7FFA	7FFA	[Trivial][ILSEQ]
5C7FFC	7FFC	[Trivial][ILSEQ]
5C7FFD	7FFD	[Trivial][ILSEQ]
5C7FFE	7FFE	[Trivial][ILSEQ]
5C7FFF	7FFF	[Trivial][ILSEQ]
5C8000	8000	[Trivial][ILSEQ]
5C8008	8008	[Trivial][ILSEQ]
5C8009	8009	[Trivial][ILSEQ]
5C800A	800A	[Trivial][ILSEQ]
5C800D	800D	[Trivial][ILSEQ]
5C801A	801A	[Trivial][ILSEQ]
5C8022	8022	[Trivial][ILSEQ]
5C8025	8025	[Trivial][ILSEQ]
5C8027	NULL	[SyntErr]
5C8030	8030	[Trivial][ILSEQ]
5C803F	803F	[Trivial][ILSEQ]
5C8040	8040	[Trivial][ILSEQ]
5C805A	805A	[Trivial][ILSEQ]
5C805C	NULL	[SyntErr]
5C805F	805F	[Trivial][ILSEQ]
5C8061	8061	[Trivial][ILSEQ]
5C8062	8062	[Trivial][ILSEQ]
5C806E	806E	[Trivial][ILSEQ]
5C8072	8072	[Trivial][ILSEQ]
5C8074	8074	[Trivial][ILSEQ]
5C807E	807E	[Trivial][ILSEQ]
5C807F	807F	[Trivial][ILSEQ]
5C8080	8080	[Trivial][ILSEQ]
5C8081	8081	[Trivial][ILSEQ]
5C809F	809F	[Trivial][ILSEQ]
5C80A0	80A0	[Trivial][ILSEQ]
5C80A1	80A1	[Trivial][ILSEQ]
5C80E0	80E0	[Trivial][ILSEQ]
5C80EF	80EF	[Trivial][ILSEQ]
5C80F9	80F9	[Trivial][ILSEQ]
5C80FA	80FA	[Trivial][ILSEQ]
5C80FC	80FC	[Trivial][ILSEQ]
5C80FD	80FD	[Trivial][ILSEQ]
5C80FE	80FE	[Trivial][ILSEQ]
5C80FF	80FF	[Trivial][ILSEQ]
5C8100	8100	[Trivial][ILSEQ]
5C8108	8108	[Trivial][ILSEQ]
5C8109	8109	[Trivial][ILSEQ]
5C810A	810A	[Trivial][ILSEQ]
5C810D	810D	[Trivial][ILSEQ]
5C811A	811A	[Trivial][ILSEQ]
5C8122	8122	[Trivial][ILSEQ]
5C8125	8125	[Trivial][ILSEQ]
5C8127	NULL	[SyntErr]
5C8130	8130	[Trivial][ILSEQ]
5C813F	813F	[Trivial][ILSEQ]
5C8140	8140	[Trivial][ILSEQ]
5C815A	815A	[Trivial][ILSEQ]
5C815C	NULL	[SyntErr]
5C815F	815F	[Trivial][ILSEQ]
5C8161	8161	[Trivial][ILSEQ]
5C8162	8162	[Trivial][ILSEQ]
5C816E	816E	[Trivial][ILSEQ]
5C8172	8172	[Trivial][ILSEQ]
5C8174	8174	[Trivial][ILSEQ]
5C817E	817E	[Trivial][ILSEQ]
5C817F	817F	[Trivial][ILSEQ]
5C8180	8180	[Trivial][ILSEQ]
5C8181	8181	[Trivial][ILSEQ]
5C819F	819F	[Trivial][ILSEQ]
5C81A0	81A0	[Trivial][ILSEQ]
5C81A1	81A1	[Trivial][ILSEQ]
5C81E0	81E0	[Trivial][ILSEQ]
5C81EF	81EF	[Trivial][ILSEQ]
5C81F9	81F9	[Trivial][ILSEQ]
5C81FA	81FA	[Trivial][ILSEQ]
5C81FC	81FC	[Trivial][ILSEQ]
5C81FD	81FD	[Trivial][ILSEQ]
5C81FE	81FE	[Trivial][ILSEQ]
5C81FF	81FF	[Trivial][ILSEQ]
5C9F00	9F00	[Trivial][ILSEQ]
5C9F08	9F08	[Trivial][ILSEQ]
5C9F09	9F09	[Trivial][ILSEQ]
5C9F0A	9F0A	[Trivial][ILSEQ]
5C9F0D	9F0D	[Trivial][ILSEQ]
5C9F1A	9F1A	[Trivial][ILSEQ]
5C9F22	9F22	[Trivial][ILSEQ]
5C9F25	9F25	[Trivial][ILSEQ]
5C9F27	NULL	[SyntErr]
5C9F30	9F30	[Trivial][ILSEQ]
5C9F3F	9F3F	[Trivial][ILSEQ]
5C9F40	9F40	[Trivial][ILSEQ]
5C9F5A	9F5A	[Trivial][ILSEQ]
5C9F5C	NULL	[SyntErr]
5C9F5F	9F5F	[Trivial][ILSEQ]
5C9F61	9F61	[Trivial][ILSEQ]
5C9F62	9F62	[Trivial][ILSEQ]
5C9F6E	9F6E	[Trivial][ILSEQ]
5C9F72	9F72	[Trivial][ILSEQ]
5C9F74	9F74	[Trivial][ILSEQ]
5C9F7E	9F7E	[Trivial][ILSEQ]
5C9F7F	9F7F	[Trivial][ILSEQ]
5C9F80	9F80	[Trivial][ILSEQ]
5C9F81	9F81	[Trivial][ILSEQ]
5C9F9F	9F9F	[Trivial][ILSEQ]
5C9FA0	9FA0	[Trivial][ILSEQ]
5C9FA1	9FA1	[Trivial][ILSEQ]
5C9FE0	9FE0	[Trivial][ILSEQ]
5C9FEF	9FEF	[Trivial][ILSEQ]
5C9FF9	9FF9	[Trivial][ILSEQ]
5C9FFA	9FFA	[Trivial][ILSEQ]
5C9FFC	9FFC	[Trivial][ILSEQ]
5C9FFD	9FFD	[Trivial][ILSEQ]
5C9FFE	9FFE	[Trivial][ILSEQ]
5C9FFF	9FFF	[Trivial][ILSEQ]
5CA000	A000	[Trivial][ILSEQ]
5CA008	A008	[Trivial][ILSEQ]
5CA009	A009	[Trivial][ILSEQ]
5CA00A	A00A	[Trivial][ILSEQ]
5CA00D	A00D	[Trivial][ILSEQ]
5CA01A	A01A	[Trivial][ILSEQ]
5CA022	A022	[Trivial][ILSEQ]
5CA025	A025	[Trivial][ILSEQ]
5CA027	NULL	[SyntErr]
5CA030	A030	[Trivial][ILSEQ]
5CA03F	A03F	[Trivial][ILSEQ]
5CA040	A040	[Trivial][ILSEQ]
5CA05A	A05A	[Trivial][ILSEQ]
5CA05C	NULL	[SyntErr]
5CA05F	A05F	[Trivial][ILSEQ]
5CA061	A061	[Trivial][ILSEQ]
5CA062	A062	[Trivial][ILSEQ]
5CA06E	A06E	[Trivial][ILSEQ]
5CA072	A072	[Trivial][ILSEQ]
5CA074	A074	[Trivial][ILSEQ]
5CA07E	A07E	[Trivial][ILSEQ]
5CA07F	A07F	[Trivial][ILSEQ]
5CA080	A080	[Trivial][ILSEQ]
5CA081	A081	[Trivial][ILSEQ]
5CA09F	A09F	[Trivial][ILSEQ]
5CA0A0	A0A0	[Trivial][ILSEQ]
5CA0A1	A0A1	[Trivial][ILSEQ]
5CA0E0	A0E0	[Trivial][ILSEQ]
5CA0EF	A0EF	[Trivial][ILSEQ]
5CA0F9	A0F9	[Trivial][ILSEQ]
5CA0FA	A0FA	[Trivial][ILSEQ]
5CA0FC	A0FC	[Trivial][ILSEQ]
5CA0FD	A0FD	[Trivial][ILSEQ]
5CA0FE	A0FE	[Trivial][ILSEQ]
5CA0FF	A0FF	[Trivial][ILSEQ]
5CA100	A100	[Trivial][ILSEQ]
5CA108	A108	[Trivial][ILSEQ]
5CA109	A109	[Trivial][ILSEQ]
5CA10A	A10A	[Trivial][ILSEQ]
5CA10D	A10D	[Trivial][ILSEQ]
5CA11A	A11A	[Trivial][ILSEQ]
5CA122	A122	[Trivial][ILSEQ]
5CA125	A125	[Trivial][ILSEQ]
5CA127	NULL	[SyntErr]
5CA130	A130	[Trivial][ILSEQ]
5CA13F	A13F	[Trivial][ILSEQ]
5CA140	A140	[Trivial][ILSEQ]
5CA15A	A15A	[Trivial][ILSEQ]
5CA15C	NULL	[SyntErr]
5CA15F	A15F	[Trivial][ILSEQ]
5CA161	A161	[Trivial][ILSEQ]
5CA162	A162	[Trivial][ILSEQ]
5CA16E	A16E	[Trivial][ILSEQ]
5CA172	A172	[Trivial][ILSEQ]
5CA174	A174	[Trivial][ILSEQ]
5CA17E	A17E	[Trivial][ILSEQ]
5CA17F	A17F	[Trivial][ILSEQ]
5CA180	A180	[Trivial][ILSEQ]
5CA181	A181	[Trivial][ILSEQ]
5CA19F	A19F	[Trivial][ILSEQ]
5CA1A0	A1A0	[Trivial][ILSEQ]
5CA1A1	A1A1	[Trivial][ILSEQ]
5CA1E0	A1E0	[Trivial][ILSEQ]
5CA1EF	A1EF	[Trivial][ILSEQ]
5CA1F9	A1F9	[Trivial][ILSEQ]
5CA1FA	A1FA	[Trivial][ILSEQ]
5CA1FC	A1FC	[Trivial][ILSEQ]
5CA1FD	A1FD	[Trivial][ILSEQ]
5CA1FE	A1FE	[Trivial][ILSEQ]
5CA1FF	A1FF	[Trivial][ILSEQ]
5CE000	E000	[Trivial][ILSEQ]
5CE008	E008	[Trivial][ILSEQ]
5CE009	E009	[Trivial][ILSEQ]
5CE00A	E00A	[Trivial][ILSEQ]
5CE00D	E00D	[Trivial][ILSEQ]
5CE01A	E01A	[Trivial][ILSEQ]
5CE022	E022	[Trivial][ILSEQ]
5CE025	E025	[Trivial][ILSEQ]
5CE027	NULL	[SyntErr]
5CE030	E030	[Trivial][ILSEQ]
5CE03F	E03F	[Trivial][ILSEQ]
5CE040	E040	[Trivial][ILSEQ]
5CE05A	E05A	[Trivial][ILSEQ]
5CE05C	NULL	[SyntErr]
5CE05F	E05F	[Trivial][ILSEQ]
5CE061	E061	[Trivial][ILSEQ]
5CE062	E062	[Trivial][ILSEQ]
5CE06E	E06E	[Trivial][ILSEQ]
5CE072	E072	[Trivial][ILSEQ]
5CE074	E074	[Trivial][ILSEQ]
5CE07E	E07E	[Trivial][ILSEQ]
5CE07F	E07F	[Trivial][ILSEQ]
5CE080	E080	[Trivial][ILSEQ]
5CE081	E081	[Trivial][ILSEQ]
5CE09F	E09F	[Trivial][ILSEQ]
5CE0A0	E0A0	[Trivial][ILSEQ]
5CE0A1	E0A1	[Trivial][ILSEQ]
5CE0E0	E0E0	[Trivial][ILSEQ]
5CE0EF	E0EF	[Trivial][ILSEQ]
5CE0F9	E0F9	[Trivial][ILSEQ]
5CE0FA	E0FA	[Trivial][ILSEQ]
5CE0FC	E0FC	[Trivial][ILSEQ]
5CE0FD	E0FD	[Trivial][ILSEQ]
5CE0FE	E0FE	[Trivial][ILSEQ]
5CE0FF	E0FF	[Trivial][ILSEQ]
5CEF00	EF00	[Trivial][ILSEQ]
5CEF08	EF08	[Trivial][ILSEQ]
5CEF09	EF09	[Trivial][ILSEQ]
5CEF0A	EF0A	[Trivial][ILSEQ]
5CEF0D	EF0D	[Trivial][ILSEQ]
5CEF1A	EF1A	[Trivial][ILSEQ]
5CEF22	EF22	[Trivial][ILSEQ]
5CEF25	EF25	[Trivial][ILSEQ]
5CEF27	NULL	[SyntErr]
5CEF30	EF30	[Trivial][ILSEQ]
5CEF3F	EF3F	[Trivial][ILSEQ]
5CEF40	EF40	[Trivial][ILSEQ]
5CEF5A	EF5A	[Trivial][ILSEQ]
5CEF5C	NULL	[SyntErr]
5CEF5F	EF5F	[Trivial][ILSEQ]
5CEF61	EF61	[Trivial][ILSEQ]
5CEF62	EF62	[Trivial][ILSEQ]
5CEF6E	EF6E	[Trivial][ILSEQ]
5CEF72	EF72	[Trivial][ILSEQ]
5CEF74	EF74	[Trivial][ILSEQ]
5CEF7E	EF7E	[Trivial][ILSEQ]
5CEF7F	EF7F	[Trivial][ILSEQ]
5CEF80	EF80	[Trivial][ILSEQ]
5CEF81	EF81	[Trivial][ILSEQ]
5CEF9F	EF9F	[Trivial][ILSEQ]
5CEFA0	EFA0	[Trivial][ILSEQ]
5CEFA1	EFA1	[Trivial][ILSEQ]
5CEFE0	EFE0	[Trivial][ILSEQ]
5CEFEF	EFEF	[Trivial][ILSEQ]
5CEFF9	EFF9	[Trivial][ILSEQ]
5CEFFA	EFFA	[Trivial][ILSEQ]
5CEFFC	EFFC	[Trivial][ILSEQ]
5CEFFD	EFFD	[Trivial][ILSEQ]
5CEFFE	EFFE	[Trivial][ILSEQ]
5CEFFF	EFFF	[Trivial][ILSEQ]
5CF900	F900	[Trivial][ILSEQ]
5CF908	F908	[Trivial][ILSEQ]
5CF909	F909	[Trivial][ILSEQ]
5CF90A	F90A	[Trivial][ILSEQ]
5CF90D	F90D	[Trivial][ILSEQ]
5CF91A	F91A	[Trivial][ILSEQ]
5CF922	F922	[Trivial][ILSEQ]
5CF925	F925	[Trivial][ILSEQ]
5CF927	NULL	[SyntErr]
5CF930	F930	[Trivial][ILSEQ]
5CF93F	F93F	[Trivial][ILSEQ]
5CF940	F940	[Trivial][ILSEQ]
5CF95A	F95A	[Trivial][ILSEQ]
5CF95C	NULL	[SyntErr]
5CF95F	F95F	[Trivial][ILSEQ]
5CF961	F961	[Trivial][ILSEQ]
5CF962	F962	[Trivial][ILSEQ]
5CF96E	F96E	[Trivial][ILSEQ]
5CF972	F972	[Trivial][ILSEQ]
5CF974	F974	[Trivial][ILSEQ]
5CF97E	F97E	[Trivial][ILSEQ]
5CF97F	F97F	[Trivial][ILSEQ]
5CF980	F980	[Trivial][ILSEQ]
5CF981	F981	[Trivial][ILSEQ]
5CF99F	F99F	[Trivial][ILSEQ]
5CF9A0	F9A0	[Trivial][ILSEQ]
5CF9A1	F9A1	[Trivial][ILSEQ]
5CF9E0	F9E0	[Trivial][ILSEQ]
5CF9EF	F9EF	[Trivial][ILSEQ]
5CF9F9	F9F9	[Trivial][ILSEQ]
5CF9FA	F9FA	[Trivial][ILSEQ]
5CF9FC	F9FC	[Trivial][ILSEQ]
5CF9FD	F9FD	[Trivial][ILSEQ]
5CF9FE	F9FE	[Trivial][ILSEQ]
5CF9FF	F9FF	[Trivial][ILSEQ]
5CFA00	FA00	[Trivial][ILSEQ]
5CFA08	FA08	[Trivial][ILSEQ]
5CFA09	FA09	[Trivial][ILSEQ]
5CFA0A	FA0A	[Trivial][ILSEQ]
5CFA0D	FA0D	[Trivial][ILSEQ]
5CFA1A	FA1A	[Trivial][ILSEQ]
5CFA22	FA22	[Trivial][ILSEQ]
5CFA25	FA25	[Trivial][ILSEQ]
5CFA27	NULL	[SyntErr]
5CFA30	FA30	[Trivial][ILSEQ]
5CFA3F	FA3F	[Trivial][ILSEQ]
5CFA40	FA40	[Trivial][ILSEQ]
5CFA5A	FA5A	[Trivial][ILSEQ]
5CFA5C	NULL	[SyntErr]
5CFA5F	FA5F	[Trivial][ILSEQ]
5CFA61	FA61	[Trivial][ILSEQ]
5CFA62	FA62	[Trivial][ILSEQ]
5CFA6E	FA6E	[Trivial][ILSEQ]
5CFA72	FA72	[Trivial][ILSEQ]
5CFA74	FA74	[Trivial][ILSEQ]
5CFA7E	FA7E	[Trivial][ILSEQ]
5CFA7F	FA7F	[Trivial][ILSEQ]
5CFA80	FA80	[Trivial][ILSEQ]
5CFA81	FA81	[Trivial][ILSEQ]
5CFA9F	FA9F	[Trivial][ILSEQ]
5CFAA0	FAA0	[Trivial][ILSEQ]
5CFAA1	FAA1	[Trivial][ILSEQ]
5CFAE0	FAE0	[Trivial][ILSEQ]
5CFAEF	FAEF	[Trivial][ILSEQ]
5CFAF9	FAF9	[Trivial][ILSEQ]
5CFAFA	FAFA	[Trivial][ILSEQ]
5CFAFC	FAFC	[Trivial][ILSEQ]
5CFAFD	FAFD	[Trivial][ILSEQ]
5CFAFE	FAFE	[Trivial][ILSEQ]
5CFAFF	FAFF	[Trivial][ILSEQ]
5CFC00	FC00	[Trivial][ILSEQ]
5CFC08	FC08	[Trivial][ILSEQ]
5CFC09	FC09	[Trivial][ILSEQ]
5CFC0A	FC0A	[Trivial][ILSEQ]
5CFC0D	FC0D	[Trivial][ILSEQ]
5CFC1A	FC1A	[Trivial][ILSEQ]
5CFC22	FC22	[Trivial][ILSEQ]
5CFC25	FC25	[Trivial][ILSEQ]
5CFC27	NULL	[SyntErr]
5CFC30	FC30	[Trivial][ILSEQ]
5CFC3F	FC3F	[Trivial][ILSEQ]
5CFC40	FC40	[Trivial][ILSEQ]
5CFC5A	FC5A	[Trivial][ILSEQ]
5CFC5C	NULL	[SyntErr]
5CFC5F	FC5F	[Trivial][ILSEQ]
5CFC61	FC61	[Trivial][ILSEQ]
5CFC62	FC62	[Trivial][ILSEQ]
5CFC6E	FC6E	[Trivial][ILSEQ]
5CFC72	FC72	[Trivial][ILSEQ]
5CFC74	FC74	[Trivial][ILSEQ]
5CFC7E	FC7E	[Trivial][ILSEQ]
5CFC7F	FC7F	[Trivial][ILSEQ]
5CFC80	FC80	[Trivial][ILSEQ]
5CFC81	FC81	[Trivial][ILSEQ]
5CFC9F	FC9F	[Trivial][ILSEQ]
5CFCA0	FCA0	[Trivial][ILSEQ]
5CFCA1	FCA1	[Trivial][ILSEQ]
5CFCE0	FCE0	[Trivial][ILSEQ]
5CFCEF	FCEF	[Trivial][ILSEQ]
5CFCF9	FCF9	[Trivial][ILSEQ]
5CFCFA	FCFA	[Trivial][ILSEQ]
5CFCFC	FCFC	[Trivial][ILSEQ]
5CFCFD	FCFD	[Trivial][ILSEQ]
5CFCFE	FCFE	[Trivial][ILSEQ]
5CFCFF	FCFF	[Trivial][ILSEQ]
5CFD00	FD00	[Trivial][ILSEQ]
5CFD08	FD08	[Trivial][ILSEQ]
5CFD09	FD09	[Trivial][ILSEQ]
5CFD0A	FD0A	[Trivial][ILSEQ]
5CFD0D	FD0D	[Trivial][ILSEQ]
5CFD1A	FD1A	[Trivial][ILSEQ]
5CFD22	FD22	[Trivial][ILSEQ]
5CFD25	FD25	[Trivial][ILSEQ]
5CFD27	NULL	[SyntErr]
5CFD30	FD30	[Trivial][ILSEQ]
5CFD3F	FD3F	[Trivial][ILSEQ]
5CFD40	FD40	[Trivial][ILSEQ]
5CFD5A	FD5A	[Trivial][ILSEQ]
5CFD5C	NULL	[SyntErr]
5CFD5F	FD5F	[Trivial][ILSEQ]
5CFD61	FD61	[Trivial][ILSEQ]
5CFD62	FD62	[Trivial][ILSEQ]
5CFD6E	FD6E	[Trivial][ILSEQ]
5CFD72	FD72	[Trivial][ILSEQ]
5CFD74	FD74	[Trivial][ILSEQ]
5CFD7E	FD7E	[Trivial][ILSEQ]
5CFD7F	FD7F	[Trivial][ILSEQ]
5CFD80	FD80	[Trivial][ILSEQ]
5CFD81	FD81	[Trivial][ILSEQ]
5CFD9F	FD9F	[Trivial][ILSEQ]
5CFDA0	FDA0	[Trivial][ILSEQ]
5CFDA1	FDA1	[Trivial][ILSEQ]
5CFDE0	FDE0	[Trivial][ILSEQ]
5CFDEF	FDEF	[Trivial][ILSEQ]
5CFDF9	FDF9	[Trivial][ILSEQ]
5CFDFA	FDFA	[Trivial][ILSEQ]
5CFDFC	FDFC	[Trivial][ILSEQ]
5CFDFD	FDFD	[Trivial][ILSEQ]
5CFDFE	FDFE	[Trivial][ILSEQ]
5CFDFF	FDFF	[Trivial][ILSEQ]
5CFE00	FE00	[Trivial][ILSEQ]
5CFE08	FE08	[Trivial][ILSEQ]
5CFE09	FE09	[Trivial][ILSEQ]
5CFE0A	FE0A	[Trivial][ILSEQ]
5CFE0D	FE0D	[Trivial][ILSEQ]
5CFE1A	FE1A	[Trivial][ILSEQ]
5CFE22	FE22	[Trivial][ILSEQ]
5CFE25	FE25	[Trivial][ILSEQ]
5CFE27	NULL	[SyntErr]
5CFE30	FE30	[Trivial][ILSEQ]
5CFE3F	FE3F	[Trivial][ILSEQ]
5CFE40	FE40	[Trivial][ILSEQ]
5CFE5A	FE5A	[Trivial][ILSEQ]
5CFE5C	NULL	[SyntErr]
5CFE5F	FE5F	[Trivial][ILSEQ]
5CFE61	FE61	[Trivial][ILSEQ]
5CFE62	FE62	[Trivial][ILSEQ]
5CFE6E	FE6E	[Trivial][ILSEQ]
5CFE72	FE72	[Trivial][ILSEQ]
5CFE74	FE74	[Trivial][ILSEQ]
5CFE7E	FE7E	[Trivial][ILSEQ]
5CFE7F	FE7F	[Trivial][ILSEQ]
5CFE80	FE80	[Trivial][ILSEQ]
5CFE81	FE81	[Trivial][ILSEQ]
5CFE9F	FE9F	[Trivial][ILSEQ]
5CFEA0	FEA0	[Trivial][ILSEQ]
5CFEA1	FEA1	[Trivial][ILSEQ]
5CFEE0	FEE0	[Trivial][ILSEQ]
5CFEEF	FEEF	[Trivial][ILSEQ]
5CFEF9	FEF9	[Trivial][ILSEQ]
5CFEFA	FEFA	[Trivial][ILSEQ]
5CFEFC	FEFC	[Trivial][ILSEQ]
5CFEFD	FEFD	[Trivial][ILSEQ]
5CFEFE	FEFE	[Trivial][ILSEQ]
5CFEFF	FEFF	[Trivial][ILSEQ]
5CFF00	FF00	[Trivial][ILSEQ]
5CFF08	FF08	[Trivial][ILSEQ]
5CFF09	FF09	[Trivial][ILSEQ]
5CFF0A	FF0A	[Trivial][ILSEQ]
5CFF0D	FF0D	[Trivial][ILSEQ]
5CFF1A	FF1A	[Trivial][ILSEQ]
5CFF22	FF22	[Trivial][ILSEQ]
5CFF25	FF25	[Trivial][ILSEQ]
5CFF27	NULL	[SyntErr]
5CFF30	FF30	[Trivial][ILSEQ]
5CFF3F	FF3F	[Trivial][ILSEQ]
5CFF40	FF40	[Trivial][ILSEQ]
5CFF5A	FF5A	[Trivial][ILSEQ]
5CFF5C	NULL	[SyntErr]
5CFF5F	FF5F	[Trivial][ILSEQ]
5CFF61	FF61	[Trivial][ILSEQ]
5CFF62	FF62	[Trivial][ILSEQ]
5CFF6E	FF6E	[Trivial][ILSEQ]
5CFF72	FF72	[Trivial][ILSEQ]
5CFF74	FF74	[Trivial][ILSEQ]
5CFF7E	FF7E	[Trivial][ILSEQ]
5CFF7F	FF7F	[Trivial][ILSEQ]
5CFF80	FF80	[Trivial][ILSEQ]
5CFF81	FF81	[Trivial][ILSEQ]
5CFF9F	FF9F	[Trivial][ILSEQ]
5CFFA0	FFA0	[Trivial][ILSEQ]
5CFFA1	FFA1	[Trivial][ILSEQ]
5CFFE0	FFE0	[Trivial][ILSEQ]
5CFFEF	FFEF	[Trivial][ILSEQ]
5CFFF9	FFF9	[Trivial][ILSEQ]
5CFFFA	FFFA	[Trivial][ILSEQ]
5CFFFC	FFFC	[Trivial][ILSEQ]
5CFFFD	FFFD	[Trivial][ILSEQ]
5CFFFE	FFFE	[Trivial][ILSEQ]
5CFFFF	FFFF	[Trivial][ILSEQ]
5C005C00	0000	[Trivial]
5C005C08	0008	[Trivial]
5C005C09	0009	[Trivial]
5C005C0A	000A	[Trivial]
5C005C0D	000D	[Trivial]
5C005C1A	001A	[Trivial]
5C005C22	0022	[Trivial]
5C005C25	005C25	[Regular]
5C005C27	0027	[Trivial]
5C005C30	0000	[Regular]
5C005C3F	003F	[Trivial]
5C005C40	0040	[Trivial]
5C005C5A	001A	[Regular]
5C005C5C	005C	[Regular]
5C005C5F	005C5F	[Regular]
5C005C61	0061	[Trivial]
5C005C62	0008	[Regular]
5C005C6E	000A	[Regular]
5C005C72	000D	[Regular]
5C005C74	0009	[Regular]
5C005C7E	007E	[Trivial]
5C005C7F	007F	[Trivial]
5C005C80	0080	[Trivial][ILSEQ]
5C005C81	0081	[Trivial][ILSEQ]
5C005C9F	009F	[Trivial][ILSEQ]
5C005CA0	00A0	[Trivial][ILSEQ]
5C005CA1	00A1	[Trivial][ILSEQ]
5C005CE0	00E0	[Trivial][ILSEQ]
5C005CEF	00EF	[Trivial][ILSEQ]
5C005CF9	00F9	[Trivial][ILSEQ]
5C005CFA	00FA	[Trivial][ILSEQ]
5C005CFC	00FC	[Trivial][ILSEQ]
5C005CFD	00FD	[Trivial][ILSEQ]
5C005CFE	00FE	[Trivial][ILSEQ]
5C005CFF	00FF	[Trivial][ILSEQ]
5C085C00	0800	[Trivial]
5C085C08	0808	[Trivial]
5C085C09	0809	[Trivial]
5C085C0A	080A	[Trivial]
5C085C0D	080D	[Trivial]
5C085C1A	081A	[Trivial]
5C085C22	0822	[Trivial]
5C085C25	085C25	[Regular]
5C085C27	0827	[Trivial]
5C085C30	0800	[Regular]
5C085C3F	083F	[Trivial]
5C085C40	0840	[Trivial]
5C085C5A	081A	[Regular]
5C085C5C	085C	[Regular]
5C085C5F	085C5F	[Regular]
5C085C61	0861	[Trivial]
5C085C62	0808	[Regular]
5C085C6E	080A	[Regular]
5C085C72	080D	[Regular]
5C085C74	0809	[Regular]
5C085C7E	087E	[Trivial]
5C085C7F	087F	[Trivial]
5C085C80	0880	[Trivial][ILSEQ]
5C085C81	0881	[Trivial][ILSEQ]
5C085C9F	089F	[Trivial][ILSEQ]
5C085CA0	08A0	[Trivial][ILSEQ]
5C085CA1	08A1	[Trivial][ILSEQ]
5C085CE0	08E0	[Trivial][ILSEQ]
5C085CEF	08EF	[Trivial][ILSEQ]
5C085CF9	08F9	[Trivial][ILSEQ]
5C085CFA	08FA	[Trivial][ILSEQ]
5C085CFC	08FC	[Trivial][ILSEQ]
5C085CFD	08FD	[Trivial][ILSEQ]
5C085CFE	08FE	[Trivial][ILSEQ]
5C085CFF	08FF	[Trivial][ILSEQ]
5C095C00	0900	[Trivial]
5C095C08	0908	[Trivial]
5C095C09	0909	[Trivial]
5C095C0A	090A	[Trivial]
5C095C0D	090D	[Trivial]
5C095C1A	091A	[Trivial]
5C095C22	0922	[Trivial]
5C095C25	095C25	[Regular]
5C095C27	0927	[Trivial]
5C095C30	0900	[Regular]
5C095C3F	093F	[Trivial]
5C095C40	0940	[Trivial]
5C095C5A	091A	[Regular]
5C095C5C	095C	[Regular]
5C095C5F	095C5F	[Regular]
5C095C61	0961	[Trivial]
5C095C62	0908	[Regular]
5C095C6E	090A	[Regular]
5C095C72	090D	[Regular]
5C095C74	0909	[Regular]
5C095C7E	097E	[Trivial]
5C095C7F	097F	[Trivial]
5C095C80	0980	[Trivial][ILSEQ]
5C095C81	0981	[Trivial][ILSEQ]
5C095C9F	099F	[Trivial][ILSEQ]
5C095CA0	09A0	[Trivial][ILSEQ]
5C095CA1	09A1	[Trivial][ILSEQ]
5C095CE0	09E0	[Trivial][ILSEQ]
5C095CEF	09EF	[Trivial][ILSEQ]
5C095CF9	09F9	[Trivial][ILSEQ]
5C095CFA	09FA	[Trivial][ILSEQ]
5C095CFC	09FC	[Trivial][ILSEQ]
5C095CFD	09FD	[Trivial][ILSEQ]
5C095CFE	09FE	[Trivial][ILSEQ]
5C095CFF	09FF	[Trivial][ILSEQ]
5C0A5C00	0A00	[Trivial]
5C0A5C08	0A08	[Trivial]
5C0A5C09	0A09	[Trivial]
5C0A5C0A	0A0A	[Trivial]
5C0A5C0D	0A0D	[Trivial]
5C0A5C1A	0A1A	[Trivial]
5C0A5C22	0A22	[Trivial]
5C0A5C25	0A5C25	[Regular]
5C0A5C27	0A27	[Trivial]
5C0A5C30	0A00	[Regular]
5C0A5C3F	0A3F	[Trivial]
5C0A5C40	0A40	[Trivial]
5C0A5C5A	0A1A	[Regular]
5C0A5C5C	0A5C	[Regular]
5C0A5C5F	0A5C5F	[Regular]
5C0A5C61	0A61	[Trivial]
5C0A5C62	0A08	[Regular]
5C0A5C6E	0A0A	[Regular]
5C0A5C72	0A0D	[Regular]
5C0A5C74	0A09	[Regular]
5C0A5C7E	0A7E	[Trivial]
5C0A5C7F	0A7F	[Trivial]
5C0A5C80	0A80	[Trivial][ILSEQ]
5C0A5C81	0A81	[Trivial][ILSEQ]
5C0A5C9F	0A9F	[Trivial][ILSEQ]
5C0A5CA0	0AA0	[Trivial][ILSEQ]
5C0A5CA1	0AA1	[Trivial][ILSEQ]
5C0A5CE0	0AE0	[Trivial][ILSEQ]
5C0A5CEF	0AEF	[Trivial][ILSEQ]
5C0A5CF9	0AF9	[Trivial][ILSEQ]
5C0A5CFA	0AFA	[Trivial][ILSEQ]
5C0A5CFC	0AFC	[Trivial][ILSEQ]
5C0A5CFD	0AFD	[Trivial][ILSEQ]
5C0A5CFE	0AFE	[Trivial][ILSEQ]
5C0A5CFF	0AFF	[Trivial][ILSEQ]
5C0D5C00	0D00	[Trivial]
5C0D5C08	0D08	[Trivial]
5C0D5C09	0D09	[Trivial]
5C0D5C0A	0D0A	[Trivial]
5C0D5C0D	0D0D	[Trivial]
5C0D5C1A	0D1A	[Trivial]
5C0D5C22	0D22	[Trivial]
5C0D5C25	0D5C25	[Regular]
5C0D5C27	0D27	[Trivial]
5C0D5C30	0D00	[Regular]
5C0D5C3F	0D3F	[Trivial]
5C0D5C40	0D40	[Trivial]
5C0D5C5A	0D1A	[Regular]
5C0D5C5C	0D5C	[Regular]
5C0D5C5F	0D5C5F	[Regular]
5C0D5C61	0D61	[Trivial]
5C0D5C62	0D08	[Regular]
5C0D5C6E	0D0A	[Regular]
5C0D5C72	0D0D	[Regular]
5C0D5C74	0D09	[Regular]
5C0D5C7E	0D7E	[Trivial]
5C0D5C7F	0D7F	[Trivial]
5C0D5C80	0D80	[Trivial][ILSEQ]
5C0D5C81	0D81	[Trivial][ILSEQ]
5C0D5C9F	0D9F	[Trivial][ILSEQ]
5C0D5CA0	0DA0	[Trivial][ILSEQ]
5C0D5CA1	0DA1	[Trivial][ILSEQ]
5C0D5CE0	0DE0	[Trivial][ILSEQ]
5C0D5CEF	0DEF	[Trivial][ILSEQ]
5C0D5CF9	0DF9	[Trivial][ILSEQ]
5C0D5CFA	0DFA	[Trivial][ILSEQ]
5C0D5CFC	0DFC	[Trivial][ILSEQ]
5C0D5CFD	0DFD	[Trivial][ILSEQ]
5C0D5CFE	0DFE	[Trivial][ILSEQ]
5C0D5CFF	0DFF	[Trivial][ILSEQ]
5C1A5C00	1A00	[Trivial]
5C1A5C08	1A08	[Trivial]
5C1A5C09	1A09	[Trivial]
5C1A5C0A	1A0A	[Trivial]
5C1A5C0D	1A0D	[Trivial]
5C1A5C1A	1A1A	[Trivial]
5C1A5C22	1A22	[Trivial]
5C1A5C25	1A5C25	[Regular]
5C1A5C27	1A27	[Trivial]
5C1A5C30	1A00	[Regular]
5C1A5C3F	1A3F	[Trivial]
5C1A5C40	1A40	[Trivial]
5C1A5C5A	1A1A	[Regular]
5C1A5C5C	1A5C	[Regular]
5C1A5C5F	1A5C5F	[Regular]
5C1A5C61	1A61	[Trivial]
5C1A5C62	1A08	[Regular]
5C1A5C6E	1A0A	[Regular]
5C1A5C72	1A0D	[Regular]
5C1A5C74	1A09	[Regular]
5C1A5C7E	1A7E	[Trivial]
5C1A5C7F	1A7F	[Trivial]
5C1A5C80	1A80	[Trivial][ILSEQ]
5C1A5C81	1A81	[Trivial][ILSEQ]
5C1A5C9F	1A9F	[Trivial][ILSEQ]
5C1A5CA0	1AA0	[Trivial][ILSEQ]
5C1A5CA1	1AA1	[Trivial][ILSEQ]
5C1A5CE0	1AE0	[Trivial][ILSEQ]
5C1A5CEF	1AEF	[Trivial][ILSEQ]
5C1A5CF9	1AF9	[Trivial][ILSEQ]
5C1A5CFA	1AFA	[Trivial][ILSEQ]
5C1A5CFC	1AFC	[Trivial][ILSEQ]
5C1A5CFD	1AFD	[Trivial][ILSEQ]
5C1A5CFE	1AFE	[Trivial][ILSEQ]
5C1A5CFF	1AFF	[Trivial][ILSEQ]
5C225C00	2200	[Trivial]
5C225C08	2208	[Trivial]
5C225C09	2209	[Trivial]
5C225C0A	220A	[Trivial]
5C225C0D	220D	[Trivial]
5C225C1A	221A	[Trivial]
5C225C22	2222	[Trivial]
5C225C25	225C25	[Regular]
5C225C27	2227	[Trivial]
5C225C30	2200	[Regular]
5C225C3F	223F	[Trivial]
5C225C40	2240	[Trivial]
5C225C5A	221A	[Regular]
5C225C5C	225C	[Regular]
5C225C5F	225C5F	[Regular]
5C225C61	2261	[Trivial]
5C225C62	2208	[Regular]
5C225C6E	220A	[Regular]
5C225C72	220D	[Regular]
5C225C74	2209	[Regular]
5C225C7E	227E	[Trivial]
5C225C7F	227F	[Trivial]
5C225C80	2280	[Trivial][ILSEQ]
5C225C81	2281	[Trivial][ILSEQ]
5C225C9F	229F	[Trivial][ILSEQ]
5C225CA0	22A0	[Trivial][ILSEQ]
5C225CA1	22A1	[Trivial][ILSEQ]
5C225CE0	22E0	[Trivial][ILSEQ]
5C225CEF	22EF	[Trivial][ILSEQ]
5C225CF9	22F9	[Trivial][ILSEQ]
5C225CFA	22FA	[Trivial][ILSEQ]
5C225CFC	22FC	[Trivial][ILSEQ]
5C225CFD	22FD	[Trivial][ILSEQ]
5C225CFE	22FE	[Trivial][ILSEQ]
5C225CFF	22FF	[Trivial][ILSEQ]
5C255C00	5C2500	[Regular]
5C255C08	5C2508	[Regular]
5C255C09	5C2509	[Regular]
5C255C0A	5C250A	[Regular]
5C255C0D	5C250D	[Regular]
5C255C1A	5C251A	[Regular]
5C255C22	5C2522	[Regular]
5C255C25	5C255C25	[Preserve][LIKE]
5C255C27	5C2527	[Regular]
5C255C30	5C2500	[Regular]
5C255C3F	5C253F	[Regular]
5C255C40	5C2540	[Regular]
5C255C5A	5C251A	[Regular]
5C255C5C	5C255C	[Regular]
5C255C5F	5C255C5F	[Preserve][LIKE]
5C255C61	5C2561	[Regular]
5C255C62	5C2508	[Regular]
5C255C6E	5C250A	[Regular]
5C255C72	5C250D	[Regular]
5C255C74	5C2509	[Regular]
5C255C7E	5C257E	[Regular]
5C255C7F	5C257F	[Regular]
5C255C80	5C2580	[Regular][ILSEQ]
5C255C81	5C2581	[Regular][ILSEQ]
5C255C9F	5C259F	[Regular][ILSEQ]
5C255CA0	5C25A0	[Regular][ILSEQ]
5C255CA1	5C25A1	[Regular][ILSEQ]
5C255CE0	5C25E0	[Regular][ILSEQ]
5C255CEF	5C25EF	[Regular][ILSEQ]
5C255CF9	5C25F9	[Regular][ILSEQ]
5C255CFA	5C25FA	[Regular][ILSEQ]
5C255CFC	5C25FC	[Regular][ILSEQ]
5C255CFD	5C25FD	[Regular][ILSEQ]
5C255CFE	5C25FE	[Regular][ILSEQ]
5C255CFF	5C25FF	[Regular][ILSEQ]
5C275C00	2700	[Trivial]
5C275C08	2708	[Trivial]
5C275C09	2709	[Trivial]
5C275C0A	270A	[Trivial]
5C275C0D	270D	[Trivial]
5C275C1A	271A	[Trivial]
5C275C22	2722	[Trivial]
5C275C25	275C25	[Regular]
5C275C27	2727	[Trivial]
5C275C30	2700	[Regular]
5C275C3F	273F	[Trivial]
5C275C40	2740	[Trivial]
5C275C5A	271A	[Regular]
5C275C5C	275C	[Regular]
5C275C5F	275C5F	[Regular]
5C275C61	2761	[Trivial]
5C275C62	2708	[Regular]
5C275C6E	270A	[Regular]
5C275C72	270D	[Regular]
5C275C74	2709	[Regular]
5C275C7E	277E	[Trivial]
5C275C7F	277F	[Trivial]
5C275C80	2780	[Trivial][ILSEQ]
5C275C81	2781	[Trivial][ILSEQ]
5C275C9F	279F	[Trivial][ILSEQ]
5C275CA0	27A0	[Trivial][ILSEQ]
5C275CA1	27A1	[Trivial][ILSEQ]
5C275CE0	27E0	[Trivial][ILSEQ]
5C275CEF	27EF	[Trivial][ILSEQ]
5C275CF9	27F9	[Trivial][ILSEQ]
5C275CFA	27FA	[Trivial][ILSEQ]
5C275CFC	27FC	[Trivial][ILSEQ]
5C275CFD	27FD	[Trivial][ILSEQ]
5C275CFE	27FE	[Trivial][ILSEQ]
5C275CFF	27FF	[Trivial][ILSEQ]
5C305C00	0000	[Regular]
5C305C08	0008	[Regular]
5C305C09	0009	[Regular]
5C305C0A	000A	[Regular]
5C305C0D	000D	[Regular]
5C305C1A	001A	[Regular]
5C305C22	0022	[Regular]
5C305C25	005C25	[Regular]
5C305C27	0027	[Regular]
5C305C30	0000	[Regular]
5C305C3F	003F	[Regular]
5C305C40	0040	[Regular]
5C305C5A	001A	[Regular]
5C305C5C	005C	[Regular]
5C305C5F	005C5F	[Regular]
5C305C61	0061	[Regular]
5C305C62	0008	[Regular]
5C305C6E	000A	[Regular]
5C305C72	000D	[Regular]
5C305C74	0009	[Regular]
5C305C7E	007E	[Regular]
5C305C7F	007F	[Regular]
5C305C80	0080	[Regular][ILSEQ]
5C305C81	0081	[Regular][ILSEQ]
5C305C9F	009F	[Regular][ILSEQ]
5C305CA0	00A0	[Regular][ILSEQ]
5C305CA1	00A1	[Regular][ILSEQ]
5C305CE0	00E0	[Regular][ILSEQ]
5C305CEF	00EF	[Regular][ILSEQ]
5C305CF9	00F9	[Regular][ILSEQ]
5C305CFA	00FA	[Regular][ILSEQ]
5C305CFC	00FC	[Regular][ILSEQ]
5C305CFD	00FD	[Regular][ILSEQ]
5C305CFE	00FE	[Regular][ILSEQ]
5C305CFF	00FF	[Regular][ILSEQ]
5C3F5C00	3F00	[Trivial]
5C3F5C08	3F08	[Trivial]
5C3F5C09	3F09	[Trivial]
5C3F5C0A	3F0A	[Trivial]
5C3F5C0D	3F0D	[Trivial]
5C3F5C1A	3F1A	[Trivial]
5C3F5C22	3F22	[Trivial]
5C3F5C25	3F5C25	[Regular]
5C3F5C27	3F27	[Trivial]
5C3F5C30	3F00	[Regular]
5C3F5C3F	3F3F	[Trivial]
5C3F5C40	3F40	[Trivial]
5C3F5C5A	3F1A	[Regular]
5C3F5C5C	3F5C	[Regular]
5C3F5C5F	3F5C5F	[Regular]
5C3F5C61	3F61	[Trivial]
5C3F5C62	3F08	[Regular]
5C3F5C6E	3F0A	[Regular]
5C3F5C72	3F0D	[Regular]
5C3F5C74	3F09	[Regular]
5C3F5C7E	3F7E	[Trivial]
5C3F5C7F	3F7F	[Trivial]
5C3F5C80	3F80	[Trivial][ILSEQ]
5C3F5C81	3F81	[Trivial][ILSEQ]
5C3F5C9F	3F9F	[Trivial][ILSEQ]
5C3F5CA0	3FA0	[Trivial][ILSEQ]
5C3F5CA1	3FA1	[Trivial][ILSEQ]
5C3F5CE0	3FE0	[Trivial][ILSEQ]
5C3F5CEF	3FEF	[Trivial][ILSEQ]
5C3F5CF9	3FF9	[Trivial][ILSEQ]
5C3F5CFA	3FFA	[Trivial][ILSEQ]
5C3F5CFC	3FFC	[Trivial][ILSEQ]
5C3F5CFD	3FFD	[Trivial][ILSEQ]
5C3F5CFE	3FFE	[Trivial][ILSEQ]
5C3F5CFF	3FFF	[Trivial][ILSEQ]
5C405C00	4000	[Trivial]
5C405C08	4008	[Trivial]
5C405C09	4009	[Trivial]
5C405C0A	400A	[Trivial]
5C405C0D	400D	[Trivial]
5C405C1A	401A	[Trivial]
5C405C22	4022	[Trivial]
5C405C25	405C25	[Regular]
5C405C27	4027	[Trivial]
5C405C30	4000	[Regular]
5C405C3F	403F	[Trivial]
5C405C40	4040	[Trivial]
5C405C5A	401A	[Regular]
5C405C5C	405C	[Regular]
5C405C5F	405C5F	[Regular]
5C405C61	4061	[Trivial]
5C405C62	4008	[Regular]
5C405C6E	400A	[Regular]
5C405C72	400D	[Regular]
5C405C74	4009	[Regular]
5C405C7E	407E	[Trivial]
5C405C7F	407F	[Trivial]
5C405C80	4080	[Trivial][ILSEQ]
5C405C81	4081	[Trivial][ILSEQ]
5C405C9F	409F	[Trivial][ILSEQ]
5C405CA0	40A0	[Trivial][ILSEQ]
5C405CA1	40A1	[Trivial][ILSEQ]
5C405CE0	40E0	[Trivial][ILSEQ]
5C405CEF	40EF	[Trivial][ILSEQ]
5C405CF9	40F9	[Trivial][ILSEQ]
5C405CFA	40FA	[Trivial][ILSEQ]
5C405CFC	40FC	[Trivial][ILSEQ]
5C405CFD	40FD	[Trivial][ILSEQ]
5C405CFE	40FE	[Trivial][ILSEQ]
5C405CFF	40FF	[Trivial][ILSEQ]
5C5A5C00	1A00	[Regular]
5C5A5C08	1A08	[Regular]
5C5A5C09	1A09	[Regular]
5C5A5C0A	1A0A	[Regular]
5C5A5C0D	1A0D	[Regular]
5C5A5C1A	1A1A	[Regular]
5C5A5C22	1A22	[Regular]
5C5A5C25	1A5C25	[Regular]
5C5A5C27	1A27	[Regular]
5C5A5C30	1A00	[Regular]
5C5A5C3F	1A3F	[Regular]
5C5A5C40	1A40	[Regular]
5C5A5C5A	1A1A	[Regular]
5C5A5C5C	1A5C	[Regular]
5C5A5C5F	1A5C5F	[Regular]
5C5A5C61	1A61	[Regular]
5C5A5C62	1A08	[Regular]
5C5A5C6E	1A0A	[Regular]
5C5A5C72	1A0D	[Regular]
5C5A5C74	1A09	[Regular]
5C5A5C7E	1A7E	[Regular]
5C5A5C7F	1A7F	[Regular]
5C5A5C80	1A80	[Regular][ILSEQ]
5C5A5C81	1A81	[Regular][ILSEQ]
5C5A5C9F	1A9F	[Regular][ILSEQ]
5C5A5CA0	1AA0	[Regular][ILSEQ]
5C5A5CA1	1AA1	[Regular][ILSEQ]
5C5A5CE0	1AE0	[Regular][ILSEQ]
5C5A5CEF	1AEF	[Regular][ILSEQ]
5C5A5CF9	1AF9	[Regular][ILSEQ]
5C5A5CFA	1AFA	[Regular][ILSEQ]
5C5A5CFC	1AFC	[Regular][ILSEQ]
5C5A5CFD	1AFD	[Regular][ILSEQ]
5C5A5CFE	1AFE	[Regular][ILSEQ]
5C5A5CFF	1AFF	[Regular][ILSEQ]
5C5C5C00	5C00	[Regular]
5C5C5C08	5C08	[Regular]
5C5C5C09	5C09	[Regular]
5C5C5C0A	5C0A	[Regular]
5C5C5C0D	5C0D	[Regular]
5C5C5C1A	5C1A	[Regular]
5C5C5C22	5C22	[Regular]
5C5C5C25	5C5C25	[Regular]
5C5C5C27	5C27	[Regular]
5C5C5C30	5C00	[Regular]
5C5C5C3F	5C3F	[Regular]
5C5C5C40	5C40	[Regular]
5C5C5C5A	5C1A	[Regular]
5C5C5C5C	5C5C	[Regular]
5C5C5C5F	5C5C5F	[Regular]
5C5C5C61	5C61	[Regular]
5C5C5C62	5C08	[Regular]
5C5C5C6E	5C0A	[Regular]
5C5C5C72	5C0D	[Regular]
5C5C5C74	5C09	[Regular]
5C5C5C7E	5C7E	[Regular]
5C5C5C7F	5C7F	[Regular]
5C5C5C80	5C80	[Regular][ILSEQ]
5C5C5C81	5C81	[Regular][ILSEQ]
5C5C5C9F	5C9F	[Regular][ILSEQ]
5C5C5CA0	5CA0	[Regular][ILSEQ]
5C5C5CA1	5CA1	[Regular][ILSEQ]
5C5C5CE0	5CE0	[Regular][ILSEQ]
5C5C5CEF	5CEF	[Regular][ILSEQ]
5C5C5CF9	5CF9	[Regular][ILSEQ]
5C5C5CFA	5CFA	[Regular][ILSEQ]
5C5C5CFC	5CFC	[Regular][ILSEQ]
5C5C5CFD	5CFD	[Regular][ILSEQ]
5C5C5CFE	5CFE	[Regular][ILSEQ]
5C5C5CFF	5CFF	[Regular][ILSEQ]
5C5F5C00	5C5F00	[Regular]
5C5F5C08	5C5F08	[Regular]
5C5F5C09	5C5F09	[Regular]
5C5F5C0A	5C5F0A	[Regular]
5C5F5C0D	5C5F0D	[Regular]
5C5F5C1A	5C5F1A	[Regular]
5C5F5C22	5C5F22	[Regular]
5C5F5C25	5C5F5C25	[Preserve][LIKE]
5C5F5C27	5C5F27	[Regular]
5C5F5C30	5C5F00	[Regular]
5C5F5C3F	5C5F3F	[Regular]
5C5F5C40	5C5F40	[Regular]
5C5F5C5A	5C5F1A	[Regular]
5C5F5C5C	5C5F5C	[Regular]
5C5F5C5F	5C5F5C5F	[Preserve][LIKE]
5C5F5C61	5C5F61	[Regular]
5C5F5C62	5C5F08	[Regular]
5C5F5C6E	5C5F0A	[Regular]
5C5F5C72	5C5F0D	[Regular]
5C5F5C74	5C5F09	[Regular]
5C5F5C7E	5C5F7E	[Regular]
5C5F5C7F	5C5F7F	[Regular]
5C5F5C80	5C5F80	[Regular][ILSEQ]
5C5F5C81	5C5F81	[Regular][ILSEQ]
5C5F5C9F	5C5F9F	[Regular][ILSEQ]
5C5F5CA0	5C5FA0	[Regular][ILSEQ]
5C5F5CA1	5C5FA1	[Regular][ILSEQ]
5C5F5CE0	5C5FE0	[Regular][ILSEQ]
5C5F5CEF	5C5FEF	[Regular][ILSEQ]
5C5F5CF9	5C5FF9	[Regular][ILSEQ]
5C5F5CFA	5C5FFA	[Regular][ILSEQ]
5C5F5CFC	5C5FFC	[Regular][ILSEQ]
5C5F5CFD	5C5FFD	[Regular][ILSEQ]
5C5F5CFE	5C5FFE	[Regular][ILSEQ]
5C5F5CFF	5C5FFF	[Regular][ILSEQ]
5C615C00	6100	[Trivial]
5C615C08	6108	[Trivial]
5C615C09	6109	[Trivial]
5C615C0A	610A	[Trivial]
5C615C0D	610D	[Trivial]
5C615C1A	611A	[Trivial]
5C615C22	6122	[Trivial]
5C615C25	615C25	[Regular]
5C615C27	6127	[Trivial]
5C615C30	6100	[Regular]
5C615C3F	613F	[Trivial]
5C615C40	6140	[Trivial]
5C615C5A	611A	[Regular]
5C615C5C	615C	[Regular]
5C615C5F	615C5F	[Regular]
5C615C61	6161	[Trivial]
5C615C62	6108	[Regular]
5C615C6E	610A	[Regular]
5C615C72	610D	[Regular]
5C615C74	6109	[Regular]
5C615C7E	617E	[Trivial]
5C615C7F	617F	[Trivial]
5C615C80	6180	[Trivial][ILSEQ]
5C615C81	6181	[Trivial][ILSEQ]
5C615C9F	619F	[Trivial][ILSEQ]
5C615CA0	61A0	[Trivial][ILSEQ]
5C615CA1	61A1	[Trivial][ILSEQ]
5C615CE0	61E0	[Trivial][ILSEQ]
5C615CEF	61EF	[Trivial][ILSEQ]
5C615CF9	61F9	[Trivial][ILSEQ]
5C615CFA	61FA	[Trivial][ILSEQ]
5C615CFC	61FC	[Trivial][ILSEQ]
5C615CFD	61FD	[Trivial][ILSEQ]
5C615CFE	61FE	[Trivial][ILSEQ]
5C615CFF	61FF	[Trivial][ILSEQ]
5C625C00	0800	[Regular]
5C625C08	0808	[Regular]
5C625C09	0809	[Regular]
5C625C0A	080A	[Regular]
5C625C0D	080D	[Regular]
5C625C1A	081A	[Regular]
5C625C22	0822	[Regular]
5C625C25	085C25	[Regular]
5C625C27	0827	[Regular]
5C625C30	0800	[Regular]
5C625C3F	083F	[Regular]
5C625C40	0840	[Regular]
5C625C5A	081A	[Regular]
5C625C5C	085C	[Regular]
5C625C5F	085C5F	[Regular]
5C625C61	0861	[Regular]
5C625C62	0808	[Regular]
5C625C6E	080A	[Regular]
5C625C72	080D	[Regular]
5C625C74	0809	[Regular]
5C625C7E	087E	[Regular]
5C625C7F	087F	[Regular]
5C625C80	0880	[Regular][ILSEQ]
5C625C81	0881	[Regular][ILSEQ]
5C625C9F	089F	[Regular][ILSEQ]
5C625CA0	08A0	[Regular][ILSEQ]
5C625CA1	08A1	[Regular][ILSEQ]
5C625CE0	08E0	[Regular][ILSEQ]
5C625CEF	08EF	[Regular][ILSEQ]
5C625CF9	08F9	[Regular][ILSEQ]
5C625CFA	08FA	[Regular][ILSEQ]
5C625CFC	08FC	[Regular][ILSEQ]
5C625CFD	08FD	[Regular][ILSEQ]
5C625CFE	08FE	[Regular][ILSEQ]
5C625CFF	08FF	[Regular][ILSEQ]
5C6E5C00	0A00	[Regular]
5C6E5C08	0A08	[Regular]
5C6E5C09	0A09	[Regular]
5C6E5C0A	0A0A	[Regular]
5C6E5C0D	0A0D	[Regular]
5C6E5C1A	0A1A	[Regular]
5C6E5C22	0A22	[Regular]
5C6E5C25	0A5C25	[Regular]
5C6E5C27	0A27	[Regular]
5C6E5C30	0A00	[Regular]
5C6E5C3F	0A3F	[Regular]
5C6E5C40	0A40	[Regular]
5C6E5C5A	0A1A	[Regular]
5C6E5C5C	0A5C	[Regular]
5C6E5C5F	0A5C5F	[Regular]
5C6E5C61	0A61	[Regular]
5C6E5C62	0A08	[Regular]
5C6E5C6E	0A0A	[Regular]
5C6E5C72	0A0D	[Regular]
5C6E5C74	0A09	[Regular]
5C6E5C7E	0A7E	[Regular]
5C6E5C7F	0A7F	[Regular]
5C6E5C80	0A80	[Regular][ILSEQ]
5C6E5C81	0A81	[Regular][ILSEQ]
5C6E5C9F	0A9F	[Regular][ILSEQ]
5C6E5CA0	0AA0	[Regular][ILSEQ]
5C6E5CA1	0AA1	[Regular][ILSEQ]
5C6E5CE0	0AE0	[Regular][ILSEQ]
5C6E5CEF	0AEF	[Regular][ILSEQ]
5C6E5CF9	0AF9	[Regular][ILSEQ]
5C6E5CFA	0AFA	[Regular][ILSEQ]
5C6E5CFC	0AFC	[Regular][ILSEQ]
5C6E5CFD	0AFD	[Regular][ILSEQ]
5C6E5CFE	0AFE	[Regular][ILSEQ]
5C6E5CFF	0AFF	[Regular][ILSEQ]
5C725C00	0D00	[Regular]
5C725C08	0D08	[Regular]
5C725C09	0D09	[Regular]
5C725C0A	0D0A	[Regular]
5C725C0D	0D0D	[Regular]
5C725C1A	0D1A	[Regular]
5C725C22	0D22	[Regular]
5C725C25	0D5C25	[Regular]
5C725C27	0D27	[Regular]
5C725C30	0D00	[Regular]
5C725C3F	0D3F	[Regular]
5C725C40	0D40	[Regular]
5C725C5A	0D1A	[Regular]
5C725C5C	0D5C	[Regular]
5C725C5F	0D5C5F	[Regular]
5C725C61	0D61	[Regular]
5C725C62	0D08	[Regular]
5C725C6E	0D0A	[Regular]
5C725C72	0D0D	[Regular]
5C725C74	0D09	[Regular]
5C725C7E	0D7E	[Regular]
5C725C7F	0D7F	[Regular]
5C725C80	0D80	[Regular][ILSEQ]
5C725C81	0D81	[Regular][ILSEQ]
5C725C9F	0D9F	[Regular][ILSEQ]
5C725CA0	0DA0	[Regular][ILSEQ]
5C725CA1	0DA1	[Regular][ILSEQ]
5C725CE0	0DE0	[Regular][ILSEQ]
5C725CEF	0DEF	[Regular][ILSEQ]
5C725CF9	0DF9	[Regular][ILSEQ]
5C725CFA	0DFA	[Regular][ILSEQ]
5C725CFC	0DFC	[Regular][ILSEQ]
5C725CFD	0DFD	[Regular][ILSEQ]
5C725CFE	0DFE	[Regular][ILSEQ]
5C725CFF	0DFF	[Regular][ILSEQ]
5C745C00	0900	[Regular]
5C745C08	0908	[Regular]
5C745C09	0909	[Regular]
5C745C0A	090A	[Regular]
5C745C0D	090D	[Regular]
5C745C1A	091A	[Regular]
5C745C22	0922	[Regular]
5C745C25	095C25	[Regular]
5C745C27	0927	[Regular]
5C745C30	0900	[Regular]
5C745C3F	093F	[Regular]
5C745C40	0940	[Regular]
5C745C5A	091A	[Regular]
5C745C5C	095C	[Regular]
5C745C5F	095C5F	[Regular]
5C745C61	0961	[Regular]
5C745C62	0908	[Regular]
5C745C6E	090A	[Regular]
5C745C72	090D	[Regular]
5C745C74	0909	[Regular]
5C745C7E	097E	[Regular]
5C745C7F	097F	[Regular]
5C745C80	0980	[Regular][ILSEQ]
5C745C81	0981	[Regular][ILSEQ]
5C745C9F	099F	[Regular][ILSEQ]
5C745CA0	09A0	[Regular][ILSEQ]
5C745CA1	09A1	[Regular][ILSEQ]
5C745CE0	09E0	[Regular][ILSEQ]
5C745CEF	09EF	[Regular][ILSEQ]
5C745CF9	09F9	[Regular][ILSEQ]
5C745CFA	09FA	[Regular][ILSEQ]
5C745CFC	09FC	[Regular][ILSEQ]
5C745CFD	09FD	[Regular][ILSEQ]
5C745CFE	09FE	[Regular][ILSEQ]
5C745CFF	09FF	[Regular][ILSEQ]
5C7E5C00	7E00	[Trivial]
5C7E5C08	7E08	[Trivial]
5C7E5C09	7E09	[Trivial]
5C7E5C0A	7E0A	[Trivial]
5C7E5C0D	7E0D	[Trivial]
5C7E5C1A	7E1A	[Trivial]
5C7E5C22	7E22	[Trivial]
5C7E5C25	7E5C25	[Regular]
5C7E5C27	7E27	[Trivial]
5C7E5C30	7E00	[Regular]
5C7E5C3F	7E3F	[Trivial]
5C7E5C40	7E40	[Trivial]
5C7E5C5A	7E1A	[Regular]
5C7E5C5C	7E5C	[Regular]
5C7E5C5F	7E5C5F	[Regular]
5C7E5C61	7E61	[Trivial]
5C7E5C62	7E08	[Regular]
5C7E5C6E	7E0A	[Regular]
5C7E5C72	7E0D	[Regular]
5C7E5C74	7E09	[Regular]
5C7E5C7E	7E7E	[Trivial]
5C7E5C7F	7E7F	[Trivial]
5C7E5C80	7E80	[Trivial][ILSEQ]
5C7E5C81	7E81	[Trivial][ILSEQ]
5C7E5C9F	7E9F	[Trivial][ILSEQ]
5C7E5CA0	7EA0	[Trivial][ILSEQ]
5C7E5CA1	7EA1	[Trivial][ILSEQ]
5C7E5CE0	7EE0	[Trivial][ILSEQ]
5C7E5CEF	7EEF	[Trivial][ILSEQ]
5C7E5CF9	7EF9	[Trivial][ILSEQ]
5C7E5CFA	7EFA	[Trivial][ILSEQ]
5C7E5CFC	7EFC	[Trivial][ILSEQ]
5C7E5CFD	7EFD	[Trivial][ILSEQ]
5C7E5CFE	7EFE	[Trivial][ILSEQ]
5C7E5CFF	7EFF	[Trivial][ILSEQ]
5C7F5C00	7F00	[Trivial]
5C7F5C08	7F08	[Trivial]
5C7F5C09	7F09	[Trivial]
5C7F5C0A	7F0A	[Trivial]
5C7F5C0D	7F0D	[Trivial]
5C7F5C1A	7F1A	[Trivial]
5C7F5C22	7F22	[Trivial]
5C7F5C25	7F5C25	[Regular]
5C7F5C27	7F27	[Trivial]
5C7F5C30	7F00	[Regular]
5C7F5C3F	7F3F	[Trivial]
5C7F5C40	7F40	[Trivial]
5C7F5C5A	7F1A	[Regular]
5C7F5C5C	7F5C	[Regular]
5C7F5C5F	7F5C5F	[Regular]
5C7F5C61	7F61	[Trivial]
5C7F5C62	7F08	[Regular]
5C7F5C6E	7F0A	[Regular]
5C7F5C72	7F0D	[Regular]
5C7F5C74	7F09	[Regular]
5C7F5C7E	7F7E	[Trivial]
5C7F5C7F	7F7F	[Trivial]
5C7F5C80	7F80	[Trivial][ILSEQ]
5C7F5C81	7F81	[Trivial][ILSEQ]
5C7F5C9F	7F9F	[Trivial][ILSEQ]
5C7F5CA0	7FA0	[Trivial][ILSEQ]
5C7F5CA1	7FA1	[Trivial][ILSEQ]
5C7F5CE0	7FE0	[Trivial][ILSEQ]
5C7F5CEF	7FEF	[Trivial][ILSEQ]
5C7F5CF9	7FF9	[Trivial][ILSEQ]
5C7F5CFA	7FFA	[Trivial][ILSEQ]
5C7F5CFC	7FFC	[Trivial][ILSEQ]
5C7F5CFD	7FFD	[Trivial][ILSEQ]
5C7F5CFE	7FFE	[Trivial][ILSEQ]
5C7F5CFF	7FFF	[Trivial][ILSEQ]
5C805C00	8000	[Trivial][ILSEQ]
5C805C08	8008	[Trivial][ILSEQ]
5C805C09	8009	[Trivial][ILSEQ]
5C805C0A	800A	[Trivial][ILSEQ]
5C805C0D	800D	[Trivial][ILSEQ]
5C805C1A	801A	[Trivial][ILSEQ]
5C805C22	8022	[Trivial][ILSEQ]
5C805C25	805C25	[Regular][ILSEQ]
5C805C27	8027	[Trivial][ILSEQ]
5C805C30	8000	[Regular][ILSEQ]
5C805C3F	803F	[Trivial][ILSEQ]
5C805C40	8040	[Trivial][ILSEQ]
5C805C5A	801A	[Regular][ILSEQ]
5C805C5C	805C	[Regular][ILSEQ]
5C805C5F	805C5F	[Regular][ILSEQ]
5C805C61	8061	[Trivial][ILSEQ]
5C805C62	8008	[Regular][ILSEQ]
5C805C6E	800A	[Regular][ILSEQ]
5C805C72	800D	[Regular][ILSEQ]
5C805C74	8009	[Regular][ILSEQ]
5C805C7E	807E	[Trivial][ILSEQ]
5C805C7F	807F	[Trivial][ILSEQ]
5C805C80	8080	[Trivial][ILSEQ]
5C805C81	8081	[Trivial][ILSEQ]
5C805C9F	809F	[Trivial][ILSEQ]
5C805CA0	80A0	[Trivial][ILSEQ]
5C805CA1	80A1	[Trivial][ILSEQ]
5C805CE0	80E0	[Trivial][ILSEQ]
5C805CEF	80EF	[Trivial][ILSEQ]
5C805CF9	80F9	[Trivial][ILSEQ]
5C805CFA	80FA	[Trivial][ILSEQ]
5C805CFC	80FC	[Trivial][ILSEQ]
5C805CFD	80FD	[Trivial][ILSEQ]
5C805CFE	80FE	[Trivial][ILSEQ]
5C805CFF	80FF	[Trivial][ILSEQ]
5C815C00	8100	[Trivial][ILSEQ]
5C815C08	8108	[Trivial][ILSEQ]
5C815C09	8109	[Trivial][ILSEQ]
5C815C0A	810A	[Trivial][ILSEQ]
5C815C0D	810D	[Trivial][ILSEQ]
5C815C1A	811A	[Trivial][ILSEQ]
5C815C22	8122	[Trivial][ILSEQ]
5C815C25	815C25	[Regular][ILSEQ]
5C815C27	8127	[Trivial][ILSEQ]
5C815C30	8100	[Regular][ILSEQ]
5C815C3F	813F	[Trivial][ILSEQ]
5C815C40	8140	[Trivial][ILSEQ]
5C815C5A	811A	[Regular][ILSEQ]
5C815C5C	815C	[Regular][ILSEQ]
5C815C5F	815C5F	[Regular][ILSEQ]
5C815C61	8161	[Trivial][ILSEQ]
5C815C62	8108	[Regular][ILSEQ]
5C815C6E	810A	[Regular][ILSEQ]
5C815C72	810D	[Regular][ILSEQ]
5C815C74	8109	[Regular][ILSEQ]
5C815C7E	817E	[Trivial][ILSEQ]
5C815C7F	817F	[Trivial][ILSEQ]
5C815C80	8180	[Trivial][ILSEQ]
5C815C81	8181	[Trivial][ILSEQ]
5C815C9F	819F	[Trivial][ILSEQ]
5C815CA0	81A0	[Trivial][ILSEQ]
5C815CA1	81A1	[Trivial][ILSEQ]
5C815CE0	81E0	[Trivial][ILSEQ]
5C815CEF	81EF	[Trivial][ILSEQ]
5C815CF9	81F9	[Trivial][ILSEQ]
5C815CFA	81FA	[Trivial][ILSEQ]
5C815CFC	81FC	[Trivial][ILSEQ]
5C815CFD	81FD	[Trivial][ILSEQ]
5C815CFE	81FE	[Trivial][ILSEQ]
5C815CFF	81FF	[Trivial][ILSEQ]
5C9F5C00	9F00	[Trivial][ILSEQ]
5C9F5C08	9F08	[Trivial][ILSEQ]
5C9F5C09	9F09	[Trivial][ILSEQ]
5C9F5C0A	9F0A	[Trivial][ILSEQ]
5C9F5C0D	9F0D	[Trivial][ILSEQ]
5C9F5C1A	9F1A	[Trivial][ILSEQ]
5C9F5C22	9F22	[Trivial][ILSEQ]
5C9F5C25	9F5C25	[Regular][ILSEQ]
5C9F5C27	9F27	[Trivial][ILSEQ]
5C9F5C30	9F00	[Regular][ILSEQ]
5C9F5C3F	9F3F	[Trivial][ILSEQ]
5C9F5C40	9F40	[Trivial][ILSEQ]
5C9F5C5A	9F1A	[Regular][ILSEQ]
5C9F5C5C	9F5C	[Regular][ILSEQ]
5C9F5C5F	9F5C5F	[Regular][ILSEQ]
5C9F5C61	9F61	[Trivial][ILSEQ]
5C9F5C62	9F08	[Regular][ILSEQ]
5C9F5C6E	9F0A	[Regular][ILSEQ]
5C9F5C72	9F0D	[Regular][ILSEQ]
5C9F5C74	9F09	[Regular][ILSEQ]
5C9F5C7E	9F7E	[Trivial][ILSEQ]
5C9F5C7F	9F7F	[Trivial][ILSEQ]
5C9F5C80	9F80	[Trivial][ILSEQ]
5C9F5C81	9F81	[Trivial][ILSEQ]
5C9F5C9F	9F9F	[Trivial][ILSEQ]
5C9F5CA0	9FA0	[Trivial][ILSEQ]
5C9F5CA1	9FA1	[Trivial][ILSEQ]
5C9F5CE0	9FE0	[Trivial][ILSEQ]
5C9F5CEF	9FEF	[Trivial][ILSEQ]
5C9F5CF9	9FF9	[Trivial][ILSEQ]
5C9F5CFA	9FFA	[Trivial][ILSEQ]
5C9F5CFC	9FFC	[Trivial][ILSEQ]
5C9F5CFD	9FFD	[Trivial][ILSEQ]
5C9F5CFE	9FFE	[Trivial][ILSEQ]
5C9F5CFF	9FFF	[Trivial][ILSEQ]
5CA05C00	A000	[Trivial][ILSEQ]
5CA05C08	A008	[Trivial][ILSEQ]
5CA05C09	A009	[Trivial][ILSEQ]
5CA05C0A	A00A	[Trivial][ILSEQ]
5CA05C0D	A00D	[Trivial][ILSEQ]
5CA05C1A	A01A	[Trivial][ILSEQ]
5CA05C22	A022	[Trivial][ILSEQ]
5CA05C25	A05C25	[Regular][ILSEQ]
5CA05C27	A027	[Trivial][ILSEQ]
5CA05C30	A000	[Regular][ILSEQ]
5CA05C3F	A03F	[Trivial][ILSEQ]
5CA05C40	A040	[Trivial][ILSEQ]
5CA05C5A	A01A	[Regular][ILSEQ]
5CA05C5C	A05C	[Regular][ILSEQ]
5CA05C5F	A05C5F	[Regular][ILSEQ]
5CA05C61	A061	[Trivial][ILSEQ]
5CA05C62	A008	[Regular][ILSEQ]
5CA05C6E	A00A	[Regular][ILSEQ]
5CA05C72	A00D	[Regular][ILSEQ]
5CA05C74	A009	[Regular][ILSEQ]
5CA05C7E	A07E	[Trivial][ILSEQ]
5CA05C7F	A07F	[Trivial][ILSEQ]
5CA05C80	A080	[Trivial][ILSEQ]
5CA05C81	A081	[Trivial][ILSEQ]
5CA05C9F	A09F	[Trivial][ILSEQ]
5CA05CA0	A0A0	[Trivial][ILSEQ]
5CA05CA1	A0A1	[Trivial][ILSEQ]
5CA05CE0	A0E0	[Trivial][ILSEQ]
5CA05CEF	A0EF	[Trivial][ILSEQ]
5CA05CF9	A0F9	[Trivial][ILSEQ]
5CA05CFA	A0FA	[Trivial][ILSEQ]
5CA05CFC	A0FC	[Trivial][ILSEQ]
5CA05CFD	A0FD	[Trivial][ILSEQ]
5CA05CFE	A0FE	[Trivial][ILSEQ]
5CA05CFF	A0FF	[Trivial][ILSEQ]
5CA15C00	A100	[Trivial][ILSEQ]
5CA15C08	A108	[Trivial][ILSEQ]
5CA15C09	A109	[Trivial][ILSEQ]
5CA15C0A	A10A	[Trivial][ILSEQ]
5CA15C0D	A10D	[Trivial][ILSEQ]
5CA15C1A	A11A	[Trivial][ILSEQ]
5CA15C22	A122	[Trivial][ILSEQ]
5CA15C25	A15C25	[Regular][ILSEQ]
5CA15C27	A127	[Trivial][ILSEQ]
5CA15C30	A100	[Regular][ILSEQ]
5CA15C3F	A13F	[Trivial][ILSEQ]
5CA15C40	A140	[Trivial][ILSEQ]
5CA15C5A	A11A	[Regular][ILSEQ]
5CA15C5C	A15C	[Regular][ILSEQ]
5CA15C5F	A15C5F	[Regular][ILSEQ]
5CA15C61	A161	[Trivial][ILSEQ]
5CA15C62	A108	[Regular][ILSEQ]
5CA15C6E	A10A	[Regular][ILSEQ]
5CA15C72	A10D	[Regular][ILSEQ]
5CA15C74	A109	[Regular][ILSEQ]
5CA15C7E	A17E	[Trivial][ILSEQ]
5CA15C7F	A17F	[Trivial][ILSEQ]
5CA15C80	A180	[Trivial][ILSEQ]
5CA15C81	A181	[Trivial][ILSEQ]
5CA15C9F	A19F	[Trivial][ILSEQ]
5CA15CA0	A1A0	[Trivial][ILSEQ]
5CA15CA1	A1A1	[Trivial][ILSEQ]
5CA15CE0	A1E0	[Trivial][ILSEQ]
5CA15CEF	A1EF	[Trivial][ILSEQ]
5CA15CF9	A1F9	[Trivial][ILSEQ]
5CA15CFA	A1FA	[Trivial][ILSEQ]
5CA15CFC	A1FC	[Trivial][ILSEQ]
5CA15CFD	A1FD	[Trivial][ILSEQ]
5CA15CFE	A1FE	[Trivial][ILSEQ]
5CA15CFF	A1FF	[Trivial][ILSEQ]
5CE05C00	E000	[Trivial][ILSEQ]
5CE05C08	E008	[Trivial][ILSEQ]
5CE05C09	E009	[Trivial][ILSEQ]
5CE05C0A	E00A	[Trivial][ILSEQ]
5CE05C0D	E00D	[Trivial][ILSEQ]
5CE05C1A	E01A	[Trivial][ILSEQ]
5CE05C22	E022	[Trivial][ILSEQ]
5CE05C25	E05C25	[Regular][ILSEQ]
5CE05C27	E027	[Trivial][ILSEQ]
5CE05C30	E000	[Regular][ILSEQ]
5CE05C3F	E03F	[Trivial][ILSEQ]
5CE05C40	E040	[Trivial][ILSEQ]
5CE05C5A	E01A	[Regular][ILSEQ]
5CE05C5C	E05C	[Regular][ILSEQ]
5CE05C5F	E05C5F	[Regular][ILSEQ]
5CE05C61	E061	[Trivial][ILSEQ]
5CE05C62	E008	[Regular][ILSEQ]
5CE05C6E	E00A	[Regular][ILSEQ]
5CE05C72	E00D	[Regular][ILSEQ]
5CE05C74	E009	[Regular][ILSEQ]
5CE05C7E	E07E	[Trivial][ILSEQ]
5CE05C7F	E07F	[Trivial][ILSEQ]
5CE05C80	E080	[Trivial][ILSEQ]
5CE05C81	E081	[Trivial][ILSEQ]
5CE05C9F	E09F	[Trivial][ILSEQ]
5CE05CA0	E0A0	[Trivial][ILSEQ]
5CE05CA1	E0A1	[Trivial][ILSEQ]
5CE05CE0	E0E0	[Trivial][ILSEQ]
5CE05CEF	E0EF	[Trivial][ILSEQ]
5CE05CF9	E0F9	[Trivial][ILSEQ]
5CE05CFA	E0FA	[Trivial][ILSEQ]
5CE05CFC	E0FC	[Trivial][ILSEQ]
5CE05CFD	E0FD	[Trivial][ILSEQ]
5CE05CFE	E0FE	[Trivial][ILSEQ]
5CE05CFF	E0FF	[Trivial][ILSEQ]
5CEF5C00	EF00	[Trivial][ILSEQ]
5CEF5C08	EF08	[Trivial][ILSEQ]
5CEF5C09	EF09	[Trivial][ILSEQ]
5CEF5C0A	EF0A	[Trivial][ILSEQ]
5CEF5C0D	EF0D	[Trivial][ILSEQ]
5CEF5C1A	EF1A	[Trivial][ILSEQ]
5CEF5C22	EF22	[Trivial][ILSEQ]
5CEF5C25	EF5C25	[Regular][ILSEQ]
5CEF5C27	EF27	[Trivial][ILSEQ]
5CEF5C30	EF00	[Regular][ILSEQ]
5CEF5C3F	EF3F	[Trivial][ILSEQ]
5CEF5C40	EF40	[Trivial][ILSEQ]
5CEF5C5A	EF1A	[Regular][ILSEQ]
5CEF5C5C	EF5C	[Regular][ILSEQ]
5CEF5C5F	EF5C5F	[Regular][ILSEQ]
5CEF5C61	EF61	[Trivial][ILSEQ]
5CEF5C62	EF08	[Regular][ILSEQ]
5CEF5C6E	EF0A	[Regular][ILSEQ]
5CEF5C72	EF0D	[Regular][ILSEQ]
5CEF5C74	EF09	[Regular][ILSEQ]
5CEF5C7E	EF7E	[Trivial][ILSEQ]
5CEF5C7F	EF7F	[Trivial][ILSEQ]
5CEF5C80	EF80	[Trivial][ILSEQ]
5CEF5C81	EF81	[Trivial][ILSEQ]
5CEF5C9F	EF9F	[Trivial][ILSEQ]
5CEF5CA0	EFA0	[Trivial][ILSEQ]
5CEF5CA1	EFA1	[Trivial][ILSEQ]
5CEF5CE0	EFE0	[Trivial][ILSEQ]
5CEF5CEF	EFEF	[Trivial][ILSEQ]
5CEF5CF9	EFF9	[Trivial][ILSEQ]
5CEF5CFA	EFFA	[Trivial][ILSEQ]
5CEF5CFC	EFFC	[Trivial][ILSEQ]
5CEF5CFD	EFFD	[Trivial][ILSEQ]
5CEF5CFE	EFFE	[Trivial][ILSEQ]
5CEF5CFF	EFFF	[Trivial][ILSEQ]
5CF95C00	F900	[Trivial][ILSEQ]
5CF95C08	F908	[Trivial][ILSEQ]
5CF95C09	F909	[Trivial][ILSEQ]
5CF95C0A	F90A	[Trivial][ILSEQ]
5CF95C0D	F90D	[Trivial][ILSEQ]
5CF95C1A	F91A	[Trivial][ILSEQ]
5CF95C22	F922	[Trivial][ILSEQ]
5CF95C25	F95C25	[Regular][ILSEQ]
5CF95C27	F927	[Trivial][ILSEQ]
5CF95C30	F900	[Regular][ILSEQ]
5CF95C3F	F93F	[Trivial][ILSEQ]
5CF95C40	F940	[Trivial][ILSEQ]
5CF95C5A	F91A	[Regular][ILSEQ]
5CF95C5C	F95C	[Regular][ILSEQ]
5CF95C5F	F95C5F	[Regular][ILSEQ]
5CF95C61	F961	[Trivial][ILSEQ]
5CF95C62	F908	[Regular][ILSEQ]
5CF95C6E	F90A	[Regular][ILSEQ]
5CF95C72	F90D	[Regular][ILSEQ]
5CF95C74	F909	[Regular][ILSEQ]
5CF95C7E	F97E	[Trivial][ILSEQ]
5CF95C7F	F97F	[Trivial][ILSEQ]
5CF95C80	F980	[Trivial][ILSEQ]
5CF95C81	F981	[Trivial][ILSEQ]
5CF95C9F	F99F	[Trivial][ILSEQ]
5CF95CA0	F9A0	[Trivial][ILSEQ]
5CF95CA1	F9A1	[Trivial][ILSEQ]
5CF95CE0	F9E0	[Trivial][ILSEQ]
5CF95CEF	F9EF	[Trivial][ILSEQ]
5CF95CF9	F9F9	[Trivial][ILSEQ]
5CF95CFA	F9FA	[Trivial][ILSEQ]
5CF95CFC	F9FC	[Trivial][ILSEQ]
5CF95CFD	F9FD	[Trivial][ILSEQ]
5CF95CFE	F9FE	[Trivial][ILSEQ]
5CF95CFF	F9FF	[Trivial][ILSEQ]
5CFA5C00	FA00	[Trivial][ILSEQ]
5CFA5C08	FA08	[Trivial][ILSEQ]
5CFA5C09	FA09	[Trivial][ILSEQ]
5CFA5C0A	FA0A	[Trivial][ILSEQ]
5CFA5C0D	FA0D	[Trivial][ILSEQ]
5CFA5C1A	FA1A	[Trivial][ILSEQ]
5CFA5C22	FA22	[Trivial][ILSEQ]
5CFA5C25	FA5C25	[Regular][ILSEQ]
5CFA5C27	FA27	[Trivial][ILSEQ]
5CFA5C30	FA00	[Regular][ILSEQ]
5CFA5C3F	FA3F	[Trivial][ILSEQ]
5CFA5C40	FA40	[Trivial][ILSEQ]
5CFA5C5A	FA1A	[Regular][ILSEQ]
5CFA5C5C	FA5C	[Regular][ILSEQ]
5CFA5C5F	FA5C5F	[Regular][ILSEQ]
5CFA5C61	FA61	[Trivial][ILSEQ]
5CFA5C62	FA08	[Regular][ILSEQ]
5CFA5C6E	FA0A	[Regular][ILSEQ]
5CFA5C72	FA0D	[Regular][ILSEQ]
5CFA5C74	FA09	[Regular][ILSEQ]
5CFA5C7E	FA7E	[Trivial][ILSEQ]
5CFA5C7F	FA7F	[Trivial][ILSEQ]
5CFA5C80	FA80	[Trivial][ILSEQ]
5CFA5C81	FA81	[Trivial][ILSEQ]
5CFA5C9F	FA9F	[Trivial][ILSEQ]
5CFA5CA0	FAA0	[Trivial][ILSEQ]
5CFA5CA1	FAA1	[Trivial][ILSEQ]
5CFA5CE0	FAE0	[Trivial][ILSEQ]
5CFA5CEF	FAEF	[Trivial][ILSEQ]
5CFA5CF9	FAF9	[Trivial][ILSEQ]
5CFA5CFA	FAFA	[Trivial][ILSEQ]
5CFA5CFC	FAFC	[Trivial][ILSEQ]
5CFA5CFD	FAFD	[Trivial][ILSEQ]
5CFA5CFE	FAFE	[Trivial][ILSEQ]
5CFA5CFF	FAFF	[Trivial][ILSEQ]
5CFC5C00	FC00	[Trivial][ILSEQ]
5CFC5C08	FC08	[Trivial][ILSEQ]
5CFC5C09	FC09	[Trivial][ILSEQ]
5CFC5C0A	FC0A	[Trivial][ILSEQ]
5CFC5C0D	FC0D	[Trivial][ILSEQ]
5CFC5C1A	FC1A	[Trivial][ILSEQ]
5CFC5C22	FC22	[Trivial][ILSEQ]
5CFC5C25	FC5C25	[Regular][ILSEQ]
5CFC5C27	FC27	[Trivial][ILSEQ]
5CFC5C30	FC00	[Regular][ILSEQ]
5CFC5C3F	FC3F	[Trivial][ILSEQ]
5CFC5C40	FC40	[Trivial][ILSEQ]
5CFC5C5A	FC1A	[Regular][ILSEQ]
5CFC5C5C	FC5C	[Regular][ILSEQ]
5CFC5C5F	FC5C5F	[Regular][ILSEQ]
5CFC5C61	FC61	[Trivial][ILSEQ]
5CFC5C62	FC08	[Regular][ILSEQ]
5CFC5C6E	FC0A	[Regular][ILSEQ]
5CFC5C72	FC0D	[Regular][ILSEQ]
5CFC5C74	FC09	[Regular][ILSEQ]
5CFC5C7E	FC7E	[Trivial][ILSEQ]
5CFC5C7F	FC7F	[Trivial][ILSEQ]
5CFC5C80	FC80	[Trivial][ILSEQ]
5CFC5C81	FC81	[Trivial][ILSEQ]
5CFC5C9F	FC9F	[Trivial][ILSEQ]
5CFC5CA0	FCA0	[Trivial][ILSEQ]
5CFC5CA1	FCA1	[Trivial][ILSEQ]
5CFC5CE0	FCE0	[Trivial][ILSEQ]
5CFC5CEF	FCEF	[Trivial][ILSEQ]
5CFC5CF9	FCF9	[Trivial][ILSEQ]
5CFC5CFA	FCFA	[Trivial][ILSEQ]
5CFC5CFC	FCFC	[Trivial][ILSEQ]
5CFC5CFD	FCFD	[Trivial][ILSEQ]
5CFC5CFE	FCFE	[Trivial][ILSEQ]
5CFC5CFF	FCFF	[Trivial][ILSEQ]
5CFD5C00	FD00	[Trivial][ILSEQ]
5CFD5C08	FD08	[Trivial][ILSEQ]
5CFD5C09	FD09	[Trivial][ILSEQ]
5CFD5C0A	FD0A	[Trivial][ILSEQ]
5CFD5C0D	FD0D	[Trivial][ILSEQ]
5CFD5C1A	FD1A	[Trivial][ILSEQ]
5CFD5C22	FD22	[Trivial][ILSEQ]
5CFD5C25	FD5C25	[Regular][ILSEQ]
5CFD5C27	FD27	[Trivial][ILSEQ]
5CFD5C30	FD00	[Regular][ILSEQ]
5CFD5C3F	FD3F	[Trivial][ILSEQ]
5CFD5C40	FD40	[Trivial][ILSEQ]
5CFD5C5A	FD1A	[Regular][ILSEQ]
5CFD5C5C	FD5C	[Regular][ILSEQ]
5CFD5C5F	FD5C5F	[Regular][ILSEQ]
5CFD5C61	FD61	[Trivial][ILSEQ]
5CFD5C62	FD08	[Regular][ILSEQ]
5CFD5C6E	FD0A	[Regular][ILSEQ]
5CFD5C72	FD0D	[Regular][ILSEQ]
5CFD5C74	FD09	[Regular][ILSEQ]
5CFD5C7E	FD7E	[Trivial][ILSEQ]
5CFD5C7F	FD7F	[Trivial][ILSEQ]
5CFD5C80	FD80	[Trivial][ILSEQ]
5CFD5C81	FD81	[Trivial][ILSEQ]
5CFD5C9F	FD9F	[Trivial][ILSEQ]
5CFD5CA0	FDA0	[Trivial][ILSEQ]
5CFD5CA1	FDA1	[Trivial][ILSEQ]
5CFD5CE0	FDE0	[Trivial][ILSEQ]
5CFD5CEF	FDEF	[Trivial][ILSEQ]
5CFD5CF9	FDF9	[Trivial][ILSEQ]
5CFD5CFA	FDFA	[Trivial][ILSEQ]
5CFD5CFC	FDFC	[Trivial][ILSEQ]
5CFD5CFD	FDFD	[Trivial][ILSEQ]
5CFD5CFE	FDFE	[Trivial][ILSEQ]
5CFD5CFF	FDFF	[Trivial][ILSEQ]
5CFE5C00	FE00	[Trivial][ILSEQ]
5CFE5C08	FE08	[Trivial][ILSEQ]
5CFE5C09	FE09	[Trivial][ILSEQ]
5CFE5C0A	FE0A	[Trivial][ILSEQ]
5CFE5C0D	FE0D	[Trivial][ILSEQ]
5CFE5C1A	FE1A	[Trivial][ILSEQ]
5CFE5C22	FE22	[Trivial][ILSEQ]
5CFE5C25	FE5C25	[Regular][ILSEQ]
5CFE5C27	FE27	[Trivial][ILSEQ]
5CFE5C30	FE00	[Regular][ILSEQ]
5CFE5C3F	FE3F	[Trivial][ILSEQ]
5CFE5C40	FE40	[Trivial][ILSEQ]
5CFE5C5A	FE1A	[Regular][ILSEQ]
5CFE5C5C	FE5C	[Regular][ILSEQ]
5CFE5C5F	FE5C5F	[Regular][ILSEQ]
5CFE5C61	FE61	[Trivial][ILSEQ]
5CFE5C62	FE08	[Regular][ILSEQ]
5CFE5C6E	FE0A	[Regular][ILSEQ]
5CFE5C72	FE0D	[Regular][ILSEQ]
5CFE5C74	FE09	[Regular][ILSEQ]
5CFE5C7E	FE7E	[Trivial][ILSEQ]
5CFE5C7F	FE7F	[Trivial][ILSEQ]
5CFE5C80	FE80	[Trivial][ILSEQ]
5CFE5C81	FE81	[Trivial][ILSEQ]
5CFE5C9F	FE9F	[Trivial][ILSEQ]
5CFE5CA0	FEA0	[Trivial][ILSEQ]
5CFE5CA1	FEA1	[Trivial][ILSEQ]
5CFE5CE0	FEE0	[Trivial][ILSEQ]
5CFE5CEF	FEEF	[Trivial][ILSEQ]
5CFE5CF9	FEF9	[Trivial][ILSEQ]
5CFE5CFA	FEFA	[Trivial][ILSEQ]
5CFE5CFC	FEFC	[Trivial][ILSEQ]
5CFE5CFD	FEFD	[Trivial][ILSEQ]
5CFE5CFE	FEFE	[Trivial][ILSEQ]
5CFE5CFF	FEFF	[Trivial][ILSEQ]
5CFF5C00	FF00	[Trivial][ILSEQ]
5CFF5C08	FF08	[Trivial][ILSEQ]
5CFF5C09	FF09	[Trivial][ILSEQ]
5CFF5C0A	FF0A	[Trivial][ILSEQ]
5CFF5C0D	FF0D	[Trivial][ILSEQ]
5CFF5C1A	FF1A	[Trivial][ILSEQ]
5CFF5C22	FF22	[Trivial][ILSEQ]
5CFF5C25	FF5C25	[Regular][ILSEQ]
5CFF5C27	FF27	[Trivial][ILSEQ]
5CFF5C30	FF00	[Regular][ILSEQ]
5CFF5C3F	FF3F	[Trivial][ILSEQ]
5CFF5C40	FF40	[Trivial][ILSEQ]
5CFF5C5A	FF1A	[Regular][ILSEQ]
5CFF5C5C	FF5C	[Regular][ILSEQ]
5CFF5C5F	FF5C5F	[Regular][ILSEQ]
5CFF5C61	FF61	[Trivial][ILSEQ]
5CFF5C62	FF08	[Regular][ILSEQ]
5CFF5C6E	FF0A	[Regular][ILSEQ]
5CFF5C72	FF0D	[Regular][ILSEQ]
5CFF5C74	FF09	[Regular][ILSEQ]
5CFF5C7E	FF7E	[Trivial][ILSEQ]
5CFF5C7F	FF7F	[Trivial][ILSEQ]
5CFF5C80	FF80	[Trivial][ILSEQ]
5CFF5C81	FF81	[Trivial][ILSEQ]
5CFF5C9F	FF9F	[Trivial][ILSEQ]
5CFF5CA0	FFA0	[Trivial][ILSEQ]
5CFF5CA1	FFA1	[Trivial][ILSEQ]
5CFF5CE0	FFE0	[Trivial][ILSEQ]
5CFF5CEF	FFEF	[Trivial][ILSEQ]
5CFF5CF9	FFF9	[Trivial][ILSEQ]
5CFF5CFA	FFFA	[Trivial][ILSEQ]
5CFF5CFC	FFFC	[Trivial][ILSEQ]
5CFF5CFD	FFFD	[Trivial][ILSEQ]
5CFF5CFE	FFFE	[Trivial][ILSEQ]
5CFF5CFF	FFFF	[Trivial][ILSEQ]
DROP TABLE t1;
DROP PROCEDURE p1;
DROP PROCEDURE p2;
DROP FUNCTION unescape;
DROP FUNCTION unescape_type;
DROP FUNCTION wellformedness;
DROP FUNCTION mysql_real_escape_string_generated;
DROP FUNCTION iswellformed;
DROP TABLE allbytes;
SET sql_mode = DEFAULT;
# End of ctype_backslash.inc
#
# MDEV-12681 Wrong VIEW results for CHAR(0xDF USING latin1)
#
SET NAMES utf8;
SELECT CHAR(0xDF USING latin1);
CHAR(0xDF USING latin1)
ß
CREATE OR REPLACE VIEW v1 AS SELECT CHAR(0xDF USING latin1) AS c;
SHOW CREATE VIEW v1;
View	Create View	character_set_client	collation_connection
v1	CREATE ALGORITHM=UNDEFINED DEFINER=`root`@`localhost` SQL SECURITY DEFINER VIEW `v1` AS select char(0xdf using latin1) AS `c`	utf8mb3	utf8mb3_general_ci
SELECT * FROM v1;
c
ß
DROP VIEW v1;
SET NAMES utf8;
#
# MDEV-13118 Wrong results with LOWER and UPPER and subquery
#
SET @save_optimizer_switch=@@optimizer_switch;
SET optimizer_switch=_latin1'derived_merge=on';
CREATE TABLE t1 AS SELECT REPEAT('a', 10) AS t LIMIT 0;
SHOW CREATE TABLE t1;
Table	Create Table
t1	CREATE TABLE `t1` (
  `t` varchar(10) CHARACTER SET utf8mb3 COLLATE utf8mb3_general_ci DEFAULT NULL
) ENGINE=MyISAM DEFAULT CHARSET=utf8mb4 COLLATE=utf8mb4_uca1400_ai_ci
INSERT INTO t1 VALUES ('abcdefghi'),('ABCDEFGHI');
SELECT CONCAT(t2,'-',t2) c2 FROM (SELECT LOWER(t) t2 FROM t1) sub;
c2
abcdefghi-abcdefghi
abcdefghi-abcdefghi
SELECT CONCAT(t2,'-',t2) c2 FROM (SELECT UPPER(t) t2 FROM t1) sub;
c2
ABCDEFGHI-ABCDEFGHI
ABCDEFGHI-ABCDEFGHI
DROP TABLE t1;
SET optimizer_switch=@save_optimizer_switch;
#
# End of 10.0 tests
#
#
# Start of 10.1 tests
#
#
# MDEV-6572 "USE dbname" with a bad sequence erroneously connects to a wrong database
#
SET NAMES utf8;
SELECT * FROM `test😁😁test`;
ERROR HY000: Invalid utf8mb3 character string: 'test\xF0\x9F\x98\x81\xF0\x9F\x98\x81test'
#
#MDEV-8256 A part of a ROW comparison is erroneously optimized away
#
SET NAMES utf8;
CREATE TABLE t1 (a VARCHAR(10) CHARACTER SET utf8);
INSERT INTO t1 VALUES ('1e1'),('1é1');
SELECT * FROM t1 WHERE a=10;
a
1e1
Warnings:
Warning	1292	Truncated incorrect DECIMAL value: '1é1'
SELECT * FROM t1 WHERE a='1e1';
a
1e1
1é1
SELECT * FROM t1 WHERE a=10 AND a='1e1';
a
1e1
Warnings:
Warning	1292	Truncated incorrect DECIMAL value: '1é1'
SELECT * FROM t1 WHERE (a,a)=(10,'1e1');
a
1e1
Warnings:
Warning	1292	Truncated incorrect DECIMAL value: '1é1'
EXPLAIN EXTENDED SELECT * FROM t1 WHERE (a,a)=(10,'1e1');
id	select_type	table	type	possible_keys	key	key_len	ref	rows	filtered	Extra
1	SIMPLE	t1	ALL	NULL	NULL	NULL	NULL	2	100.00	Using where
Warnings:
Note	1003	select `test`.`t1`.`a` AS `a` from `test`.`t1` where `test`.`t1`.`a` = 10 and `test`.`t1`.`a` = '1e1'
DROP TABLE t1;
#
# MDEV-8688 Wrong result for SELECT..WHERE varchar_column IN (1,2,3) AND varchar_column=' 1';
#
SET NAMES utf8;
CREATE TABLE t1 (a VARCHAR(10) CHARACTER SET latin1);
INSERT INTO t1 VALUES ('1e1'),('1ë1');
SELECT * FROM t1 WHERE a IN (1,2);
a
1ë1
Warnings:
Warning	1292	Truncated incorrect DECIMAL value: '1ë1'
SELECT * FROM t1 WHERE a IN (1,2) AND a='1ë1';
a
1ë1
Warnings:
Warning	1292	Truncated incorrect DECIMAL value: '1ë1'
SELECT * FROM t1 WHERE a IN (1,2,'x') AND a='1ë1';
a
1ë1
Warnings:
Warning	1292	Truncated incorrect DECIMAL value: '1ë1'
EXPLAIN EXTENDED SELECT * FROM t1 WHERE a IN (1,2) AND a='1ë1';
id	select_type	table	type	possible_keys	key	key_len	ref	rows	filtered	Extra
1	SIMPLE	t1	ALL	NULL	NULL	NULL	NULL	2	100.00	Using where
Warnings:
Note	1003	select `test`.`t1`.`a` AS `a` from `test`.`t1` where `test`.`t1`.`a` = '1ë1' and `test`.`t1`.`a` in (1,2)
EXPLAIN EXTENDED SELECT * FROM t1 WHERE a IN (1,2,'x') AND a='1ë1';
id	select_type	table	type	possible_keys	key	key_len	ref	rows	filtered	Extra
1	SIMPLE	t1	ALL	NULL	NULL	NULL	NULL	2	100.00	Using where
Warnings:
Note	1003	select `test`.`t1`.`a` AS `a` from `test`.`t1` where `test`.`t1`.`a` = '1ë1' and `test`.`t1`.`a` in (1,2,'x')
DROP TABLE IF EXISTS t1;
#
# MDEV-8816 Equal field propagation is not applied for WHERE varbinary_column>=_utf8'a' COLLATE utf8_swedish_ci AND varbinary_column='A';
#
CREATE TABLE t1 (c VARBINARY(10));
INSERT INTO t1 VALUES ('a'),('A');
SELECT * FROM t1 WHERE c>=_utf8'a' COLLATE utf8_general_ci AND c='A';
c
A
EXPLAIN EXTENDED
SELECT * FROM t1 WHERE c>=_utf8'a' COLLATE utf8_general_ci AND c='A';
id	select_type	table	type	possible_keys	key	key_len	ref	rows	filtered	Extra
1	SIMPLE	t1	ALL	NULL	NULL	NULL	NULL	2	100.00	Using where
Warnings:
Note	1003	select `test`.`t1`.`c` AS `c` from `test`.`t1` where `test`.`t1`.`c` = 'A'
DROP TABLE t1;
#
# MDEV-7231 Field ROUTINE_DEFINITION in INFORMATION_SCHEMA.`ROUTINES` contains broken procedure body when used shielding quotes inside.
#
CREATE PROCEDURE p1()
BEGIN
SELECT CONCAT('ABC = ''',1,''''), CONCAT('ABC = ',2);
SELECT '''', """", '\'', "\"";
SELECT '<tab>	<tab>\t<tab>';
SELECT '<nl>
<nl>\n<nl>';
SELECT 'test';
SELECT 'tëst';
SELECT 'test\0';
SELECT 'tëst\0';
SELECT _binary'test';
SELECT _binary'test\0';
SELECT N'''', N"""", N'\'', N"\"";
SELECT N'<tab>	<tab>\t<tab>';
SELECT N'<nl>
<nl>\n<nl>';
SELECT N'test';
SELECT N'tëst';
SELECT N'test\0';
SELECT N'tëst\0';
END$$
SELECT ROUTINE_DEFINITION FROM INFORMATION_SCHEMA.ROUTINES
WHERE ROUTINE_SCHEMA='test' AND SPECIFIC_NAME ='p1';
ROUTINE_DEFINITION
BEGIN
SELECT CONCAT('ABC = ''',1,''''), CONCAT('ABC = ',2);
SELECT '''', """", '''', """";
SELECT '<tab>\t<tab>\t<tab>';
SELECT '<nl>\n<nl>\n<nl>';
SELECT 'test';
SELECT 'tëst';
SELECT 'test\0';
SELECT 'tëst\0';
SELECT 'test';
SELECT 'test\0';
SELECT N'''', N"""", N'''', N"""";
SELECT N'<tab>\t<tab>\t<tab>';
SELECT N'<nl>\n<nl>\n<nl>';
SELECT N'test';
SELECT N'tëst';
SELECT N'test\0';
SELECT N'tëst\0';
END
SELECT body_utf8 FROM mysql.proc WHERE name='p1';
body_utf8
BEGIN
SELECT CONCAT('ABC = ''',1,''''), CONCAT('ABC = ',2);
SELECT '''', """", '''', """";
SELECT '<tab>\t<tab>\t<tab>';
SELECT '<nl>\n<nl>\n<nl>';
SELECT 'test';
SELECT 'tëst';
SELECT 'test\0';
SELECT 'tëst\0';
SELECT 'test';
SELECT 'test\0';
SELECT N'''', N"""", N'''', N"""";
SELECT N'<tab>\t<tab>\t<tab>';
SELECT N'<nl>\n<nl>\n<nl>';
SELECT N'test';
SELECT N'tëst';
SELECT N'test\0';
SELECT N'tëst\0';
END
DROP PROCEDURE p1;
SET @@SQL_MODE='NO_BACKSLASH_ESCAPES';
CREATE PROCEDURE p1()
BEGIN
SELECT CONCAT('ABC = ''',1,''''), CONCAT('ABC = ',2);
SELECT '''', """";
SELECT '<tab>	<tab>\t<tab>';
SELECT '<nl>
<nl>\n<nl>';
SELECT 'test';
SELECT 'tëst';
SELECT 'test\0';
SELECT 'tëst\0';
SELECT _binary'test';
SELECT _binary'test\0';
SELECT N'''', N"""";
SELECT N'<tab>	<tab>\t<tab>';
SELECT N'<nl>
<nl>\n<nl>';
SELECT N'test';
SELECT N'tëst';
SELECT N'test\0';
SELECT N'tëst\0';
END$$
SELECT ROUTINE_DEFINITION FROM INFORMATION_SCHEMA.ROUTINES
WHERE ROUTINE_SCHEMA='test' AND SPECIFIC_NAME ='p1';
ROUTINE_DEFINITION
BEGIN
SELECT CONCAT('ABC = ''',1,''''), CONCAT('ABC = ',2);
SELECT '''', """";
SELECT '<tab>	<tab>\t<tab>';
SELECT '<nl>
<nl>\n<nl>';
SELECT 'test';
SELECT 'tëst';
SELECT 'test\0';
SELECT 'tëst\0';
SELECT 'test';
SELECT 'test\0';
SELECT N'''', N"""";
SELECT N'<tab>	<tab>\t<tab>';
SELECT N'<nl>
<nl>\n<nl>';
SELECT N'test';
SELECT N'tëst';
SELECT N'test\0';
SELECT N'tëst\0';
END
SELECT body_utf8 FROM mysql.proc WHERE name='p1';
body_utf8
BEGIN
SELECT CONCAT('ABC = ''',1,''''), CONCAT('ABC = ',2);
SELECT '''', """";
SELECT '<tab>	<tab>\t<tab>';
SELECT '<nl>
<nl>\n<nl>';
SELECT 'test';
SELECT 'tëst';
SELECT 'test\0';
SELECT 'tëst\0';
SELECT 'test';
SELECT 'test\0';
SELECT N'''', N"""";
SELECT N'<tab>	<tab>\t<tab>';
SELECT N'<nl>
<nl>\n<nl>';
SELECT N'test';
SELECT N'tëst';
SELECT N'test\0';
SELECT N'tëst\0';
END
DROP PROCEDURE p1;
SET @@SQL_MODE=default;
#
# MDEV-10191 non convertible chars convert() resulted in Null instead "?" on Windows
#
SET sql_mode='STRICT_TRANS_TABLES';
SELECT CONVERT(_utf8 0xC499 USING latin1);
CONVERT(_utf8 0xC499 USING latin1)
?
Warnings:
Warning	1977	Cannot convert 'utf8mb3' character 0xC499 to 'latin1'
SELECT CAST(_utf8 0xC499 AS CHAR CHARACTER SET latin1);
CAST(_utf8 0xC499 AS CHAR CHARACTER SET latin1)
?
Warnings:
Warning	1977	Cannot convert 'utf8mb3' character 0xC499 to 'latin1'
SET sql_mode=default;
SELECT CONVERT(_utf8 0xC499 USING latin1);
CONVERT(_utf8 0xC499 USING latin1)
?
Warnings:
Warning	1977	Cannot convert 'utf8mb3' character 0xC499 to 'latin1'
SELECT CAST(_utf8 0xC499 AS CHAR CHARACTER SET latin1);
CAST(_utf8 0xC499 AS CHAR CHARACTER SET latin1)
?
Warnings:
Warning	1977	Cannot convert 'utf8mb3' character 0xC499 to 'latin1'
#
# MDEV-15005 ASAN: stack-buffer-overflow in my_strnncollsp_simple
#
SET NAMES utf8;
SELECT CONVERT(1, CHAR) IN ('100', 10, '101');
CONVERT(1, CHAR) IN ('100', 10, '101')
0
SELECT CONVERT(1, CHAR) IN ('100', 10, '1');
CONVERT(1, CHAR) IN ('100', 10, '1')
1
SELECT CONVERT(1, CHAR) IN ('100', '10', '1');
CONVERT(1, CHAR) IN ('100', '10', '1')
1
#
# MDEV-23535 SIGSEGV, SIGABRT and SIGILL in typeinfo for Item_func_set_collation (on optimized builds)
#
SET NAMES utf8;
CREATE OR REPLACE TABLE t1(a DATETIME) ENGINE=MYISAM;
INSERT INTO t1 VALUES ('2019-03-10 02:55:05');
CREATE OR REPLACE TABLE t2(a VARCHAR(50) CHARACTER SET latin1) ENGINE=MYISAM;
INSERT INTO t2 VALUES ('2019-03-10 02:55:05');
SELECT * FROM t1 WHERE (SELECT 1,CONCAT(a) FROM t1) = (SELECT 1,CONCAT(a) FROM t2);
a
2019-03-10 02:55:05
DROP TABLE t1, t2;
#
# End of 10.1 tests
#
#
# Start of 10.2 tests
#
#
# MDEV-9824 LOAD DATA does not work with multi-byte strings in LINES TERMINATED BY when IGNORE is specified
#
CREATE TABLE t1 (c1 VARCHAR(10) CHARACTER SET utf8);
LOAD DATA INFILE '../../std_data/loaddata/mdev9824.txt' INTO TABLE t1 CHARACTER SET utf8 LINES TERMINATED BY 'ёё';
Warnings:
Warning	1638	Non-ASCII separator arguments are not fully supported
SELECT c1 FROM t1;
c1
a
b
c
DELETE FROM t1;
LOAD DATA INFILE '../../std_data/loaddata/mdev9824.txt' INTO TABLE t1 CHARACTER SET utf8 LINES TERMINATED BY 'ёё' IGNORE 1 LINES;
Warnings:
Warning	1638	Non-ASCII separator arguments are not fully supported
SELECT c1 FROM t1 ORDER BY c1;
c1
b
c
DROP TABLE t1;
#
# MDEV-9842 LOAD DATA INFILE does not work well with a TEXT column when using sjis
#
CREATE TABLE t1 (a TEXT CHARACTER SET utf8);
LOAD DATA INFILE '../../std_data/loaddata/mdev9823.utf8mb4.txt' IGNORE INTO TABLE t1 CHARACTER SET utf8 IGNORE 4 LINES;
Warnings:
Warning	1366	Incorrect string value: '\xD0' for column `test`.`t1`.`a` at row 1
Warning	1366	Incorrect string value: '\xE1\x80' for column `test`.`t1`.`a` at row 3
Warning	1366	Incorrect string value: '\xF0\x9F\x98' for column `test`.`t1`.`a` at row 5
Warning	1366	Incorrect string value: '\xF0\x9F\x98\x8E' for column `test`.`t1`.`a` at row 7
Warning	1366	Incorrect string value: '\xF0\x9F\x98' for column `test`.`t1`.`a` at row 8
SELECT HEX(a) FROM t1;
HEX(a)
3F
78787831
3F3F
78787832
3F3F3F
78787833
3F3F3F3F
3F3F3F
DROP TABLE t1;
#
# MDEV-9874 LOAD XML INFILE does not handle well broken multi-byte characters
#
CREATE TABLE t1 (a TEXT CHARACTER SET utf8);
LOAD XML INFILE '../../std_data/loaddata/mdev9874.xml' IGNORE INTO TABLE t1 CHARACTER SET utf8 ROWS IDENTIFIED BY '<row>';
Warnings:
Warning	1366	Incorrect string value: '\xD0' for column `test`.`t1`.`a` at row 1
SELECT HEX(a) FROM t1;
HEX(a)
613F
DROP TABLE t1;
#
# MDEV-10134 Add full support for DEFAULT
#
SET NAMES latin1;
CREATE TABLE t1 (a VARCHAR(30) CHARACTER SET latin1 DEFAULT CONCAT('ß'));
SET NAMES utf8;
SHOW CREATE TABLE t1;
Table	Create Table
t1	CREATE TABLE `t1` (
  `a` varchar(30) CHARACTER SET latin1 COLLATE latin1_swedish_ci DEFAULT concat('ÃŸ')
) ENGINE=MyISAM DEFAULT CHARSET=utf8mb4 COLLATE=utf8mb4_uca1400_ai_ci
INSERT INTO t1 VALUES (DEFAULT);
SELECT HEX(a),a  FROM t1;
HEX(a)	a
C39F	ÃŸ
SET NAMES latin1;
ALTER TABLE t1 ADD b VARCHAR(30) CHARACTER SET latin1 DEFAULT CONCAT('ß');
SET NAMES utf8;
ALTER TABLE t1 ADD c VARCHAR(30) CHARACTER SET latin1 DEFAULT CONCAT('ÃŸ');
SHOW CREATE TABLE t1;
Table	Create Table
t1	CREATE TABLE `t1` (
  `a` varchar(30) CHARACTER SET latin1 COLLATE latin1_swedish_ci DEFAULT concat('ÃŸ'),
  `b` varchar(30) CHARACTER SET latin1 COLLATE latin1_swedish_ci DEFAULT concat('ÃŸ'),
  `c` varchar(30) CHARACTER SET latin1 COLLATE latin1_swedish_ci DEFAULT concat('ÃŸ')
) ENGINE=MyISAM DEFAULT CHARSET=utf8mb4 COLLATE=utf8mb4_uca1400_ai_ci
DELETE FROM t1;
INSERT INTO t1 VALUES();
SELECT * FROM t1;
a	b	c
ÃŸ	ÃŸ	ÃŸ
SET NAMES latin1;
DELETE FROM t1;
INSERT INTO t1 VALUES();
SET NAMES utf8;
SELECT * FROM t1;
a	b	c
ÃŸ	ÃŸ	ÃŸ
DROP TABLE t1;
SET NAMES latin1;
CREATE TABLE t1 (a VARCHAR(30) CHARACTER SET utf8 DEFAULT CONCAT('ß'));
SET NAMES utf8;
SHOW CREATE TABLE t1;
Table	Create Table
t1	CREATE TABLE `t1` (
  `a` varchar(30) CHARACTER SET utf8mb3 COLLATE utf8mb3_general_ci DEFAULT concat('ÃŸ')
) ENGINE=MyISAM DEFAULT CHARSET=utf8mb4 COLLATE=utf8mb4_uca1400_ai_ci
INSERT INTO t1 VALUES (DEFAULT);
SELECT HEX(a), a FROM t1;
HEX(a)	a
C383C5B8	ÃŸ
DROP TABLE t1;
SET NAMES utf8;
CREATE TABLE t1 (a VARCHAR(30) CHARACTER SET latin1 DEFAULT CONCAT('ß'));
SHOW CREATE TABLE t1;
Table	Create Table
t1	CREATE TABLE `t1` (
  `a` varchar(30) CHARACTER SET latin1 COLLATE latin1_swedish_ci DEFAULT concat('ß')
) ENGINE=MyISAM DEFAULT CHARSET=utf8mb4 COLLATE=utf8mb4_uca1400_ai_ci
INSERT INTO t1 VALUES (DEFAULT);
SELECT HEX(a) FROM t1;
HEX(a)
DF
DROP TABLE t1;
SET NAMES utf8;
CREATE TABLE t1 (a VARCHAR(30) CHARACTER SET utf8 DEFAULT CONCAT('ß'));
SHOW CREATE TABLE t1;
Table	Create Table
t1	CREATE TABLE `t1` (
  `a` varchar(30) CHARACTER SET utf8mb3 COLLATE utf8mb3_general_ci DEFAULT concat('ß')
) ENGINE=MyISAM DEFAULT CHARSET=utf8mb4 COLLATE=utf8mb4_uca1400_ai_ci
INSERT INTO t1 VALUES (DEFAULT);
SELECT HEX(a) FROM t1;
HEX(a)
C39F
DROP TABLE t1;
#
# MDEV-9711 NO PAD Collatons
#
SET DEFAULT_STORAGE_ENGINE=MyISAM;
#
# Start of ctype_pad.inc
#
#
# Unique indexes
#
CREATE TABLE t1 (a VARCHAR(10) PRIMARY KEY) COLLATE 'utf8_general_nopad_ci';
SHOW CREATE TABLE t1;
Table	Create Table
t1	CREATE TABLE `t1` (
  `a` varchar(10) NOT NULL,
  PRIMARY KEY (`a`)
) ENGINE=MyISAM DEFAULT CHARSET=utf8mb3 COLLATE=utf8mb3_general_nopad_ci
INSERT INTO t1 VALUES ('abc'),('abc  '),(' a'),(' a '),('a   ');
SELECT HEX(a), a FROM t1 ORDER BY a;
HEX(a)	a
2061	 a
206120	 a 
61202020	a   
616263	abc
6162632020	abc  
SELECT HEX(a), a FROM t1 IGNORE INDEX(PRIMARY) ORDER BY a;
HEX(a)	a
2061	 a
206120	 a 
61202020	a   
616263	abc
6162632020	abc  
SELECT HEX(a), a FROM t1 IGNORE INDEX(PRIMARY) ORDER BY a DESC;
HEX(a)	a
6162632020	abc  
616263	abc
61202020	a   
206120	 a 
2061	 a
#
# UNION
#
CREATE TABLE t2 (a VARCHAR(10)) COLLATE 'utf8_general_nopad_ci';
INSERT INTO t2 VALUES ('abc '),('abc  '),(' a'),('a ');
SELECT HEX(a),a FROM (SELECT * FROM t1 UNION SELECT * FROM t2 ORDER BY a) td;
HEX(a)	a
2061	 a
206120	 a 
6120	a 
61202020	a   
616263	abc
61626320	abc 
6162632020	abc  
DROP TABLE t1;
DROP TABLE t2;
#
# DISTINCT, COUNT, MAX
#
CREATE TABLE t1 (a VARCHAR(10)) COLLATE 'utf8_general_nopad_ci';
INSERT INTO t1 VALUES ('a'),('a  '),(' a'),(' a '),('a   ');
SELECT HEX(a), a FROM (SELECT DISTINCT a FROM t1 ORDER BY a) td;
HEX(a)	a
2061	 a
206120	 a 
61	a
612020	a  
61202020	a   
SELECT COUNT(DISTINCT a) FROM t1 ORDER BY a;
COUNT(DISTINCT a)
5
SELECT HEX(MAX(a)), MAX(a) FROM t1;
HEX(MAX(a))	MAX(a)
61202020	a   
#
# GROUP BY
#
CREATE TABLE t2 (a VARCHAR(10), b int, c varchar(10)) COLLATE 'utf8_general_nopad_ci';
INSERT t2 values('ab', 12, 'cd'), ('ab', 2, 'ed'), ('aa', 20, 'er'), ('aa  ', 0, 'er ');
SELECT HEX(a), cnt FROM (SELECT a, COUNT(a) AS cnt FROM t2 GROUP BY a ORDER BY a) AS td;
HEX(a)	cnt
6161	1
61612020	1
6162	2
DROP TABLE t2;
#
# Weights
#
SELECT HEX(WEIGHT_STRING(a AS CHAR(10))) FROM t1;
HEX(WEIGHT_STRING(a AS CHAR(10)))
0041000000000000000000000000000000000000
0041002000200000000000000000000000000000
0020004100000000000000000000000000000000
0020004100200000000000000000000000000000
0041002000200020000000000000000000000000
DROP TABLE t1;
#
# IF, CASE, LEAST
#
SELECT IF('abc' COLLATE 'utf8_general_nopad_ci' = 'abc ', 'pad', 'nopad') as exp;
exp
nopad
SELECT CASE 'abc' COLLATE 'utf8_general_nopad_ci' WHEN 'abc ' THEN 'pad' ELSE 'nopad' END as exp;
exp
nopad
SELECT CASE WHEN 'abc' COLLATE 'utf8_general_nopad_ci' = 'abc ' THEN 'pad' ELSE 'nopad' END as exp;
exp
nopad
SELECT HEX(LEAST('abc ' COLLATE 'utf8_general_nopad_ci', 'abc  ')) as exp;
exp
61626320
SELECT HEX(GREATEST('abc ' COLLATE 'utf8_general_nopad_ci', 'abc  ')) as exp;
exp
6162632020
#
# Collation mix
#
CREATE TABLE t1 (a VARCHAR(10)) COLLATE 'utf8_general_ci';
INSERT INTO t1 VALUES ('a'),('a ');
SELECT COUNT(*) FROM t1 WHERE a='a';
COUNT(*)
2
SELECT COUNT(*) FROM t1 WHERE a='a' COLLATE 'utf8_general_ci';
COUNT(*)
2
SELECT COUNT(*) FROM t1 WHERE a='a' COLLATE 'utf8_general_nopad_ci';
COUNT(*)
1
ALTER TABLE t1 MODIFY a VARCHAR(10) COLLATE 'utf8_general_nopad_ci';
SELECT COUNT(*) FROM t1 WHERE a='a';
COUNT(*)
1
SELECT COUNT(*) FROM t1 WHERE a='a' COLLATE 'utf8_general_ci';
COUNT(*)
2
SELECT COUNT(*) FROM t1 WHERE a='a' COLLATE 'utf8_general_nopad_ci';
COUNT(*)
1
DROP TABLE t1;
#
# End of ctype_pad.inc
#
SET DEFAULT_STORAGE_ENGINE=HEAP;
#
# Start of ctype_pad.inc
#
#
# Unique indexes
#
CREATE TABLE t1 (a VARCHAR(10) PRIMARY KEY) COLLATE 'utf8_general_nopad_ci';
SHOW CREATE TABLE t1;
Table	Create Table
t1	CREATE TABLE `t1` (
  `a` varchar(10) NOT NULL,
  PRIMARY KEY (`a`)
) ENGINE=MEMORY DEFAULT CHARSET=utf8mb3 COLLATE=utf8mb3_general_nopad_ci
INSERT INTO t1 VALUES ('abc'),('abc  '),(' a'),(' a '),('a   ');
SELECT HEX(a), a FROM t1 ORDER BY a;
HEX(a)	a
2061	 a
206120	 a 
61202020	a   
616263	abc
6162632020	abc  
SELECT HEX(a), a FROM t1 IGNORE INDEX(PRIMARY) ORDER BY a;
HEX(a)	a
2061	 a
206120	 a 
61202020	a   
616263	abc
6162632020	abc  
SELECT HEX(a), a FROM t1 IGNORE INDEX(PRIMARY) ORDER BY a DESC;
HEX(a)	a
6162632020	abc  
616263	abc
61202020	a   
206120	 a 
2061	 a
#
# UNION
#
CREATE TABLE t2 (a VARCHAR(10)) COLLATE 'utf8_general_nopad_ci';
INSERT INTO t2 VALUES ('abc '),('abc  '),(' a'),('a ');
SELECT HEX(a),a FROM (SELECT * FROM t1 UNION SELECT * FROM t2 ORDER BY a) td;
HEX(a)	a
2061	 a
206120	 a 
6120	a 
61202020	a   
616263	abc
61626320	abc 
6162632020	abc  
DROP TABLE t1;
DROP TABLE t2;
#
# DISTINCT, COUNT, MAX
#
CREATE TABLE t1 (a VARCHAR(10)) COLLATE 'utf8_general_nopad_ci';
INSERT INTO t1 VALUES ('a'),('a  '),(' a'),(' a '),('a   ');
SELECT HEX(a), a FROM (SELECT DISTINCT a FROM t1 ORDER BY a) td;
HEX(a)	a
2061	 a
206120	 a 
61	a
612020	a  
61202020	a   
SELECT COUNT(DISTINCT a) FROM t1 ORDER BY a;
COUNT(DISTINCT a)
5
SELECT HEX(MAX(a)), MAX(a) FROM t1;
HEX(MAX(a))	MAX(a)
61202020	a   
#
# GROUP BY
#
CREATE TABLE t2 (a VARCHAR(10), b int, c varchar(10)) COLLATE 'utf8_general_nopad_ci';
INSERT t2 values('ab', 12, 'cd'), ('ab', 2, 'ed'), ('aa', 20, 'er'), ('aa  ', 0, 'er ');
SELECT HEX(a), cnt FROM (SELECT a, COUNT(a) AS cnt FROM t2 GROUP BY a ORDER BY a) AS td;
HEX(a)	cnt
6161	1
61612020	1
6162	2
DROP TABLE t2;
#
# Weights
#
SELECT HEX(WEIGHT_STRING(a AS CHAR(10))) FROM t1;
HEX(WEIGHT_STRING(a AS CHAR(10)))
0041000000000000000000000000000000000000
0041002000200000000000000000000000000000
0020004100000000000000000000000000000000
0020004100200000000000000000000000000000
0041002000200020000000000000000000000000
DROP TABLE t1;
#
# IF, CASE, LEAST
#
SELECT IF('abc' COLLATE 'utf8_general_nopad_ci' = 'abc ', 'pad', 'nopad') as exp;
exp
nopad
SELECT CASE 'abc' COLLATE 'utf8_general_nopad_ci' WHEN 'abc ' THEN 'pad' ELSE 'nopad' END as exp;
exp
nopad
SELECT CASE WHEN 'abc' COLLATE 'utf8_general_nopad_ci' = 'abc ' THEN 'pad' ELSE 'nopad' END as exp;
exp
nopad
SELECT HEX(LEAST('abc ' COLLATE 'utf8_general_nopad_ci', 'abc  ')) as exp;
exp
61626320
SELECT HEX(GREATEST('abc ' COLLATE 'utf8_general_nopad_ci', 'abc  ')) as exp;
exp
6162632020
#
# Collation mix
#
CREATE TABLE t1 (a VARCHAR(10)) COLLATE 'utf8_general_ci';
INSERT INTO t1 VALUES ('a'),('a ');
SELECT COUNT(*) FROM t1 WHERE a='a';
COUNT(*)
2
SELECT COUNT(*) FROM t1 WHERE a='a' COLLATE 'utf8_general_ci';
COUNT(*)
2
SELECT COUNT(*) FROM t1 WHERE a='a' COLLATE 'utf8_general_nopad_ci';
COUNT(*)
1
ALTER TABLE t1 MODIFY a VARCHAR(10) COLLATE 'utf8_general_nopad_ci';
SELECT COUNT(*) FROM t1 WHERE a='a';
COUNT(*)
1
SELECT COUNT(*) FROM t1 WHERE a='a' COLLATE 'utf8_general_ci';
COUNT(*)
2
SELECT COUNT(*) FROM t1 WHERE a='a' COLLATE 'utf8_general_nopad_ci';
COUNT(*)
1
DROP TABLE t1;
#
# End of ctype_pad.inc
#
SET DEFAULT_STORAGE_ENGINE=Default;
SET DEFAULT_STORAGE_ENGINE=MyISAM;
#
# Start of ctype_pad.inc
#
#
# Unique indexes
#
CREATE TABLE t1 (a VARCHAR(10) PRIMARY KEY) COLLATE 'utf8_nopad_bin';
SHOW CREATE TABLE t1;
Table	Create Table
t1	CREATE TABLE `t1` (
  `a` varchar(10) NOT NULL,
  PRIMARY KEY (`a`)
) ENGINE=MyISAM DEFAULT CHARSET=utf8mb3 COLLATE=utf8mb3_nopad_bin
INSERT INTO t1 VALUES ('abc'),('abc  '),(' a'),(' a '),('a   ');
SELECT HEX(a), a FROM t1 ORDER BY a;
HEX(a)	a
2061	 a
206120	 a 
61202020	a   
616263	abc
6162632020	abc  
SELECT HEX(a), a FROM t1 IGNORE INDEX(PRIMARY) ORDER BY a;
HEX(a)	a
2061	 a
206120	 a 
61202020	a   
616263	abc
6162632020	abc  
SELECT HEX(a), a FROM t1 IGNORE INDEX(PRIMARY) ORDER BY a DESC;
HEX(a)	a
6162632020	abc  
616263	abc
61202020	a   
206120	 a 
2061	 a
#
# UNION
#
CREATE TABLE t2 (a VARCHAR(10)) COLLATE 'utf8_nopad_bin';
INSERT INTO t2 VALUES ('abc '),('abc  '),(' a'),('a ');
SELECT HEX(a),a FROM (SELECT * FROM t1 UNION SELECT * FROM t2 ORDER BY a) td;
HEX(a)	a
2061	 a
206120	 a 
6120	a 
61202020	a   
616263	abc
61626320	abc 
6162632020	abc  
DROP TABLE t1;
DROP TABLE t2;
#
# DISTINCT, COUNT, MAX
#
CREATE TABLE t1 (a VARCHAR(10)) COLLATE 'utf8_nopad_bin';
INSERT INTO t1 VALUES ('a'),('a  '),(' a'),(' a '),('a   ');
SELECT HEX(a), a FROM (SELECT DISTINCT a FROM t1 ORDER BY a) td;
HEX(a)	a
2061	 a
206120	 a 
61	a
612020	a  
61202020	a   
SELECT COUNT(DISTINCT a) FROM t1 ORDER BY a;
COUNT(DISTINCT a)
5
SELECT HEX(MAX(a)), MAX(a) FROM t1;
HEX(MAX(a))	MAX(a)
61202020	a   
#
# GROUP BY
#
CREATE TABLE t2 (a VARCHAR(10), b int, c varchar(10)) COLLATE 'utf8_nopad_bin';
INSERT t2 values('ab', 12, 'cd'), ('ab', 2, 'ed'), ('aa', 20, 'er'), ('aa  ', 0, 'er ');
SELECT HEX(a), cnt FROM (SELECT a, COUNT(a) AS cnt FROM t2 GROUP BY a ORDER BY a) AS td;
HEX(a)	cnt
6161	1
61612020	1
6162	2
DROP TABLE t2;
#
# Weights
#
SELECT HEX(WEIGHT_STRING(a AS CHAR(10))) FROM t1;
HEX(WEIGHT_STRING(a AS CHAR(10)))
0061000000000000000000000000000000000000
0061002000200000000000000000000000000000
0020006100000000000000000000000000000000
0020006100200000000000000000000000000000
0061002000200020000000000000000000000000
DROP TABLE t1;
#
# IF, CASE, LEAST
#
SELECT IF('abc' COLLATE 'utf8_nopad_bin' = 'abc ', 'pad', 'nopad') as exp;
exp
nopad
SELECT CASE 'abc' COLLATE 'utf8_nopad_bin' WHEN 'abc ' THEN 'pad' ELSE 'nopad' END as exp;
exp
nopad
SELECT CASE WHEN 'abc' COLLATE 'utf8_nopad_bin' = 'abc ' THEN 'pad' ELSE 'nopad' END as exp;
exp
nopad
SELECT HEX(LEAST('abc ' COLLATE 'utf8_nopad_bin', 'abc  ')) as exp;
exp
61626320
SELECT HEX(GREATEST('abc ' COLLATE 'utf8_nopad_bin', 'abc  ')) as exp;
exp
6162632020
#
# Collation mix
#
CREATE TABLE t1 (a VARCHAR(10)) COLLATE 'utf8_bin';
INSERT INTO t1 VALUES ('a'),('a ');
SELECT COUNT(*) FROM t1 WHERE a='a';
COUNT(*)
2
SELECT COUNT(*) FROM t1 WHERE a='a' COLLATE 'utf8_bin';
COUNT(*)
2
SELECT COUNT(*) FROM t1 WHERE a='a' COLLATE 'utf8_nopad_bin';
COUNT(*)
1
ALTER TABLE t1 MODIFY a VARCHAR(10) COLLATE 'utf8_nopad_bin';
SELECT COUNT(*) FROM t1 WHERE a='a';
COUNT(*)
1
SELECT COUNT(*) FROM t1 WHERE a='a' COLLATE 'utf8_bin';
COUNT(*)
2
SELECT COUNT(*) FROM t1 WHERE a='a' COLLATE 'utf8_nopad_bin';
COUNT(*)
1
DROP TABLE t1;
#
# End of ctype_pad.inc
#
SET DEFAULT_STORAGE_ENGINE=HEAP;
#
# Start of ctype_pad.inc
#
#
# Unique indexes
#
CREATE TABLE t1 (a VARCHAR(10) PRIMARY KEY) COLLATE 'utf8_nopad_bin';
SHOW CREATE TABLE t1;
Table	Create Table
t1	CREATE TABLE `t1` (
  `a` varchar(10) NOT NULL,
  PRIMARY KEY (`a`)
) ENGINE=MEMORY DEFAULT CHARSET=utf8mb3 COLLATE=utf8mb3_nopad_bin
INSERT INTO t1 VALUES ('abc'),('abc  '),(' a'),(' a '),('a   ');
SELECT HEX(a), a FROM t1 ORDER BY a;
HEX(a)	a
2061	 a
206120	 a 
61202020	a   
616263	abc
6162632020	abc  
SELECT HEX(a), a FROM t1 IGNORE INDEX(PRIMARY) ORDER BY a;
HEX(a)	a
2061	 a
206120	 a 
61202020	a   
616263	abc
6162632020	abc  
SELECT HEX(a), a FROM t1 IGNORE INDEX(PRIMARY) ORDER BY a DESC;
HEX(a)	a
6162632020	abc  
616263	abc
61202020	a   
206120	 a 
2061	 a
#
# UNION
#
CREATE TABLE t2 (a VARCHAR(10)) COLLATE 'utf8_nopad_bin';
INSERT INTO t2 VALUES ('abc '),('abc  '),(' a'),('a ');
SELECT HEX(a),a FROM (SELECT * FROM t1 UNION SELECT * FROM t2 ORDER BY a) td;
HEX(a)	a
2061	 a
206120	 a 
6120	a 
61202020	a   
616263	abc
61626320	abc 
6162632020	abc  
DROP TABLE t1;
DROP TABLE t2;
#
# DISTINCT, COUNT, MAX
#
CREATE TABLE t1 (a VARCHAR(10)) COLLATE 'utf8_nopad_bin';
INSERT INTO t1 VALUES ('a'),('a  '),(' a'),(' a '),('a   ');
SELECT HEX(a), a FROM (SELECT DISTINCT a FROM t1 ORDER BY a) td;
HEX(a)	a
2061	 a
206120	 a 
61	a
612020	a  
61202020	a   
SELECT COUNT(DISTINCT a) FROM t1 ORDER BY a;
COUNT(DISTINCT a)
5
SELECT HEX(MAX(a)), MAX(a) FROM t1;
HEX(MAX(a))	MAX(a)
61202020	a   
#
# GROUP BY
#
CREATE TABLE t2 (a VARCHAR(10), b int, c varchar(10)) COLLATE 'utf8_nopad_bin';
INSERT t2 values('ab', 12, 'cd'), ('ab', 2, 'ed'), ('aa', 20, 'er'), ('aa  ', 0, 'er ');
SELECT HEX(a), cnt FROM (SELECT a, COUNT(a) AS cnt FROM t2 GROUP BY a ORDER BY a) AS td;
HEX(a)	cnt
6161	1
61612020	1
6162	2
DROP TABLE t2;
#
# Weights
#
SELECT HEX(WEIGHT_STRING(a AS CHAR(10))) FROM t1;
HEX(WEIGHT_STRING(a AS CHAR(10)))
0061000000000000000000000000000000000000
0061002000200000000000000000000000000000
0020006100000000000000000000000000000000
0020006100200000000000000000000000000000
0061002000200020000000000000000000000000
DROP TABLE t1;
#
# IF, CASE, LEAST
#
SELECT IF('abc' COLLATE 'utf8_nopad_bin' = 'abc ', 'pad', 'nopad') as exp;
exp
nopad
SELECT CASE 'abc' COLLATE 'utf8_nopad_bin' WHEN 'abc ' THEN 'pad' ELSE 'nopad' END as exp;
exp
nopad
SELECT CASE WHEN 'abc' COLLATE 'utf8_nopad_bin' = 'abc ' THEN 'pad' ELSE 'nopad' END as exp;
exp
nopad
SELECT HEX(LEAST('abc ' COLLATE 'utf8_nopad_bin', 'abc  ')) as exp;
exp
61626320
SELECT HEX(GREATEST('abc ' COLLATE 'utf8_nopad_bin', 'abc  ')) as exp;
exp
6162632020
#
# Collation mix
#
CREATE TABLE t1 (a VARCHAR(10)) COLLATE 'utf8_bin';
INSERT INTO t1 VALUES ('a'),('a ');
SELECT COUNT(*) FROM t1 WHERE a='a';
COUNT(*)
2
SELECT COUNT(*) FROM t1 WHERE a='a' COLLATE 'utf8_bin';
COUNT(*)
2
SELECT COUNT(*) FROM t1 WHERE a='a' COLLATE 'utf8_nopad_bin';
COUNT(*)
1
ALTER TABLE t1 MODIFY a VARCHAR(10) COLLATE 'utf8_nopad_bin';
SELECT COUNT(*) FROM t1 WHERE a='a';
COUNT(*)
1
SELECT COUNT(*) FROM t1 WHERE a='a' COLLATE 'utf8_bin';
COUNT(*)
2
SELECT COUNT(*) FROM t1 WHERE a='a' COLLATE 'utf8_nopad_bin';
COUNT(*)
1
DROP TABLE t1;
#
# End of ctype_pad.inc
#
SET DEFAULT_STORAGE_ENGINE=Default;
#
# MDEV-23408 Wrong result upon query from I_S and further Assertion `!alias_arg || strlen(alias_arg->str) == alias_arg->length' failed with certain connection charset
#
SET NAMES utf8;
SET SESSION character_set_connection=latin1;
CREATE VIEW v1 AS SELECT 'ä' AS c1;
SELECT c1, HEX(c1) FROM v1;
c1	HEX(c1)
ä	E4
CREATE TABLE kv (v BLOB);
LOAD DATA INFILE 'MYSQLD_DATADIR/test/v1.frm' REPLACE INTO TABLE kv;
SELECT * FROM kv WHERE v LIKE _binary'query=%';
v
query=select 'ä' AS `c1`
DROP TABLE kv;
DROP VIEW v1;
SET NAMES utf8;
#
# MDEV-24335 Unexpected question mark in the end of a TINYTEXT column
#
CREATE TABLE t1 (a TINYTEXT character set utf8);
INSERT IGNORE INTO t1 VALUES (REPEAT(_utf8 0xD184, 250));
Warnings:
Warning	1366	Incorrect string value: '\xD1\x84\xD1\x84\xD1\x84...' for column `test`.`t1`.`a` at row 1
SELECT LENGTH(a), CHAR_LENGTH(a), RIGHT(a,3) FROM t1;
LENGTH(a)	CHAR_LENGTH(a)	RIGHT(a,3)
254	127	ффф
DROP TABLE t1;
#
# End of 10.2 tests
#
#
# Start of 10.3 tests
#
#
# MDEV-11155 Bad error message when creating a SET column with comma and non-ASCII characters
#
SET NAMES utf8;
CREATE TABLE t1 (a SET('a,bü'));
ERROR 22007: Illegal set 'a,bü' value found during parsing
#
# MDEV-12607 Hybrid functions create wrong VARBINARY length when mixing character and binary data
#
SET sql_mode='';
SET NAMES utf8;
CREATE OR REPLACE TABLE t1 AS SELECT COALESCE('ßa',_binary 'a');
SELECT * FROM t1;
COALESCE('ßa',_binary 'a')
ßa
SHOW CREATE TABLE t1;
Table	Create Table
t1	CREATE TABLE `t1` (
  `COALESCE('ßa',_binary 'a')` varbinary(6) NOT NULL
) ENGINE=MyISAM DEFAULT CHARSET=utf8mb4 COLLATE=utf8mb4_uca1400_ai_ci
DROP TABLE t1;
SET sql_mode=DEFAULT;
#
# MDEV-19239 ERROR 1300 (HY000): Invalid utf8 character string in 10.3.13-MariaDB
#
SET NAMES utf8;
SELECT
x.消息ID,
x.消息TITLE,
x.消息类型,
x.发送时间,
x.阅读时间,x.老师ID,
IF(x.四天内最近一次登录时间='2100-01-01 00:00:00','',x.四天内最近一次登录时间) 四天内最近一次登录时间
FROM (
SELECT
msg.*,
CASE
WHEN login.login_time BETWEEN msg.发送时间 AND DATE_ADD(msg.发送时间,INTERVAL 4 DAY)
THEN login.login_time
WHEN (login.login_time NOT BETWEEN msg.发送时间 AND DATE_ADD(msg.发送时间,INTERVAL 4 DAY)) AND login.login_time>0
THEN '2100-01-01 00:00:00' ELSE ''
      END 四天内最近一次登录时间
FROM (
SELECT
me.id 消息ID,
me.title 消息TITLE,
CASE
WHEN me.type=1
THEN 'Interview Message'
        WHEN me.type=2
THEN 'Orientation Message'
        WHEN me.type=3
THEN 'Warning Message'
        WHEN me.type=4
THEN 'Fail Message'
        WHEN me.type=5
THEN 'FM Message'
        WHEN me.type=6
THEN 'Training Message'
        WHEN me.type=7
THEN 'TUrgent Message'
      END 消息类型,
FROM_UNIXTIME(me.sending_time) 发送时间,
IF(tar.is_read=1,FROM_UNIXTIME(tar.read_time),'') 阅读时间,
tar.tid 老师ID
FROM ebk_message me
LEFT JOIN ebk_message_target tar
ON me.id=tar.msg_id
WHERE
FROM_UNIXTIME(me.sending_time,'%Y-%m-%d') BETWEEN 'start' AND 'end' AND me.status=1 AND tar.tid>0
GROUP BY
tar.tid,
me.sending_time,me.id) msg
LEFT JOIN (
SELECT tid,FROM_UNIXTIME(login_time) login_time
FROM ebk_teacher_login_log
WHERE FROM_UNIXTIME(login_time,'%Y-%m-%d') BETWEEN 'start' AND DATE_ADD('end',INTERVAL 4 DAY)
ORDER BY tid,FROM_UNIXTIME(login_time)) login
ON
msg.老师ID=login.tid
ORDER BY msg.消息ID,msg.发送时间,msg.老师ID,login_time) x
GROUP BY x.消息ID,x.发送时间,x.老师ID;
ERROR 42S02: Table 'test.ebk_message' doesn't exist
SET NAMES utf8;
CREATE TABLE t1 (x INT);
INSERT INTO t1 VALUES (1);
SELECT x AS 5天内最近一次登录时间 FROM t1;
5天内最近一次登录时间
1
DROP TABLE t1;
#
# MDEV-22391 Assertion `0' failed in Item_type_holder::val_str on utf16 charset table query
#
SET NAMES utf8;
VALUES (_latin1 0xDF) UNION SELECT _utf8'a' COLLATE utf8_bin;
_latin1 0xDF
ß
a
VALUES (_latin1 0xDF) UNION VALUES(_utf8'a' COLLATE utf8_bin);
_latin1 0xDF
ß
a
#
# End of 10.3 tests
#
#
# Start of 10.4 tests
#
#
# MDEV-27653 long uniques don't work with unicode collations
#
SET NAMES utf8mb3;
CREATE TABLE t1 (
a CHAR(30) COLLATE utf8mb3_general_ci,
UNIQUE KEY(a) USING HASH
);
SHOW CREATE TABLE t1;
Table	Create Table
t1	CREATE TABLE `t1` (
  `a` char(30) CHARACTER SET utf8mb3 COLLATE utf8mb3_general_ci DEFAULT NULL,
  UNIQUE KEY `a` (`a`) USING HASH
) ENGINE=MyISAM DEFAULT CHARSET=utf8mb4 COLLATE=utf8mb4_uca1400_ai_ci
INSERT INTO t1 VALUES ('a');
INSERT INTO t1 VALUES ('ä');
ERROR 23000: Duplicate entry 'ä' for key 'a'
SELECT * FROM t1;
a
a
DROP TABLE t1;
CREATE TABLE t1 (
a CHAR(30) COLLATE utf8mb3_general_ci,
UNIQUE KEY(a(10)) USING HASH
);
SHOW CREATE TABLE t1;
Table	Create Table
t1	CREATE TABLE `t1` (
  `a` char(30) CHARACTER SET utf8mb3 COLLATE utf8mb3_general_ci DEFAULT NULL,
  UNIQUE KEY `a` (`a`(10)) USING HASH
) ENGINE=MyISAM DEFAULT CHARSET=utf8mb4 COLLATE=utf8mb4_uca1400_ai_ci
INSERT INTO t1 VALUES ('a');
INSERT INTO t1 VALUES ('ä');
ERROR 23000: Duplicate entry 'ä' for key 'a'
SELECT * FROM t1;
a
a
DROP TABLE t1;
CREATE TABLE t1 (
a VARCHAR(30) COLLATE utf8mb3_general_ci,
UNIQUE KEY(a) USING HASH
);
SHOW CREATE TABLE t1;
Table	Create Table
t1	CREATE TABLE `t1` (
  `a` varchar(30) CHARACTER SET utf8mb3 COLLATE utf8mb3_general_ci DEFAULT NULL,
  UNIQUE KEY `a` (`a`) USING HASH
) ENGINE=MyISAM DEFAULT CHARSET=utf8mb4 COLLATE=utf8mb4_uca1400_ai_ci
INSERT INTO t1 VALUES ('a');
INSERT INTO t1 VALUES ('ä');
ERROR 23000: Duplicate entry 'ä' for key 'a'
SELECT * FROM t1;
a
a
DROP TABLE t1;
CREATE TABLE t1 (
a VARCHAR(30) COLLATE utf8mb3_general_ci,
UNIQUE KEY(a(10)) USING HASH
);
SHOW CREATE TABLE t1;
Table	Create Table
t1	CREATE TABLE `t1` (
  `a` varchar(30) CHARACTER SET utf8mb3 COLLATE utf8mb3_general_ci DEFAULT NULL,
  UNIQUE KEY `a` (`a`(10)) USING HASH
) ENGINE=MyISAM DEFAULT CHARSET=utf8mb4 COLLATE=utf8mb4_uca1400_ai_ci
INSERT INTO t1 VALUES ('a');
INSERT INTO t1 VALUES ('ä');
ERROR 23000: Duplicate entry 'ä' for key 'a'
SELECT * FROM t1;
a
a
DROP TABLE t1;
CREATE TABLE t1 (a TEXT COLLATE utf8mb3_general_ci UNIQUE);
SHOW CREATE TABLE t1;
Table	Create Table
t1	CREATE TABLE `t1` (
  `a` text CHARACTER SET utf8mb3 COLLATE utf8mb3_general_ci DEFAULT NULL,
  UNIQUE KEY `a` (`a`) USING HASH
) ENGINE=MyISAM DEFAULT CHARSET=utf8mb4 COLLATE=utf8mb4_uca1400_ai_ci
INSERT INTO t1 VALUES ('a');
INSERT INTO t1 VALUES ('ä');
ERROR 23000: Duplicate entry 'ä' for key 'a'
SELECT * FROM t1;
a
a
DROP TABLE t1;
CREATE TABLE t1 (
a LONGTEXT COLLATE utf8mb3_general_ci,
UNIQUE KEY(a(10)) USING HASH
);
SHOW CREATE TABLE t1;
Table	Create Table
t1	CREATE TABLE `t1` (
  `a` longtext CHARACTER SET utf8mb3 COLLATE utf8mb3_general_ci DEFAULT NULL,
  UNIQUE KEY `a` (`a`(10)) USING HASH
) ENGINE=MyISAM DEFAULT CHARSET=utf8mb4 COLLATE=utf8mb4_uca1400_ai_ci
INSERT INTO t1 VALUES ('a');
INSERT INTO t1 VALUES ('ä');
ERROR 23000: Duplicate entry 'ä' for key 'a'
SELECT * FROM t1;
a
a
DROP TABLE t1;
SHOW CREATE TABLE t1;
Table	Create Table
t1	CREATE TABLE `t1` (
  `a` text CHARACTER SET utf8mb3 COLLATE utf8mb3_general_ci DEFAULT NULL,
  UNIQUE KEY `a` (`a`) USING HASH
) ENGINE=MyISAM DEFAULT CHARSET=latin1 COLLATE=latin1_swedish_ci
SELECT a, OCTET_LENGTH(a) FROM t1 ORDER BY BINARY a;
a	OCTET_LENGTH(a)
a	1
ä	2
CHECK TABLE t1;
Table	Op	Msg_type	Msg_text
test.t1	check	error	Table rebuild required. Please do "ALTER TABLE `t1` FORCE" or dump/reload to fix it!
INSERT INTO t1 VALUES ('A');
ERROR 23000: Duplicate entry 'A' for key 'a'
INSERT INTO t1 VALUES ('Ä');
ERROR 23000: Duplicate entry 'Ä' for key 'a'
INSERT INTO t1 VALUES ('Ấ');
SELECT a, OCTET_LENGTH(a) FROM t1 ORDER BY BINARY a;
a	OCTET_LENGTH(a)
a	1
ä	2
Ấ	3
CHECK TABLE t1;
Table	Op	Msg_type	Msg_text
test.t1	check	error	Table rebuild required. Please do "ALTER TABLE `t1` FORCE" or dump/reload to fix it!
ALTER TABLE t1 FORCE;
ERROR 23000: Duplicate entry 'ä' for key 'a'
DELETE FROM t1 WHERE OCTET_LENGTH(a)>1;
ALTER TABLE t1 FORCE;
INSERT INTO t1 VALUES ('ä');
ERROR 23000: Duplicate entry 'ä' for key 'a'
DROP TABLE t1;
SHOW CREATE TABLE t1;
Table	Create Table
t1	CREATE TABLE `t1` (
  `a` text CHARACTER SET utf8mb3 COLLATE utf8mb3_general_ci DEFAULT NULL,
  UNIQUE KEY `a` (`a`) USING HASH
) ENGINE=MyISAM DEFAULT CHARSET=latin1 COLLATE=latin1_swedish_ci
SELECT a, OCTET_LENGTH(a) FROM t1 ORDER BY BINARY a;
a	OCTET_LENGTH(a)
a	1
ä	2
ALTER IGNORE TABLE t1 FORCE;
SELECT a, OCTET_LENGTH(a) FROM t1 ORDER BY BINARY a;
a	OCTET_LENGTH(a)
a	1
DROP TABLE t1;
SHOW CREATE TABLE t1;
Table	Create Table
t1	CREATE TABLE `t1` (
  `a` text CHARACTER SET utf8mb3 COLLATE utf8mb3_general_ci DEFAULT NULL,
  UNIQUE KEY `a` (`a`) USING HASH
) ENGINE=MyISAM DEFAULT CHARSET=latin1 COLLATE=latin1_swedish_ci
SELECT a, OCTET_LENGTH(a) FROM t1 ORDER BY BINARY a;
a	OCTET_LENGTH(a)
a	1
ä	2
REPAIR TABLE t1;
Table	Op	Msg_type	Msg_text
test.t1	repair	Warning	Number of rows changed from 2 to 1
test.t1	repair	status	OK
SELECT a, OCTET_LENGTH(a) FROM t1 ORDER BY BINARY a;
a	OCTET_LENGTH(a)
a	1
DROP TABLE t1;
#
# End of 10.4 tests
#
#
# Start of 10.5 tests
#
#
# MDEV-20712 Wrong data type for CAST(@a AS BINARY) for a numeric variable
#
SET NAMES utf8;
SET @a=2;
CREATE OR REPLACE TABLE t1 AS SELECT CAST(1 AS BINARY), CAST(@a AS BINARY), CAST(@b:=3 AS BINARY);
SHOW CREATE TABLE t1;
Table	Create Table
t1	CREATE TABLE `t1` (
  `CAST(1 AS BINARY)` varbinary(1) DEFAULT NULL,
  `CAST(@a AS BINARY)` varbinary(20) DEFAULT NULL,
  `CAST(@b:=3 AS BINARY)` varbinary(1) DEFAULT NULL
) ENGINE=MyISAM DEFAULT CHARSET=utf8mb4 COLLATE=utf8mb4_uca1400_ai_ci
DROP TABLE t1;
#
# MDEV-20890 Illegal mix of collations with UUID()
#
SET NAMES utf8 COLLATE utf8_unicode_ci;
SELECT sys_guid()>'';
sys_guid()>''
1
#
# MDEV-8844 Unreadable control characters printed as is in warnings
#
SET NAMES utf8;
# control, part1
SELECT CAST(_utf8 0x610062 AS INT);
CAST(_utf8 0x610062 AS INT)
0
Warnings:
Warning	1292	Truncated incorrect INTEGER value: 'a\0000b'
SELECT CAST(_utf8 0x610162 AS INT);
CAST(_utf8 0x610162 AS INT)
0
Warnings:
Warning	1292	Truncated incorrect INTEGER value: 'a\0001b'
SELECT CAST(_utf8 0x611F62 AS INT);
CAST(_utf8 0x611F62 AS INT)
0
Warnings:
Warning	1292	Truncated incorrect INTEGER value: 'a\001Fb'
# control, part2: U+0080..U+009F
SELECT CAST(_utf8 0x617F62 AS INT);
CAST(_utf8 0x617F62 AS INT)
0
Warnings:
Warning	1292	Truncated incorrect INTEGER value: 'a\007Fb'
SELECT CAST(_utf8 0x61C28062 AS INT);
CAST(_utf8 0x61C28062 AS INT)
0
Warnings:
Warning	1292	Truncated incorrect INTEGER value: 'a\0080b'
SELECT CAST(_utf8 0x61C29F62 AS INT);
CAST(_utf8 0x61C29F62 AS INT)
0
Warnings:
Warning	1292	Truncated incorrect INTEGER value: 'a\009Fb'
# normal characters
SELECT CAST(_utf8 0x612062 AS INT);
CAST(_utf8 0x612062 AS INT)
0
Warnings:
Warning	1292	Truncated incorrect INTEGER value: 'a b'
SELECT CAST(_utf8 0x617E62 AS INT);
CAST(_utf8 0x617E62 AS INT)
0
Warnings:
Warning	1292	Truncated incorrect INTEGER value: 'a~b'
SELECT CAST(_utf8 0x61C2BF62 AS INT);
CAST(_utf8 0x61C2BF62 AS INT)
0
Warnings:
Warning	1292	Truncated incorrect INTEGER value: 'a¿b'
SELECT CAST(_utf8 'ëëë' AS INT);
CAST(_utf8 'ëëë' AS INT)
0
Warnings:
Warning	1292	Truncated incorrect INTEGER value: 'ëëë'
SELECT CAST(_utf8 'œœœ' AS INT);
CAST(_utf8 'œœœ' AS INT)
0
Warnings:
Warning	1292	Truncated incorrect INTEGER value: 'œœœ'
SELECT CAST(_utf8 'яяя' AS INT);
CAST(_utf8 'яяя' AS INT)
0
Warnings:
Warning	1292	Truncated incorrect INTEGER value: 'яяя'
#
# MDEV-30111 InnoDB: Failing assertion: update->n_fields == 0 in row_ins_sec_index_entry_by_modify
#
select strcmp(_utf8mb3'' collate utf8mb3_general_nopad_ci, _utf8mb3 0x0001050001) as c1;
c1
-1
select strcmp(_utf8mb3'' collate utf8mb3_nopad_bin, _utf8mb3 0x0001050001) as c1;
c1
-1
#
# End of 10.5 tests
#
#
# Start of 10.9 tests
#
#
# MDEV-28118 Wrong collation of `CAST(.. AS CHAR COLLATE DEFAULT)`
#
SET NAMES utf8mb3 COLLATE utf8mb3_bin;
SELECT COLLATION(CAST('a' AS CHAR COLLATE DEFAULT)) AS c1;
c1
utf8mb3_general_ci
CREATE TABLE t1 AS SELECT CAST('a' AS CHAR COLLATE DEFAULT) AS c1;
SHOW CREATE TABLE t1;
Table	Create Table
t1	CREATE TABLE `t1` (
  `c1` varchar(1) CHARACTER SET utf8mb3 COLLATE utf8mb3_general_ci DEFAULT NULL
) ENGINE=MyISAM DEFAULT CHARSET=utf8mb4 COLLATE=utf8mb4_uca1400_ai_ci
DROP TABLE t1;
#
# MDEV-28119 Wrong column collation on MODIFY + CONVERT
#
CREATE TABLE t1 (a CHAR);
ALTER TABLE t1
MODIFY a CHAR COLLATE DEFAULT,
CONVERT TO CHARACTER SET utf8mb3 COLLATE utf8mb3_bin;
SHOW CREATE TABLE t1;
Table	Create Table
t1	CREATE TABLE `t1` (
  `a` char(1) CHARACTER SET utf8mb3 COLLATE utf8mb3_general_ci DEFAULT NULL
) ENGINE=MyISAM DEFAULT CHARSET=utf8mb3 COLLATE=utf8mb3_bin
DROP TABLE t1;
CREATE TABLE t1 (a CHAR);
ALTER TABLE t1
MODIFY a CHAR BINARY,
CONVERT TO CHARACTER SET utf8mb3 COLLATE utf8mb3_general_ci;
SHOW CREATE TABLE t1;
Table	Create Table
t1	CREATE TABLE `t1` (
  `a` char(1) CHARACTER SET utf8mb3 COLLATE utf8mb3_bin DEFAULT NULL
) ENGINE=MyISAM DEFAULT CHARSET=utf8mb3 COLLATE=utf8mb3_general_ci
DROP TABLE t1;
#
# End of 10.9 tests
#
#
# Start of 11.6 tests
#
#
# MDEV-35041 Simple comparison causes "Illegal mix of collations" even with default server settings
#
CREATE TABLE t1 (a INT);
SET NAMES utf8mb3;
SELECT COLUMN_TYPE INTO @col_type FROM INFORMATION_SCHEMA.COLUMNS
WHERE TABLE_NAME='t1';
SELECT @col_type != 'binary(128)';
@col_type != 'binary(128)'
1
SELECT COERCIBILITY(@col_type), COERCIBILITY('binary(128)');
COERCIBILITY(@col_type)	COERCIBILITY('binary(128)')
5	6
DROP TABLE t1;
#
# End of 11.6 tests
#
